
--
-- Dumping data for table `atthegate`
--

INSERT INTO `atthegate` (`direction`, `license`, `name`, `company`, `category`, `dr_license`, `creation`, `recdate`, `rectime`, `profile`, `incidents`, `dr_name`, `name_in`, `name_out`, `going`, `company2`, `visiting`) VALUES
('out', '0004281248080', 'DANIELLEFOURIE', '', '', '0004281248080', '14:21 03-5-2020', '2020/03/05', '14:21:00', 'Staff', '', '', 'DANIELLE / FOURIE', '', 'Hibiscus', '', ''),
('in', '6013000089', 'sTuku', '', '', '', '07:49 05-5-2020', '2020/05/05', '07:49:00', 'Staff', '', '', 's / Tuku', '', 'm', '', ''),
('in', '53063621087', 'NOMBUYISELO FLORENCEMAGAWU', '', '', '5306250231087', '07:59 24-4-2020', '24-4-2020', '07:59:00', 'Staff', '', '', 'NOMBUYISELO FLORENCE / MAGAWU', '', '', '', ''),
('in', '74040613089', 'TTsitsi', '', '', '', '08:26 02-5-2020', '2020/02/05', '08:26:00', 'Staff', '', '', 'T / Tsitsi', '', 'Unit 39', '', ''),
('out', '78119505080', 'NOMFUSIJAMES', '', '', '7811050502080', '17:36 25-4-2020', '25-4-2020', '17:36:00', 'Staff', '', '', '', '', '', '', ''),
('in', '89030804089', 'PUMEZANTLOKWANA', '', '', '8903080498089', '06:58 15-4-2020', '15-4-2020', '06:58:00', 'Staff', '', '', 'PUMEZA / NTLOKWANA', '', '', '', ''),
('in', '700503671080', 'VUYO RICHARDMSESIWE', '', '', '7005036271080', '07:36 07-5-2020', '2020/07/05', '07:36:00', 'Staff', '', '', 'VUYO RICHARD / MSESIWE', '', 'work', '', ''),
('in', '740705326086', 'XMKhamkham', '', '', '', '07:15 17-4-2020', '17-4-2020', '07:15:00', 'Staff', '', '', 'XM / Khamkham', '', '', '', ''),
('in', '780109025080', 'DMJACU', '', '', '7801090235080', '18:41 13-4-2020', '13-4-2020', '18:41:00', 'Staff', '', '', 'D / MJACU', '', '', '', ''),
('in', '790250017081', 'MilliscentGaseba', '', '', '', '17:58 21-4-2020', '21-4-2020', '17:58:00', 'Staff', '', '', 'Milliscent / Gaseba', '', '', '', ''),
('out', '810195340087', 'MZIWETHUMAFANI', '', '', '8101095340087', '17:05 25-4-2020', '25-4-2020', '17:05:00', 'Staff', '', '', '', '', '', '', ''),
('in', '810930099083', 'LYNDRO URSULAJORDAAN', '', '', '8109300099083', '18:38 18-4-2020', '18-4-2020', '18:38:00', 'Staff', '', '', 'LYNDRO URSULA / JORDAAN', '', '', '', ''),
('in', '830507024081', 'LUNGISWAGANGQU', '', '', '8305070242081', '07:33 19-4-2020', '19-4-2020', '07:33:00', 'Staff', '', '', 'LUNGISWA / GANGQU', '', '', '', ''),
('in', '870317563808', 'ZMNyanya', '', '', '', '07:38 28-4-2020', '28-4-2020', '07:38:00', 'Staff', '', '', 'ZM / Nyanya', '', '', '', ''),
('in', '3503260002084', 'MAHOBBS', '', '', '3503260002084', '08:15 10-5-2020', '2020/10/05', '08:15:00', 'Visitors', 'Expired car licence', 'MA / HOBBS', '', '', '', '', '180'),
('out', '3512160325081', 'F.AWerner', '', '', '', '10:36 14-4-2020', '14-4-2020', '10:36:00', 'Resident', '', '', '', 'F.A / Werner', '', '', ''),
('out', '3801210057186', 'IrisClough', '', '', '', '09:53 07-5-2020', '2020/07/05', '09:53:00', 'Resident', '', '', '', 'Iris / Clough', '', '', ''),
('in', '3811115050087', 'JTHROOS', '', '', '3811115050087', '16:02 09-5-2020', '2020/09/05', '16:02:00', 'Visitors', 'Expired driver licence', 'JTH / ROOS', '', '', '', '', '10'),
('in', '3812090063087', 'JENIFER HELENSIMPSON', '', '', '3812090063087', '10:56 08-5-2020', '2020/08/05', '10:56:00', 'Resident', '', '', 'JENIFER HELEN / SIMPSON', '', '', '', ''),
('in', '3903120064086', 'AEALSTON', '', '', '3803165088083', '11:18 09-5-2020', '2020/09/05', '11:18:00', 'Visitors', 'Expired car licence', 'AE / ALSTON', '', '', '', '', '111'),
('in', '4009090011088', 'RDNelson', '', '', '', '09:20 29-4-2020', '29-4-2020', '09:20:00', 'Visitors', 'Expired car licence', 'RD / Nelson', '', '', '', '', '188'),
('out', '4211305048083', 'Charles pellew', '', '', '', '13:34 07-5-2020', '2020/07/05', '13:34:00', 'Resident', 'Expired car licence', '', '', 'Charles  / pellew', '', '', ''),
('out', '4304020062081', 'SpearmanMaureen', '', '', '', '12:43 07-5-2020', '2020/07/05', '12:43:00', 'Resident', '', '', '', 'Spearman / Maureen', '', '', ''),
('out', '4401250054182', 'CollettRobin', '', '', '', '10:08 07-5-2020', '2020/07/05', '10:08:00', 'Resident', '', '', '', 'Collett / Robin', '', '', ''),
('in', '4409265015080', 'AELMS', '', '', '4409265015080', '06:32 28-4-2020', '28-4-2020', '06:32:00', 'Visitors', '', 'A / ELMS', '', '', '', '', '190'),
('in', '4501190496185', 'FMSpieker', '', '', '', '10:37 10-5-2020', '2020/10/05', '10:37:00', 'Visitors', '', 'FM / Spieker', '', '', '', '', '158'),
('in', '4603100040184', 'SAReijman', '', '', '', '16:34 29-4-2020', '29-4-2020', '16:34:00', 'Visitors', '', 'SA / Reijman', '', '', '', '', '169'),
('in', '4805155336082', 'MGClayton', '', '', '', '09:54 11-5-2020', '2020/11/05', '09:54:00', 'Visitors', '', 'MG / Clayton', '', '', '', '', '100'),
('in', '5006070037082', 'E.M.MMacMahon', '', '', '', '06:49 20-4-2020', '20-4-2020', '06:49:00', 'Staff', '', '', 'E.M.M / MacMahon', '', '', '', ''),
('in', '5103230472083', 'SINDISWA CYNTHIAGXOYIYA', '', '', '5103230472083', '08:43 08-5-2020', '2020/08/05', '08:43:00', 'Staff', '', '', 'SINDISWA CYNTHIA / GXOYIYA', '', 'Unit 132', '', ''),
('in', '5306250231087', 'NOMBUYISELO FLORENCEMAGAWU', '', '', '5306250231087', '08:06 20-4-2020', '20-4-2020', '08:06:00', 'Staff', '', '', 'NOMBUYISELO FLORENCE / MAGAWU', '', '', '', ''),
('in', '5606150031085', 'CLCOATES', '', '', '5606150031085', '12:48 28-4-2020', '28-4-2020', '12:48:00', 'Visitors', '', 'CL / COATES', '', '', '', '', '161'),
('in', '5706030367086', 'n GwebileN Jullian', '', '', '', '07:26 07-5-2020', '2020/07/05', '07:26:00', 'Staff', '', '', 'n Gwebile / N Jullian', '', 'work', '', ''),
('in', '5706160208085', 'MajorieCampbell', '', '', '', '18:04 10-5-2020', '2020/10/05', '18:04:00', 'Staff', '', '', 'Majorie / Campbell', '', '144', '', ''),
('out', '5707135793086', 'ZANDISILEQAKAMFANA', '', '', '5707135793086', '16:23 07-5-2020', '2020/07/05', '16:23:00', 'Staff', '', '', '', '', '', '', ''),
('in', '5807016108089', 'Gongqavukile', '', '', '', '07:35 07-5-2020', '2020/07/05', '07:35:00', 'Staff', '', '', 'Gongqa / vukile', '', 'work', '', ''),
('out', '5811280758082', 'MAVISTEMBENI', '', '', '5811280758082', '07:34 08-5-2020', '2020/08/05', '07:34:00', 'Staff', '', '', 'MAVIS / TEMBENI', '', '212', '', ''),
('in', '5812050320087', 'MYani Faku', '', '', '', '06:41 02-5-2020', '2020/02/05', '06:41:00', 'Staff', '', '', 'M / Yani Faku', '', 'Kitchen', '', ''),
('in', '5812050320087', 'PatriciaRayi', '', '', '', '07:02 13-4-2020', '13-4-2020', '07:02:00', 'Staff', '', '', 'Patricia / Rayi', '', '', '', ''),
('in', '5901030766087', 'TFHoboshe', '', '', '', '06:47 18-4-2020', '18-4-2020', '06:47:00', 'Staff', '', '', 'TF / Hoboshe', '', '', '', ''),
('in', '5901075574081', 'Daweti MadidaD M', '', '', '', '07:09 07-5-2020', '2020/07/05', '07:09:00', 'Staff', '', '', 'Daweti Madida / D M', '', 'Gardin', '', ''),
('in', '5901260650084', 'Mpandepumla', '', '', '', '08:02 07-5-2020', '2020/07/05', '08:02:00', 'Staff', '', '', 'Mpande / pumla', '', 'work', '', ''),
('in', '5903100648088', 'TNkombisa', '', '', '', '07:57 11-5-2020', '2020/11/05', '07:57:00', 'Staff', '', '', 'T / Nkombisa', '', '71', '', ''),
('in', '6007120590087', 'BMMemani', '', '', '', '08:50 10-5-2020', '2020/10/05', '08:50:00', 'Staff', '', '', 'BM / Memani', '', '114', '', ''),
('out', '6010135284084', 'BONISILE GEORGEPETER', '', '', '6010135284084', '15:50 05-5-2020', '2020/05/05', '15:50:00', 'Staff', '', '', 'BG / Peter', '', 'KG', '', ''),
('in', '6104150342081', 'NomakulaNgxingo', '', '', '', '07:35 13-4-2020', '13-4-2020', '07:35:00', 'Staff', '', '', 'Nomakula / Ngxingo', '', '', '', ''),
('in', '6111235691085', 'DuruweGeofrey', '', '', '', '07:37 07-5-2020', '2020/07/05', '07:37:00', 'Staff', '', '', 'Duruwe / Geofrey', '', 'work', '', ''),
('in', '6201260710080', 'JaniceMatthews', '', '', '', '18:35 21-4-2020', '21-4-2020', '18:35:00', 'Staff', '', '', 'Janice / Matthews', '', '', '', ''),
('in', '6209200634088', 'Belewasiziwe', '', '', '', '07:37 07-5-2020', '2020/07/05', '07:37:00', 'Staff', '', '', 'Belewa / siziwe', '', 'work', '', ''),
('in', '6209200634088', 'FBelewa', '', '', '', '07:08 01-5-2020', '2020/01/05', '07:08:00', 'Staff', '', '', 'F / Belewa', '', '167', '', ''),
('in', '6209200634088', 'FBelewa', '', '', '', '06:59 16-4-2020', '16-4-2020', '06:59:00', 'Staff', '', '', 'F / Belewa', '', '', '', ''),
('in', '6209200634088', 'FlorenceBelewa', '', '', '', '06:57 13-4-2020', '13-4-2020', '06:57:00', 'Staff', '', '', 'Florence / Belewa', '', '', '', ''),
('in', '6209200634088', 'FVBelewa', '', '', '', '07:33 30-4-2020', '30-4-2020', '07:33:00', 'Staff', '', '', 'FV / Belewa', '', '', '', ''),
('in', '6209200634088', 'S.F.Belewa', '', '', '', '07:05 14-4-2020', '14-4-2020', '07:05:00', 'Staff', '', '', 'S.F. / Belewa', '', '', '', ''),
('in', '6209200634088', 'S.FBelewa', '', '', '', '06:59 20-4-2020', '20-4-2020', '06:59:00', 'Staff', '', '', 'S.F / Belewa', '', '', '', ''),
('in', '6209200634088', 'SFBelewa', '', '', '', '07:25 11-5-2020', '2020/11/05', '07:25:00', 'Staff', '', '', 'SF / Belewa', '', '167', '', ''),
('in', '6209200634088', 'SFBelewa', '', '', '', '07:05 08-5-2020', '2020/08/05', '07:05:00', 'Staff', '', '', 'SF / Belewa', '', 'Unit 167', '', ''),
('in', '6209200634088', 'SFBelewa', '', '', '', '07:26 05-5-2020', '2020/05/05', '07:26:00', 'Staff', '', '', 'SF / Belewa', '', 'Unit 167', '', ''),
('in', '6209200634088', 'SFBelewa', '', '', '', '07:28 29-4-2020', '29-4-2020', '07:28:00', 'Staff', '', '', 'SF / Belewa', '', '', '', ''),
('in', '6209200634088', 'SFBelewa', '', '', '', '07:31 28-4-2020', '28-4-2020', '07:31:00', 'Staff', '', '', 'SF / Belewa', '', '', '', ''),
('in', '6209200634088', 'SFBelewa', '', '', '', '07:03 27-4-2020', '27-4-2020', '07:03:00', 'Staff', '', '', 'SF / Belewa', '', '', '', ''),
('in', '6209200634088', 'SFBelewa', '', '', '', '07:10 24-4-2020', '24-4-2020', '07:10:00', 'Staff', '', '', 'SF / Belewa', '', '', '', ''),
('in', '6209200634088', 'SFBelewa', '', '', '', '07:05 23-4-2020', '23-4-2020', '07:05:00', 'Staff', '', '', 'SF / Belewa', '', '', '', ''),
('in', '6209200634088', 'SFBelewa', '', '', '', '07:02 22-4-2020', '22-4-2020', '07:02:00', 'Staff', '', '', 'SF / Belewa', '', '', '', ''),
('in', '6209200634088', 'SFBelewa', '', '', '', '07:00 17-4-2020', '17-4-2020', '07:00:00', 'Staff', '', '', 'SF / Belewa', '', '', '', ''),
('in', '6209200634088', 'SFBrlees', '', '', '', '06:57 21-4-2020', '21-4-2020', '06:57:00', 'Staff', '', '', 'SF / Brlees', '', '', '', ''),
('out', '6209200634088', '', '', '', '', '17:04 08-5-2020', '2020/08/05', '17:04:00', 'Staff', '', '', 'SF / Belewa', '', 'Unit 167', '', ''),
('out', '6209200634088', '', '', '', '', '17:04 07-5-2020', '2020/07/05', '17:04:00', 'Staff', '', '', 'Belewa / siziwe', '', 'work', '', ''),
('out', '6209200634088', '', '', '', '', '17:03 06-5-2020', '2020/06/05', '17:03:00', 'Staff', '', '', '', '', '', '', ''),
('out', '6209200634088', '', '', '', '', '17:09 05-5-2020', '2020/05/05', '17:09:00', 'Staff', '', '', 'SF / Belewa', '', 'Unit 167', '', ''),
('out', '6209200634088', '', '', '', '', '09:08 01-5-2020', '2020/01/05', '09:08:00', 'Staff', '', '', 'F / Belewa', '', '167', '', ''),
('out', '6209200634088', '', '', '', '', '16:58 30-4-2020', '30-4-2020', '16:58:00', 'Staff', '', '', 'FV / Belewa', '', '', '', ''),
('out', '6209200634088', '', '', '', '', '17:06 29-4-2020', '29-4-2020', '17:06:00', 'Staff', '', '', 'SF / Belewa', '', '', '', ''),
('out', '6209200634088', '', '', '', '', '16:58 28-4-2020', '28-4-2020', '16:58:00', 'Staff', '', '', 'SF / Belewa', '', '', '', ''),
('out', '6209200634088', '', '', '', '', '17:10 27-4-2020', '27-4-2020', '17:10:00', 'Staff', '', '', 'SF / Belewa', '', '', '', ''),
('out', '6209200634088', '', '', '', '', '17:27 24-4-2020', '24-4-2020', '17:27:00', 'Staff', '', '', 'SF / Belewa', '', '', '', ''),
('out', '6209200634088', '', '', '', '', '17:34 23-4-2020', '23-4-2020', '17:34:00', 'Staff', '', '', 'SF / Belewa', '', '', '', ''),
('out', '6209200634088', '', '', '', '', '17:38 22-4-2020', '22-4-2020', '17:38:00', 'Staff', '', '', 'SF / Belewa', '', '', '', ''),
('out', '6209200634088', '', '', '', '', '17:16 21-4-2020', '21-4-2020', '17:16:00', 'Staff', '', '', 'SF / Brlees', '', '', '', ''),
('out', '6209200634088', '', '', '', '', '17:15 20-4-2020', '20-4-2020', '17:15:00', 'Staff', '', '', 'S.F / Belewa', '', '', '', ''),
('out', '6209200634088', '', '', '', '', '17:16 17-4-2020', '17-4-2020', '17:16:00', 'Staff', '', '', 'SF / Belewa', '', '', '', ''),
('out', '6209200634088', '', '', '', '', '17:16 16-4-2020', '16-4-2020', '17:16:00', 'Staff', '', '', 'F / Belewa', '', '', '', ''),
('out', '6209200634088', '', '', '', '', '17:20 14-4-2020', '14-4-2020', '17:20:00', 'Staff', '', '', 'S.F. / Belewa', '', '', '', ''),
('out', '6209200634088', '', '', '', '', '17:03 13-4-2020', '13-4-2020', '17:03:00', 'Staff', '', '', 'Florence / Belewa', '', '', '', ''),
('in', '6210280109082', 'LeslyPottet', '', '', '', '15:19 25-4-2020', '25-4-2020', '15:19:00', 'Visitors', '', 'Lesly / Pottet', '', '', '', '', 'G1'),
('in', '6210280109082', 'LJPorter', '', '', '', '14:02 24-4-2020', '24-4-2020', '14:02:00', 'Visitors', '', 'LJ / Porter', '', '', '', '', 'G1'),
('in', '6210280109082', 'LJPorter', '', '', '', '10:22 23-4-2020', '23-4-2020', '10:22:00', 'Visitors', '', 'LJ / Porter', '', '', '', '', 'G1'),
('in', '6210280109082', 'LrdlryBota', '', '', '', '13:49 22-4-2020', '22-4-2020', '13:49:00', 'Visitors', '', 'Lrdlry / Bota', '', '', '', '', '3'),
('in', '6212120482083', 'nntantisi', '', '', '', '08:01 06-5-2020', '2020/06/05', '08:01:00', 'Staff', '', '', 'n / ntantisi', '', 'work', '', ''),
('in', '6212120482083', 'NP Ntantiso', '', '', '', '08:31 20-4-2020', '20-4-2020', '08:31:00', 'Staff', '', '', 'NP  / Ntantiso', '', '', '', ''),
('in', '6212120482083', 'Ntantiso NompumeleloN Nompumelelo', '', '', '', '08:15 07-5-2020', '2020/07/05', '08:15:00', 'Staff', '', '', 'Ntantiso Nompumelelo / N Nompumelelo', '', 'work', '', ''),
('in', '6212120482083', 'NVNtantiso', '', '', '', '07:52 11-5-2020', '2020/11/05', '07:52:00', 'Staff', '', '', 'NV / Ntantiso', '', 'O', '', ''),
('in', '6212120482083', 'NVNtantiso', '', '', '', '07:52 08-5-2020', '2020/08/05', '07:52:00', 'Staff', '', '', 'NV / Ntantiso', '', 'Adminn', '', ''),
('in', '6212120482083', 'NVNtantiso', '', '', '', '08:14 05-5-2020', '2020/05/05', '08:14:00', 'Staff', '', '', 'NV / Ntantiso', '', 'Admin', '', ''),
('in', '6212120482083', 'NVNtantiso', '', '', '', '08:16 04-5-2020', '2020/04/05', '08:16:00', 'Staff', '', '', 'NV / Ntantiso', '', 'O', '', ''),
('in', '6212120482083', 'NVNtantiso', '', '', '', '08:09 29-4-2020', '29-4-2020', '08:09:00', 'Staff', '', '', 'NV / Ntantiso', '', '', '', ''),
('in', '6212120482083', 'NVNtantiso', '', '', '', '08:29 28-4-2020', '28-4-2020', '08:29:00', 'Staff', '', '', 'NV / Ntantiso', '', '', '', ''),
('in', '6212120482083', 'NVNtantiso', '', '', '', '08:23 24-4-2020', '24-4-2020', '08:23:00', 'Staff', '', '', 'NV / Ntantiso', '', '', '', ''),
('in', '6212120482083', 'NVNtantiso', '', '', '', '08:37 23-4-2020', '23-4-2020', '08:37:00', 'Staff', '', '', 'NV / Ntantiso', '', '', '', ''),
('in', '6212120482083', 'NVNtantiso', '', '', '', '08:18 17-4-2020', '17-4-2020', '08:18:00', 'Staff', '', '', 'NV / Ntantiso', '', '', '', ''),
('in', '6212120482083', 'NVNtsntido', '', '', '', '08:33 22-4-2020', '22-4-2020', '08:33:00', 'Staff', '', '', 'NV / Ntsntido', '', '', '', ''),
('in', '6212120482083', 'NVNtsntiso', '', '', '', '08:11 30-4-2020', '30-4-2020', '08:11:00', 'Staff', '', '', 'NV / Ntsntiso', '', '', '', ''),
('in', '6212120482083', 'Nvntsntiso', '', '', '', '08:31 16-4-2020', '16-4-2020', '08:31:00', 'Staff', '', '', 'Nv / ntsntiso', '', '', '', ''),
('in', '6212120482083', 'VNntsntido', '', '', '', '08:19 21-4-2020', '21-4-2020', '08:19:00', 'Staff', '', '', 'VN / ntsntido', '', '', '', ''),
('out', '6212120482083', '', '', '', '', '16:35 08-5-2020', '2020/08/05', '16:35:00', 'Staff', '', '', 'NV / Ntantiso', '', 'Adminn', '', ''),
('out', '6212120482083', '', '', '', '', '16:36 07-5-2020', '2020/07/05', '16:36:00', 'Staff', '', '', 'Ntantiso Nompumelelo / N Nompumelelo', '', 'work', '', ''),
('out', '6212120482083', '', '', '', '', '16:36 06-5-2020', '2020/06/05', '16:36:00', 'Staff', '', '', 'n / ntantisi', '', 'work', '', ''),
('out', '6212120482083', '', '', '', '', '16:31 05-5-2020', '2020/05/05', '16:31:00', 'Staff', '', '', 'NV / Ntantiso', '', 'Admin', '', ''),
('out', '6212120482083', '', '', '', '', '16:39 04-5-2020', '2020/04/05', '16:39:00', 'Staff', '', '', 'NV / Ntantiso', '', 'O', '', ''),
('out', '6212120482083', '', '', '', '', '16:26 30-4-2020', '30-4-2020', '16:26:00', 'Staff', '', '', 'NV / Ntsntiso', '', '', '', ''),
('out', '6212120482083', '', '', '', '', '16:54 29-4-2020', '29-4-2020', '16:54:00', 'Staff', '', '', 'NV / Ntantiso', '', '', '', ''),
('out', '6212120482083', '', '', '', '', '16:58 28-4-2020', '28-4-2020', '16:58:00', 'Staff', '', '', 'NV / Ntantiso', '', '', '', ''),
('out', '6212120482083', '', '', '', '', '16:42 22-4-2020', '22-4-2020', '16:42:00', 'Staff', '', '', 'NV / Ntsntido', '', '', '', ''),
('out', '6212120482083', '', '', '', '', '16:35 21-4-2020', '21-4-2020', '16:35:00', 'Staff', '', '', 'VN / ntsntido', '', '', '', ''),
('out', '6212120482083', '', '', '', '', '16:34 20-4-2020', '20-4-2020', '16:34:00', 'Staff', '', '', 'NP  / Ntantiso', '', '', '', ''),
('out', '6212120482083', '', '', '', '', '16:54 17-4-2020', '17-4-2020', '16:54:00', 'Staff', '', '', 'NV / Ntantiso', '', '', '', ''),
('in', '6303095010080', 'JLPhillips', '', '', '', '15:44 27-4-2020', '27-4-2020', '15:44:00', 'Visitors', 'Expired car licence', 'JL / Phillips', '', '', '', '', '122'),
('in', '6303095010080', 'JLPHILLIPS', '', '', '6303095010080', '16:26 27-4-2020', '27-4-2020', '16:26:00', 'Visitors', 'Expired driver licence, Expired car licence', 'JL / PHILLIPS', '', '', '', '', '122'),
('in', '6308245423083', 'NJBATINI', 'PA Butchery', '', '6308245423083', '15:02 04-5-2020', '2020/04/05', '15:02:00', 'Contractors', 'Expired car licence', 'NJ / BATINI', '', '', '', 'PA Butchery', ''),
('in', '6311125777081', 'Belwan linoilr', '', '', '', '07:56 07-5-2020', '2020/07/05', '07:56:00', 'Staff', '', '', 'Belwan  / linoilr', '', 'work', '', ''),
('in', '6311125777081', 'LBelwana', '', '', '', '07:37 11-5-2020', '2020/11/05', '07:37:00', 'Staff', '', '', 'L / Belwana', '', 'M', '', ''),
('in', '6311125777081', 'LBelwana', '', '', '', '07:41 08-5-2020', '2020/08/05', '07:41:00', 'Staff', '', '', 'L / Belwana', '', 'M', '', ''),
('in', '6311125777081', 'LBelwana', '', '', '', '07:48 05-5-2020', '2020/05/05', '07:48:00', 'Staff', '', '', 'L / Belwana', '', 'M', '', ''),
('in', '6311125777081', 'Lbhelwana', '', '', '', '07:48 06-5-2020', '2020/06/05', '07:48:00', 'Staff', '', '', 'L / bhelwana', '', 'work', '', ''),
('out', '6311125777081', 'THANDEKILEKOMENI', '', '', '6507205851080', '16:30 06-5-2020', '2020/06/05', '16:30:00', 'Staff', '', '', 'L / bhelwana', '', 'work', '', ''),
('out', '6311125777081', '', '', '', '', '16:28 08-5-2020', '2020/08/05', '16:28:00', 'Staff', '', '', 'L / Belwana', '', 'M', '', ''),
('out', '6311125777081', '', '', '', '', '16:29 07-5-2020', '2020/07/05', '16:29:00', 'Staff', '', '', 'Belwan  / linoilr', '', 'work', '', ''),
('out', '6311125777081', '', '', '', '', '16:28 05-5-2020', '2020/05/05', '16:28:00', 'Staff', '', '', 'L / Belwana', '', 'M', '', ''),
('in', '6311235954083', 'GladmanSontsonga', '', '', '', '08:05 20-4-2020', '20-4-2020', '08:05:00', 'Staff', '', '', 'Gladman / Sontsonga', '', '', '', ''),
('in', '6311235954083', 'GSontsonga', '', '', '', '07:36 08-5-2020', '2020/08/05', '07:36:00', 'Staff', '', '', 'G / Sontsonga', '', 'M', '', ''),
('in', '6311235954083', 'gsontsonga', '', '', '', '07:37 06-5-2020', '2020/06/05', '07:37:00', 'Staff', '', '', 'g / sontsonga', '', 'work', '', ''),
('in', '6311235954083', 'GSontsonga', '', '', '', '07:39 05-5-2020', '2020/05/05', '07:39:00', 'Staff', '', '', 'G / Sontsonga', '', 'M', '', ''),
('in', '6311235954083', 'GSontsonga', '', '', '', '07:44 04-5-2020', '2020/04/05', '07:44:00', 'Staff', '', '', 'G / Sontsonga', '', 'Mantainance', '', ''),
('in', '6311235954083', 'GSontsonga', '', '', '', '07:41 30-4-2020', '30-4-2020', '07:41:00', 'Staff', '', '', 'G / Sontsonga', '', '', '', ''),
('in', '6311235954083', 'GSontsonga', '', '', '', '07:43 29-4-2020', '29-4-2020', '07:43:00', 'Staff', '', '', 'G / Sontsonga', '', '', '', ''),
('in', '6311235954083', 'GSontsonga', '', '', '', '08:07 28-4-2020', '28-4-2020', '08:07:00', 'Staff', '', '', 'G / Sontsonga', '', '', '', ''),
('in', '6311235954083', 'GSontsonga', '', '', '', '07:35 24-4-2020', '24-4-2020', '07:35:00', 'Staff', '', '', 'G / Sontsonga', '', '', '', ''),
('in', '6311235954083', 'GSontsonga', '', '', '', '07:51 23-4-2020', '23-4-2020', '07:51:00', 'Staff', '', '', 'G / Sontsonga', '', '', '', ''),
('in', '6311235954083', 'GSontsonga', '', '', '', '07:47 22-4-2020', '22-4-2020', '07:47:00', 'Staff', '', '', 'G / Sontsonga', '', '', '', ''),
('in', '6311235954083', 'GSontsonga', '', '', '', '07:47 21-4-2020', '21-4-2020', '07:47:00', 'Staff', '', '', 'G / Sontsonga', '', '', '', ''),
('in', '6311235954083', 'GSontsonga', '', '', '', '08:03 17-4-2020', '17-4-2020', '08:03:00', 'Staff', '', '', 'G / Sontsonga', '', '', '', ''),
('in', '6311235954083', 'GSontsonga', '', '', '', '08:07 14-4-2020', '14-4-2020', '08:07:00', 'Staff', '', '', 'G / Sontsonga', '', '', '', ''),
('in', '6311235954083', 'sintsladmans', '', '', '', '07:59 15-4-2020', '15-4-2020', '07:59:00', 'Staff', '', '', 'sintsladman / s', '', '', '', ''),
('in', '6311235954083', 'Sontsonga Gladman', '', '', '', '07:50 07-5-2020', '2020/07/05', '07:50:00', 'Staff', '', '', 'Sontsonga  / Gladman', '', 'work', '', ''),
('in', '6311235954083', 'SSontsongs', '', '', '', '07:54 11-5-2020', '2020/11/05', '07:54:00', 'Staff', '', '', 'S / Sontsongs', '', 'M,', '', ''),
('out', '6311235954083', '', '', '', '', '16:25 08-5-2020', '2020/08/05', '16:25:00', 'Staff', '', '', 'G / Sontsonga', '', 'M', '', ''),
('out', '6311235954083', '', '', '', '', '16:27 07-5-2020', '2020/07/05', '16:27:00', 'Staff', '', '', 'Sontsonga  / Gladman', '', 'work', '', ''),
('out', '6311235954083', '', '', '', '', '16:28 06-5-2020', '2020/06/05', '16:28:00', 'Staff', '', '', 'g / sontsonga', '', 'work', '', ''),
('out', '6311235954083', '', '', '', '', '16:26 05-5-2020', '2020/05/05', '16:26:00', 'Staff', '', '', 'G / Sontsonga', '', 'M', '', ''),
('out', '6311235954083', '', '', '', '', '16:27 04-5-2020', '2020/04/05', '16:27:00', 'Staff', '', '', 'G / Sontsonga', '', 'Mantainance', '', ''),
('out', '6311235954083', '', '', '', '', '16:28 30-4-2020', '30-4-2020', '16:28:00', 'Staff', '', '', 'G / Sontsonga', '', '', '', ''),
('out', '6311235954083', '', '', '', '', '16:27 29-4-2020', '29-4-2020', '16:27:00', 'Staff', '', '', 'G / Sontsonga', '', '', '', ''),
('out', '6311235954083', '', '', '', '', '16:30 28-4-2020', '28-4-2020', '16:30:00', 'Staff', '', '', 'G / Sontsonga', '', '', '', ''),
('out', '6311235954083', '', '', '', '', '16:29 24-4-2020', '24-4-2020', '16:29:00', 'Staff', '', '', 'G / Sontsonga', '', '', '', ''),
('out', '6311235954083', '', '', '', '', '16:34 23-4-2020', '23-4-2020', '16:34:00', 'Staff', '', '', 'G / Sontsonga', '', '', '', ''),
('out', '6311235954083', '', '', '', '', '16:30 22-4-2020', '22-4-2020', '16:30:00', 'Staff', '', '', 'G / Sontsonga', '', '', '', ''),
('out', '6311235954083', '', '', '', '', '16:30 21-4-2020', '21-4-2020', '16:30:00', 'Staff', '', '', 'G / Sontsonga', '', '', '', ''),
('out', '6311235954083', '', '', '', '', '12:15 20-4-2020', '20-4-2020', '12:15:00', 'Staff', '', '', 'Gladman / Sontsonga', '', '', '', ''),
('out', '6311235954083', '', '', '', '', '10:58 17-4-2020', '17-4-2020', '10:58:00', 'Staff', '', '', 'G / Sontsonga', '', '', '', ''),
('out', '6311235954083', '', '', '', '', '10:04 15-4-2020', '15-4-2020', '10:04:00', 'Staff', '', '', 'sintsladman / s', '', '', '', ''),
('out', '6311235954083', '', '', '', '', '10:38 14-4-2020', '14-4-2020', '10:38:00', 'Staff', '', '', 'G / Sontsonga', '', '', '', ''),
('in', '6312030723087', 'E.PTsolekile', '', '', '', '17:53 27-4-2020', '27-4-2020', '17:53:00', 'Staff', '', '', 'E.P / Tsolekile', '', '', '', ''),
('in', '6312030723087', 'E.PTsolekile', '', '', '', '17:39 23-4-2020', '23-4-2020', '17:39:00', 'Staff', '', '', 'E.P / Tsolekile', '', '', '', ''),
('in', '6312030723087', 'E.PTsolekile', '', '', '', '17:54 22-4-2020', '22-4-2020', '17:54:00', 'Staff', '', '', 'E.P / Tsolekile', '', '', '', ''),
('in', '6312030723087', 'E.PTsolekile', '', '', '', '18:12 17-4-2020', '17-4-2020', '18:12:00', 'Staff', '', '', 'E.P / Tsolekile', '', '', '', ''),
('in', '6312030723087', 'ellicia pumzatsolekile', '', '', '', '17:57 19-4-2020', '19-4-2020', '17:57:00', 'Staff', '', '', 'ellicia pumza / tsolekile', '', '', '', ''),
('in', '6312030723087', 'Ellicia Tsolekilepumza', '', '', '', '17:46 06-5-2020', '2020/06/05', '17:46:00', 'Staff', '', '', 'Ellicia Tsolekile / pumza', '', '208', '', ''),
('in', '6312030723087', 'ElliciaTsolekile', '', '', '', '18:00 03-5-2020', '2020/03/05', '18:00:00', 'Staff', '', '', 'Ellicia / Tsolekile', '', '208', '', ''),
('in', '6312030723087', 'elliciatsolekule', '', '', '', '18:05 18-4-2020', '18-4-2020', '18:05:00', 'Staff', '', '', 'ellicia / tsolekule', '', '', '', ''),
('in', '6312030723087', 'EPTsolekile', '', '', '', '17:56 28-4-2020', '28-4-2020', '17:56:00', 'Staff', '', '', 'EP / Tsolekile', '', '', '', ''),
('in', '6312030723087', 'Phumza TsolekileAlicia Tsolekil', '', '', '', '17:45 13-4-2020', '13-4-2020', '17:45:00', 'Staff', '', '', 'Phumza Tsolekile / Alicia Tsolekil', '', '', '', ''),
('in', '6312030723087', 'Pumza TsolekileAllicia Tsolekile', '', '', '', '18:05 14-4-2020', '14-4-2020', '18:05:00', 'Staff', '', '', 'Pumza Tsolekile / Allicia Tsolekile', '', '', '', ''),
('in', '6312030723087', 'tsolekileellicia', '', '', '', '17:54 02-5-2020', '2020/02/05', '17:54:00', 'Staff', '', '', 'tsolekile / ellicia', '', '208', '', ''),
('in', '6312030723087', 'tsolekileellicia', '', '', '', '17:51 01-5-2020', '2020/01/05', '17:51:00', 'Staff', '', '', 'tsolekile / ellicia', '', '208', '', ''),
('in', '6312030723087', 'tsolekilepumza', '', '', '', '17:45 07-5-2020', '2020/07/05', '17:45:00', 'Staff', '', '', 'tsolekile / pumza', '', '208', '', ''),
('out', '6312030723087', '', '', '', '', '06:59 08-5-2020', '2020/08/05', '06:59:00', 'Staff', '', '', 'tsolekile / pumza', '', '208', '', ''),
('out', '6312030723087', '', '', '', '', '07:14 07-5-2020', '2020/07/05', '07:14:00', 'Staff', '', '', 'Ellicia Tsolekile / pumza', '', '208', '', ''),
('out', '6312030723087', '', '', '', '', '07:10 04-5-2020', '2020/04/05', '07:10:00', 'Staff', '', '', 'Ellicia / Tsolekile', '', '208', '', ''),
('out', '6312030723087', '', '', '', '', '07:01 03-5-2020', '2020/03/05', '07:01:00', 'Staff', '', '', 'tsolekile / ellicia', '', '208', '', ''),
('out', '6312030723087', '', '', '', '', '07:16 02-5-2020', '2020/02/05', '07:16:00', 'Staff', '', '', 'tsolekile / ellicia', '', '208', '', ''),
('out', '6312030723087', '', '', '', '', '07:08 29-4-2020', '29-4-2020', '07:08:00', 'Staff', '', '', 'EP / Tsolekile', '', '', '', ''),
('out', '6312030723087', '', '', '', '', '07:08 28-4-2020', '28-4-2020', '07:08:00', 'Staff', '', '', 'E.P / Tsolekile', '', '', '', ''),
('out', '6312030723087', '', '', '', '', '07:10 24-4-2020', '24-4-2020', '07:10:00', 'Staff', '', '', 'E.P / Tsolekile', '', '', '', ''),
('out', '6312030723087', '', '', '', '', '07:02 23-4-2020', '23-4-2020', '07:02:00', 'Staff', '', '', 'E.P / Tsolekile', '', '', '', ''),
('out', '6312030723087', '', '', '', '', '07:03 20-4-2020', '20-4-2020', '07:03:00', 'Staff', '', '', 'ellicia pumza / tsolekile', '', '', '', ''),
('out', '6312030723087', '', '', '', '', '06:47 19-4-2020', '19-4-2020', '06:47:00', 'Staff', '', '', 'ellicia / tsolekule', '', '', '', ''),
('out', '6312030723087', '', '', '', '', '06:40 18-4-2020', '18-4-2020', '06:40:00', 'Staff', '', '', 'E.P / Tsolekile', '', '', '', ''),
('out', '6312030723087', '', '', '', '', '07:03 15-4-2020', '15-4-2020', '07:03:00', 'Staff', '', '', 'Pumza Tsolekile / Allicia Tsolekile', '', '', '', ''),
('out', '6312030723087', '', '', '', '', '07:09 14-4-2020', '14-4-2020', '07:09:00', 'Staff', '', '', 'Phumza Tsolekile / Alicia Tsolekil', '', '', '', ''),
('in', '6401016265088', 'GrootboomThamsanqa', '', '', '', '07:18 07-5-2020', '2020/07/05', '07:18:00', 'Staff', '', '', 'Grootboom / Thamsanqa', '', 'work', '', ''),
('in', '6401016265088', 'T.RGrootboom', '', '', '', '07:24 05-5-2020', '2020/05/05', '07:24:00', 'Staff', '', '', 'T.R / Grootboom', '', 'K G', '', ''),
('in', '6401016265088', 'TRGrootboom', '', '', '', '07:26 11-5-2020', '2020/11/05', '07:26:00', 'Staff', '', '', 'TR / Grootboom', '', 'KG', '', ''),
('in', '6401016265088', 'TRGrootboom', '', '', '', '07:26 08-5-2020', '2020/08/05', '07:26:00', 'Staff', '', '', 'TR / Grootboom', '', 'KG', '', ''),
('in', '6401016265088', 'TRGrootboom', '', '', '', '07:19 04-5-2020', '2020/04/05', '07:19:00', 'Staff', '', '', 'TR / Grootboom', '', 'Kenton Gardens', '', ''),
('in', '6401016265088', 'TRGrootboom', '', '', '', '07:03 30-4-2020', '30-4-2020', '07:03:00', 'Staff', '', '', 'TR / Grootboom', '', '', '', ''),
('out', '6401016265088', '', '', '', '', '16:16 08-5-2020', '2020/08/05', '16:16:00', 'Staff', '', '', 'TR / Grootboom', '', 'KG', '', ''),
('out', '6401016265088', '', '', '', '', '16:25 07-5-2020', '2020/07/05', '16:25:00', 'Staff', '', '', 'Grootboom / Thamsanqa', '', 'work', '', ''),
('out', '6401016265088', '', '', '', '', '16:25 05-5-2020', '2020/05/05', '16:25:00', 'Staff', '', '', 'T.R / Grootboom', '', 'K G', '', ''),
('out', '6401016265088', '', '', '', '', '16:25 04-5-2020', '2020/04/05', '16:25:00', 'Staff', '', '', 'TR / Grootboom', '', 'Kenton Gardens', '', ''),
('out', '6401016265088', '', '', '', '', '07:49 30-4-2020', '30-4-2020', '07:49:00', 'Staff', '', '', 'TR / Grootboom', '', '', '', ''),
('out', '6402290463084', '', '', '', '', '07:06 11-5-2020', '2020/11/05', '07:06:00', 'Staff', '', '', '', '', '', '', ''),
('out', '6402290463084', '', '', '', '', '07:09 10-5-2020', '2020/10/05', '07:09:00', 'Staff', '', '', '', '', '', '', ''),
('out', '6402290463084', '', '', '', '', '07:10 06-5-2020', '2020/06/05', '07:10:00', 'Staff', '', '', '', '', '', '', ''),
('out', '6402290463084', '', '', '', '', '07:15 05-5-2020', '2020/05/05', '07:15:00', 'Staff', '', '', '', '', '', '', ''),
('out', '6402290463084', '', '', '', '', '06:59 01-5-2020', '2020/01/05', '06:59:00', 'Staff', '', '', '', '', '', '', ''),
('out', '6402290463084', '', '', '', '', '06:48 30-4-2020', '30-4-2020', '06:48:00', 'Staff', '', '', '', '', '', '', ''),
('out', '6402290463084', '', '', '', '', '07:08 27-4-2020', '27-4-2020', '07:08:00', 'Staff', '', '', '', '', '', '', ''),
('out', '6402290463084', '', '', '', '', '07:03 26-4-2020', '26-4-2020', '07:03:00', 'Staff', '', '', '', '', '', '', ''),
('out', '6402290463084', '', '', '', '', '07:05 25-4-2020', '25-4-2020', '07:05:00', 'Staff', '', '', '', '', '', '', ''),
('out', '6402290463084', '', '', '', '', '07:07 22-4-2020', '22-4-2020', '07:07:00', 'Staff', '', '', '', '', '', '', ''),
('out', '6402290463084', '', '', '', '', '07:11 21-4-2020', '21-4-2020', '07:11:00', 'Staff', '', '', '', '', '', '', ''),
('out', '6402290463084', '', '', '', '', '07:07 17-4-2020', '17-4-2020', '07:07:00', 'Staff', '', '', '', '', '', '', ''),
('out', '6402290463084', '', '', '', '', '07:09 16-4-2020', '16-4-2020', '07:09:00', 'Staff', '', '', '', '', '', '', ''),
('out', '6402290463084', '', '', '', '', '07:07 12-4-2020', '2020/12/04', '07:07:00', 'Staff', '', '', '', '', '', '', ''),
('out', '6402290463084', '', '', '', '', '06:57 11-4-2020', '2020/11/04', '06:57:00', 'Staff', '', '', '', '', '', '', ''),
('in', '6501010740083', 'FMGengqani', '', '', '', '07:53 11-5-2020', '2020/11/05', '07:53:00', 'Staff', '', '', 'FM / Gengqani', '', '175', '', ''),
('in', '6501010740083', 'FUNEKA MIRRIAMQENGQANI', '', '', '6501010740083', '08:00 08-5-2020', '2020/08/05', '08:00:00', 'Staff', '', '', 'FUNEKA MIRRIAM / QENGQANI', '', '175', '', ''),
('out', '6501010740083', 'FUNEKA MIRRIAMQENGQANI', '', '', '6501010740083', '12:46 08-5-2020', '2020/08/05', '12:46:00', 'Staff', '', '', 'FUNEKA MIRRIAM / QENGQANI', '', '175', '', ''),
('in', '6501010740083', 'FUNEKA MIRRIAMQENGQANI', '', '', '6501010740083', '07:57 07-5-2020', '2020/07/05', '07:57:00', 'Staff', '', '', 'FUNEKA MIRRIAM / QENGQANI', '', 'work', '', ''),
('out', '6501010740083', '', '', '', '', '13:21 07-5-2020', '2020/07/05', '13:21:00', 'Staff', '', '', 'FUNEKA MIRRIAM / QENGQANI', '', 'work', '', ''),
('out', '6501010740083', '', '', '', '', '15:01 06-5-2020', '2020/06/05', '15:01:00', 'Staff', '', '', '', '', '', '', ''),
('out', '6503165013084', '', '', '', '', '11:05 24-4-2020', '24-4-2020', '11:05:00', 'Visitors', '', '', '', '', '', '', ''),
('in', '6507205851080', 'THANDEKILEKOMENI', '', '', '6507205851080', '07:37 08-5-2020', '2020/08/05', '07:37:00', 'Staff', '', '', 'THANDEKILE / KOMENI', '', 'M', '', ''),
('out', '6507205851080', 'THANDEKILEKOMENI', '', '', '6507205851080', '16:27 08-5-2020', '2020/08/05', '16:27:00', 'Staff', '', '', 'THANDEKILE / KOMENI', '', 'M', '', ''),
('in', '6507205851080', 'THANDEKILEKOMENI', '', '', '6507205851080', '07:39 07-5-2020', '2020/07/05', '07:39:00', 'Staff', '', '', 'THANDEKILE / KOMENI', '', 'Work', '', ''),
('out', '6507205851080', 'THANDEKILEKOMENI', '', '', '6507205851080', '16:29 07-5-2020', '2020/07/05', '16:29:00', 'Staff', '', '', 'THANDEKILE / KOMENI', '', 'Work', '', ''),
('in', '6507205851080', 'THANDEKILEKOMENI', '', '', '6507205851080', '07:44 04-5-2020', '2020/04/05', '07:44:00', 'Staff', '', '', 'THANDEKILE / KOMENI', '', 'Mantainance', '', ''),
('out', '6507205851080', 'THANDEKILEKOMENI', '', '', '6507205851080', '16:28 04-5-2020', '2020/04/05', '16:28:00', 'Staff', '', '', 'THANDEKILE / KOMENI', '', 'Mantainance', '', ''),
('in', '6507205851080', 'THANDEKILEKOMENI', '', '', '6507205851080', '07:41 30-4-2020', '30-4-2020', '07:41:00', 'Staff', '', '', 'THANDEKILE / KOMENI', '', '', '', ''),
('out', '6507205851080', 'THANDEKILEKOMENI', '', '', '6507205851080', '16:29 30-4-2020', '30-4-2020', '16:29:00', 'Staff', '', '', 'THANDEKILE / KOMENI', '', '', '', ''),
('out', '6507205851080', 'THANDEKILEKOMENI', '', '', '6507205851080', '16:28 29-4-2020', '29-4-2020', '16:28:00', 'Staff', '', '', 'T / Nkomeni', '', '', '', ''),
('out', '6507205851080', 'THANDEKILEKOMENI', '', '', '6507205851080', '16:32 28-4-2020', '28-4-2020', '16:32:00', 'Staff', '', '', 'T / Nkomeni', '', '', '', ''),
('in', '6507205851080', 'Tk', '', '', '', '07:55 11-5-2020', '2020/11/05', '07:55:00', 'Staff', '', '', 'T / k', '', 'm', '', ''),
('in', '6507205851080', 'tkhumeni', '', '', '', '07:30 06-5-2020', '2020/06/05', '07:30:00', 'Staff', '', '', 't / khumeni', '', 'work', '', ''),
('in', '6507205851080', 'TKomene', '', '', '', '07:39 05-5-2020', '2020/05/05', '07:39:00', 'Staff', '', '', 'T / Komene', '', 'M', '', ''),
('in', '6507205851080', 'TNkomeni', '', '', '', '07:43 29-4-2020', '29-4-2020', '07:43:00', 'Staff', '', '', 'T / Nkomeni', '', '', '', ''),
('in', '6507205851080', 'TNkomeni', '', '', '', '08:08 28-4-2020', '28-4-2020', '08:08:00', 'Staff', '', '', 'T / Nkomeni', '', '', '', ''),
('out', '6507205851080', '', '', '', '', '16:26 05-5-2020', '2020/05/05', '16:26:00', 'Staff', '', '', 'T / Komene', '', 'M', '', ''),
('in', '6509100150089', 'NontsikeleloThonga', '', '', '', '08:06 20-4-2020', '20-4-2020', '08:06:00', 'Staff', '', '', 'Nontsikelelo / Thonga', '', '', '', ''),
('in', '6509100150089', 'NontsikeleloThonga', '', '', '', '08:02 14-4-2020', '14-4-2020', '08:02:00', 'Staff', '', '', 'Nontsikelelo / Thonga', '', '', '', ''),
('in', '6509100150089', 'NThonga', '', '', '', '08:00 09-5-2020', '2020/09/05', '08:00:00', 'Staff', '', '', 'N / Thonga', '', '157', '', ''),
('in', '6509100150089', 'NThonga', '', '', '', '07:59 08-5-2020', '2020/08/05', '07:59:00', 'Staff', '', '', 'N / Thonga', '', '157', '', ''),
('in', '6509100150089', 'NThonga', '', '', '', '10:16 06-5-2020', '2020/06/05', '10:16:00', 'Staff', '', '', 'N / Thonga', '', 'work', '', ''),
('in', '6509100150089', 'NThonga', '', '', '', '08:03 05-5-2020', '2020/05/05', '08:03:00', 'Staff', '', '', 'N / Thonga', '', 'Unit 157', '', ''),
('in', '6509100150089', 'NThonga', '', '', '', '08:01 04-5-2020', '2020/04/05', '08:01:00', 'Staff', '', '', 'N / Thonga', '', 'Unit 157', '', ''),
('in', '6509100150089', 'NThonga', '', '', '', '08:07 01-5-2020', '2020/01/05', '08:07:00', 'Staff', '', '', 'N / Thonga', '', '157', '', ''),
('in', '6509100150089', 'NThonga', '', '', '', '08:00 30-4-2020', '30-4-2020', '08:00:00', 'Staff', '', '', 'N / Thonga', '', '', '', ''),
('in', '6509100150089', 'NThonga', '', '', '', '08:08 29-4-2020', '29-4-2020', '08:08:00', 'Staff', '', '', 'N / Thonga', '', '', '', ''),
('in', '6509100150089', 'NThonga', '', '', '', '10:01 28-4-2020', '28-4-2020', '10:01:00', 'Staff', '', '', 'N / Thonga', '', '', '', ''),
('in', '6509100150089', 'NThonga', '', '', '', '08:08 27-4-2020', '27-4-2020', '08:08:00', 'Staff', '', '', 'N / Thonga', '', '', '', ''),
('in', '6509100150089', 'NThonga', '', '', '', '08:11 25-4-2020', '25-4-2020', '08:11:00', 'Staff', '', '', 'N / Thonga', '', '', '', ''),
('in', '6509100150089', 'NThonga', '', '', '', '08:08 24-4-2020', '24-4-2020', '08:08:00', 'Staff', '', '', 'N / Thonga', '', '', '', ''),
('in', '6509100150089', 'NThonga', '', '', '', '08:07 23-4-2020', '23-4-2020', '08:07:00', 'Staff', '', '', 'N / Thonga', '', '', '', ''),
('in', '6509100150089', 'NThonga', '', '', '', '08:05 22-4-2020', '22-4-2020', '08:05:00', 'Staff', '', '', 'N / Thonga', '', '', '', ''),
('in', '6509100150089', 'NThonga', '', '', '', '08:09 21-4-2020', '21-4-2020', '08:09:00', 'Staff', '', '', 'N / Thonga', '', '', '', ''),
('in', '6509100150089', 'NThonga', '', '', '', '08:11 18-4-2020', '18-4-2020', '08:11:00', 'Staff', '', '', 'N / Thonga', '', '', '', ''),
('in', '6509100150089', 'NThonga', '', '', '', '08:04 17-4-2020', '17-4-2020', '08:04:00', 'Staff', '', '', 'N / Thonga', '', '', '', ''),
('in', '6509100150089', 'NThonga', '', '', '', '08:09 16-4-2020', '16-4-2020', '08:09:00', 'Staff', '', '', 'N / Thonga', '', '', '', ''),
('in', '6509100150089', 'NThonga', '', '', '', '08:02 11-4-2020', '2020/11/04', '08:02:00', 'Staff', '', '', 'N / Thonga', '', '', '', ''),
('in', '6509100150089', 'NtsikiThonga', '', '', '', '09:28 02-5-2020', '2020/02/05', '09:28:00', 'Staff', '', '', 'Ntsiki / Thonga', '', '157', '', ''),
('in', '6509100150089', 'Thongan', '', '', '', '08:26 15-4-2020', '15-4-2020', '08:26:00', 'Staff', '', '', 'Thonga / n', '', '', '', ''),
('in', '6509100150089', 'ThongaNontsikelelo', '', '', '', '07:57 07-5-2020', '2020/07/05', '07:57:00', 'Staff', '', '', 'Thonga / Nontsikelelo', '', 'work', '', ''),
('in', '6509100150089', 'TThonga', '', '', '', '07:59 11-5-2020', '2020/11/05', '07:59:00', 'Staff', '', '', 'T / Thonga', '', '157', '', ''),
('out', '6509100150089', '', '', '', '', '13:12 09-5-2020', '2020/09/05', '13:12:00', 'Staff', '', '', 'N / Thonga', '', '157', '', ''),
('out', '6509100150089', '', '', '', '', '15:11 08-5-2020', '2020/08/05', '15:11:00', 'Staff', '', '', 'N / Thonga', '', '157', '', ''),
('out', '6509100150089', '', '', '', '', '15:05 07-5-2020', '2020/07/05', '15:05:00', 'Staff', '', '', 'Thonga / Nontsikelelo', '', 'work', '', ''),
('out', '6509100150089', '', '', '', '', '15:08 06-5-2020', '2020/06/05', '15:08:00', 'Staff', '', '', 'N / Thonga', '', 'work', '', ''),
('out', '6509100150089', '', '', '', '', '15:19 05-5-2020', '2020/05/05', '15:19:00', 'Staff', '', '', 'N / Thonga', '', 'Unit 157', '', ''),
('out', '6509100150089', '', '', '', '', '15:13 04-5-2020', '2020/04/05', '15:13:00', 'Staff', '', '', 'N / Thonga', '', 'Unit 157', '', ''),
('out', '6509100150089', '', '', '', '', '13:24 02-5-2020', '2020/02/05', '13:24:00', 'Staff', '', '', 'Ntsiki / Thonga', '', '157', '', ''),
('out', '6509100150089', '', '', '', '', '15:08 01-5-2020', '2020/01/05', '15:08:00', 'Staff', '', '', 'N / Thonga', '', '157', '', ''),
('out', '6509100150089', '', '', '', '', '14:10 30-4-2020', '30-4-2020', '14:10:00', 'Staff', '', '', 'N / Thonga', '', '', '', ''),
('out', '6509100150089', '', '', '', '', '14:09 29-4-2020', '29-4-2020', '14:09:00', 'Staff', '', '', 'N / Thonga', '', '', '', ''),
('out', '6509100150089', '', '', '', '', '15:13 28-4-2020', '28-4-2020', '15:13:00', 'Staff', '', '', 'N / Thonga', '', '', '', ''),
('out', '6509100150089', '', '', '', '', '15:01 27-4-2020', '27-4-2020', '15:01:00', 'Staff', '', '', 'N / Thonga', '', '', '', ''),
('out', '6509100150089', '', '', '', '', '13:30 25-4-2020', '25-4-2020', '13:30:00', 'Staff', '', '', 'N / Thonga', '', '', '', ''),
('out', '6509100150089', '', '', '', '', '15:05 24-4-2020', '24-4-2020', '15:05:00', 'Staff', '', '', 'N / Thonga', '', '', '', ''),
('out', '6509100150089', '', '', '', '', '15:09 23-4-2020', '23-4-2020', '15:09:00', 'Staff', '', '', 'N / Thonga', '', '', '', ''),
('out', '6509100150089', '', '', '', '', '15:11 22-4-2020', '22-4-2020', '15:11:00', 'Staff', '', '', 'N / Thonga', '', '', '', ''),
('out', '6509100150089', '', '', '', '', '15:10 21-4-2020', '21-4-2020', '15:10:00', 'Staff', '', '', 'N / Thonga', '', '', '', ''),
('out', '6509100150089', '', '', '', '', '15:18 20-4-2020', '20-4-2020', '15:18:00', 'Staff', '', '', 'Nontsikelelo / Thonga', '', '', '', ''),
('out', '6509100150089', '', '', '', '', '09:28 19-4-2020', '19-4-2020', '09:28:00', 'Staff', '', '', 'N / Thonga', '', '', '', ''),
('out', '6509100150089', '', '', '', '', '15:09 17-4-2020', '17-4-2020', '15:09:00', 'Staff', '', '', 'N / Thonga', '', '', '', ''),
('out', '6509100150089', '', '', '', '', '15:08 16-4-2020', '16-4-2020', '15:08:00', 'Staff', '', '', 'N / Thonga', '', '', '', ''),
('out', '6509100150089', '', '', '', '', '15:05 15-4-2020', '15-4-2020', '15:05:00', 'Staff', '', '', 'Thonga / n', '', '', '', ''),
('out', '6509100150089', '', '', '', '', '15:08 14-4-2020', '14-4-2020', '15:08:00', 'Staff', '', '', 'Nontsikelelo / Thonga', '', '', '', ''),
('out', '6509100150089', '', '', '', '', '12:55 11-4-2020', '2020/11/04', '12:55:00', 'Staff', '', '', 'N / Thonga', '', '', '', ''),
('in', '6512260276082', 'JMposelwa', '', '', '', '07:48 08-5-2020', '2020/08/05', '07:48:00', 'Staff', '', '', 'J / Mposelwa', '', 'Unit 226', '', ''),
('in', '6609160323087', 'Ditalap', '', '', '', '08:00 15-4-2020', '15-4-2020', '08:00:00', 'Staff', '', '', 'Ditala / p', '', '', '', ''),
('in', '6609160323087', 'DitanaPindiwe', '', '', '', '07:52 13-4-2020', '13-4-2020', '07:52:00', 'Staff', '', '', 'Ditana / Pindiwe', '', '', '', ''),
('in', '6609160323087', 'PD', '', '', '', '07:53 09-5-2020', '2020/09/05', '07:53:00', 'Staff', '', '', 'P / D', '', 'l', '', ''),
('in', '6609160323087', 'PDitala', '', '', '', '07:48 11-5-2020', '2020/11/05', '07:48:00', 'Staff', '', '', 'P / Ditala', '', 'L', '', ''),
('in', '6609160323087', 'PDitala', '', '', '', '07:50 05-5-2020', '2020/05/05', '07:50:00', 'Staff', '', '', 'P / Ditala', '', 'L', '', ''),
('in', '6609160323087', 'PDitala', '', '', '', '08:04 29-4-2020', '29-4-2020', '08:04:00', 'Staff', '', '', 'P / Ditala', '', '', '', ''),
('in', '6609160323087', 'PDitala', '', '', '', '07:48 27-4-2020', '27-4-2020', '07:48:00', 'Staff', '', '', 'P / Ditala', '', '', '', ''),
('in', '6609160323087', 'PDitala', '', '', '', '07:47 25-4-2020', '25-4-2020', '07:47:00', 'Staff', '', '', 'P / Ditala', '', '', '', ''),
('in', '6609160323087', 'PDitala', '', '', '', '08:15 24-4-2020', '24-4-2020', '08:15:00', 'Staff', '', '', 'P / Ditala', '', '', '', ''),
('in', '6609160323087', 'PDitala', '', '', '', '08:16 23-4-2020', '23-4-2020', '08:16:00', 'Staff', '', '', 'P / Ditala', '', '', '', ''),
('in', '6609160323087', 'PDitala', '', '', '', '07:49 22-4-2020', '22-4-2020', '07:49:00', 'Staff', '', '', 'P / Ditala', '', '', '', ''),
('in', '6609160323087', 'PDitala', '', '', '', '07:50 17-4-2020', '17-4-2020', '07:50:00', 'Staff', '', '', 'P / Ditala', '', '', '', ''),
('in', '6609160323087', 'PDitala', '', '', '', '07:52 11-4-2020', '2020/11/04', '07:52:00', 'Staff', '', '', 'P / Ditala', '', '', '', ''),
('in', '6609160323087', 'PDitals', '', '', '', '07:50 28-4-2020', '28-4-2020', '07:50:00', 'Staff', '', '', 'P / Ditals', '', '', '', ''),
('in', '6609160323087', 'PDitana', '', '', '', '07:52 04-5-2020', '2020/04/05', '07:52:00', 'Staff', '', '', 'P / Ditana', '', 'Laundry', '', ''),
('in', '6609160323087', 'PDitana', '', '', '', '07:50 01-5-2020', '2020/01/05', '07:50:00', 'Staff', '', '', 'P / Ditana', '', 'laundry', '', ''),
('in', '6609160323087', 'PDitani', '', '', '', '07:47 08-5-2020', '2020/08/05', '07:47:00', 'Staff', '', '', 'P / Ditani', '', 'Laundry', '', ''),
('in', '6609160323087', 'PDitsla', '', '', '', '07:50 30-4-2020', '30-4-2020', '07:50:00', 'Staff', '', '', 'P / Ditsla', '', '', '', ''),
('in', '6609160323087', 'Pditsos', '', '', '', '07:50 16-4-2020', '16-4-2020', '07:50:00', 'Staff', '', '', 'P / ditsos', '', '', '', ''),
('in', '6609160323087', 'PindiweDitana', '', '', '', '07:50 20-4-2020', '20-4-2020', '07:50:00', 'Staff', '', '', 'Pindiwe / Ditana', '', '', '', ''),
('in', '6609160323087', 'PindiweDitana', '', '', '', '07:52 14-4-2020', '14-4-2020', '07:52:00', 'Staff', '', '', 'Pindiwe / Ditana', '', '', '', ''),
('in', '6609160323087', 'PPDitala', '', '', '', '07:52 21-4-2020', '21-4-2020', '07:52:00', 'Staff', '', '', 'PP / Ditala', '', '', '', ''),
('out', '6609160323087', '', '', '', '', '12:46 09-5-2020', '2020/09/05', '12:46:00', 'Staff', '', '', 'P / D', '', 'l', '', ''),
('out', '6609160323087', '', '', '', '', '15:57 08-5-2020', '2020/08/05', '15:57:00', 'Staff', '', '', 'P / Ditani', '', 'Laundry', '', ''),
('out', '6609160323087', '', '', '', '', '15:57 05-5-2020', '2020/05/05', '15:57:00', 'Staff', '', '', 'P / Ditala', '', 'L', '', ''),
('out', '6609160323087', '', '', '', '', '15:58 04-5-2020', '2020/04/05', '15:58:00', 'Staff', '', '', 'P / Ditana', '', 'Laundry', '', ''),
('out', '6609160323087', '', '', '', '', '15:56 01-5-2020', '2020/01/05', '15:56:00', 'Staff', '', '', 'P / Ditana', '', 'laundry', '', ''),
('out', '6609160323087', '', '', '', '', '15:57 30-4-2020', '30-4-2020', '15:57:00', 'Staff', '', '', 'P / Ditsla', '', '', '', ''),
('out', '6609160323087', '', '', '', '', '15:58 29-4-2020', '29-4-2020', '15:58:00', 'Staff', '', '', 'P / Ditala', '', '', '', ''),
('out', '6609160323087', '', '', '', '', '15:57 28-4-2020', '28-4-2020', '15:57:00', 'Staff', '', '', 'P / Ditals', '', '', '', ''),
('out', '6609160323087', '', '', '', '', '15:52 27-4-2020', '27-4-2020', '15:52:00', 'Staff', '', '', 'P / Ditala', '', '', '', ''),
('out', '6609160323087', '', '', '', '', '13:06 25-4-2020', '25-4-2020', '13:06:00', 'Staff', '', '', 'P / Ditala', '', '', '', ''),
('out', '6609160323087', '', '', '', '', '15:51 24-4-2020', '24-4-2020', '15:51:00', 'Staff', '', '', 'P / Ditala', '', '', '', ''),
('out', '6609160323087', '', '', '', '', '15:53 23-4-2020', '23-4-2020', '15:53:00', 'Staff', '', '', 'P / Ditala', '', '', '', ''),
('out', '6609160323087', '', '', '', '', '16:01 22-4-2020', '22-4-2020', '16:01:00', 'Staff', '', '', 'P / Ditala', '', '', '', ''),
('out', '6609160323087', '', '', '', '', '15:58 21-4-2020', '21-4-2020', '15:58:00', 'Staff', '', '', 'PP / Ditala', '', '', '', ''),
('out', '6609160323087', '', '', '', '', '15:55 20-4-2020', '20-4-2020', '15:55:00', 'Staff', '', '', 'Pindiwe / Ditana', '', '', '', ''),
('out', '6609160323087', '', '', '', '', '15:56 17-4-2020', '17-4-2020', '15:56:00', 'Staff', '', '', 'P / Ditala', '', '', '', ''),
('out', '6609160323087', '', '', '', '', '16:04 16-4-2020', '16-4-2020', '16:04:00', 'Staff', '', '', 'P / ditsos', '', '', '', ''),
('out', '6609160323087', '', '', '', '', '15:55 15-4-2020', '15-4-2020', '15:55:00', 'Staff', '', '', 'Ditala / p', '', '', '', ''),
('out', '6609160323087', '', '', '', '', '15:51 14-4-2020', '14-4-2020', '15:51:00', 'Staff', '', '', 'Pindiwe / Ditana', '', '', '', ''),
('out', '6609160323087', '', '', '', '', '15:51 13-4-2020', '13-4-2020', '15:51:00', 'Staff', '', '', 'Ditana / Pindiwe', '', '', '', ''),
('out', '6609160323087', '', '', '', '', '12:55 11-4-2020', '2020/11/04', '12:55:00', 'Staff', '', '', 'P / Ditala', '', '', '', ''),
('in', '6703130360087', 'L.E.Norongwa', '', '', '', '06:57 20-4-2020', '20-4-2020', '06:57:00', 'Staff', '', '', 'L.E. / Norongwa', '', '', '', ''),
('in', '6703130360087', 'L.E.Norongwana', '', '', '', '07:00 14-4-2020', '14-4-2020', '07:00:00', 'Staff', '', '', 'L.E. / Norongwana', '', '', '', ''),
('in', '6703130360087', 'LE Norongwana', '', '', '', '07:02 08-5-2020', '2020/08/05', '07:02:00', 'Staff', '', '', 'LE  / Norongwana', '', 'Care Centre', '', ''),
('in', '6703130360087', 'LE Norongwana', '', '', '', '07:01 05-5-2020', '2020/05/05', '07:01:00', 'Staff', '', '', 'LE  / Norongwana', '', 'Care Centre', '', ''),
('in', '6703130360087', 'LENigwala', '', '', '', '06:57 21-4-2020', '21-4-2020', '06:57:00', 'Staff', '', '', 'LE / Nigwala', '', '', '', ''),
('in', '6703130360087', 'LENorongwana', '', '', '', '06:56 11-5-2020', '2020/11/05', '06:56:00', 'Staff', '', '', 'LE / Norongwana', '', 'C/C', '', ''),
('in', '6703130360087', 'LENorongwana', '', '', '', '07:00 04-5-2020', '2020/04/05', '07:00:00', 'Staff', '', '', 'LE / Norongwana', '', 'Care Cenntre', '', ''),
('in', '6703130360087', 'LENorongwana', '', '', '', '07:02 30-4-2020', '30-4-2020', '07:02:00', 'Staff', '', '', 'LE / Norongwana', '', '', '', ''),
('in', '6703130360087', 'LENorongwana', '', '', '', '07:00 29-4-2020', '29-4-2020', '07:00:00', 'Staff', '', '', 'LE / Norongwana', '', '', '', ''),
('in', '6703130360087', 'LENorongwana', '', '', '', '06:55 28-4-2020', '28-4-2020', '06:55:00', 'Staff', '', '', 'LE / Norongwana', '', '', '', ''),
('in', '6703130360087', 'LENorongwana', '', '', '', '07:05 24-4-2020', '24-4-2020', '07:05:00', 'Staff', '', '', 'LE / Norongwana', '', '', '', ''),
('in', '6703130360087', 'LENorongwana', '', '', '', '07:05 23-4-2020', '23-4-2020', '07:05:00', 'Staff', '', '', 'LE / Norongwana', '', '', '', ''),
('in', '6703130360087', 'LENorongwana', '', '', '', '07:01 22-4-2020', '22-4-2020', '07:01:00', 'Staff', '', '', 'LE / Norongwana', '', '', '', '');
INSERT INTO `atthegate` (`direction`, `license`, `name`, `company`, `category`, `dr_license`, `creation`, `recdate`, `rectime`, `profile`, `incidents`, `dr_name`, `name_in`, `name_out`, `going`, `company2`, `visiting`) VALUES
('in', '6703130360087', 'LENorongwana', '', '', '', '07:04 17-4-2020', '17-4-2020', '07:04:00', 'Staff', '', '', 'LE / Norongwana', '', '', '', ''),
('in', '6703130360087', 'LENorongwana', '', '', '', '07:04 16-4-2020', '16-4-2020', '07:04:00', 'Staff', '', '', 'LE / Norongwana', '', '', '', ''),
('in', '6703130360087', 'LENorongwana', '', '', '', '07:08 15-4-2020', '15-4-2020', '07:08:00', 'Staff', '', '', 'LE / Norongwana', '', '', '', ''),
('in', '6703130360087', 'Lindelwa Norongwanl Norongwsna', '', '', '', '07:06 07-5-2020', '2020/07/05', '07:06:00', 'Staff', '', '', 'Lindelwa Norongwan / l Norongwsna', '', 'Frail care', '', ''),
('in', '6703130360087', 'lindelwanorhongwana', '', '', '', '07:01 06-5-2020', '2020/06/05', '07:01:00', 'Staff', '', '', 'lindelwa / norhongwana', '', 'frail care', '', ''),
('out', '6703130360087', '', '', '', '', '13:01 08-5-2020', '2020/08/05', '13:01:00', 'Staff', '', '', 'LE  / Norongwana', '', 'Care Centre', '', ''),
('out', '6703130360087', '', '', '', '', '15:54 07-5-2020', '2020/07/05', '15:54:00', 'Staff', '', '', 'Lindelwa Norongwan / l Norongwsna', '', 'Frail care', '', ''),
('out', '6703130360087', '', '', '', '', '15:54 06-5-2020', '2020/06/05', '15:54:00', 'Staff', '', '', 'lindelwa / norhongwana', '', 'frail care', '', ''),
('out', '6703130360087', '', '', '', '', '15:56 05-5-2020', '2020/05/05', '15:56:00', 'Staff', '', '', 'LE  / Norongwana', '', 'Care Centre', '', ''),
('out', '0004281248080', 'DANIELLEFOURIE', '', '', '0004281248080', '14:21 03-5-2020', '2020/03/05', '14:21', 'Staff', '', '', 'DANIELLE / FOURIE', '', 'Hibiscus', '', ''),
('in', '6013000089', 'sTuku', '', '', '', '07:49 05-5-2020', '2020/05/05', '07:49', 'Staff', '', '', 's / Tuku', '', 'm', '', ''),
('in', '53063621087', 'NOMBUYISELO FLORENCEMAGAWU', '', '', '5306250231087', '07:59 24-4-2020', '24-4-2020', '07:59', 'Staff', '', '', 'NOMBUYISELO FLORENCE / MAGAWU', '', '', '', ''),
('in', '74040613089', 'TTsitsi', '', '', '', '08:26 02-5-2020', '2020/02/05', '08:26', 'Staff', '', '', 'T / Tsitsi', '', 'Unit 39', '', ''),
('out', '78119505080', 'NOMFUSIJAMES', '', '', '7811050502080', '17:36 25-4-2020', '25-4-2020', '17:36', 'Staff', '', '', '', '', '', '', ''),
('in', '89030804089', 'PUMEZANTLOKWANA', '', '', '8903080498089', '06:58 15-4-2020', '15-4-2020', '06:58', 'Staff', '', '', 'PUMEZA / NTLOKWANA', '', '', '', ''),
('in', '700503671080', 'VUYO RICHARDMSESIWE', '', '', '7005036271080', '07:36 07-5-2020', '2020/07/05', '07:36', 'Staff', '', '', 'VUYO RICHARD / MSESIWE', '', 'work', '', ''),
('in', '740705326086', 'XMKhamkham', '', '', '', '07:15 17-4-2020', '17-4-2020', '07:15', 'Staff', '', '', 'XM / Khamkham', '', '', '', ''),
('in', '780109025080', 'DMJACU', '', '', '7801090235080', '18:41 13-4-2020', '13-4-2020', '18:41', 'Staff', '', '', 'D / MJACU', '', '', '', ''),
('in', '790250017081', 'MilliscentGaseba', '', '', '', '17:58 21-4-2020', '21-4-2020', '17:58', 'Staff', '', '', 'Milliscent / Gaseba', '', '', '', ''),
('out', '810195340087', 'MZIWETHUMAFANI', '', '', '8101095340087', '17:05 25-4-2020', '25-4-2020', '17:05', 'Staff', '', '', '', '', '', '', ''),
('in', '810930099083', 'LYNDRO URSULAJORDAAN', '', '', '8109300099083', '18:38 18-4-2020', '18-4-2020', '18:38', 'Staff', '', '', 'LYNDRO URSULA / JORDAAN', '', '', '', ''),
('in', '830507024081', 'LUNGISWAGANGQU', '', '', '8305070242081', '07:33 19-4-2020', '19-4-2020', '07:33', 'Staff', '', '', 'LUNGISWA / GANGQU', '', '', '', ''),
('in', '870317563808', 'ZMNyanya', '', '', '', '07:38 28-4-2020', '28-4-2020', '07:38', 'Staff', '', '', 'ZM / Nyanya', '', '', '', ''),
('in', '3503260002084', 'MAHOBBS', '', '', '3503260002084', '08:15 10-5-2020', '2020/10/05', '08:15', 'Visitors', 'Expired car licence', 'MA / HOBBS', '', '', '', '', '180'),
('out', '3512160325081', 'F.AWerner', '', '', '', '10:36 14-4-2020', '14-4-2020', '10:36', 'Resident', '', '', '', 'F.A / Werner', '', '', ''),
('out', '3801210057186', 'IrisClough', '', '', '', '09:53 07-5-2020', '2020/07/05', '09:53', 'Resident', '', '', '', 'Iris / Clough', '', '', ''),
('in', '3811115050087', 'JTHROOS', '', '', '3811115050087', '16:02 09-5-2020', '2020/09/05', '16:02', 'Visitors', 'Expired driver licence', 'JTH / ROOS', '', '', '', '', '10'),
('in', '3812090063087', 'JENIFER HELENSIMPSON', '', '', '3812090063087', '10:56 08-5-2020', '2020/08/05', '10:56', 'Resident', '', '', 'JENIFER HELEN / SIMPSON', '', '', '', ''),
('in', '3903120064086', 'AEALSTON', '', '', '3803165088083', '11:18 09-5-2020', '2020/09/05', '11:18', 'Visitors', 'Expired car licence', 'AE / ALSTON', '', '', '', '', '111'),
('in', '4009090011088', 'RDNelson', '', '', '', '09:20 29-4-2020', '29-4-2020', '09:20', 'Visitors', 'Expired car licence', 'RD / Nelson', '', '', '', '', '188'),
('out', '4211305048083', 'Charles pellew', '', '', '', '13:34 07-5-2020', '2020/07/05', '13:34', 'Resident', 'Expired car licence', '', '', 'Charles  / pellew', '', '', ''),
('out', '4304020062081', 'SpearmanMaureen', '', '', '', '12:43 07-5-2020', '2020/07/05', '12:43', 'Resident', '', '', '', 'Spearman / Maureen', '', '', ''),
('out', '4401250054182', 'CollettRobin', '', '', '', '10:08 07-5-2020', '2020/07/05', '10:08', 'Resident', '', '', '', 'Collett / Robin', '', '', ''),
('in', '4409265015080', 'AELMS', '', '', '4409265015080', '06:32 28-4-2020', '28-4-2020', '06:32', 'Visitors', '', 'A / ELMS', '', '', '', '', '190'),
('in', '4501190496185', 'FMSpieker', '', '', '', '10:37 10-5-2020', '2020/10/05', '10:37', 'Visitors', '', 'FM / Spieker', '', '', '', '', '158'),
('in', '4603100040184', 'SAReijman', '', '', '', '16:34 29-4-2020', '29-4-2020', '16:34', 'Visitors', '', 'SA / Reijman', '', '', '', '', '169'),
('in', '4805155336082', 'MGClayton', '', '', '', '09:54 11-5-2020', '2020/11/05', '09:54', 'Visitors', '', 'MG / Clayton', '', '', '', '', '100'),
('in', '5006070037082', 'E.M.MMacMahon', '', '', '', '06:49 20-4-2020', '20-4-2020', '06:49', 'Staff', '', '', 'E.M.M / MacMahon', '', '', '', ''),
('in', '5103230472083', 'SINDISWA CYNTHIAGXOYIYA', '', '', '5103230472083', '08:43 08-5-2020', '2020/08/05', '08:43', 'Staff', '', '', 'SINDISWA CYNTHIA / GXOYIYA', '', 'Unit 132', '', ''),
('in', '5306250231087', 'NOMBUYISELO FLORENCEMAGAWU', '', '', '5306250231087', '08:06 20-4-2020', '20-4-2020', '08:06', 'Staff', '', '', 'NOMBUYISELO FLORENCE / MAGAWU', '', '', '', ''),
('in', '5606150031085', 'CLCOATES', '', '', '5606150031085', '12:48 28-4-2020', '28-4-2020', '12:48', 'Visitors', '', 'CL / COATES', '', '', '', '', '161'),
('in', '5706030367086', 'n GwebileN Jullian', '', '', '', '07:26 07-5-2020', '2020/07/05', '07:26', 'Staff', '', '', 'n Gwebile / N Jullian', '', 'work', '', ''),
('in', '5706160208085', 'MajorieCampbell', '', '', '', '18:04 10-5-2020', '2020/10/05', '18:04', 'Staff', '', '', 'Majorie / Campbell', '', '144', '', ''),
('out', '5707135793086', 'ZANDISILEQAKAMFANA', '', '', '5707135793086', '16:23 07-5-2020', '2020/07/05', '16:23', 'Staff', '', '', '', '', '', '', ''),
('in', '5807016108089', 'Gongqavukile', '', '', '', '07:35 07-5-2020', '2020/07/05', '07:35', 'Staff', '', '', 'Gongqa / vukile', '', 'work', '', ''),
('out', '5811280758082', 'MAVISTEMBENI', '', '', '5811280758082', '07:34 08-5-2020', '2020/08/05', '07:34', 'Staff', '', '', 'MAVIS / TEMBENI', '', '212', '', ''),
('in', '5812050320087', 'MYani Faku', '', '', '', '06:41 02-5-2020', '2020/02/05', '06:41', 'Staff', '', '', 'M / Yani Faku', '', 'Kitchen', '', ''),
('in', '5812050320087', 'PatriciaRayi', '', '', '', '07:02 13-4-2020', '13-4-2020', '07:02', 'Staff', '', '', 'Patricia / Rayi', '', '', '', ''),
('in', '5901030766087', 'TFHoboshe', '', '', '', '06:47 18-4-2020', '18-4-2020', '06:47', 'Staff', '', '', 'TF / Hoboshe', '', '', '', ''),
('in', '5901075574081', 'Daweti MadidaD M', '', '', '', '07:09 07-5-2020', '2020/07/05', '07:09', 'Staff', '', '', 'Daweti Madida / D M', '', 'Gardin', '', ''),
('in', '5901260650084', 'Mpandepumla', '', '', '', '08:02 07-5-2020', '2020/07/05', '08:02', 'Staff', '', '', 'Mpande / pumla', '', 'work', '', ''),
('in', '5903100648088', 'TNkombisa', '', '', '', '07:57 11-5-2020', '2020/11/05', '07:57', 'Staff', '', '', 'T / Nkombisa', '', '71', '', ''),
('in', '6007120590087', 'BMMemani', '', '', '', '08:50 10-5-2020', '2020/10/05', '08:50', 'Staff', '', '', 'BM / Memani', '', '114', '', ''),
('out', '6010135284084', 'BONISILE GEORGEPETER', '', '', '6010135284084', '15:50 05-5-2020', '2020/05/05', '15:50', 'Staff', '', '', 'BG / Peter', '', 'KG', '', ''),
('in', '6104150342081', 'NomakulaNgxingo', '', '', '', '07:35 13-4-2020', '13-4-2020', '07:35', 'Staff', '', '', 'Nomakula / Ngxingo', '', '', '', ''),
('in', '6111235691085', 'DuruweGeofrey', '', '', '', '07:37 07-5-2020', '2020/07/05', '07:37', 'Staff', '', '', 'Duruwe / Geofrey', '', 'work', '', ''),
('in', '6201260710080', 'JaniceMatthews', '', '', '', '18:35 21-4-2020', '21-4-2020', '18:35', 'Staff', '', '', 'Janice / Matthews', '', '', '', ''),
('in', '6209200634088', 'Belewasiziwe', '', '', '', '07:37 07-5-2020', '2020/07/05', '07:37', 'Staff', '', '', 'Belewa / siziwe', '', 'work', '', ''),
('in', '6209200634088', 'FBelewa', '', '', '', '07:08 01-5-2020', '2020/01/05', '07:08', 'Staff', '', '', 'F / Belewa', '', '167', '', ''),
('in', '6209200634088', 'FBelewa', '', '', '', '06:59 16-4-2020', '16-4-2020', '06:59', 'Staff', '', '', 'F / Belewa', '', '', '', ''),
('in', '6209200634088', 'FlorenceBelewa', '', '', '', '06:57 13-4-2020', '13-4-2020', '06:57', 'Staff', '', '', 'Florence / Belewa', '', '', '', ''),
('in', '6209200634088', 'FVBelewa', '', '', '', '07:33 30-4-2020', '30-4-2020', '07:33', 'Staff', '', '', 'FV / Belewa', '', '', '', ''),
('in', '6209200634088', 'S.F.Belewa', '', '', '', '07:05 14-4-2020', '14-4-2020', '07:05', 'Staff', '', '', 'S.F. / Belewa', '', '', '', ''),
('in', '6209200634088', 'S.FBelewa', '', '', '', '06:59 20-4-2020', '20-4-2020', '06:59', 'Staff', '', '', 'S.F / Belewa', '', '', '', ''),
('in', '6209200634088', 'SFBelewa', '', '', '', '07:25 11-5-2020', '2020/11/05', '07:25', 'Staff', '', '', 'SF / Belewa', '', '167', '', ''),
('in', '6209200634088', 'SFBelewa', '', '', '', '07:05 08-5-2020', '2020/08/05', '07:05', 'Staff', '', '', 'SF / Belewa', '', 'Unit 167', '', ''),
('in', '6209200634088', 'SFBelewa', '', '', '', '07:26 05-5-2020', '2020/05/05', '07:26', 'Staff', '', '', 'SF / Belewa', '', 'Unit 167', '', ''),
('in', '6209200634088', 'SFBelewa', '', '', '', '07:28 29-4-2020', '29-4-2020', '07:28', 'Staff', '', '', 'SF / Belewa', '', '', '', ''),
('in', '6209200634088', 'SFBelewa', '', '', '', '07:31 28-4-2020', '28-4-2020', '07:31', 'Staff', '', '', 'SF / Belewa', '', '', '', ''),
('in', '6209200634088', 'SFBelewa', '', '', '', '07:03 27-4-2020', '27-4-2020', '07:03', 'Staff', '', '', 'SF / Belewa', '', '', '', ''),
('in', '6209200634088', 'SFBelewa', '', '', '', '07:10 24-4-2020', '24-4-2020', '07:10', 'Staff', '', '', 'SF / Belewa', '', '', '', ''),
('in', '6209200634088', 'SFBelewa', '', '', '', '07:05 23-4-2020', '23-4-2020', '07:05', 'Staff', '', '', 'SF / Belewa', '', '', '', ''),
('in', '6209200634088', 'SFBelewa', '', '', '', '07:02 22-4-2020', '22-4-2020', '07:02', 'Staff', '', '', 'SF / Belewa', '', '', '', ''),
('in', '6209200634088', 'SFBelewa', '', '', '', '07:00 17-4-2020', '17-4-2020', '07:00', 'Staff', '', '', 'SF / Belewa', '', '', '', ''),
('in', '6209200634088', 'SFBrlees', '', '', '', '06:57 21-4-2020', '21-4-2020', '06:57', 'Staff', '', '', 'SF / Brlees', '', '', '', ''),
('out', '6209200634088', '', '', '', '', '17:04 08-5-2020', '2020/08/05', '17:04', 'Staff', '', '', 'SF / Belewa', '', 'Unit 167', '', ''),
('out', '6209200634088', '', '', '', '', '17:04 07-5-2020', '2020/07/05', '17:04', 'Staff', '', '', 'Belewa / siziwe', '', 'work', '', ''),
('out', '6209200634088', '', '', '', '', '17:03 06-5-2020', '2020/06/05', '17:03', 'Staff', '', '', '', '', '', '', ''),
('out', '6209200634088', '', '', '', '', '17:09 05-5-2020', '2020/05/05', '17:09', 'Staff', '', '', 'SF / Belewa', '', 'Unit 167', '', ''),
('out', '6209200634088', '', '', '', '', '09:08 01-5-2020', '2020/01/05', '09:08', 'Staff', '', '', 'F / Belewa', '', '167', '', ''),
('out', '6209200634088', '', '', '', '', '16:58 30-4-2020', '30-4-2020', '16:58', 'Staff', '', '', 'FV / Belewa', '', '', '', ''),
('out', '6209200634088', '', '', '', '', '17:06 29-4-2020', '29-4-2020', '17:06', 'Staff', '', '', 'SF / Belewa', '', '', '', ''),
('out', '6209200634088', '', '', '', '', '16:58 28-4-2020', '28-4-2020', '16:58', 'Staff', '', '', 'SF / Belewa', '', '', '', ''),
('out', '6209200634088', '', '', '', '', '17:10 27-4-2020', '27-4-2020', '17:10', 'Staff', '', '', 'SF / Belewa', '', '', '', ''),
('out', '6209200634088', '', '', '', '', '17:27 24-4-2020', '24-4-2020', '17:27', 'Staff', '', '', 'SF / Belewa', '', '', '', ''),
('out', '6209200634088', '', '', '', '', '17:34 23-4-2020', '23-4-2020', '17:34', 'Staff', '', '', 'SF / Belewa', '', '', '', ''),
('out', '6209200634088', '', '', '', '', '17:38 22-4-2020', '22-4-2020', '17:38', 'Staff', '', '', 'SF / Belewa', '', '', '', ''),
('out', '6209200634088', '', '', '', '', '17:16 21-4-2020', '21-4-2020', '17:16', 'Staff', '', '', 'SF / Brlees', '', '', '', ''),
('out', '6209200634088', '', '', '', '', '17:15 20-4-2020', '20-4-2020', '17:15', 'Staff', '', '', 'S.F / Belewa', '', '', '', ''),
('out', '6209200634088', '', '', '', '', '17:16 17-4-2020', '17-4-2020', '17:16', 'Staff', '', '', 'SF / Belewa', '', '', '', ''),
('out', '6209200634088', '', '', '', '', '17:16 16-4-2020', '16-4-2020', '17:16', 'Staff', '', '', 'F / Belewa', '', '', '', ''),
('out', '6209200634088', '', '', '', '', '17:20 14-4-2020', '14-4-2020', '17:20', 'Staff', '', '', 'S.F. / Belewa', '', '', '', ''),
('out', '6209200634088', '', '', '', '', '17:03 13-4-2020', '13-4-2020', '17:03', 'Staff', '', '', 'Florence / Belewa', '', '', '', ''),
('in', '6210280109082', 'LeslyPottet', '', '', '', '15:19 25-4-2020', '25-4-2020', '15:19', 'Visitors', '', 'Lesly / Pottet', '', '', '', '', 'G1'),
('in', '6210280109082', 'LJPorter', '', '', '', '14:02 24-4-2020', '24-4-2020', '14:02', 'Visitors', '', 'LJ / Porter', '', '', '', '', 'G1'),
('in', '6210280109082', 'LJPorter', '', '', '', '10:22 23-4-2020', '23-4-2020', '10:22', 'Visitors', '', 'LJ / Porter', '', '', '', '', 'G1'),
('in', '6210280109082', 'LrdlryBota', '', '', '', '13:49 22-4-2020', '22-4-2020', '13:49', 'Visitors', '', 'Lrdlry / Bota', '', '', '', '', '3'),
('in', '6212120482083', 'nntantisi', '', '', '', '08:01 06-5-2020', '2020/06/05', '08:01', 'Staff', '', '', 'n / ntantisi', '', 'work', '', ''),
('in', '6212120482083', 'NP Ntantiso', '', '', '', '08:31 20-4-2020', '20-4-2020', '08:31', 'Staff', '', '', 'NP  / Ntantiso', '', '', '', ''),
('in', '6212120482083', 'Ntantiso NompumeleloN Nompumelelo', '', '', '', '08:15 07-5-2020', '2020/07/05', '08:15', 'Staff', '', '', 'Ntantiso Nompumelelo / N Nompumelelo', '', 'work', '', ''),
('in', '6212120482083', 'NVNtantiso', '', '', '', '07:52 11-5-2020', '2020/11/05', '07:52', 'Staff', '', '', 'NV / Ntantiso', '', 'O', '', ''),
('in', '6212120482083', 'NVNtantiso', '', '', '', '07:52 08-5-2020', '2020/08/05', '07:52', 'Staff', '', '', 'NV / Ntantiso', '', 'Adminn', '', ''),
('in', '6212120482083', 'NVNtantiso', '', '', '', '08:14 05-5-2020', '2020/05/05', '08:14', 'Staff', '', '', 'NV / Ntantiso', '', 'Admin', '', ''),
('in', '6212120482083', 'NVNtantiso', '', '', '', '08:16 04-5-2020', '2020/04/05', '08:16', 'Staff', '', '', 'NV / Ntantiso', '', 'O', '', ''),
('in', '6212120482083', 'NVNtantiso', '', '', '', '08:09 29-4-2020', '29-4-2020', '08:09', 'Staff', '', '', 'NV / Ntantiso', '', '', '', ''),
('in', '6212120482083', 'NVNtantiso', '', '', '', '08:29 28-4-2020', '28-4-2020', '08:29', 'Staff', '', '', 'NV / Ntantiso', '', '', '', ''),
('in', '6212120482083', 'NVNtantiso', '', '', '', '08:23 24-4-2020', '24-4-2020', '08:23', 'Staff', '', '', 'NV / Ntantiso', '', '', '', ''),
('in', '6212120482083', 'NVNtantiso', '', '', '', '08:37 23-4-2020', '23-4-2020', '08:37', 'Staff', '', '', 'NV / Ntantiso', '', '', '', ''),
('in', '6212120482083', 'NVNtantiso', '', '', '', '08:18 17-4-2020', '17-4-2020', '08:18', 'Staff', '', '', 'NV / Ntantiso', '', '', '', ''),
('in', '6212120482083', 'NVNtsntido', '', '', '', '08:33 22-4-2020', '22-4-2020', '08:33', 'Staff', '', '', 'NV / Ntsntido', '', '', '', ''),
('in', '6212120482083', 'NVNtsntiso', '', '', '', '08:11 30-4-2020', '30-4-2020', '08:11', 'Staff', '', '', 'NV / Ntsntiso', '', '', '', ''),
('in', '6212120482083', 'Nvntsntiso', '', '', '', '08:31 16-4-2020', '16-4-2020', '08:31', 'Staff', '', '', 'Nv / ntsntiso', '', '', '', ''),
('in', '6212120482083', 'VNntsntido', '', '', '', '08:19 21-4-2020', '21-4-2020', '08:19', 'Staff', '', '', 'VN / ntsntido', '', '', '', ''),
('out', '6212120482083', '', '', '', '', '16:35 08-5-2020', '2020/08/05', '16:35', 'Staff', '', '', 'NV / Ntantiso', '', 'Adminn', '', ''),
('out', '6212120482083', '', '', '', '', '16:36 07-5-2020', '2020/07/05', '16:36', 'Staff', '', '', 'Ntantiso Nompumelelo / N Nompumelelo', '', 'work', '', ''),
('out', '6212120482083', '', '', '', '', '16:36 06-5-2020', '2020/06/05', '16:36', 'Staff', '', '', 'n / ntantisi', '', 'work', '', ''),
('out', '6212120482083', '', '', '', '', '16:31 05-5-2020', '2020/05/05', '16:31', 'Staff', '', '', 'NV / Ntantiso', '', 'Admin', '', ''),
('out', '6212120482083', '', '', '', '', '16:39 04-5-2020', '2020/04/05', '16:39', 'Staff', '', '', 'NV / Ntantiso', '', 'O', '', ''),
('out', '6212120482083', '', '', '', '', '16:26 30-4-2020', '30-4-2020', '16:26', 'Staff', '', '', 'NV / Ntsntiso', '', '', '', ''),
('out', '6212120482083', '', '', '', '', '16:54 29-4-2020', '29-4-2020', '16:54', 'Staff', '', '', 'NV / Ntantiso', '', '', '', ''),
('out', '6212120482083', '', '', '', '', '16:58 28-4-2020', '28-4-2020', '16:58', 'Staff', '', '', 'NV / Ntantiso', '', '', '', ''),
('out', '6212120482083', '', '', '', '', '16:42 22-4-2020', '22-4-2020', '16:42', 'Staff', '', '', 'NV / Ntsntido', '', '', '', ''),
('out', '6212120482083', '', '', '', '', '16:35 21-4-2020', '21-4-2020', '16:35', 'Staff', '', '', 'VN / ntsntido', '', '', '', ''),
('out', '6212120482083', '', '', '', '', '16:34 20-4-2020', '20-4-2020', '16:34', 'Staff', '', '', 'NP  / Ntantiso', '', '', '', ''),
('out', '6212120482083', '', '', '', '', '16:54 17-4-2020', '17-4-2020', '16:54', 'Staff', '', '', 'NV / Ntantiso', '', '', '', ''),
('in', '6303095010080', 'JLPhillips', '', '', '', '15:44 27-4-2020', '27-4-2020', '15:44', 'Visitors', 'Expired car licence', 'JL / Phillips', '', '', '', '', '122'),
('in', '6303095010080', 'JLPHILLIPS', '', '', '6303095010080', '16:26 27-4-2020', '27-4-2020', '16:26', 'Visitors', 'Expired driver licence, Expired car licence', 'JL / PHILLIPS', '', '', '', '', '122'),
('in', '6308245423083', 'NJBATINI', 'PA Butchery', '', '6308245423083', '15:02 04-5-2020', '2020/04/05', '15:02', 'Contractors', 'Expired car licence', 'NJ / BATINI', '', '', '', 'PA Butchery', ''),
('in', '6311125777081', 'Belwan linoilr', '', '', '', '07:56 07-5-2020', '2020/07/05', '07:56', 'Staff', '', '', 'Belwan  / linoilr', '', 'work', '', ''),
('in', '6311125777081', 'LBelwana', '', '', '', '07:37 11-5-2020', '2020/11/05', '07:37', 'Staff', '', '', 'L / Belwana', '', 'M', '', ''),
('in', '6311125777081', 'LBelwana', '', '', '', '07:41 08-5-2020', '2020/08/05', '07:41', 'Staff', '', '', 'L / Belwana', '', 'M', '', ''),
('in', '6311125777081', 'LBelwana', '', '', '', '07:48 05-5-2020', '2020/05/05', '07:48', 'Staff', '', '', 'L / Belwana', '', 'M', '', ''),
('in', '6311125777081', 'Lbhelwana', '', '', '', '07:48 06-5-2020', '2020/06/05', '07:48', 'Staff', '', '', 'L / bhelwana', '', 'work', '', ''),
('out', '6311125777081', 'THANDEKILEKOMENI', '', '', '6507205851080', '16:30 06-5-2020', '2020/06/05', '16:30', 'Staff', '', '', 'L / bhelwana', '', 'work', '', ''),
('out', '6311125777081', '', '', '', '', '16:28 08-5-2020', '2020/08/05', '16:28', 'Staff', '', '', 'L / Belwana', '', 'M', '', ''),
('out', '6311125777081', '', '', '', '', '16:29 07-5-2020', '2020/07/05', '16:29', 'Staff', '', '', 'Belwan  / linoilr', '', 'work', '', ''),
('out', '6311125777081', '', '', '', '', '16:28 05-5-2020', '2020/05/05', '16:28', 'Staff', '', '', 'L / Belwana', '', 'M', '', ''),
('in', '6311235954083', 'GladmanSontsonga', '', '', '', '08:05 20-4-2020', '20-4-2020', '08:05', 'Staff', '', '', 'Gladman / Sontsonga', '', '', '', ''),
('in', '6311235954083', 'GSontsonga', '', '', '', '07:36 08-5-2020', '2020/08/05', '07:36', 'Staff', '', '', 'G / Sontsonga', '', 'M', '', ''),
('in', '6311235954083', 'gsontsonga', '', '', '', '07:37 06-5-2020', '2020/06/05', '07:37', 'Staff', '', '', 'g / sontsonga', '', 'work', '', ''),
('in', '6311235954083', 'GSontsonga', '', '', '', '07:39 05-5-2020', '2020/05/05', '07:39', 'Staff', '', '', 'G / Sontsonga', '', 'M', '', ''),
('in', '6311235954083', 'GSontsonga', '', '', '', '07:44 04-5-2020', '2020/04/05', '07:44', 'Staff', '', '', 'G / Sontsonga', '', 'Mantainance', '', ''),
('in', '6311235954083', 'GSontsonga', '', '', '', '07:41 30-4-2020', '30-4-2020', '07:41', 'Staff', '', '', 'G / Sontsonga', '', '', '', ''),
('in', '6311235954083', 'GSontsonga', '', '', '', '07:43 29-4-2020', '29-4-2020', '07:43', 'Staff', '', '', 'G / Sontsonga', '', '', '', ''),
('in', '6311235954083', 'GSontsonga', '', '', '', '08:07 28-4-2020', '28-4-2020', '08:07', 'Staff', '', '', 'G / Sontsonga', '', '', '', ''),
('in', '6311235954083', 'GSontsonga', '', '', '', '07:35 24-4-2020', '24-4-2020', '07:35', 'Staff', '', '', 'G / Sontsonga', '', '', '', ''),
('in', '6311235954083', 'GSontsonga', '', '', '', '07:51 23-4-2020', '23-4-2020', '07:51', 'Staff', '', '', 'G / Sontsonga', '', '', '', ''),
('in', '6311235954083', 'GSontsonga', '', '', '', '07:47 22-4-2020', '22-4-2020', '07:47', 'Staff', '', '', 'G / Sontsonga', '', '', '', ''),
('in', '6311235954083', 'GSontsonga', '', '', '', '07:47 21-4-2020', '21-4-2020', '07:47', 'Staff', '', '', 'G / Sontsonga', '', '', '', ''),
('in', '6311235954083', 'GSontsonga', '', '', '', '08:03 17-4-2020', '17-4-2020', '08:03', 'Staff', '', '', 'G / Sontsonga', '', '', '', ''),
('in', '6311235954083', 'GSontsonga', '', '', '', '08:07 14-4-2020', '14-4-2020', '08:07', 'Staff', '', '', 'G / Sontsonga', '', '', '', ''),
('in', '6311235954083', 'sintsladmans', '', '', '', '07:59 15-4-2020', '15-4-2020', '07:59', 'Staff', '', '', 'sintsladman / s', '', '', '', ''),
('in', '6311235954083', 'Sontsonga Gladman', '', '', '', '07:50 07-5-2020', '2020/07/05', '07:50', 'Staff', '', '', 'Sontsonga  / Gladman', '', 'work', '', ''),
('in', '6311235954083', 'SSontsongs', '', '', '', '07:54 11-5-2020', '2020/11/05', '07:54', 'Staff', '', '', 'S / Sontsongs', '', 'M,', '', ''),
('out', '6311235954083', '', '', '', '', '16:25 08-5-2020', '2020/08/05', '16:25', 'Staff', '', '', 'G / Sontsonga', '', 'M', '', ''),
('out', '6311235954083', '', '', '', '', '16:27 07-5-2020', '2020/07/05', '16:27', 'Staff', '', '', 'Sontsonga  / Gladman', '', 'work', '', ''),
('out', '6311235954083', '', '', '', '', '16:28 06-5-2020', '2020/06/05', '16:28', 'Staff', '', '', 'g / sontsonga', '', 'work', '', ''),
('out', '6311235954083', '', '', '', '', '16:26 05-5-2020', '2020/05/05', '16:26', 'Staff', '', '', 'G / Sontsonga', '', 'M', '', ''),
('out', '6311235954083', '', '', '', '', '16:27 04-5-2020', '2020/04/05', '16:27', 'Staff', '', '', 'G / Sontsonga', '', 'Mantainance', '', ''),
('out', '6311235954083', '', '', '', '', '16:28 30-4-2020', '30-4-2020', '16:28', 'Staff', '', '', 'G / Sontsonga', '', '', '', ''),
('out', '6311235954083', '', '', '', '', '16:27 29-4-2020', '29-4-2020', '16:27', 'Staff', '', '', 'G / Sontsonga', '', '', '', ''),
('out', '6311235954083', '', '', '', '', '16:30 28-4-2020', '28-4-2020', '16:30', 'Staff', '', '', 'G / Sontsonga', '', '', '', ''),
('out', '6311235954083', '', '', '', '', '16:29 24-4-2020', '24-4-2020', '16:29', 'Staff', '', '', 'G / Sontsonga', '', '', '', ''),
('out', '6311235954083', '', '', '', '', '16:34 23-4-2020', '23-4-2020', '16:34', 'Staff', '', '', 'G / Sontsonga', '', '', '', ''),
('out', '6311235954083', '', '', '', '', '16:30 22-4-2020', '22-4-2020', '16:30', 'Staff', '', '', 'G / Sontsonga', '', '', '', ''),
('out', '6311235954083', '', '', '', '', '16:30 21-4-2020', '21-4-2020', '16:30', 'Staff', '', '', 'G / Sontsonga', '', '', '', ''),
('out', '6311235954083', '', '', '', '', '12:15 20-4-2020', '20-4-2020', '12:15', 'Staff', '', '', 'Gladman / Sontsonga', '', '', '', ''),
('out', '6311235954083', '', '', '', '', '10:58 17-4-2020', '17-4-2020', '10:58', 'Staff', '', '', 'G / Sontsonga', '', '', '', ''),
('out', '6311235954083', '', '', '', '', '10:04 15-4-2020', '15-4-2020', '10:04', 'Staff', '', '', 'sintsladman / s', '', '', '', ''),
('out', '6311235954083', '', '', '', '', '10:38 14-4-2020', '14-4-2020', '10:38', 'Staff', '', '', 'G / Sontsonga', '', '', '', ''),
('in', '6312030723087', 'E.PTsolekile', '', '', '', '17:53 27-4-2020', '27-4-2020', '17:53', 'Staff', '', '', 'E.P / Tsolekile', '', '', '', ''),
('in', '6312030723087', 'E.PTsolekile', '', '', '', '17:39 23-4-2020', '23-4-2020', '17:39', 'Staff', '', '', 'E.P / Tsolekile', '', '', '', ''),
('in', '6312030723087', 'E.PTsolekile', '', '', '', '17:54 22-4-2020', '22-4-2020', '17:54', 'Staff', '', '', 'E.P / Tsolekile', '', '', '', ''),
('in', '6312030723087', 'E.PTsolekile', '', '', '', '18:12 17-4-2020', '17-4-2020', '18:12', 'Staff', '', '', 'E.P / Tsolekile', '', '', '', ''),
('in', '6312030723087', 'ellicia pumzatsolekile', '', '', '', '17:57 19-4-2020', '19-4-2020', '17:57', 'Staff', '', '', 'ellicia pumza / tsolekile', '', '', '', ''),
('in', '6312030723087', 'Ellicia Tsolekilepumza', '', '', '', '17:46 06-5-2020', '2020/06/05', '17:46', 'Staff', '', '', 'Ellicia Tsolekile / pumza', '', '208', '', ''),
('in', '6312030723087', 'ElliciaTsolekile', '', '', '', '18:00 03-5-2020', '2020/03/05', '18:00', 'Staff', '', '', 'Ellicia / Tsolekile', '', '208', '', ''),
('in', '6312030723087', 'elliciatsolekule', '', '', '', '18:05 18-4-2020', '18-4-2020', '18:05', 'Staff', '', '', 'ellicia / tsolekule', '', '', '', ''),
('in', '6312030723087', 'EPTsolekile', '', '', '', '17:56 28-4-2020', '28-4-2020', '17:56', 'Staff', '', '', 'EP / Tsolekile', '', '', '', ''),
('in', '6312030723087', 'Phumza TsolekileAlicia Tsolekil', '', '', '', '17:45 13-4-2020', '13-4-2020', '17:45', 'Staff', '', '', 'Phumza Tsolekile / Alicia Tsolekil', '', '', '', ''),
('in', '6312030723087', 'Pumza TsolekileAllicia Tsolekile', '', '', '', '18:05 14-4-2020', '14-4-2020', '18:05', 'Staff', '', '', 'Pumza Tsolekile / Allicia Tsolekile', '', '', '', ''),
('in', '6312030723087', 'tsolekileellicia', '', '', '', '17:54 02-5-2020', '2020/02/05', '17:54', 'Staff', '', '', 'tsolekile / ellicia', '', '208', '', ''),
('in', '6312030723087', 'tsolekileellicia', '', '', '', '17:51 01-5-2020', '2020/01/05', '17:51', 'Staff', '', '', 'tsolekile / ellicia', '', '208', '', ''),
('in', '6312030723087', 'tsolekilepumza', '', '', '', '17:45 07-5-2020', '2020/07/05', '17:45', 'Staff', '', '', 'tsolekile / pumza', '', '208', '', ''),
('out', '6312030723087', '', '', '', '', '06:59 08-5-2020', '2020/08/05', '06:59', 'Staff', '', '', 'tsolekile / pumza', '', '208', '', ''),
('out', '6312030723087', '', '', '', '', '07:14 07-5-2020', '2020/07/05', '07:14', 'Staff', '', '', 'Ellicia Tsolekile / pumza', '', '208', '', ''),
('out', '6312030723087', '', '', '', '', '07:10 04-5-2020', '2020/04/05', '07:10', 'Staff', '', '', 'Ellicia / Tsolekile', '', '208', '', ''),
('out', '6312030723087', '', '', '', '', '07:01 03-5-2020', '2020/03/05', '07:01', 'Staff', '', '', 'tsolekile / ellicia', '', '208', '', ''),
('out', '6312030723087', '', '', '', '', '07:16 02-5-2020', '2020/02/05', '07:16', 'Staff', '', '', 'tsolekile / ellicia', '', '208', '', ''),
('out', '6312030723087', '', '', '', '', '07:08 29-4-2020', '29-4-2020', '07:08', 'Staff', '', '', 'EP / Tsolekile', '', '', '', ''),
('out', '6312030723087', '', '', '', '', '07:08 28-4-2020', '28-4-2020', '07:08', 'Staff', '', '', 'E.P / Tsolekile', '', '', '', ''),
('out', '6312030723087', '', '', '', '', '07:10 24-4-2020', '24-4-2020', '07:10', 'Staff', '', '', 'E.P / Tsolekile', '', '', '', ''),
('out', '6312030723087', '', '', '', '', '07:02 23-4-2020', '23-4-2020', '07:02', 'Staff', '', '', 'E.P / Tsolekile', '', '', '', ''),
('out', '6312030723087', '', '', '', '', '07:03 20-4-2020', '20-4-2020', '07:03', 'Staff', '', '', 'ellicia pumza / tsolekile', '', '', '', ''),
('out', '6312030723087', '', '', '', '', '06:47 19-4-2020', '19-4-2020', '06:47', 'Staff', '', '', 'ellicia / tsolekule', '', '', '', ''),
('out', '6312030723087', '', '', '', '', '06:40 18-4-2020', '18-4-2020', '06:40', 'Staff', '', '', 'E.P / Tsolekile', '', '', '', ''),
('out', '6312030723087', '', '', '', '', '07:03 15-4-2020', '15-4-2020', '07:03', 'Staff', '', '', 'Pumza Tsolekile / Allicia Tsolekile', '', '', '', ''),
('out', '6312030723087', '', '', '', '', '07:09 14-4-2020', '14-4-2020', '07:09', 'Staff', '', '', 'Phumza Tsolekile / Alicia Tsolekil', '', '', '', ''),
('in', '6401016265088', 'GrootboomThamsanqa', '', '', '', '07:18 07-5-2020', '2020/07/05', '07:18', 'Staff', '', '', 'Grootboom / Thamsanqa', '', 'work', '', ''),
('in', '6401016265088', 'T.RGrootboom', '', '', '', '07:24 05-5-2020', '2020/05/05', '07:24', 'Staff', '', '', 'T.R / Grootboom', '', 'K G', '', ''),
('in', '6401016265088', 'TRGrootboom', '', '', '', '07:26 11-5-2020', '2020/11/05', '07:26', 'Staff', '', '', 'TR / Grootboom', '', 'KG', '', ''),
('in', '6401016265088', 'TRGrootboom', '', '', '', '07:26 08-5-2020', '2020/08/05', '07:26', 'Staff', '', '', 'TR / Grootboom', '', 'KG', '', ''),
('in', '6401016265088', 'TRGrootboom', '', '', '', '07:19 04-5-2020', '2020/04/05', '07:19', 'Staff', '', '', 'TR / Grootboom', '', 'Kenton Gardens', '', ''),
('in', '6401016265088', 'TRGrootboom', '', '', '', '07:03 30-4-2020', '30-4-2020', '07:03', 'Staff', '', '', 'TR / Grootboom', '', '', '', ''),
('out', '6401016265088', '', '', '', '', '16:16 08-5-2020', '2020/08/05', '16:16', 'Staff', '', '', 'TR / Grootboom', '', 'KG', '', ''),
('out', '6401016265088', '', '', '', '', '16:25 07-5-2020', '2020/07/05', '16:25', 'Staff', '', '', 'Grootboom / Thamsanqa', '', 'work', '', ''),
('out', '6401016265088', '', '', '', '', '16:25 05-5-2020', '2020/05/05', '16:25', 'Staff', '', '', 'T.R / Grootboom', '', 'K G', '', ''),
('out', '6401016265088', '', '', '', '', '16:25 04-5-2020', '2020/04/05', '16:25', 'Staff', '', '', 'TR / Grootboom', '', 'Kenton Gardens', '', ''),
('out', '6401016265088', '', '', '', '', '07:49 30-4-2020', '30-4-2020', '07:49', 'Staff', '', '', 'TR / Grootboom', '', '', '', ''),
('out', '6402290463084', '', '', '', '', '07:06 11-5-2020', '2020/11/05', '07:06', 'Staff', '', '', '', '', '', '', ''),
('out', '6402290463084', '', '', '', '', '07:09 10-5-2020', '2020/10/05', '07:09', 'Staff', '', '', '', '', '', '', ''),
('out', '6402290463084', '', '', '', '', '07:10 06-5-2020', '2020/06/05', '07:10', 'Staff', '', '', '', '', '', '', ''),
('out', '6402290463084', '', '', '', '', '07:15 05-5-2020', '2020/05/05', '07:15', 'Staff', '', '', '', '', '', '', ''),
('out', '6402290463084', '', '', '', '', '06:59 01-5-2020', '2020/01/05', '06:59', 'Staff', '', '', '', '', '', '', ''),
('out', '6402290463084', '', '', '', '', '06:48 30-4-2020', '30-4-2020', '06:48', 'Staff', '', '', '', '', '', '', ''),
('out', '6402290463084', '', '', '', '', '07:08 27-4-2020', '27-4-2020', '07:08', 'Staff', '', '', '', '', '', '', ''),
('out', '6402290463084', '', '', '', '', '07:03 26-4-2020', '26-4-2020', '07:03', 'Staff', '', '', '', '', '', '', ''),
('out', '6402290463084', '', '', '', '', '07:05 25-4-2020', '25-4-2020', '07:05', 'Staff', '', '', '', '', '', '', ''),
('out', '6402290463084', '', '', '', '', '07:07 22-4-2020', '22-4-2020', '07:07', 'Staff', '', '', '', '', '', '', ''),
('out', '6402290463084', '', '', '', '', '07:11 21-4-2020', '21-4-2020', '07:11', 'Staff', '', '', '', '', '', '', ''),
('out', '6402290463084', '', '', '', '', '07:07 17-4-2020', '17-4-2020', '07:07', 'Staff', '', '', '', '', '', '', ''),
('out', '6402290463084', '', '', '', '', '07:09 16-4-2020', '16-4-2020', '07:09', 'Staff', '', '', '', '', '', '', ''),
('out', '6402290463084', '', '', '', '', '07:07 12-4-2020', '2020/12/04', '07:07', 'Staff', '', '', '', '', '', '', ''),
('out', '6402290463084', '', '', '', '', '06:57 11-4-2020', '2020/11/04', '06:57', 'Staff', '', '', '', '', '', '', ''),
('in', '6501010740083', 'FMGengqani', '', '', '', '07:53 11-5-2020', '2020/11/05', '07:53', 'Staff', '', '', 'FM / Gengqani', '', '175', '', ''),
('in', '6501010740083', 'FUNEKA MIRRIAMQENGQANI', '', '', '6501010740083', '08:00 08-5-2020', '2020/08/05', '08:00', 'Staff', '', '', 'FUNEKA MIRRIAM / QENGQANI', '', '175', '', ''),
('out', '6501010740083', 'FUNEKA MIRRIAMQENGQANI', '', '', '6501010740083', '12:46 08-5-2020', '2020/08/05', '12:46', 'Staff', '', '', 'FUNEKA MIRRIAM / QENGQANI', '', '175', '', ''),
('in', '6501010740083', 'FUNEKA MIRRIAMQENGQANI', '', '', '6501010740083', '07:57 07-5-2020', '2020/07/05', '07:57', 'Staff', '', '', 'FUNEKA MIRRIAM / QENGQANI', '', 'work', '', ''),
('out', '6501010740083', '', '', '', '', '13:21 07-5-2020', '2020/07/05', '13:21', 'Staff', '', '', 'FUNEKA MIRRIAM / QENGQANI', '', 'work', '', ''),
('out', '6501010740083', '', '', '', '', '15:01 06-5-2020', '2020/06/05', '15:01', 'Staff', '', '', '', '', '', '', ''),
('out', '6503165013084', '', '', '', '', '11:05 24-4-2020', '24-4-2020', '11:05', 'Visitors', '', '', '', '', '', '', ''),
('in', '6507205851080', 'THANDEKILEKOMENI', '', '', '6507205851080', '07:37 08-5-2020', '2020/08/05', '07:37', 'Staff', '', '', 'THANDEKILE / KOMENI', '', 'M', '', ''),
('out', '6507205851080', 'THANDEKILEKOMENI', '', '', '6507205851080', '16:27 08-5-2020', '2020/08/05', '16:27', 'Staff', '', '', 'THANDEKILE / KOMENI', '', 'M', '', ''),
('in', '6507205851080', 'THANDEKILEKOMENI', '', '', '6507205851080', '07:39 07-5-2020', '2020/07/05', '07:39', 'Staff', '', '', 'THANDEKILE / KOMENI', '', 'Work', '', ''),
('out', '6507205851080', 'THANDEKILEKOMENI', '', '', '6507205851080', '16:29 07-5-2020', '2020/07/05', '16:29', 'Staff', '', '', 'THANDEKILE / KOMENI', '', 'Work', '', ''),
('in', '6507205851080', 'THANDEKILEKOMENI', '', '', '6507205851080', '07:44 04-5-2020', '2020/04/05', '07:44', 'Staff', '', '', 'THANDEKILE / KOMENI', '', 'Mantainance', '', ''),
('out', '6507205851080', 'THANDEKILEKOMENI', '', '', '6507205851080', '16:28 04-5-2020', '2020/04/05', '16:28', 'Staff', '', '', 'THANDEKILE / KOMENI', '', 'Mantainance', '', ''),
('in', '6507205851080', 'THANDEKILEKOMENI', '', '', '6507205851080', '07:41 30-4-2020', '30-4-2020', '07:41', 'Staff', '', '', 'THANDEKILE / KOMENI', '', '', '', ''),
('out', '6507205851080', 'THANDEKILEKOMENI', '', '', '6507205851080', '16:29 30-4-2020', '30-4-2020', '16:29', 'Staff', '', '', 'THANDEKILE / KOMENI', '', '', '', ''),
('out', '6507205851080', 'THANDEKILEKOMENI', '', '', '6507205851080', '16:28 29-4-2020', '29-4-2020', '16:28', 'Staff', '', '', 'T / Nkomeni', '', '', '', ''),
('out', '6507205851080', 'THANDEKILEKOMENI', '', '', '6507205851080', '16:32 28-4-2020', '28-4-2020', '16:32', 'Staff', '', '', 'T / Nkomeni', '', '', '', ''),
('in', '6507205851080', 'Tk', '', '', '', '07:55 11-5-2020', '2020/11/05', '07:55', 'Staff', '', '', 'T / k', '', 'm', '', ''),
('in', '6507205851080', 'tkhumeni', '', '', '', '07:30 06-5-2020', '2020/06/05', '07:30', 'Staff', '', '', 't / khumeni', '', 'work', '', ''),
('in', '6507205851080', 'TKomene', '', '', '', '07:39 05-5-2020', '2020/05/05', '07:39', 'Staff', '', '', 'T / Komene', '', 'M', '', ''),
('in', '6507205851080', 'TNkomeni', '', '', '', '07:43 29-4-2020', '29-4-2020', '07:43', 'Staff', '', '', 'T / Nkomeni', '', '', '', ''),
('in', '6507205851080', 'TNkomeni', '', '', '', '08:08 28-4-2020', '28-4-2020', '08:08', 'Staff', '', '', 'T / Nkomeni', '', '', '', ''),
('out', '6507205851080', '', '', '', '', '16:26 05-5-2020', '2020/05/05', '16:26', 'Staff', '', '', 'T / Komene', '', 'M', '', ''),
('in', '6509100150089', 'NontsikeleloThonga', '', '', '', '08:06 20-4-2020', '20-4-2020', '08:06', 'Staff', '', '', 'Nontsikelelo / Thonga', '', '', '', ''),
('in', '6509100150089', 'NontsikeleloThonga', '', '', '', '08:02 14-4-2020', '14-4-2020', '08:02', 'Staff', '', '', 'Nontsikelelo / Thonga', '', '', '', ''),
('in', '6509100150089', 'NThonga', '', '', '', '08:00 09-5-2020', '2020/09/05', '08:00', 'Staff', '', '', 'N / Thonga', '', '157', '', ''),
('in', '6509100150089', 'NThonga', '', '', '', '07:59 08-5-2020', '2020/08/05', '07:59', 'Staff', '', '', 'N / Thonga', '', '157', '', ''),
('in', '6509100150089', 'NThonga', '', '', '', '10:16 06-5-2020', '2020/06/05', '10:16', 'Staff', '', '', 'N / Thonga', '', 'work', '', ''),
('in', '6509100150089', 'NThonga', '', '', '', '08:03 05-5-2020', '2020/05/05', '08:03', 'Staff', '', '', 'N / Thonga', '', 'Unit 157', '', ''),
('in', '6509100150089', 'NThonga', '', '', '', '08:01 04-5-2020', '2020/04/05', '08:01', 'Staff', '', '', 'N / Thonga', '', 'Unit 157', '', ''),
('in', '6509100150089', 'NThonga', '', '', '', '08:07 01-5-2020', '2020/01/05', '08:07', 'Staff', '', '', 'N / Thonga', '', '157', '', ''),
('in', '6509100150089', 'NThonga', '', '', '', '08:00 30-4-2020', '30-4-2020', '08:00', 'Staff', '', '', 'N / Thonga', '', '', '', ''),
('in', '6509100150089', 'NThonga', '', '', '', '08:08 29-4-2020', '29-4-2020', '08:08', 'Staff', '', '', 'N / Thonga', '', '', '', ''),
('in', '6509100150089', 'NThonga', '', '', '', '10:01 28-4-2020', '28-4-2020', '10:01', 'Staff', '', '', 'N / Thonga', '', '', '', ''),
('in', '6509100150089', 'NThonga', '', '', '', '08:08 27-4-2020', '27-4-2020', '08:08', 'Staff', '', '', 'N / Thonga', '', '', '', ''),
('in', '6509100150089', 'NThonga', '', '', '', '08:11 25-4-2020', '25-4-2020', '08:11', 'Staff', '', '', 'N / Thonga', '', '', '', ''),
('in', '6509100150089', 'NThonga', '', '', '', '08:08 24-4-2020', '24-4-2020', '08:08', 'Staff', '', '', 'N / Thonga', '', '', '', ''),
('in', '6509100150089', 'NThonga', '', '', '', '08:07 23-4-2020', '23-4-2020', '08:07', 'Staff', '', '', 'N / Thonga', '', '', '', ''),
('in', '6509100150089', 'NThonga', '', '', '', '08:05 22-4-2020', '22-4-2020', '08:05', 'Staff', '', '', 'N / Thonga', '', '', '', ''),
('in', '6509100150089', 'NThonga', '', '', '', '08:09 21-4-2020', '21-4-2020', '08:09', 'Staff', '', '', 'N / Thonga', '', '', '', ''),
('in', '6509100150089', 'NThonga', '', '', '', '08:11 18-4-2020', '18-4-2020', '08:11', 'Staff', '', '', 'N / Thonga', '', '', '', ''),
('in', '6509100150089', 'NThonga', '', '', '', '08:04 17-4-2020', '17-4-2020', '08:04', 'Staff', '', '', 'N / Thonga', '', '', '', ''),
('in', '6509100150089', 'NThonga', '', '', '', '08:09 16-4-2020', '16-4-2020', '08:09', 'Staff', '', '', 'N / Thonga', '', '', '', ''),
('in', '6509100150089', 'NThonga', '', '', '', '08:02 11-4-2020', '2020/11/04', '08:02', 'Staff', '', '', 'N / Thonga', '', '', '', ''),
('in', '6509100150089', 'NtsikiThonga', '', '', '', '09:28 02-5-2020', '2020/02/05', '09:28', 'Staff', '', '', 'Ntsiki / Thonga', '', '157', '', ''),
('in', '6509100150089', 'Thongan', '', '', '', '08:26 15-4-2020', '15-4-2020', '08:26', 'Staff', '', '', 'Thonga / n', '', '', '', ''),
('in', '6509100150089', 'ThongaNontsikelelo', '', '', '', '07:57 07-5-2020', '2020/07/05', '07:57', 'Staff', '', '', 'Thonga / Nontsikelelo', '', 'work', '', ''),
('in', '6509100150089', 'TThonga', '', '', '', '07:59 11-5-2020', '2020/11/05', '07:59', 'Staff', '', '', 'T / Thonga', '', '157', '', ''),
('out', '6509100150089', '', '', '', '', '13:12 09-5-2020', '2020/09/05', '13:12', 'Staff', '', '', 'N / Thonga', '', '157', '', ''),
('out', '6509100150089', '', '', '', '', '15:11 08-5-2020', '2020/08/05', '15:11', 'Staff', '', '', 'N / Thonga', '', '157', '', ''),
('out', '6509100150089', '', '', '', '', '15:05 07-5-2020', '2020/07/05', '15:05', 'Staff', '', '', 'Thonga / Nontsikelelo', '', 'work', '', ''),
('out', '6509100150089', '', '', '', '', '15:08 06-5-2020', '2020/06/05', '15:08', 'Staff', '', '', 'N / Thonga', '', 'work', '', ''),
('out', '6509100150089', '', '', '', '', '15:19 05-5-2020', '2020/05/05', '15:19', 'Staff', '', '', 'N / Thonga', '', 'Unit 157', '', ''),
('out', '6509100150089', '', '', '', '', '15:13 04-5-2020', '2020/04/05', '15:13', 'Staff', '', '', 'N / Thonga', '', 'Unit 157', '', ''),
('out', '6509100150089', '', '', '', '', '13:24 02-5-2020', '2020/02/05', '13:24', 'Staff', '', '', 'Ntsiki / Thonga', '', '157', '', ''),
('out', '6509100150089', '', '', '', '', '15:08 01-5-2020', '2020/01/05', '15:08', 'Staff', '', '', 'N / Thonga', '', '157', '', ''),
('out', '6509100150089', '', '', '', '', '14:10 30-4-2020', '30-4-2020', '14:10', 'Staff', '', '', 'N / Thonga', '', '', '', ''),
('out', '6509100150089', '', '', '', '', '14:09 29-4-2020', '29-4-2020', '14:09', 'Staff', '', '', 'N / Thonga', '', '', '', ''),
('out', '6509100150089', '', '', '', '', '15:13 28-4-2020', '28-4-2020', '15:13', 'Staff', '', '', 'N / Thonga', '', '', '', ''),
('out', '6509100150089', '', '', '', '', '15:01 27-4-2020', '27-4-2020', '15:01', 'Staff', '', '', 'N / Thonga', '', '', '', ''),
('out', '6509100150089', '', '', '', '', '13:30 25-4-2020', '25-4-2020', '13:30', 'Staff', '', '', 'N / Thonga', '', '', '', ''),
('out', '6509100150089', '', '', '', '', '15:05 24-4-2020', '24-4-2020', '15:05', 'Staff', '', '', 'N / Thonga', '', '', '', ''),
('out', '6509100150089', '', '', '', '', '15:09 23-4-2020', '23-4-2020', '15:09', 'Staff', '', '', 'N / Thonga', '', '', '', ''),
('out', '6509100150089', '', '', '', '', '15:11 22-4-2020', '22-4-2020', '15:11', 'Staff', '', '', 'N / Thonga', '', '', '', ''),
('out', '6509100150089', '', '', '', '', '15:10 21-4-2020', '21-4-2020', '15:10', 'Staff', '', '', 'N / Thonga', '', '', '', ''),
('out', '6509100150089', '', '', '', '', '15:18 20-4-2020', '20-4-2020', '15:18', 'Staff', '', '', 'Nontsikelelo / Thonga', '', '', '', ''),
('out', '6509100150089', '', '', '', '', '09:28 19-4-2020', '19-4-2020', '09:28', 'Staff', '', '', 'N / Thonga', '', '', '', ''),
('out', '6509100150089', '', '', '', '', '15:09 17-4-2020', '17-4-2020', '15:09', 'Staff', '', '', 'N / Thonga', '', '', '', ''),
('out', '6509100150089', '', '', '', '', '15:08 16-4-2020', '16-4-2020', '15:08', 'Staff', '', '', 'N / Thonga', '', '', '', ''),
('out', '6509100150089', '', '', '', '', '15:05 15-4-2020', '15-4-2020', '15:05', 'Staff', '', '', 'Thonga / n', '', '', '', ''),
('out', '6509100150089', '', '', '', '', '15:08 14-4-2020', '14-4-2020', '15:08', 'Staff', '', '', 'Nontsikelelo / Thonga', '', '', '', ''),
('out', '6509100150089', '', '', '', '', '12:55 11-4-2020', '2020/11/04', '12:55', 'Staff', '', '', 'N / Thonga', '', '', '', ''),
('in', '6512260276082', 'JMposelwa', '', '', '', '07:48 08-5-2020', '2020/08/05', '07:48', 'Staff', '', '', 'J / Mposelwa', '', 'Unit 226', '', ''),
('in', '6609160323087', 'Ditalap', '', '', '', '08:00 15-4-2020', '15-4-2020', '08:00', 'Staff', '', '', 'Ditala / p', '', '', '', ''),
('in', '6609160323087', 'DitanaPindiwe', '', '', '', '07:52 13-4-2020', '13-4-2020', '07:52', 'Staff', '', '', 'Ditana / Pindiwe', '', '', '', ''),
('in', '6609160323087', 'PD', '', '', '', '07:53 09-5-2020', '2020/09/05', '07:53', 'Staff', '', '', 'P / D', '', 'l', '', ''),
('in', '6609160323087', 'PDitala', '', '', '', '07:48 11-5-2020', '2020/11/05', '07:48', 'Staff', '', '', 'P / Ditala', '', 'L', '', ''),
('in', '6609160323087', 'PDitala', '', '', '', '07:50 05-5-2020', '2020/05/05', '07:50', 'Staff', '', '', 'P / Ditala', '', 'L', '', ''),
('in', '6609160323087', 'PDitala', '', '', '', '08:04 29-4-2020', '29-4-2020', '08:04', 'Staff', '', '', 'P / Ditala', '', '', '', ''),
('in', '6609160323087', 'PDitala', '', '', '', '07:48 27-4-2020', '27-4-2020', '07:48', 'Staff', '', '', 'P / Ditala', '', '', '', ''),
('in', '6609160323087', 'PDitala', '', '', '', '07:47 25-4-2020', '25-4-2020', '07:47', 'Staff', '', '', 'P / Ditala', '', '', '', ''),
('in', '6609160323087', 'PDitala', '', '', '', '08:15 24-4-2020', '24-4-2020', '08:15', 'Staff', '', '', 'P / Ditala', '', '', '', ''),
('in', '6609160323087', 'PDitala', '', '', '', '08:16 23-4-2020', '23-4-2020', '08:16', 'Staff', '', '', 'P / Ditala', '', '', '', ''),
('in', '6609160323087', 'PDitala', '', '', '', '07:49 22-4-2020', '22-4-2020', '07:49', 'Staff', '', '', 'P / Ditala', '', '', '', ''),
('in', '6609160323087', 'PDitala', '', '', '', '07:50 17-4-2020', '17-4-2020', '07:50', 'Staff', '', '', 'P / Ditala', '', '', '', ''),
('in', '6609160323087', 'PDitala', '', '', '', '07:52 11-4-2020', '2020/11/04', '07:52', 'Staff', '', '', 'P / Ditala', '', '', '', ''),
('in', '6609160323087', 'PDitals', '', '', '', '07:50 28-4-2020', '28-4-2020', '07:50', 'Staff', '', '', 'P / Ditals', '', '', '', ''),
('in', '6609160323087', 'PDitana', '', '', '', '07:52 04-5-2020', '2020/04/05', '07:52', 'Staff', '', '', 'P / Ditana', '', 'Laundry', '', ''),
('in', '6609160323087', 'PDitana', '', '', '', '07:50 01-5-2020', '2020/01/05', '07:50', 'Staff', '', '', 'P / Ditana', '', 'laundry', '', ''),
('in', '6609160323087', 'PDitani', '', '', '', '07:47 08-5-2020', '2020/08/05', '07:47', 'Staff', '', '', 'P / Ditani', '', 'Laundry', '', ''),
('in', '6609160323087', 'PDitsla', '', '', '', '07:50 30-4-2020', '30-4-2020', '07:50', 'Staff', '', '', 'P / Ditsla', '', '', '', ''),
('in', '6609160323087', 'Pditsos', '', '', '', '07:50 16-4-2020', '16-4-2020', '07:50', 'Staff', '', '', 'P / ditsos', '', '', '', ''),
('in', '6609160323087', 'PindiweDitana', '', '', '', '07:50 20-4-2020', '20-4-2020', '07:50', 'Staff', '', '', 'Pindiwe / Ditana', '', '', '', ''),
('in', '6609160323087', 'PindiweDitana', '', '', '', '07:52 14-4-2020', '14-4-2020', '07:52', 'Staff', '', '', 'Pindiwe / Ditana', '', '', '', ''),
('in', '6609160323087', 'PPDitala', '', '', '', '07:52 21-4-2020', '21-4-2020', '07:52', 'Staff', '', '', 'PP / Ditala', '', '', '', ''),
('out', '6609160323087', '', '', '', '', '12:46 09-5-2020', '2020/09/05', '12:46', 'Staff', '', '', 'P / D', '', 'l', '', ''),
('out', '6609160323087', '', '', '', '', '15:57 08-5-2020', '2020/08/05', '15:57', 'Staff', '', '', 'P / Ditani', '', 'Laundry', '', ''),
('out', '6609160323087', '', '', '', '', '15:57 05-5-2020', '2020/05/05', '15:57', 'Staff', '', '', 'P / Ditala', '', 'L', '', ''),
('out', '6609160323087', '', '', '', '', '15:58 04-5-2020', '2020/04/05', '15:58', 'Staff', '', '', 'P / Ditana', '', 'Laundry', '', ''),
('out', '6609160323087', '', '', '', '', '15:56 01-5-2020', '2020/01/05', '15:56', 'Staff', '', '', 'P / Ditana', '', 'laundry', '', ''),
('out', '6609160323087', '', '', '', '', '15:57 30-4-2020', '30-4-2020', '15:57', 'Staff', '', '', 'P / Ditsla', '', '', '', ''),
('out', '6609160323087', '', '', '', '', '15:58 29-4-2020', '29-4-2020', '15:58', 'Staff', '', '', 'P / Ditala', '', '', '', ''),
('out', '6609160323087', '', '', '', '', '15:57 28-4-2020', '28-4-2020', '15:57', 'Staff', '', '', 'P / Ditals', '', '', '', ''),
('out', '6609160323087', '', '', '', '', '15:52 27-4-2020', '27-4-2020', '15:52', 'Staff', '', '', 'P / Ditala', '', '', '', ''),
('out', '6609160323087', '', '', '', '', '13:06 25-4-2020', '25-4-2020', '13:06', 'Staff', '', '', 'P / Ditala', '', '', '', ''),
('out', '6609160323087', '', '', '', '', '15:51 24-4-2020', '24-4-2020', '15:51', 'Staff', '', '', 'P / Ditala', '', '', '', ''),
('out', '6609160323087', '', '', '', '', '15:53 23-4-2020', '23-4-2020', '15:53', 'Staff', '', '', 'P / Ditala', '', '', '', ''),
('out', '6609160323087', '', '', '', '', '16:01 22-4-2020', '22-4-2020', '16:01', 'Staff', '', '', 'P / Ditala', '', '', '', ''),
('out', '6609160323087', '', '', '', '', '15:58 21-4-2020', '21-4-2020', '15:58', 'Staff', '', '', 'PP / Ditala', '', '', '', ''),
('out', '6609160323087', '', '', '', '', '15:55 20-4-2020', '20-4-2020', '15:55', 'Staff', '', '', 'Pindiwe / Ditana', '', '', '', ''),
('out', '6609160323087', '', '', '', '', '15:56 17-4-2020', '17-4-2020', '15:56', 'Staff', '', '', 'P / Ditala', '', '', '', ''),
('out', '6609160323087', '', '', '', '', '16:04 16-4-2020', '16-4-2020', '16:04', 'Staff', '', '', 'P / ditsos', '', '', '', ''),
('out', '6609160323087', '', '', '', '', '15:55 15-4-2020', '15-4-2020', '15:55', 'Staff', '', '', 'Ditala / p', '', '', '', ''),
('out', '6609160323087', '', '', '', '', '15:51 14-4-2020', '14-4-2020', '15:51', 'Staff', '', '', 'Pindiwe / Ditana', '', '', '', ''),
('out', '6609160323087', '', '', '', '', '15:51 13-4-2020', '13-4-2020', '15:51', 'Staff', '', '', 'Ditana / Pindiwe', '', '', '', ''),
('out', '6609160323087', '', '', '', '', '12:55 11-4-2020', '2020/11/04', '12:55', 'Staff', '', '', 'P / Ditala', '', '', '', ''),
('in', '6703130360087', 'L.E.Norongwa', '', '', '', '06:57 20-4-2020', '20-4-2020', '06:57', 'Staff', '', '', 'L.E. / Norongwa', '', '', '', ''),
('in', '6703130360087', 'L.E.Norongwana', '', '', '', '07:00 14-4-2020', '14-4-2020', '07:00', 'Staff', '', '', 'L.E. / Norongwana', '', '', '', ''),
('in', '6703130360087', 'LE Norongwana', '', '', '', '07:02 08-5-2020', '2020/08/05', '07:02', 'Staff', '', '', 'LE  / Norongwana', '', 'Care Centre', '', ''),
('in', '6703130360087', 'LE Norongwana', '', '', '', '07:01 05-5-2020', '2020/05/05', '07:01', 'Staff', '', '', 'LE  / Norongwana', '', 'Care Centre', '', ''),
('in', '6703130360087', 'LENigwala', '', '', '', '06:57 21-4-2020', '21-4-2020', '06:57', 'Staff', '', '', 'LE / Nigwala', '', '', '', ''),
('in', '6703130360087', 'LENorongwana', '', '', '', '06:56 11-5-2020', '2020/11/05', '06:56', 'Staff', '', '', 'LE / Norongwana', '', 'C/C', '', ''),
('in', '6703130360087', 'LENorongwana', '', '', '', '07:00 04-5-2020', '2020/04/05', '07:00', 'Staff', '', '', 'LE / Norongwana', '', 'Care Cenntre', '', ''),
('in', '6703130360087', 'LENorongwana', '', '', '', '07:02 30-4-2020', '30-4-2020', '07:02', 'Staff', '', '', 'LE / Norongwana', '', '', '', ''),
('in', '6703130360087', 'LENorongwana', '', '', '', '07:00 29-4-2020', '29-4-2020', '07:00', 'Staff', '', '', 'LE / Norongwana', '', '', '', ''),
('in', '6703130360087', 'LENorongwana', '', '', '', '06:55 28-4-2020', '28-4-2020', '06:55', 'Staff', '', '', 'LE / Norongwana', '', '', '', '');
INSERT INTO `atthegate` (`direction`, `license`, `name`, `company`, `category`, `dr_license`, `creation`, `recdate`, `rectime`, `profile`, `incidents`, `dr_name`, `name_in`, `name_out`, `going`, `company2`, `visiting`) VALUES
('in', '6703130360087', 'LENorongwana', '', '', '', '07:05 24-4-2020', '24-4-2020', '07:05', 'Staff', '', '', 'LE / Norongwana', '', '', '', ''),
('in', '6703130360087', 'LENorongwana', '', '', '', '07:05 23-4-2020', '23-4-2020', '07:05', 'Staff', '', '', 'LE / Norongwana', '', '', '', ''),
('in', '6703130360087', 'LENorongwana', '', '', '', '07:01 22-4-2020', '22-4-2020', '07:01', 'Staff', '', '', 'LE / Norongwana', '', '', '', ''),
('in', '6703130360087', 'LENorongwana', '', '', '', '07:04 17-4-2020', '17-4-2020', '07:04', 'Staff', '', '', 'LE / Norongwana', '', '', '', ''),
('in', '6703130360087', 'LENorongwana', '', '', '', '07:04 16-4-2020', '16-4-2020', '07:04', 'Staff', '', '', 'LE / Norongwana', '', '', '', ''),
('in', '6703130360087', 'LENorongwana', '', '', '', '07:08 15-4-2020', '15-4-2020', '07:08', 'Staff', '', '', 'LE / Norongwana', '', '', '', ''),
('in', '6703130360087', 'Lindelwa Norongwanl Norongwsna', '', '', '', '07:06 07-5-2020', '2020/07/05', '07:06', 'Staff', '', '', 'Lindelwa Norongwan / l Norongwsna', '', 'Frail care', '', ''),
('in', '6703130360087', 'lindelwanorhongwana', '', '', '', '07:01 06-5-2020', '2020/06/05', '07:01', 'Staff', '', '', 'lindelwa / norhongwana', '', 'frail care', '', ''),
('out', '6703130360087', '', '', '', '', '13:01 08-5-2020', '2020/08/05', '13:01', 'Staff', '', '', 'LE  / Norongwana', '', 'Care Centre', '', ''),
('out', '6703130360087', '', '', '', '', '15:54 07-5-2020', '2020/07/05', '15:54', 'Staff', '', '', 'Lindelwa Norongwan / l Norongwsna', '', 'Frail care', '', ''),
('out', '6703130360087', '', '', '', '', '15:54 06-5-2020', '2020/06/05', '15:54', 'Staff', '', '', 'lindelwa / norhongwana', '', 'frail care', '', ''),
('out', '6703130360087', '', '', '', '', '15:56 05-5-2020', '2020/05/05', '15:56', 'Staff', '', '', 'LE  / Norongwana', '', 'Care Centre', '', ''),
('', 'Licence', 'Name', 'Company', 'Category', 'Driver Lic ID', 'Creation date', 'Date', 'Time', 'App profile', 'Incidents', 'Scan Drivers Licence(in)', 'Name and Surname(in)', 'Name and Surname(out)', 'Where are you going(in)', 'Company Name(in)', 'Resident visiting(in)'),
('out', '0004281248080', 'DANIELLEFOURIE', '', '', '0004281248080', '14:21 03-5-2020', '2020/03/05', '14:21', 'Staff', '', '', 'DANIELLE / FOURIE', '', 'Hibiscus', '', ''),
('in', '6013000089', 'sTuku', '', '', '', '07:49 05-5-2020', '2020/05/05', '07:49', 'Staff', '', '', 's / Tuku', '', 'm', '', ''),
('in', '53063621087', 'NOMBUYISELO FLORENCEMAGAWU', '', '', '5306250231087', '07:59 24-4-2020', '24-4-2020', '07:59', 'Staff', '', '', 'NOMBUYISELO FLORENCE / MAGAWU', '', '', '', ''),
('in', '74040613089', 'TTsitsi', '', '', '', '08:26 02-5-2020', '2020/02/05', '08:26', 'Staff', '', '', 'T / Tsitsi', '', 'Unit 39', '', ''),
('out', '78119505080', 'NOMFUSIJAMES', '', '', '7811050502080', '17:36 25-4-2020', '25-4-2020', '17:36', 'Staff', '', '', '', '', '', '', ''),
('in', '89030804089', 'PUMEZANTLOKWANA', '', '', '8903080498089', '06:58 15-4-2020', '15-4-2020', '06:58', 'Staff', '', '', 'PUMEZA / NTLOKWANA', '', '', '', ''),
('in', '700503671080', 'VUYO RICHARDMSESIWE', '', '', '7005036271080', '07:36 07-5-2020', '2020/07/05', '07:36', 'Staff', '', '', 'VUYO RICHARD / MSESIWE', '', 'work', '', ''),
('in', '740705326086', 'XMKhamkham', '', '', '', '07:15 17-4-2020', '17-4-2020', '07:15', 'Staff', '', '', 'XM / Khamkham', '', '', '', ''),
('in', '780109025080', 'DMJACU', '', '', '7801090235080', '18:41 13-4-2020', '13-4-2020', '18:41', 'Staff', '', '', 'D / MJACU', '', '', '', ''),
('in', '790250017081', 'MilliscentGaseba', '', '', '', '17:58 21-4-2020', '21-4-2020', '17:58', 'Staff', '', '', 'Milliscent / Gaseba', '', '', '', ''),
('out', '810195340087', 'MZIWETHUMAFANI', '', '', '8101095340087', '17:05 25-4-2020', '25-4-2020', '17:05', 'Staff', '', '', '', '', '', '', ''),
('in', '810930099083', 'LYNDRO URSULAJORDAAN', '', '', '8109300099083', '18:38 18-4-2020', '18-4-2020', '18:38', 'Staff', '', '', 'LYNDRO URSULA / JORDAAN', '', '', '', ''),
('in', '830507024081', 'LUNGISWAGANGQU', '', '', '8305070242081', '07:33 19-4-2020', '19-4-2020', '07:33', 'Staff', '', '', 'LUNGISWA / GANGQU', '', '', '', ''),
('in', '870317563808', 'ZMNyanya', '', '', '', '07:38 28-4-2020', '28-4-2020', '07:38', 'Staff', '', '', 'ZM / Nyanya', '', '', '', ''),
('in', '3503260002084', 'MAHOBBS', '', '', '3503260002084', '08:15 10-5-2020', '2020/10/05', '08:15', 'Visitors', 'Expired car licence', 'MA / HOBBS', '', '', '', '', '180'),
('out', '3512160325081', 'F.AWerner', '', '', '', '10:36 14-4-2020', '14-4-2020', '10:36', 'Resident', '', '', '', 'F.A / Werner', '', '', ''),
('out', '3801210057186', 'IrisClough', '', '', '', '09:53 07-5-2020', '2020/07/05', '09:53', 'Resident', '', '', '', 'Iris / Clough', '', '', ''),
('in', '3811115050087', 'JTHROOS', '', '', '3811115050087', '16:02 09-5-2020', '2020/09/05', '16:02', 'Visitors', 'Expired driver licence', 'JTH / ROOS', '', '', '', '', '10'),
('in', '3812090063087', 'JENIFER HELENSIMPSON', '', '', '3812090063087', '10:56 08-5-2020', '2020/08/05', '10:56', 'Resident', '', '', 'JENIFER HELEN / SIMPSON', '', '', '', ''),
('in', '3903120064086', 'AEALSTON', '', '', '3803165088083', '11:18 09-5-2020', '2020/09/05', '11:18', 'Visitors', 'Expired car licence', 'AE / ALSTON', '', '', '', '', '111'),
('in', '4009090011088', 'RDNelson', '', '', '', '09:20 29-4-2020', '29-4-2020', '09:20', 'Visitors', 'Expired car licence', 'RD / Nelson', '', '', '', '', '188'),
('out', '4211305048083', 'Charles pellew', '', '', '', '13:34 07-5-2020', '2020/07/05', '13:34', 'Resident', 'Expired car licence', '', '', 'Charles  / pellew', '', '', ''),
('out', '4304020062081', 'SpearmanMaureen', '', '', '', '12:43 07-5-2020', '2020/07/05', '12:43', 'Resident', '', '', '', 'Spearman / Maureen', '', '', ''),
('out', '4401250054182', 'CollettRobin', '', '', '', '10:08 07-5-2020', '2020/07/05', '10:08', 'Resident', '', '', '', 'Collett / Robin', '', '', ''),
('in', '4409265015080', 'AELMS', '', '', '4409265015080', '06:32 28-4-2020', '28-4-2020', '06:32', 'Visitors', '', 'A / ELMS', '', '', '', '', '190'),
('in', '4501190496185', 'FMSpieker', '', '', '', '10:37 10-5-2020', '2020/10/05', '10:37', 'Visitors', '', 'FM / Spieker', '', '', '', '', '158'),
('in', '4603100040184', 'SAReijman', '', '', '', '16:34 29-4-2020', '29-4-2020', '16:34', 'Visitors', '', 'SA / Reijman', '', '', '', '', '169'),
('in', '4805155336082', 'MGClayton', '', '', '', '09:54 11-5-2020', '2020/11/05', '09:54', 'Visitors', '', 'MG / Clayton', '', '', '', '', '100'),
('in', '5006070037082', 'E.M.MMacMahon', '', '', '', '06:49 20-4-2020', '20-4-2020', '06:49', 'Staff', '', '', 'E.M.M / MacMahon', '', '', '', ''),
('in', '5103230472083', 'SINDISWA CYNTHIAGXOYIYA', '', '', '5103230472083', '08:43 08-5-2020', '2020/08/05', '08:43', 'Staff', '', '', 'SINDISWA CYNTHIA / GXOYIYA', '', 'Unit 132', '', ''),
('in', '5306250231087', 'NOMBUYISELO FLORENCEMAGAWU', '', '', '5306250231087', '08:06 20-4-2020', '20-4-2020', '08:06', 'Staff', '', '', 'NOMBUYISELO FLORENCE / MAGAWU', '', '', '', ''),
('in', '5606150031085', 'CLCOATES', '', '', '5606150031085', '12:48 28-4-2020', '28-4-2020', '12:48', 'Visitors', '', 'CL / COATES', '', '', '', '', '161'),
('in', '5706030367086', 'n GwebileN Jullian', '', '', '', '07:26 07-5-2020', '2020/07/05', '07:26', 'Staff', '', '', 'n Gwebile / N Jullian', '', 'work', '', ''),
('in', '5706160208085', 'MajorieCampbell', '', '', '', '18:04 10-5-2020', '2020/10/05', '18:04', 'Staff', '', '', 'Majorie / Campbell', '', '144', '', ''),
('out', '5707135793086', 'ZANDISILEQAKAMFANA', '', '', '5707135793086', '16:23 07-5-2020', '2020/07/05', '16:23', 'Staff', '', '', '', '', '', '', ''),
('in', '5807016108089', 'Gongqavukile', '', '', '', '07:35 07-5-2020', '2020/07/05', '07:35', 'Staff', '', '', 'Gongqa / vukile', '', 'work', '', ''),
('out', '5811280758082', 'MAVISTEMBENI', '', '', '5811280758082', '07:34 08-5-2020', '2020/08/05', '07:34', 'Staff', '', '', 'MAVIS / TEMBENI', '', '212', '', ''),
('in', '5812050320087', 'MYani Faku', '', '', '', '06:41 02-5-2020', '2020/02/05', '06:41', 'Staff', '', '', 'M / Yani Faku', '', 'Kitchen', '', ''),
('in', '5812050320087', 'PatriciaRayi', '', '', '', '07:02 13-4-2020', '13-4-2020', '07:02', 'Staff', '', '', 'Patricia / Rayi', '', '', '', ''),
('in', '5901030766087', 'TFHoboshe', '', '', '', '06:47 18-4-2020', '18-4-2020', '06:47', 'Staff', '', '', 'TF / Hoboshe', '', '', '', ''),
('in', '5901075574081', 'Daweti MadidaD M', '', '', '', '07:09 07-5-2020', '2020/07/05', '07:09', 'Staff', '', '', 'Daweti Madida / D M', '', 'Gardin', '', ''),
('in', '5901260650084', 'Mpandepumla', '', '', '', '08:02 07-5-2020', '2020/07/05', '08:02', 'Staff', '', '', 'Mpande / pumla', '', 'work', '', ''),
('in', '5903100648088', 'TNkombisa', '', '', '', '07:57 11-5-2020', '2020/11/05', '07:57', 'Staff', '', '', 'T / Nkombisa', '', '71', '', ''),
('in', '6007120590087', 'BMMemani', '', '', '', '08:50 10-5-2020', '2020/10/05', '08:50', 'Staff', '', '', 'BM / Memani', '', '114', '', ''),
('out', '6010135284084', 'BONISILE GEORGEPETER', '', '', '6010135284084', '15:50 05-5-2020', '2020/05/05', '15:50', 'Staff', '', '', 'BG / Peter', '', 'KG', '', ''),
('in', '6104150342081', 'NomakulaNgxingo', '', '', '', '07:35 13-4-2020', '13-4-2020', '07:35', 'Staff', '', '', 'Nomakula / Ngxingo', '', '', '', ''),
('in', '6111235691085', 'DuruweGeofrey', '', '', '', '07:37 07-5-2020', '2020/07/05', '07:37', 'Staff', '', '', 'Duruwe / Geofrey', '', 'work', '', ''),
('in', '6201260710080', 'JaniceMatthews', '', '', '', '18:35 21-4-2020', '21-4-2020', '18:35', 'Staff', '', '', 'Janice / Matthews', '', '', '', ''),
('in', '6209200634088', 'Belewasiziwe', '', '', '', '07:37 07-5-2020', '2020/07/05', '07:37', 'Staff', '', '', 'Belewa / siziwe', '', 'work', '', ''),
('in', '6209200634088', 'FBelewa', '', '', '', '07:08 01-5-2020', '2020/01/05', '07:08', 'Staff', '', '', 'F / Belewa', '', '167', '', ''),
('in', '6209200634088', 'FBelewa', '', '', '', '06:59 16-4-2020', '16-4-2020', '06:59', 'Staff', '', '', 'F / Belewa', '', '', '', ''),
('in', '6209200634088', 'FlorenceBelewa', '', '', '', '06:57 13-4-2020', '13-4-2020', '06:57', 'Staff', '', '', 'Florence / Belewa', '', '', '', ''),
('in', '6209200634088', 'FVBelewa', '', '', '', '07:33 30-4-2020', '30-4-2020', '07:33', 'Staff', '', '', 'FV / Belewa', '', '', '', ''),
('in', '6209200634088', 'S.F.Belewa', '', '', '', '07:05 14-4-2020', '14-4-2020', '07:05', 'Staff', '', '', 'S.F. / Belewa', '', '', '', ''),
('in', '6209200634088', 'S.FBelewa', '', '', '', '06:59 20-4-2020', '20-4-2020', '06:59', 'Staff', '', '', 'S.F / Belewa', '', '', '', ''),
('in', '6209200634088', 'SFBelewa', '', '', '', '07:25 11-5-2020', '2020/11/05', '07:25', 'Staff', '', '', 'SF / Belewa', '', '167', '', ''),
('in', '6209200634088', 'SFBelewa', '', '', '', '07:05 08-5-2020', '2020/08/05', '07:05', 'Staff', '', '', 'SF / Belewa', '', 'Unit 167', '', ''),
('in', '6209200634088', 'SFBelewa', '', '', '', '07:26 05-5-2020', '2020/05/05', '07:26', 'Staff', '', '', 'SF / Belewa', '', 'Unit 167', '', ''),
('in', '6209200634088', 'SFBelewa', '', '', '', '07:28 29-4-2020', '29-4-2020', '07:28', 'Staff', '', '', 'SF / Belewa', '', '', '', ''),
('in', '6209200634088', 'SFBelewa', '', '', '', '07:31 28-4-2020', '28-4-2020', '07:31', 'Staff', '', '', 'SF / Belewa', '', '', '', ''),
('in', '6209200634088', 'SFBelewa', '', '', '', '07:03 27-4-2020', '27-4-2020', '07:03', 'Staff', '', '', 'SF / Belewa', '', '', '', ''),
('in', '6209200634088', 'SFBelewa', '', '', '', '07:10 24-4-2020', '24-4-2020', '07:10', 'Staff', '', '', 'SF / Belewa', '', '', '', ''),
('in', '6209200634088', 'SFBelewa', '', '', '', '07:05 23-4-2020', '23-4-2020', '07:05', 'Staff', '', '', 'SF / Belewa', '', '', '', ''),
('in', '6209200634088', 'SFBelewa', '', '', '', '07:02 22-4-2020', '22-4-2020', '07:02', 'Staff', '', '', 'SF / Belewa', '', '', '', ''),
('in', '6209200634088', 'SFBelewa', '', '', '', '07:00 17-4-2020', '17-4-2020', '07:00', 'Staff', '', '', 'SF / Belewa', '', '', '', ''),
('in', '6209200634088', 'SFBrlees', '', '', '', '06:57 21-4-2020', '21-4-2020', '06:57', 'Staff', '', '', 'SF / Brlees', '', '', '', ''),
('out', '6209200634088', '', '', '', '', '17:04 08-5-2020', '2020/08/05', '17:04', 'Staff', '', '', 'SF / Belewa', '', 'Unit 167', '', ''),
('out', '6209200634088', '', '', '', '', '17:04 07-5-2020', '2020/07/05', '17:04', 'Staff', '', '', 'Belewa / siziwe', '', 'work', '', ''),
('out', '6209200634088', '', '', '', '', '17:03 06-5-2020', '2020/06/05', '17:03', 'Staff', '', '', '', '', '', '', ''),
('out', '6209200634088', '', '', '', '', '17:09 05-5-2020', '2020/05/05', '17:09', 'Staff', '', '', 'SF / Belewa', '', 'Unit 167', '', ''),
('out', '6209200634088', '', '', '', '', '09:08 01-5-2020', '2020/01/05', '09:08', 'Staff', '', '', 'F / Belewa', '', '167', '', ''),
('out', '6209200634088', '', '', '', '', '16:58 30-4-2020', '30-4-2020', '16:58', 'Staff', '', '', 'FV / Belewa', '', '', '', ''),
('out', '6209200634088', '', '', '', '', '17:06 29-4-2020', '29-4-2020', '17:06', 'Staff', '', '', 'SF / Belewa', '', '', '', ''),
('out', '6209200634088', '', '', '', '', '16:58 28-4-2020', '28-4-2020', '16:58', 'Staff', '', '', 'SF / Belewa', '', '', '', ''),
('out', '6209200634088', '', '', '', '', '17:10 27-4-2020', '27-4-2020', '17:10', 'Staff', '', '', 'SF / Belewa', '', '', '', ''),
('out', '6209200634088', '', '', '', '', '17:27 24-4-2020', '24-4-2020', '17:27', 'Staff', '', '', 'SF / Belewa', '', '', '', ''),
('out', '6209200634088', '', '', '', '', '17:34 23-4-2020', '23-4-2020', '17:34', 'Staff', '', '', 'SF / Belewa', '', '', '', ''),
('out', '6209200634088', '', '', '', '', '17:38 22-4-2020', '22-4-2020', '17:38', 'Staff', '', '', 'SF / Belewa', '', '', '', ''),
('out', '6209200634088', '', '', '', '', '17:16 21-4-2020', '21-4-2020', '17:16', 'Staff', '', '', 'SF / Brlees', '', '', '', ''),
('out', '6209200634088', '', '', '', '', '17:15 20-4-2020', '20-4-2020', '17:15', 'Staff', '', '', 'S.F / Belewa', '', '', '', ''),
('out', '6209200634088', '', '', '', '', '17:16 17-4-2020', '17-4-2020', '17:16', 'Staff', '', '', 'SF / Belewa', '', '', '', ''),
('out', '6209200634088', '', '', '', '', '17:16 16-4-2020', '16-4-2020', '17:16', 'Staff', '', '', 'F / Belewa', '', '', '', ''),
('out', '6209200634088', '', '', '', '', '17:20 14-4-2020', '14-4-2020', '17:20', 'Staff', '', '', 'S.F. / Belewa', '', '', '', ''),
('out', '6209200634088', '', '', '', '', '17:03 13-4-2020', '13-4-2020', '17:03', 'Staff', '', '', 'Florence / Belewa', '', '', '', ''),
('in', '6210280109082', 'LeslyPottet', '', '', '', '15:19 25-4-2020', '25-4-2020', '15:19', 'Visitors', '', 'Lesly / Pottet', '', '', '', '', 'G1'),
('in', '6210280109082', 'LJPorter', '', '', '', '14:02 24-4-2020', '24-4-2020', '14:02', 'Visitors', '', 'LJ / Porter', '', '', '', '', 'G1'),
('in', '6210280109082', 'LJPorter', '', '', '', '10:22 23-4-2020', '23-4-2020', '10:22', 'Visitors', '', 'LJ / Porter', '', '', '', '', 'G1'),
('in', '6210280109082', 'LrdlryBota', '', '', '', '13:49 22-4-2020', '22-4-2020', '13:49', 'Visitors', '', 'Lrdlry / Bota', '', '', '', '', '3'),
('in', '6212120482083', 'nntantisi', '', '', '', '08:01 06-5-2020', '2020/06/05', '08:01', 'Staff', '', '', 'n / ntantisi', '', 'work', '', ''),
('in', '6212120482083', 'NP Ntantiso', '', '', '', '08:31 20-4-2020', '20-4-2020', '08:31', 'Staff', '', '', 'NP  / Ntantiso', '', '', '', ''),
('in', '6212120482083', 'Ntantiso NompumeleloN Nompumelelo', '', '', '', '08:15 07-5-2020', '2020/07/05', '08:15', 'Staff', '', '', 'Ntantiso Nompumelelo / N Nompumelelo', '', 'work', '', ''),
('in', '6212120482083', 'NVNtantiso', '', '', '', '07:52 11-5-2020', '2020/11/05', '07:52', 'Staff', '', '', 'NV / Ntantiso', '', 'O', '', ''),
('in', '6212120482083', 'NVNtantiso', '', '', '', '07:52 08-5-2020', '2020/08/05', '07:52', 'Staff', '', '', 'NV / Ntantiso', '', 'Adminn', '', ''),
('in', '6212120482083', 'NVNtantiso', '', '', '', '08:14 05-5-2020', '2020/05/05', '08:14', 'Staff', '', '', 'NV / Ntantiso', '', 'Admin', '', ''),
('in', '6212120482083', 'NVNtantiso', '', '', '', '08:16 04-5-2020', '2020/04/05', '08:16', 'Staff', '', '', 'NV / Ntantiso', '', 'O', '', ''),
('in', '6212120482083', 'NVNtantiso', '', '', '', '08:09 29-4-2020', '29-4-2020', '08:09', 'Staff', '', '', 'NV / Ntantiso', '', '', '', ''),
('in', '6212120482083', 'NVNtantiso', '', '', '', '08:29 28-4-2020', '28-4-2020', '08:29', 'Staff', '', '', 'NV / Ntantiso', '', '', '', ''),
('in', '6212120482083', 'NVNtantiso', '', '', '', '08:23 24-4-2020', '24-4-2020', '08:23', 'Staff', '', '', 'NV / Ntantiso', '', '', '', ''),
('in', '6212120482083', 'NVNtantiso', '', '', '', '08:37 23-4-2020', '23-4-2020', '08:37', 'Staff', '', '', 'NV / Ntantiso', '', '', '', ''),
('in', '6212120482083', 'NVNtantiso', '', '', '', '08:18 17-4-2020', '17-4-2020', '08:18', 'Staff', '', '', 'NV / Ntantiso', '', '', '', ''),
('in', '6212120482083', 'NVNtsntido', '', '', '', '08:33 22-4-2020', '22-4-2020', '08:33', 'Staff', '', '', 'NV / Ntsntido', '', '', '', ''),
('in', '6212120482083', 'NVNtsntiso', '', '', '', '08:11 30-4-2020', '30-4-2020', '08:11', 'Staff', '', '', 'NV / Ntsntiso', '', '', '', ''),
('in', '6212120482083', 'Nvntsntiso', '', '', '', '08:31 16-4-2020', '16-4-2020', '08:31', 'Staff', '', '', 'Nv / ntsntiso', '', '', '', ''),
('in', '6212120482083', 'VNntsntido', '', '', '', '08:19 21-4-2020', '21-4-2020', '08:19', 'Staff', '', '', 'VN / ntsntido', '', '', '', ''),
('out', '6212120482083', '', '', '', '', '16:35 08-5-2020', '2020/08/05', '16:35', 'Staff', '', '', 'NV / Ntantiso', '', 'Adminn', '', ''),
('out', '6212120482083', '', '', '', '', '16:36 07-5-2020', '2020/07/05', '16:36', 'Staff', '', '', 'Ntantiso Nompumelelo / N Nompumelelo', '', 'work', '', ''),
('out', '6212120482083', '', '', '', '', '16:36 06-5-2020', '2020/06/05', '16:36', 'Staff', '', '', 'n / ntantisi', '', 'work', '', ''),
('out', '6212120482083', '', '', '', '', '16:31 05-5-2020', '2020/05/05', '16:31', 'Staff', '', '', 'NV / Ntantiso', '', 'Admin', '', ''),
('out', '6212120482083', '', '', '', '', '16:39 04-5-2020', '2020/04/05', '16:39', 'Staff', '', '', 'NV / Ntantiso', '', 'O', '', ''),
('out', '6212120482083', '', '', '', '', '16:26 30-4-2020', '30-4-2020', '16:26', 'Staff', '', '', 'NV / Ntsntiso', '', '', '', ''),
('out', '6212120482083', '', '', '', '', '16:54 29-4-2020', '29-4-2020', '16:54', 'Staff', '', '', 'NV / Ntantiso', '', '', '', ''),
('out', '6212120482083', '', '', '', '', '16:58 28-4-2020', '28-4-2020', '16:58', 'Staff', '', '', 'NV / Ntantiso', '', '', '', ''),
('out', '6212120482083', '', '', '', '', '16:42 22-4-2020', '22-4-2020', '16:42', 'Staff', '', '', 'NV / Ntsntido', '', '', '', ''),
('out', '6212120482083', '', '', '', '', '16:35 21-4-2020', '21-4-2020', '16:35', 'Staff', '', '', 'VN / ntsntido', '', '', '', ''),
('out', '6212120482083', '', '', '', '', '16:34 20-4-2020', '20-4-2020', '16:34', 'Staff', '', '', 'NP  / Ntantiso', '', '', '', ''),
('out', '6212120482083', '', '', '', '', '16:54 17-4-2020', '17-4-2020', '16:54', 'Staff', '', '', 'NV / Ntantiso', '', '', '', ''),
('in', '6303095010080', 'JLPhillips', '', '', '', '15:44 27-4-2020', '27-4-2020', '15:44', 'Visitors', 'Expired car licence', 'JL / Phillips', '', '', '', '', '122'),
('in', '6303095010080', 'JLPHILLIPS', '', '', '6303095010080', '16:26 27-4-2020', '27-4-2020', '16:26', 'Visitors', 'Expired driver licence, Expired car licence', 'JL / PHILLIPS', '', '', '', '', '122'),
('in', '6308245423083', 'NJBATINI', 'PA Butchery', '', '6308245423083', '15:02 04-5-2020', '2020/04/05', '15:02', 'Contractors', 'Expired car licence', 'NJ / BATINI', '', '', '', 'PA Butchery', ''),
('in', '6311125777081', 'Belwan linoilr', '', '', '', '07:56 07-5-2020', '2020/07/05', '07:56', 'Staff', '', '', 'Belwan  / linoilr', '', 'work', '', ''),
('in', '6311125777081', 'LBelwana', '', '', '', '07:37 11-5-2020', '2020/11/05', '07:37', 'Staff', '', '', 'L / Belwana', '', 'M', '', ''),
('in', '6311125777081', 'LBelwana', '', '', '', '07:41 08-5-2020', '2020/08/05', '07:41', 'Staff', '', '', 'L / Belwana', '', 'M', '', ''),
('in', '6311125777081', 'LBelwana', '', '', '', '07:48 05-5-2020', '2020/05/05', '07:48', 'Staff', '', '', 'L / Belwana', '', 'M', '', ''),
('in', '6311125777081', 'Lbhelwana', '', '', '', '07:48 06-5-2020', '2020/06/05', '07:48', 'Staff', '', '', 'L / bhelwana', '', 'work', '', ''),
('out', '6311125777081', 'THANDEKILEKOMENI', '', '', '6507205851080', '16:30 06-5-2020', '2020/06/05', '16:30', 'Staff', '', '', 'L / bhelwana', '', 'work', '', ''),
('out', '6311125777081', '', '', '', '', '16:28 08-5-2020', '2020/08/05', '16:28', 'Staff', '', '', 'L / Belwana', '', 'M', '', ''),
('out', '6311125777081', '', '', '', '', '16:29 07-5-2020', '2020/07/05', '16:29', 'Staff', '', '', 'Belwan  / linoilr', '', 'work', '', ''),
('out', '6311125777081', '', '', '', '', '16:28 05-5-2020', '2020/05/05', '16:28', 'Staff', '', '', 'L / Belwana', '', 'M', '', ''),
('in', '6311235954083', 'GladmanSontsonga', '', '', '', '08:05 20-4-2020', '20-4-2020', '08:05', 'Staff', '', '', 'Gladman / Sontsonga', '', '', '', ''),
('in', '6311235954083', 'GSontsonga', '', '', '', '07:36 08-5-2020', '2020/08/05', '07:36', 'Staff', '', '', 'G / Sontsonga', '', 'M', '', ''),
('in', '6311235954083', 'gsontsonga', '', '', '', '07:37 06-5-2020', '2020/06/05', '07:37', 'Staff', '', '', 'g / sontsonga', '', 'work', '', ''),
('in', '6311235954083', 'GSontsonga', '', '', '', '07:39 05-5-2020', '2020/05/05', '07:39', 'Staff', '', '', 'G / Sontsonga', '', 'M', '', ''),
('in', '6311235954083', 'GSontsonga', '', '', '', '07:44 04-5-2020', '2020/04/05', '07:44', 'Staff', '', '', 'G / Sontsonga', '', 'Mantainance', '', ''),
('in', '6311235954083', 'GSontsonga', '', '', '', '07:41 30-4-2020', '30-4-2020', '07:41', 'Staff', '', '', 'G / Sontsonga', '', '', '', ''),
('in', '6311235954083', 'GSontsonga', '', '', '', '07:43 29-4-2020', '29-4-2020', '07:43', 'Staff', '', '', 'G / Sontsonga', '', '', '', ''),
('in', '6311235954083', 'GSontsonga', '', '', '', '08:07 28-4-2020', '28-4-2020', '08:07', 'Staff', '', '', 'G / Sontsonga', '', '', '', ''),
('in', '6311235954083', 'GSontsonga', '', '', '', '07:35 24-4-2020', '24-4-2020', '07:35', 'Staff', '', '', 'G / Sontsonga', '', '', '', ''),
('in', '6311235954083', 'GSontsonga', '', '', '', '07:51 23-4-2020', '23-4-2020', '07:51', 'Staff', '', '', 'G / Sontsonga', '', '', '', ''),
('in', '6311235954083', 'GSontsonga', '', '', '', '07:47 22-4-2020', '22-4-2020', '07:47', 'Staff', '', '', 'G / Sontsonga', '', '', '', ''),
('in', '6311235954083', 'GSontsonga', '', '', '', '07:47 21-4-2020', '21-4-2020', '07:47', 'Staff', '', '', 'G / Sontsonga', '', '', '', ''),
('in', '6311235954083', 'GSontsonga', '', '', '', '08:03 17-4-2020', '17-4-2020', '08:03', 'Staff', '', '', 'G / Sontsonga', '', '', '', ''),
('in', '6311235954083', 'GSontsonga', '', '', '', '08:07 14-4-2020', '14-4-2020', '08:07', 'Staff', '', '', 'G / Sontsonga', '', '', '', ''),
('in', '6311235954083', 'sintsladmans', '', '', '', '07:59 15-4-2020', '15-4-2020', '07:59', 'Staff', '', '', 'sintsladman / s', '', '', '', ''),
('in', '6311235954083', 'Sontsonga Gladman', '', '', '', '07:50 07-5-2020', '2020/07/05', '07:50', 'Staff', '', '', 'Sontsonga  / Gladman', '', 'work', '', ''),
('in', '6311235954083', 'SSontsongs', '', '', '', '07:54 11-5-2020', '2020/11/05', '07:54', 'Staff', '', '', 'S / Sontsongs', '', 'M,', '', ''),
('out', '6311235954083', '', '', '', '', '16:25 08-5-2020', '2020/08/05', '16:25', 'Staff', '', '', 'G / Sontsonga', '', 'M', '', ''),
('out', '6311235954083', '', '', '', '', '16:27 07-5-2020', '2020/07/05', '16:27', 'Staff', '', '', 'Sontsonga  / Gladman', '', 'work', '', ''),
('out', '6311235954083', '', '', '', '', '16:28 06-5-2020', '2020/06/05', '16:28', 'Staff', '', '', 'g / sontsonga', '', 'work', '', ''),
('out', '6311235954083', '', '', '', '', '16:26 05-5-2020', '2020/05/05', '16:26', 'Staff', '', '', 'G / Sontsonga', '', 'M', '', ''),
('out', '6311235954083', '', '', '', '', '16:27 04-5-2020', '2020/04/05', '16:27', 'Staff', '', '', 'G / Sontsonga', '', 'Mantainance', '', ''),
('out', '6311235954083', '', '', '', '', '16:28 30-4-2020', '30-4-2020', '16:28', 'Staff', '', '', 'G / Sontsonga', '', '', '', ''),
('out', '6311235954083', '', '', '', '', '16:27 29-4-2020', '29-4-2020', '16:27', 'Staff', '', '', 'G / Sontsonga', '', '', '', ''),
('out', '6311235954083', '', '', '', '', '16:30 28-4-2020', '28-4-2020', '16:30', 'Staff', '', '', 'G / Sontsonga', '', '', '', ''),
('out', '6311235954083', '', '', '', '', '16:29 24-4-2020', '24-4-2020', '16:29', 'Staff', '', '', 'G / Sontsonga', '', '', '', ''),
('out', '6311235954083', '', '', '', '', '16:34 23-4-2020', '23-4-2020', '16:34', 'Staff', '', '', 'G / Sontsonga', '', '', '', ''),
('out', '6311235954083', '', '', '', '', '16:30 22-4-2020', '22-4-2020', '16:30', 'Staff', '', '', 'G / Sontsonga', '', '', '', ''),
('out', '6311235954083', '', '', '', '', '16:30 21-4-2020', '21-4-2020', '16:30', 'Staff', '', '', 'G / Sontsonga', '', '', '', ''),
('out', '6311235954083', '', '', '', '', '12:15 20-4-2020', '20-4-2020', '12:15', 'Staff', '', '', 'Gladman / Sontsonga', '', '', '', ''),
('out', '6311235954083', '', '', '', '', '10:58 17-4-2020', '17-4-2020', '10:58', 'Staff', '', '', 'G / Sontsonga', '', '', '', ''),
('out', '6311235954083', '', '', '', '', '10:04 15-4-2020', '15-4-2020', '10:04', 'Staff', '', '', 'sintsladman / s', '', '', '', ''),
('out', '6311235954083', '', '', '', '', '10:38 14-4-2020', '14-4-2020', '10:38', 'Staff', '', '', 'G / Sontsonga', '', '', '', ''),
('in', '6312030723087', 'E.PTsolekile', '', '', '', '17:53 27-4-2020', '27-4-2020', '17:53', 'Staff', '', '', 'E.P / Tsolekile', '', '', '', ''),
('in', '6312030723087', 'E.PTsolekile', '', '', '', '17:39 23-4-2020', '23-4-2020', '17:39', 'Staff', '', '', 'E.P / Tsolekile', '', '', '', ''),
('in', '6312030723087', 'E.PTsolekile', '', '', '', '17:54 22-4-2020', '22-4-2020', '17:54', 'Staff', '', '', 'E.P / Tsolekile', '', '', '', ''),
('in', '6312030723087', 'E.PTsolekile', '', '', '', '18:12 17-4-2020', '17-4-2020', '18:12', 'Staff', '', '', 'E.P / Tsolekile', '', '', '', ''),
('in', '6312030723087', 'ellicia pumzatsolekile', '', '', '', '17:57 19-4-2020', '19-4-2020', '17:57', 'Staff', '', '', 'ellicia pumza / tsolekile', '', '', '', ''),
('in', '6312030723087', 'Ellicia Tsolekilepumza', '', '', '', '17:46 06-5-2020', '2020/06/05', '17:46', 'Staff', '', '', 'Ellicia Tsolekile / pumza', '', '208', '', ''),
('in', '6312030723087', 'ElliciaTsolekile', '', '', '', '18:00 03-5-2020', '2020/03/05', '18:00', 'Staff', '', '', 'Ellicia / Tsolekile', '', '208', '', ''),
('in', '6312030723087', 'elliciatsolekule', '', '', '', '18:05 18-4-2020', '18-4-2020', '18:05', 'Staff', '', '', 'ellicia / tsolekule', '', '', '', ''),
('in', '6312030723087', 'EPTsolekile', '', '', '', '17:56 28-4-2020', '28-4-2020', '17:56', 'Staff', '', '', 'EP / Tsolekile', '', '', '', ''),
('in', '6312030723087', 'Phumza TsolekileAlicia Tsolekil', '', '', '', '17:45 13-4-2020', '13-4-2020', '17:45', 'Staff', '', '', 'Phumza Tsolekile / Alicia Tsolekil', '', '', '', ''),
('in', '6312030723087', 'Pumza TsolekileAllicia Tsolekile', '', '', '', '18:05 14-4-2020', '14-4-2020', '18:05', 'Staff', '', '', 'Pumza Tsolekile / Allicia Tsolekile', '', '', '', ''),
('in', '6312030723087', 'tsolekileellicia', '', '', '', '17:54 02-5-2020', '2020/02/05', '17:54', 'Staff', '', '', 'tsolekile / ellicia', '', '208', '', ''),
('in', '6312030723087', 'tsolekileellicia', '', '', '', '17:51 01-5-2020', '2020/01/05', '17:51', 'Staff', '', '', 'tsolekile / ellicia', '', '208', '', ''),
('in', '6312030723087', 'tsolekilepumza', '', '', '', '17:45 07-5-2020', '2020/07/05', '17:45', 'Staff', '', '', 'tsolekile / pumza', '', '208', '', ''),
('out', '6312030723087', '', '', '', '', '06:59 08-5-2020', '2020/08/05', '06:59', 'Staff', '', '', 'tsolekile / pumza', '', '208', '', ''),
('out', '6312030723087', '', '', '', '', '07:14 07-5-2020', '2020/07/05', '07:14', 'Staff', '', '', 'Ellicia Tsolekile / pumza', '', '208', '', ''),
('out', '6312030723087', '', '', '', '', '07:10 04-5-2020', '2020/04/05', '07:10', 'Staff', '', '', 'Ellicia / Tsolekile', '', '208', '', ''),
('out', '6312030723087', '', '', '', '', '07:01 03-5-2020', '2020/03/05', '07:01', 'Staff', '', '', 'tsolekile / ellicia', '', '208', '', ''),
('out', '6312030723087', '', '', '', '', '07:16 02-5-2020', '2020/02/05', '07:16', 'Staff', '', '', 'tsolekile / ellicia', '', '208', '', ''),
('out', '6312030723087', '', '', '', '', '07:08 29-4-2020', '29-4-2020', '07:08', 'Staff', '', '', 'EP / Tsolekile', '', '', '', ''),
('out', '6312030723087', '', '', '', '', '07:08 28-4-2020', '28-4-2020', '07:08', 'Staff', '', '', 'E.P / Tsolekile', '', '', '', ''),
('out', '6312030723087', '', '', '', '', '07:10 24-4-2020', '24-4-2020', '07:10', 'Staff', '', '', 'E.P / Tsolekile', '', '', '', ''),
('out', '6312030723087', '', '', '', '', '07:02 23-4-2020', '23-4-2020', '07:02', 'Staff', '', '', 'E.P / Tsolekile', '', '', '', ''),
('out', '6312030723087', '', '', '', '', '07:03 20-4-2020', '20-4-2020', '07:03', 'Staff', '', '', 'ellicia pumza / tsolekile', '', '', '', ''),
('out', '6312030723087', '', '', '', '', '06:47 19-4-2020', '19-4-2020', '06:47', 'Staff', '', '', 'ellicia / tsolekule', '', '', '', ''),
('out', '6312030723087', '', '', '', '', '06:40 18-4-2020', '18-4-2020', '06:40', 'Staff', '', '', 'E.P / Tsolekile', '', '', '', ''),
('out', '6312030723087', '', '', '', '', '07:03 15-4-2020', '15-4-2020', '07:03', 'Staff', '', '', 'Pumza Tsolekile / Allicia Tsolekile', '', '', '', ''),
('out', '6312030723087', '', '', '', '', '07:09 14-4-2020', '14-4-2020', '07:09', 'Staff', '', '', 'Phumza Tsolekile / Alicia Tsolekil', '', '', '', ''),
('in', '6401016265088', 'GrootboomThamsanqa', '', '', '', '07:18 07-5-2020', '2020/07/05', '07:18', 'Staff', '', '', 'Grootboom / Thamsanqa', '', 'work', '', ''),
('in', '6401016265088', 'T.RGrootboom', '', '', '', '07:24 05-5-2020', '2020/05/05', '07:24', 'Staff', '', '', 'T.R / Grootboom', '', 'K G', '', ''),
('in', '6401016265088', 'TRGrootboom', '', '', '', '07:26 11-5-2020', '2020/11/05', '07:26', 'Staff', '', '', 'TR / Grootboom', '', 'KG', '', ''),
('in', '6401016265088', 'TRGrootboom', '', '', '', '07:26 08-5-2020', '2020/08/05', '07:26', 'Staff', '', '', 'TR / Grootboom', '', 'KG', '', ''),
('in', '6401016265088', 'TRGrootboom', '', '', '', '07:19 04-5-2020', '2020/04/05', '07:19', 'Staff', '', '', 'TR / Grootboom', '', 'Kenton Gardens', '', ''),
('in', '6401016265088', 'TRGrootboom', '', '', '', '07:03 30-4-2020', '30-4-2020', '07:03', 'Staff', '', '', 'TR / Grootboom', '', '', '', ''),
('out', '6401016265088', '', '', '', '', '16:16 08-5-2020', '2020/08/05', '16:16', 'Staff', '', '', 'TR / Grootboom', '', 'KG', '', ''),
('out', '6401016265088', '', '', '', '', '16:25 07-5-2020', '2020/07/05', '16:25', 'Staff', '', '', 'Grootboom / Thamsanqa', '', 'work', '', ''),
('out', '6401016265088', '', '', '', '', '16:25 05-5-2020', '2020/05/05', '16:25', 'Staff', '', '', 'T.R / Grootboom', '', 'K G', '', ''),
('out', '6401016265088', '', '', '', '', '16:25 04-5-2020', '2020/04/05', '16:25', 'Staff', '', '', 'TR / Grootboom', '', 'Kenton Gardens', '', ''),
('out', '6401016265088', '', '', '', '', '07:49 30-4-2020', '30-4-2020', '07:49', 'Staff', '', '', 'TR / Grootboom', '', '', '', ''),
('out', '6402290463084', '', '', '', '', '07:06 11-5-2020', '2020/11/05', '07:06', 'Staff', '', '', '', '', '', '', ''),
('out', '6402290463084', '', '', '', '', '07:09 10-5-2020', '2020/10/05', '07:09', 'Staff', '', '', '', '', '', '', ''),
('out', '6402290463084', '', '', '', '', '07:10 06-5-2020', '2020/06/05', '07:10', 'Staff', '', '', '', '', '', '', ''),
('out', '6402290463084', '', '', '', '', '07:15 05-5-2020', '2020/05/05', '07:15', 'Staff', '', '', '', '', '', '', ''),
('out', '6402290463084', '', '', '', '', '06:59 01-5-2020', '2020/01/05', '06:59', 'Staff', '', '', '', '', '', '', ''),
('out', '6402290463084', '', '', '', '', '06:48 30-4-2020', '30-4-2020', '06:48', 'Staff', '', '', '', '', '', '', ''),
('out', '6402290463084', '', '', '', '', '07:08 27-4-2020', '27-4-2020', '07:08', 'Staff', '', '', '', '', '', '', ''),
('out', '6402290463084', '', '', '', '', '07:03 26-4-2020', '26-4-2020', '07:03', 'Staff', '', '', '', '', '', '', ''),
('out', '6402290463084', '', '', '', '', '07:05 25-4-2020', '25-4-2020', '07:05', 'Staff', '', '', '', '', '', '', ''),
('out', '6402290463084', '', '', '', '', '07:07 22-4-2020', '22-4-2020', '07:07', 'Staff', '', '', '', '', '', '', ''),
('out', '6402290463084', '', '', '', '', '07:11 21-4-2020', '21-4-2020', '07:11', 'Staff', '', '', '', '', '', '', ''),
('out', '6402290463084', '', '', '', '', '07:07 17-4-2020', '17-4-2020', '07:07', 'Staff', '', '', '', '', '', '', ''),
('out', '6402290463084', '', '', '', '', '07:09 16-4-2020', '16-4-2020', '07:09', 'Staff', '', '', '', '', '', '', ''),
('out', '6402290463084', '', '', '', '', '07:07 12-4-2020', '2020/12/04', '07:07', 'Staff', '', '', '', '', '', '', ''),
('out', '6402290463084', '', '', '', '', '06:57 11-4-2020', '2020/11/04', '06:57', 'Staff', '', '', '', '', '', '', ''),
('in', '6501010740083', 'FMGengqani', '', '', '', '07:53 11-5-2020', '2020/11/05', '07:53', 'Staff', '', '', 'FM / Gengqani', '', '175', '', ''),
('in', '6501010740083', 'FUNEKA MIRRIAMQENGQANI', '', '', '6501010740083', '08:00 08-5-2020', '2020/08/05', '08:00', 'Staff', '', '', 'FUNEKA MIRRIAM / QENGQANI', '', '175', '', ''),
('out', '6501010740083', 'FUNEKA MIRRIAMQENGQANI', '', '', '6501010740083', '12:46 08-5-2020', '2020/08/05', '12:46', 'Staff', '', '', 'FUNEKA MIRRIAM / QENGQANI', '', '175', '', ''),
('in', '6501010740083', 'FUNEKA MIRRIAMQENGQANI', '', '', '6501010740083', '07:57 07-5-2020', '2020/07/05', '07:57', 'Staff', '', '', 'FUNEKA MIRRIAM / QENGQANI', '', 'work', '', ''),
('out', '6501010740083', '', '', '', '', '13:21 07-5-2020', '2020/07/05', '13:21', 'Staff', '', '', 'FUNEKA MIRRIAM / QENGQANI', '', 'work', '', ''),
('out', '6501010740083', '', '', '', '', '15:01 06-5-2020', '2020/06/05', '15:01', 'Staff', '', '', '', '', '', '', ''),
('out', '6503165013084', '', '', '', '', '11:05 24-4-2020', '24-4-2020', '11:05', 'Visitors', '', '', '', '', '', '', ''),
('in', '6507205851080', 'THANDEKILEKOMENI', '', '', '6507205851080', '07:37 08-5-2020', '2020/08/05', '07:37', 'Staff', '', '', 'THANDEKILE / KOMENI', '', 'M', '', ''),
('out', '6507205851080', 'THANDEKILEKOMENI', '', '', '6507205851080', '16:27 08-5-2020', '2020/08/05', '16:27', 'Staff', '', '', 'THANDEKILE / KOMENI', '', 'M', '', ''),
('in', '6507205851080', 'THANDEKILEKOMENI', '', '', '6507205851080', '07:39 07-5-2020', '2020/07/05', '07:39', 'Staff', '', '', 'THANDEKILE / KOMENI', '', 'Work', '', ''),
('out', '6507205851080', 'THANDEKILEKOMENI', '', '', '6507205851080', '16:29 07-5-2020', '2020/07/05', '16:29', 'Staff', '', '', 'THANDEKILE / KOMENI', '', 'Work', '', ''),
('in', '6507205851080', 'THANDEKILEKOMENI', '', '', '6507205851080', '07:44 04-5-2020', '2020/04/05', '07:44', 'Staff', '', '', 'THANDEKILE / KOMENI', '', 'Mantainance', '', ''),
('out', '6507205851080', 'THANDEKILEKOMENI', '', '', '6507205851080', '16:28 04-5-2020', '2020/04/05', '16:28', 'Staff', '', '', 'THANDEKILE / KOMENI', '', 'Mantainance', '', ''),
('in', '6507205851080', 'THANDEKILEKOMENI', '', '', '6507205851080', '07:41 30-4-2020', '30-4-2020', '07:41', 'Staff', '', '', 'THANDEKILE / KOMENI', '', '', '', ''),
('out', '6507205851080', 'THANDEKILEKOMENI', '', '', '6507205851080', '16:29 30-4-2020', '30-4-2020', '16:29', 'Staff', '', '', 'THANDEKILE / KOMENI', '', '', '', ''),
('out', '6507205851080', 'THANDEKILEKOMENI', '', '', '6507205851080', '16:28 29-4-2020', '29-4-2020', '16:28', 'Staff', '', '', 'T / Nkomeni', '', '', '', ''),
('out', '6507205851080', 'THANDEKILEKOMENI', '', '', '6507205851080', '16:32 28-4-2020', '28-4-2020', '16:32', 'Staff', '', '', 'T / Nkomeni', '', '', '', ''),
('in', '6507205851080', 'Tk', '', '', '', '07:55 11-5-2020', '2020/11/05', '07:55', 'Staff', '', '', 'T / k', '', 'm', '', ''),
('in', '6507205851080', 'tkhumeni', '', '', '', '07:30 06-5-2020', '2020/06/05', '07:30', 'Staff', '', '', 't / khumeni', '', 'work', '', ''),
('in', '6507205851080', 'TKomene', '', '', '', '07:39 05-5-2020', '2020/05/05', '07:39', 'Staff', '', '', 'T / Komene', '', 'M', '', ''),
('in', '6507205851080', 'TNkomeni', '', '', '', '07:43 29-4-2020', '29-4-2020', '07:43', 'Staff', '', '', 'T / Nkomeni', '', '', '', ''),
('in', '6507205851080', 'TNkomeni', '', '', '', '08:08 28-4-2020', '28-4-2020', '08:08', 'Staff', '', '', 'T / Nkomeni', '', '', '', ''),
('out', '6507205851080', '', '', '', '', '16:26 05-5-2020', '2020/05/05', '16:26', 'Staff', '', '', 'T / Komene', '', 'M', '', ''),
('in', '6509100150089', 'NontsikeleloThonga', '', '', '', '08:06 20-4-2020', '20-4-2020', '08:06', 'Staff', '', '', 'Nontsikelelo / Thonga', '', '', '', ''),
('in', '6509100150089', 'NontsikeleloThonga', '', '', '', '08:02 14-4-2020', '14-4-2020', '08:02', 'Staff', '', '', 'Nontsikelelo / Thonga', '', '', '', ''),
('in', '6509100150089', 'NThonga', '', '', '', '08:00 09-5-2020', '2020/09/05', '08:00', 'Staff', '', '', 'N / Thonga', '', '157', '', ''),
('in', '6509100150089', 'NThonga', '', '', '', '07:59 08-5-2020', '2020/08/05', '07:59', 'Staff', '', '', 'N / Thonga', '', '157', '', ''),
('in', '6509100150089', 'NThonga', '', '', '', '10:16 06-5-2020', '2020/06/05', '10:16', 'Staff', '', '', 'N / Thonga', '', 'work', '', ''),
('in', '6509100150089', 'NThonga', '', '', '', '08:03 05-5-2020', '2020/05/05', '08:03', 'Staff', '', '', 'N / Thonga', '', 'Unit 157', '', ''),
('in', '6509100150089', 'NThonga', '', '', '', '08:01 04-5-2020', '2020/04/05', '08:01', 'Staff', '', '', 'N / Thonga', '', 'Unit 157', '', ''),
('in', '6509100150089', 'NThonga', '', '', '', '08:07 01-5-2020', '2020/01/05', '08:07', 'Staff', '', '', 'N / Thonga', '', '157', '', ''),
('in', '6509100150089', 'NThonga', '', '', '', '08:00 30-4-2020', '30-4-2020', '08:00', 'Staff', '', '', 'N / Thonga', '', '', '', ''),
('in', '6509100150089', 'NThonga', '', '', '', '08:08 29-4-2020', '29-4-2020', '08:08', 'Staff', '', '', 'N / Thonga', '', '', '', ''),
('in', '6509100150089', 'NThonga', '', '', '', '10:01 28-4-2020', '28-4-2020', '10:01', 'Staff', '', '', 'N / Thonga', '', '', '', ''),
('in', '6509100150089', 'NThonga', '', '', '', '08:08 27-4-2020', '27-4-2020', '08:08', 'Staff', '', '', 'N / Thonga', '', '', '', ''),
('in', '6509100150089', 'NThonga', '', '', '', '08:11 25-4-2020', '25-4-2020', '08:11', 'Staff', '', '', 'N / Thonga', '', '', '', ''),
('in', '6509100150089', 'NThonga', '', '', '', '08:08 24-4-2020', '24-4-2020', '08:08', 'Staff', '', '', 'N / Thonga', '', '', '', ''),
('in', '6509100150089', 'NThonga', '', '', '', '08:07 23-4-2020', '23-4-2020', '08:07', 'Staff', '', '', 'N / Thonga', '', '', '', ''),
('in', '6509100150089', 'NThonga', '', '', '', '08:05 22-4-2020', '22-4-2020', '08:05', 'Staff', '', '', 'N / Thonga', '', '', '', ''),
('in', '6509100150089', 'NThonga', '', '', '', '08:09 21-4-2020', '21-4-2020', '08:09', 'Staff', '', '', 'N / Thonga', '', '', '', ''),
('in', '6509100150089', 'NThonga', '', '', '', '08:11 18-4-2020', '18-4-2020', '08:11', 'Staff', '', '', 'N / Thonga', '', '', '', ''),
('in', '6509100150089', 'NThonga', '', '', '', '08:04 17-4-2020', '17-4-2020', '08:04', 'Staff', '', '', 'N / Thonga', '', '', '', ''),
('in', '6509100150089', 'NThonga', '', '', '', '08:09 16-4-2020', '16-4-2020', '08:09', 'Staff', '', '', 'N / Thonga', '', '', '', ''),
('in', '6509100150089', 'NThonga', '', '', '', '08:02 11-4-2020', '2020/11/04', '08:02', 'Staff', '', '', 'N / Thonga', '', '', '', ''),
('in', '6509100150089', 'NtsikiThonga', '', '', '', '09:28 02-5-2020', '2020/02/05', '09:28', 'Staff', '', '', 'Ntsiki / Thonga', '', '157', '', ''),
('in', '6509100150089', 'Thongan', '', '', '', '08:26 15-4-2020', '15-4-2020', '08:26', 'Staff', '', '', 'Thonga / n', '', '', '', ''),
('in', '6509100150089', 'ThongaNontsikelelo', '', '', '', '07:57 07-5-2020', '2020/07/05', '07:57', 'Staff', '', '', 'Thonga / Nontsikelelo', '', 'work', '', ''),
('in', '6509100150089', 'TThonga', '', '', '', '07:59 11-5-2020', '2020/11/05', '07:59', 'Staff', '', '', 'T / Thonga', '', '157', '', ''),
('out', '6509100150089', '', '', '', '', '13:12 09-5-2020', '2020/09/05', '13:12', 'Staff', '', '', 'N / Thonga', '', '157', '', ''),
('out', '6509100150089', '', '', '', '', '15:11 08-5-2020', '2020/08/05', '15:11', 'Staff', '', '', 'N / Thonga', '', '157', '', ''),
('out', '6509100150089', '', '', '', '', '15:05 07-5-2020', '2020/07/05', '15:05', 'Staff', '', '', 'Thonga / Nontsikelelo', '', 'work', '', ''),
('out', '6509100150089', '', '', '', '', '15:08 06-5-2020', '2020/06/05', '15:08', 'Staff', '', '', 'N / Thonga', '', 'work', '', ''),
('out', '6509100150089', '', '', '', '', '15:19 05-5-2020', '2020/05/05', '15:19', 'Staff', '', '', 'N / Thonga', '', 'Unit 157', '', ''),
('out', '6509100150089', '', '', '', '', '15:13 04-5-2020', '2020/04/05', '15:13', 'Staff', '', '', 'N / Thonga', '', 'Unit 157', '', ''),
('out', '6509100150089', '', '', '', '', '13:24 02-5-2020', '2020/02/05', '13:24', 'Staff', '', '', 'Ntsiki / Thonga', '', '157', '', ''),
('out', '6509100150089', '', '', '', '', '15:08 01-5-2020', '2020/01/05', '15:08', 'Staff', '', '', 'N / Thonga', '', '157', '', ''),
('out', '6509100150089', '', '', '', '', '14:10 30-4-2020', '30-4-2020', '14:10', 'Staff', '', '', 'N / Thonga', '', '', '', ''),
('out', '6509100150089', '', '', '', '', '14:09 29-4-2020', '29-4-2020', '14:09', 'Staff', '', '', 'N / Thonga', '', '', '', ''),
('out', '6509100150089', '', '', '', '', '15:13 28-4-2020', '28-4-2020', '15:13', 'Staff', '', '', 'N / Thonga', '', '', '', ''),
('out', '6509100150089', '', '', '', '', '15:01 27-4-2020', '27-4-2020', '15:01', 'Staff', '', '', 'N / Thonga', '', '', '', ''),
('out', '6509100150089', '', '', '', '', '13:30 25-4-2020', '25-4-2020', '13:30', 'Staff', '', '', 'N / Thonga', '', '', '', ''),
('out', '6509100150089', '', '', '', '', '15:05 24-4-2020', '24-4-2020', '15:05', 'Staff', '', '', 'N / Thonga', '', '', '', ''),
('out', '6509100150089', '', '', '', '', '15:09 23-4-2020', '23-4-2020', '15:09', 'Staff', '', '', 'N / Thonga', '', '', '', ''),
('out', '6509100150089', '', '', '', '', '15:11 22-4-2020', '22-4-2020', '15:11', 'Staff', '', '', 'N / Thonga', '', '', '', ''),
('out', '6509100150089', '', '', '', '', '15:10 21-4-2020', '21-4-2020', '15:10', 'Staff', '', '', 'N / Thonga', '', '', '', ''),
('out', '6509100150089', '', '', '', '', '15:18 20-4-2020', '20-4-2020', '15:18', 'Staff', '', '', 'Nontsikelelo / Thonga', '', '', '', ''),
('out', '6509100150089', '', '', '', '', '09:28 19-4-2020', '19-4-2020', '09:28', 'Staff', '', '', 'N / Thonga', '', '', '', ''),
('out', '6509100150089', '', '', '', '', '15:09 17-4-2020', '17-4-2020', '15:09', 'Staff', '', '', 'N / Thonga', '', '', '', ''),
('out', '6509100150089', '', '', '', '', '15:08 16-4-2020', '16-4-2020', '15:08', 'Staff', '', '', 'N / Thonga', '', '', '', ''),
('out', '6509100150089', '', '', '', '', '15:05 15-4-2020', '15-4-2020', '15:05', 'Staff', '', '', 'Thonga / n', '', '', '', ''),
('out', '6509100150089', '', '', '', '', '15:08 14-4-2020', '14-4-2020', '15:08', 'Staff', '', '', 'Nontsikelelo / Thonga', '', '', '', ''),
('out', '6509100150089', '', '', '', '', '12:55 11-4-2020', '2020/11/04', '12:55', 'Staff', '', '', 'N / Thonga', '', '', '', ''),
('in', '6512260276082', 'JMposelwa', '', '', '', '07:48 08-5-2020', '2020/08/05', '07:48', 'Staff', '', '', 'J / Mposelwa', '', 'Unit 226', '', ''),
('in', '6609160323087', 'Ditalap', '', '', '', '08:00 15-4-2020', '15-4-2020', '08:00', 'Staff', '', '', 'Ditala / p', '', '', '', ''),
('in', '6609160323087', 'DitanaPindiwe', '', '', '', '07:52 13-4-2020', '13-4-2020', '07:52', 'Staff', '', '', 'Ditana / Pindiwe', '', '', '', ''),
('in', '6609160323087', 'PD', '', '', '', '07:53 09-5-2020', '2020/09/05', '07:53', 'Staff', '', '', 'P / D', '', 'l', '', ''),
('in', '6609160323087', 'PDitala', '', '', '', '07:48 11-5-2020', '2020/11/05', '07:48', 'Staff', '', '', 'P / Ditala', '', 'L', '', ''),
('in', '6609160323087', 'PDitala', '', '', '', '07:50 05-5-2020', '2020/05/05', '07:50', 'Staff', '', '', 'P / Ditala', '', 'L', '', ''),
('in', '6609160323087', 'PDitala', '', '', '', '08:04 29-4-2020', '29-4-2020', '08:04', 'Staff', '', '', 'P / Ditala', '', '', '', ''),
('in', '6609160323087', 'PDitala', '', '', '', '07:48 27-4-2020', '27-4-2020', '07:48', 'Staff', '', '', 'P / Ditala', '', '', '', ''),
('in', '6609160323087', 'PDitala', '', '', '', '07:47 25-4-2020', '25-4-2020', '07:47', 'Staff', '', '', 'P / Ditala', '', '', '', ''),
('in', '6609160323087', 'PDitala', '', '', '', '08:15 24-4-2020', '24-4-2020', '08:15', 'Staff', '', '', 'P / Ditala', '', '', '', ''),
('in', '6609160323087', 'PDitala', '', '', '', '08:16 23-4-2020', '23-4-2020', '08:16', 'Staff', '', '', 'P / Ditala', '', '', '', ''),
('in', '6609160323087', 'PDitala', '', '', '', '07:49 22-4-2020', '22-4-2020', '07:49', 'Staff', '', '', 'P / Ditala', '', '', '', ''),
('in', '6609160323087', 'PDitala', '', '', '', '07:50 17-4-2020', '17-4-2020', '07:50', 'Staff', '', '', 'P / Ditala', '', '', '', ''),
('in', '6609160323087', 'PDitala', '', '', '', '07:52 11-4-2020', '2020/11/04', '07:52', 'Staff', '', '', 'P / Ditala', '', '', '', ''),
('in', '6609160323087', 'PDitals', '', '', '', '07:50 28-4-2020', '28-4-2020', '07:50', 'Staff', '', '', 'P / Ditals', '', '', '', ''),
('in', '6609160323087', 'PDitana', '', '', '', '07:52 04-5-2020', '2020/04/05', '07:52', 'Staff', '', '', 'P / Ditana', '', 'Laundry', '', ''),
('in', '6609160323087', 'PDitana', '', '', '', '07:50 01-5-2020', '2020/01/05', '07:50', 'Staff', '', '', 'P / Ditana', '', 'laundry', '', ''),
('in', '6609160323087', 'PDitani', '', '', '', '07:47 08-5-2020', '2020/08/05', '07:47', 'Staff', '', '', 'P / Ditani', '', 'Laundry', '', ''),
('in', '6609160323087', 'PDitsla', '', '', '', '07:50 30-4-2020', '30-4-2020', '07:50', 'Staff', '', '', 'P / Ditsla', '', '', '', ''),
('in', '6609160323087', 'Pditsos', '', '', '', '07:50 16-4-2020', '16-4-2020', '07:50', 'Staff', '', '', 'P / ditsos', '', '', '', ''),
('in', '6609160323087', 'PindiweDitana', '', '', '', '07:50 20-4-2020', '20-4-2020', '07:50', 'Staff', '', '', 'Pindiwe / Ditana', '', '', '', ''),
('in', '6609160323087', 'PindiweDitana', '', '', '', '07:52 14-4-2020', '14-4-2020', '07:52', 'Staff', '', '', 'Pindiwe / Ditana', '', '', '', ''),
('in', '6609160323087', 'PPDitala', '', '', '', '07:52 21-4-2020', '21-4-2020', '07:52', 'Staff', '', '', 'PP / Ditala', '', '', '', ''),
('out', '6609160323087', '', '', '', '', '12:46 09-5-2020', '2020/09/05', '12:46', 'Staff', '', '', 'P / D', '', 'l', '', ''),
('out', '6609160323087', '', '', '', '', '15:57 08-5-2020', '2020/08/05', '15:57', 'Staff', '', '', 'P / Ditani', '', 'Laundry', '', ''),
('out', '6609160323087', '', '', '', '', '15:57 05-5-2020', '2020/05/05', '15:57', 'Staff', '', '', 'P / Ditala', '', 'L', '', ''),
('out', '6609160323087', '', '', '', '', '15:58 04-5-2020', '2020/04/05', '15:58', 'Staff', '', '', 'P / Ditana', '', 'Laundry', '', ''),
('out', '6609160323087', '', '', '', '', '15:56 01-5-2020', '2020/01/05', '15:56', 'Staff', '', '', 'P / Ditana', '', 'laundry', '', ''),
('out', '6609160323087', '', '', '', '', '15:57 30-4-2020', '30-4-2020', '15:57', 'Staff', '', '', 'P / Ditsla', '', '', '', ''),
('out', '6609160323087', '', '', '', '', '15:58 29-4-2020', '29-4-2020', '15:58', 'Staff', '', '', 'P / Ditala', '', '', '', ''),
('out', '6609160323087', '', '', '', '', '15:57 28-4-2020', '28-4-2020', '15:57', 'Staff', '', '', 'P / Ditals', '', '', '', ''),
('out', '6609160323087', '', '', '', '', '15:52 27-4-2020', '27-4-2020', '15:52', 'Staff', '', '', 'P / Ditala', '', '', '', ''),
('out', '6609160323087', '', '', '', '', '13:06 25-4-2020', '25-4-2020', '13:06', 'Staff', '', '', 'P / Ditala', '', '', '', ''),
('out', '6609160323087', '', '', '', '', '15:51 24-4-2020', '24-4-2020', '15:51', 'Staff', '', '', 'P / Ditala', '', '', '', ''),
('out', '6609160323087', '', '', '', '', '15:53 23-4-2020', '23-4-2020', '15:53', 'Staff', '', '', 'P / Ditala', '', '', '', ''),
('out', '6609160323087', '', '', '', '', '16:01 22-4-2020', '22-4-2020', '16:01', 'Staff', '', '', 'P / Ditala', '', '', '', ''),
('out', '6609160323087', '', '', '', '', '15:58 21-4-2020', '21-4-2020', '15:58', 'Staff', '', '', 'PP / Ditala', '', '', '', ''),
('out', '6609160323087', '', '', '', '', '15:55 20-4-2020', '20-4-2020', '15:55', 'Staff', '', '', 'Pindiwe / Ditana', '', '', '', ''),
('out', '6609160323087', '', '', '', '', '15:56 17-4-2020', '17-4-2020', '15:56', 'Staff', '', '', 'P / Ditala', '', '', '', ''),
('out', '6609160323087', '', '', '', '', '16:04 16-4-2020', '16-4-2020', '16:04', 'Staff', '', '', 'P / ditsos', '', '', '', ''),
('out', '6609160323087', '', '', '', '', '15:55 15-4-2020', '15-4-2020', '15:55', 'Staff', '', '', 'Ditala / p', '', '', '', ''),
('out', '6609160323087', '', '', '', '', '15:51 14-4-2020', '14-4-2020', '15:51', 'Staff', '', '', 'Pindiwe / Ditana', '', '', '', ''),
('out', '6609160323087', '', '', '', '', '15:51 13-4-2020', '13-4-2020', '15:51', 'Staff', '', '', 'Ditana / Pindiwe', '', '', '', ''),
('out', '6609160323087', '', '', '', '', '12:55 11-4-2020', '2020/11/04', '12:55', 'Staff', '', '', 'P / Ditala', '', '', '', ''),
('in', '6703130360087', 'L.E.Norongwa', '', '', '', '06:57 20-4-2020', '20-4-2020', '06:57', 'Staff', '', '', 'L.E. / Norongwa', '', '', '', ''),
('in', '6703130360087', 'L.E.Norongwana', '', '', '', '07:00 14-4-2020', '14-4-2020', '07:00', 'Staff', '', '', 'L.E. / Norongwana', '', '', '', ''),
('in', '6703130360087', 'LE Norongwana', '', '', '', '07:02 08-5-2020', '2020/08/05', '07:02', 'Staff', '', '', 'LE  / Norongwana', '', 'Care Centre', '', ''),
('in', '6703130360087', 'LE Norongwana', '', '', '', '07:01 05-5-2020', '2020/05/05', '07:01', 'Staff', '', '', 'LE  / Norongwana', '', 'Care Centre', '', ''),
('in', '6703130360087', 'LENigwala', '', '', '', '06:57 21-4-2020', '21-4-2020', '06:57', 'Staff', '', '', 'LE / Nigwala', '', '', '', '');
INSERT INTO `atthegate` (`direction`, `license`, `name`, `company`, `category`, `dr_license`, `creation`, `recdate`, `rectime`, `profile`, `incidents`, `dr_name`, `name_in`, `name_out`, `going`, `company2`, `visiting`) VALUES
('in', '6703130360087', 'LENorongwana', '', '', '', '06:56 11-5-2020', '2020/11/05', '06:56', 'Staff', '', '', 'LE / Norongwana', '', 'C/C', '', ''),
('in', '6703130360087', 'LENorongwana', '', '', '', '07:00 04-5-2020', '2020/04/05', '07:00', 'Staff', '', '', 'LE / Norongwana', '', 'Care Cenntre', '', ''),
('in', '6703130360087', 'LENorongwana', '', '', '', '07:02 30-4-2020', '30-4-2020', '07:02', 'Staff', '', '', 'LE / Norongwana', '', '', '', ''),
('in', '6703130360087', 'LENorongwana', '', '', '', '07:00 29-4-2020', '29-4-2020', '07:00', 'Staff', '', '', 'LE / Norongwana', '', '', '', ''),
('in', '6703130360087', 'LENorongwana', '', '', '', '06:55 28-4-2020', '28-4-2020', '06:55', 'Staff', '', '', 'LE / Norongwana', '', '', '', ''),
('in', '6703130360087', 'LENorongwana', '', '', '', '07:05 24-4-2020', '24-4-2020', '07:05', 'Staff', '', '', 'LE / Norongwana', '', '', '', ''),
('in', '6703130360087', 'LENorongwana', '', '', '', '07:05 23-4-2020', '23-4-2020', '07:05', 'Staff', '', '', 'LE / Norongwana', '', '', '', ''),
('in', '6703130360087', 'LENorongwana', '', '', '', '07:01 22-4-2020', '22-4-2020', '07:01', 'Staff', '', '', 'LE / Norongwana', '', '', '', ''),
('in', '6703130360087', 'LENorongwana', '', '', '', '07:04 17-4-2020', '17-4-2020', '07:04', 'Staff', '', '', 'LE / Norongwana', '', '', '', ''),
('in', '6703130360087', 'LENorongwana', '', '', '', '07:04 16-4-2020', '16-4-2020', '07:04', 'Staff', '', '', 'LE / Norongwana', '', '', '', ''),
('in', '6703130360087', 'LENorongwana', '', '', '', '07:08 15-4-2020', '15-4-2020', '07:08', 'Staff', '', '', 'LE / Norongwana', '', '', '', ''),
('in', '6703130360087', 'Lindelwa Norongwanl Norongwsna', '', '', '', '07:06 07-5-2020', '2020/07/05', '07:06', 'Staff', '', '', 'Lindelwa Norongwan / l Norongwsna', '', 'Frail care', '', ''),
('in', '6703130360087', 'lindelwanorhongwana', '', '', '', '07:01 06-5-2020', '2020/06/05', '07:01', 'Staff', '', '', 'lindelwa / norhongwana', '', 'frail care', '', ''),
('out', '6703130360087', '', '', '', '', '13:01 08-5-2020', '2020/08/05', '13:01', 'Staff', '', '', 'LE  / Norongwana', '', 'Care Centre', '', ''),
('out', '6703130360087', '', '', '', '', '15:54 07-5-2020', '2020/07/05', '15:54', 'Staff', '', '', 'Lindelwa Norongwan / l Norongwsna', '', 'Frail care', '', ''),
('out', '6703130360087', '', '', '', '', '15:54 06-5-2020', '2020/06/05', '15:54', 'Staff', '', '', 'lindelwa / norhongwana', '', 'frail care', '', ''),
('out', '6703130360087', '', '', '', '', '15:56 05-5-2020', '2020/05/05', '15:56', 'Staff', '', '', 'LE  / Norongwana', '', 'Care Centre', '', ''),
('out', '6703130360087', '', '', '', '', '15:53 04-5-2020', '2020/04/05', '15:53', 'Staff', '', '', 'LE / Norongwana', '', 'Care Cenntre', '', ''),
('out', '6703130360087', '', '', '', '', '15:54 30-4-2020', '30-4-2020', '15:54', 'Staff', '', '', 'LE / Norongwana', '', '', '', ''),
('out', '6703130360087', '', '', '', '', '15:55 29-4-2020', '29-4-2020', '15:55', 'Staff', '', '', 'LE / Norongwana', '', '', '', ''),
('out', '6703130360087', '', '', '', '', '15:55 28-4-2020', '28-4-2020', '15:55', 'Staff', '', '', 'LE / Norongwana', '', '', '', ''),
('out', '6703130360087', '', '', '', '', '13:01 24-4-2020', '24-4-2020', '13:01', 'Staff', '', '', 'LE / Norongwana', '', '', '', ''),
('out', '6703130360087', '', '', '', '', '15:52 23-4-2020', '23-4-2020', '15:52', 'Staff', '', '', 'LE / Norongwana', '', '', '', ''),
('out', '6703130360087', '', '', '', '', '15:59 22-4-2020', '22-4-2020', '15:59', 'Staff', '', '', 'LE / Norongwana', '', '', '', ''),
('out', '6703130360087', '', '', '', '', '15:48 21-4-2020', '21-4-2020', '15:48', 'Staff', '', '', 'LE / Nigwala', '', '', '', ''),
('out', '6703130360087', '', '', '', '', '15:52 20-4-2020', '20-4-2020', '15:52', 'Staff', '', '', 'L.E. / Norongwa', '', '', '', ''),
('out', '6703130360087', '', '', '', '', '13:01 17-4-2020', '17-4-2020', '13:01', 'Staff', '', '', 'LE / Norongwana', '', '', '', ''),
('out', '6703130360087', '', '', '', '', '15:53 16-4-2020', '16-4-2020', '15:53', 'Staff', '', '', 'LE / Norongwana', '', '', '', ''),
('out', '6703130360087', '', '', '', '', '15:53 15-4-2020', '15-4-2020', '15:53', 'Staff', '', '', 'LE / Norongwana', '', '', '', ''),
('out', '6703130360087', '', '', '', '', '15:53 14-4-2020', '14-4-2020', '15:53', 'Staff', '', '', 'L.E. / Norongwana', '', '', '', ''),
('in', '6704195587085', 'A CNobebe', '', '', '', '07:19 05-5-2020', '2020/05/05', '07:19', 'Staff', '', '', 'A C / Nobebe', '', 'K G,', '', ''),
('in', '6704195587085', 'A NobebeA B', '', '', '', '07:25 07-5-2020', '2020/07/05', '07:25', 'Staff', '', '', 'A Nobebe / A B', '', 'worj', '', ''),
('in', '6704195587085', 'A.CNobebe', '', '', '', '07:21 04-5-2020', '2020/04/05', '07:21', 'Staff', '', '', 'A.C / Nobebe', '', 'Kenton Gardens', '', ''),
('in', '6704195587085', 'ACNobebe', '', '', '', '07:22 11-5-2020', '2020/11/05', '07:22', 'Staff', '', '', 'AC / Nobebe', '', 'KG', '', ''),
('in', '6704195587085', 'ACNobebe', '', '', '', '07:24 08-5-2020', '2020/08/05', '07:24', 'Staff', '', '', 'AC / Nobebe', '', 'M', '', ''),
('in', '6704195587085', 'acnobebe', '', '', '', '07:19 06-5-2020', '2020/06/05', '07:19', 'Staff', '', '', 'ac / nobebe', '', 'work', '', ''),
('in', '6704195587085', 'ACNobebe', '', '', '', '07:23 30-4-2020', '30-4-2020', '07:23', 'Staff', '', '', 'AC / Nobebe', '', '', '', ''),
('out', '6704195587085', '', '', '', '', '16:01 08-5-2020', '2020/08/05', '16:01', 'Staff', '', '', 'AC / Nobebe', '', 'M', '', ''),
('out', '6704195587085', '', '', '', '', '16:25 07-5-2020', '2020/07/05', '16:25', 'Staff', '', '', 'A Nobebe / A B', '', 'worj', '', ''),
('out', '6704195587085', '', '', '', '', '16:28 06-5-2020', '2020/06/05', '16:28', 'Staff', '', '', 'ac / nobebe', '', 'work', '', ''),
('out', '6704195587085', '', '', '', '', '16:25 05-5-2020', '2020/05/05', '16:25', 'Staff', '', '', 'A C / Nobebe', '', 'K G,', '', ''),
('out', '6704195587085', '', '', '', '', '16:26 04-5-2020', '2020/04/05', '16:26', 'Staff', '', '', 'A.C / Nobebe', '', 'Kenton Gardens', '', ''),
('out', '6704195587085', '', '', '', '', '16:04 30-4-2020', '30-4-2020', '16:04', 'Staff', '', '', 'AC / Nobebe', '', '', '', ''),
('out', '6704195587085', '', '', '', '', '16:26 29-4-2020', '29-4-2020', '16:26', 'Staff', '', '', '', '', '', '', ''),
('in', '6705285756084', 'Mthwaloqondile', '', '', '', '07:30 07-5-2020', '2020/07/05', '07:30', 'Staff', '', '', 'Mthwalo / qondile', '', 'work', '', ''),
('in', '6705285756084', 'QMthwalo', '', '', '', '07:26 11-5-2020', '2020/11/05', '07:26', 'Staff', '', '', 'Q / Mthwalo', '', 'M', '', ''),
('in', '6705285756084', 'QMthwalo', '', '', '', '07:25 08-5-2020', '2020/08/05', '07:25', 'Staff', '', '', 'Q / Mthwalo', '', 'M', '', ''),
('out', '6705285756084', '', '', '', '', '16:23 08-5-2020', '2020/08/05', '16:23', 'Staff', '', '', 'Q / Mthwalo', '', 'M', '', ''),
('out', '6705285756084', '', '', '', '', '16:25 07-5-2020', '2020/07/05', '16:25', 'Staff', '', '', 'Mthwalo / qondile', '', 'work', '', ''),
('in', '6706030367086', 'N.JGwebile', '', '', '', '07:34 20-4-2020', '20-4-2020', '07:34', 'Staff', '', '', 'N.J / Gwebile', '', '', '', ''),
('in', '6706030367086', 'NJGwebile', '', '', '', '07:19 30-4-2020', '30-4-2020', '07:19', 'Staff', '', '', 'NJ / Gwebile', '', '', '', ''),
('in', '6706030367086', 'NJGwebile', '', '', '', '08:01 15-4-2020', '15-4-2020', '08:01', 'Staff', '', '', 'NJ / Gwebile', '', '', '', ''),
('in', '6706030367086', 'NjGwebilenj', '', '', '', '07:22 23-4-2020', '23-4-2020', '07:22', 'Staff', '', '', 'NjGwebile / nj', '', '', '', ''),
('out', '6706030367086', '', '', '', '', '12:12 07-5-2020', '2020/07/05', '12:12', 'Staff', '', '', '', '', '', '', ''),
('out', '6706030367086', '', '', '', '', '12:03 30-4-2020', '30-4-2020', '12:03', 'Staff', '', '', 'NJ / Gwebile', '', '', '', ''),
('out', '6706030367086', '', '', '', '', '12:11 23-4-2020', '23-4-2020', '12:11', 'Staff', '', '', 'NjGwebile / nj', '', '', '', ''),
('out', '6706030367086', '', '', '', '', '12:40 20-4-2020', '20-4-2020', '12:40', 'Staff', '', '', 'N.J / Gwebile', '', '', '', ''),
('out', '6706030367086', '', '', '', '', '13:07 15-4-2020', '15-4-2020', '13:07', 'Staff', '', '', 'NJ / Gwebile', '', '', '', ''),
('in', '6707100226084', 'MONICABOUWER', '', '', '6707100666084', '07:49 14-4-2020', '14-4-2020', '07:49', 'Staff', '', '', 'MONICA / BOUWER', '', '', '', ''),
('in', '6707100666084', 'bouirm', '', '', '', '07:56 15-4-2020', '15-4-2020', '07:56', 'Staff', '', '', 'bouir / m', '', '', '', ''),
('in', '6707100666084', 'MBouer', '', '', '', '07:48 05-5-2020', '2020/05/05', '07:48', 'Staff', '', '', 'M / Bouer', '', 'G3', '', ''),
('in', '6707100666084', 'MBouer', '', '', '', '08:02 24-4-2020', '24-4-2020', '08:02', 'Staff', '', '', 'M / Bouer', '', '', '', ''),
('in', '6707100666084', 'MBoure,', '', '', '', '08:00 22-4-2020', '22-4-2020', '08:00', 'Staff', '', '', 'M / Boure,', '', '', '', ''),
('in', '6707100666084', 'MBouwer', '', '', '', '07:39 08-5-2020', '2020/08/05', '07:39', 'Staff', '', '', 'M / Bouwer', '', 'Unit G3', '', ''),
('in', '6707100666084', 'MBouwer', '', '', '', '07:38 04-5-2020', '2020/04/05', '07:38', 'Staff', '', '', 'M / Bouwer', '', 'G3', '', ''),
('in', '6707100666084', 'MBouwer', '', '', '', '07:53 01-5-2020', '2020/01/05', '07:53', 'Staff', '', '', 'M / Bouwer', '', 'G3', '', ''),
('in', '6707100666084', 'MBouwer', '', '', '', '07:48 28-4-2020', '28-4-2020', '07:48', 'Staff', '', '', 'M / Bouwer', '', '', '', ''),
('in', '6707100666084', 'MBouwer', '', '', '', '07:54 21-4-2020', '21-4-2020', '07:54', 'Staff', '', '', 'M / Bouwer', '', '', '', ''),
('in', '6707100666084', 'Mbouwer', '', '', '', '08:01 16-4-2020', '16-4-2020', '08:01', 'Staff', '', '', 'M / bouwer', '', '', '', ''),
('out', '6707100666084', 'MONICABOUWER', '', '', '6707100666084', '12:33 11-5-2020', '2020/11/05', '12:33', 'Staff', '', '', '', '', '', '', ''),
('in', '6707100666084', 'MONICABOUWER', '', '', '6707100666084', '07:51 07-5-2020', '2020/07/05', '07:51', 'Staff', '', '', 'MONICA / BOUWER', '', 'work', '', ''),
('out', '6707100666084', 'MONICABOUWER', '', '', '6707100666084', '14:28 07-5-2020', '2020/07/05', '14:28', 'Staff', '', '', 'MONICA / BOUWER', '', 'work', '', ''),
('out', '6707100666084', 'MONICABOUWER', '', '', '6707100666084', '14:17 06-5-2020', '2020/06/05', '14:17', 'Staff', '', '', '', '', '', '', ''),
('out', '6707100666084', 'MONICABOUWER', '', '', '6707100666084', '14:20 01-5-2020', '2020/01/05', '14:20', 'Staff', '', '', 'M / Bouwer', '', 'G3', '', ''),
('in', '6707100666084', 'MONICABOUWER', '', '', '6707100666084', '07:51 30-4-2020', '30-4-2020', '07:51', 'Staff', '', '', 'MONICA / BOUWER', '', '', '', ''),
('in', '6707100666084', 'MONICABOUWER', '', '', '6707100666084', '07:47 29-4-2020', '29-4-2020', '07:47', 'Staff', '', '', 'MONICA / BOUWER', '', '', '', ''),
('in', '6707100666084', 'MONICABOUWER', '', '', '6707100666084', '07:50 27-4-2020', '27-4-2020', '07:50', 'Staff', '', '', 'MONICA / BOUWER', '', '', '', ''),
('out', '6707100666084', 'MONICABOUWER', '', '', '6707100666084', '13:46 27-4-2020', '27-4-2020', '13:46', 'Staff', '', '', 'MONICA / BOUWER', '', '', '', ''),
('in', '6707100666084', 'MONICABOUWER', '', '', '6707100666084', '08:12 25-4-2020', '25-4-2020', '08:12', 'Staff', '', '', 'MONICA / BOUWER', '', '', '', ''),
('out', '6707100666084', 'MONICABOUWER', '', '', '6707100666084', '13:30 25-4-2020', '25-4-2020', '13:30', 'Staff', '', '', 'MONICA / BOUWER', '', '', '', ''),
('out', '6707100666084', 'MONICABOUWER', '', '', '6707100666084', '14:11 23-4-2020', '23-4-2020', '14:11', 'Staff', '', '', '', '', '', '', ''),
('out', '6707100666084', 'MONICABOUWER', '', '', '6707100666084', '14:21 22-4-2020', '22-4-2020', '14:21', 'Staff', '', '', 'M / Boure,', '', '', '', ''),
('out', '6707100666084', 'MONICABOUWER', '', '', '6707100666084', '16:07 21-4-2020', '21-4-2020', '16:07', 'Staff', '', '', 'M / Bouwer', '', '', '', ''),
('in', '6707100666084', 'MONICABOUWER', '', '', '6707100666084', '07:53 20-4-2020', '20-4-2020', '07:53', 'Staff', '', '', 'MONICA / BOUWER', '', '', '', ''),
('out', '6707100666084', 'MONICABOUWER', '', '', '6707100666084', '13:48 20-4-2020', '20-4-2020', '13:48', 'Staff', '', '', 'MONICA / BOUWER', '', '', '', ''),
('in', '6707100666084', 'MONICABOUWER', '', '', '6707100666084', '07:53 17-4-2020', '17-4-2020', '07:53', 'Staff', '', '', 'MONICA / BOUWER', '', '', '', ''),
('out', '6707100666084', 'MONICABOUWER', '', '', '6707100666084', '13:35 16-4-2020', '16-4-2020', '13:35', 'Staff', '', '', 'M / bouwer', '', '', '', ''),
('out', '6707100666084', 'MONICABOUWER', '', '', '6707100666084', '16:01 14-4-2020', '14-4-2020', '16:01', 'Staff', '', '', '', '', '', '', ''),
('in', '6707100666084', 'MonicaBouwer', '', '', '', '07:55 13-4-2020', '13-4-2020', '07:55', 'Staff', '', '', 'Monica / Bouwer', '', '', '', ''),
('out', '6707100666084', '', '', '', '', '13:38 08-5-2020', '2020/08/05', '13:38', 'Staff', '', '', 'M / Bouwer', '', 'Unit G3', '', ''),
('out', '6707100666084', '', '', '', '', '07:46 06-5-2020', '2020/06/05', '07:46', 'Staff', '', '', '', '', '', '', ''),
('out', '6707100666084', '', '', '', '', '16:05 05-5-2020', '2020/05/05', '16:05', 'Staff', '', '', 'M / Bouer', '', 'G3', '', ''),
('out', '6707100666084', '', '', '', '', '13:32 04-5-2020', '2020/04/05', '13:32', 'Staff', '', '', 'M / Bouwer', '', 'G3', '', ''),
('out', '6707100666084', '', '', '', '', '13:56 30-4-2020', '30-4-2020', '13:56', 'Staff', '', '', 'MONICA / BOUWER', '', '', '', ''),
('out', '6707100666084', '', '', '', '', '14:04 29-4-2020', '29-4-2020', '14:04', 'Staff', '', '', 'MONICA / BOUWER', '', '', '', ''),
('out', '6707100666084', '', '', '', '', '14:41 24-4-2020', '24-4-2020', '14:41', 'Staff', '', '', 'M / Bouer', '', '', '', ''),
('out', '6707100666084', '', '', '', '', '13:52 17-4-2020', '17-4-2020', '13:52', 'Staff', '', '', 'MONICA / BOUWER', '', '', '', ''),
('out', '6707100666084', '', '', '', '', '13:51 15-4-2020', '15-4-2020', '13:51', 'Staff', '', '', 'bouir / m', '', '', '', ''),
('out', '6707100666084', '', '', '', '', '13:49 13-4-2020', '13-4-2020', '13:49', 'Staff', '', '', 'Monica / Bouwer', '', '', '', ''),
('in', '6707100667084', 'MONICABOUWER', '', '', '6707100666084', '08:00 23-4-2020', '23-4-2020', '08:00', 'Staff', '', '', 'MONICA / BOUWER', '', '', '', ''),
('out', '6707200666084', 'MONICABOUWER', '', '', '6707100666084', '16:06 28-4-2020', '28-4-2020', '16:06', 'Staff', '', '', '', '', '', '', ''),
('in', '6801165052080', 'RMSPARKS', '', '', '6801165052080', '15:14 28-4-2020', '28-4-2020', '15:14', 'Visitors', '', 'RM / SPARKS', '', '', '', '', '30'),
('in', '6804020781083', 'ziwazoya', '', '', '', '07:38 07-5-2020', '2020/07/05', '07:38', 'Staff', '', '', 'ziwa / zoya', '', 'work', '', ''),
('in', '6804020781083', 'ZJJiwa', '', '', '', '07:38 04-5-2020', '2020/04/05', '07:38', 'Staff', '', '', 'ZJ / Jiwa', '', 'Care Centre', '', ''),
('in', '6804020781083', 'ZJziea', '', '', '', '07:45 23-4-2020', '23-4-2020', '07:45', 'Staff', '', '', 'ZJ / ziea', '', '', '', ''),
('in', '6804020781083', 'ZJZiwa', '', '', '', '07:35 11-5-2020', '2020/11/05', '07:35', 'Staff', '', '', 'ZJ / Ziwa', '', 'Cc', '', ''),
('in', '6804020781083', 'ZJZiwa', '', '', '', '07:43 08-5-2020', '2020/08/05', '07:43', 'Staff', '', '', 'ZJ / Ziwa', '', 'CC', '', ''),
('in', '6804020781083', 'ZJZiwa', '', '', '', '07:38 05-5-2020', '2020/05/05', '07:38', 'Staff', '', '', 'ZJ / Ziwa', '', 'Admin', '', ''),
('in', '6804020781083', 'ZjZiwa', '', '', '', '07:47 30-4-2020', '30-4-2020', '07:47', 'Staff', '', '', 'Zj / Ziwa', '', '', '', ''),
('in', '6804020781083', 'ZJZiwa', '', '', '', '07:47 29-4-2020', '29-4-2020', '07:47', 'Staff', '', '', 'ZJ / Ziwa', '', '', '', ''),
('in', '6804020781083', 'ZJZiwa', '', '', '', '07:52 28-4-2020', '28-4-2020', '07:52', 'Staff', '', '', 'ZJ / Ziwa', '', '', '', ''),
('in', '6804020781083', 'Zjziwa', '', '', '', '07:47 24-4-2020', '24-4-2020', '07:47', 'Staff', '', '', 'Zj / ziwa', '', '', '', ''),
('in', '6804020781083', 'ZJZiwa', '', '', '', '07:49 22-4-2020', '22-4-2020', '07:49', 'Staff', '', '', 'ZJ / Ziwa', '', '', '', ''),
('in', '6804020781083', 'ZJZiwa', '', '', '', '07:39 21-4-2020', '21-4-2020', '07:39', 'Staff', '', '', 'ZJ / Ziwa', '', '', '', ''),
('in', '6804020781083', 'ZoyaJuddia', '', '', '', '08:36 20-4-2020', '20-4-2020', '08:36', 'Staff', '', '', 'Zoya / Juddia', '', '', '', ''),
('in', '6804020781083', 'zziwa', '', '', '', '07:39 06-5-2020', '2020/06/05', '07:39', 'Staff', '', '', 'z / ziwa', '', 'work', '', ''),
('out', '6804020781083', '', '', '', '', '15:57 08-5-2020', '2020/08/05', '15:57', 'Staff', '', '', 'ZJ / Ziwa', '', 'CC', '', ''),
('out', '6804020781083', '', '', '', '', '16:04 07-5-2020', '2020/07/05', '16:04', 'Staff', '', '', 'ziwa / zoya', '', 'work', '', ''),
('out', '6804020781083', '', '', '', '', '16:16 06-5-2020', '2020/06/05', '16:16', 'Staff', '', '', 'z / ziwa', '', 'work', '', ''),
('out', '6804020781083', '', '', '', '', '16:25 05-5-2020', '2020/05/05', '16:25', 'Staff', '', '', 'ZJ / Ziwa', '', 'Admin', '', ''),
('out', '6804020781083', '', '', '', '', '16:10 04-5-2020', '2020/04/05', '16:10', 'Staff', '', '', 'ZJ / Jiwa', '', 'Care Centre', '', ''),
('out', '6804020781083', '', '', '', '', '15:57 30-4-2020', '30-4-2020', '15:57', 'Staff', '', '', 'Zj / Ziwa', '', '', '', ''),
('out', '6804020781083', '', '', '', '', '15:58 29-4-2020', '29-4-2020', '15:58', 'Staff', '', '', 'ZJ / Ziwa', '', '', '', ''),
('out', '6804020781083', '', '', '', '', '15:57 28-4-2020', '28-4-2020', '15:57', 'Staff', '', '', 'ZJ / Ziwa', '', '', '', ''),
('out', '6804020781083', '', '', '', '', '15:51 24-4-2020', '24-4-2020', '15:51', 'Staff', '', '', 'Zj / ziwa', '', '', '', ''),
('out', '6804020781083', '', '', '', '', '15:53 23-4-2020', '23-4-2020', '15:53', 'Staff', '', '', 'ZJ / ziea', '', '', '', ''),
('out', '6804020781083', '', '', '', '', '16:01 22-4-2020', '22-4-2020', '16:01', 'Staff', '', '', 'ZJ / Ziwa', '', '', '', ''),
('out', '6804020781083', '', '', '', '', '15:58 21-4-2020', '21-4-2020', '15:58', 'Staff', '', '', 'ZJ / Ziwa', '', '', '', ''),
('out', '6804020781083', '', '', '', '', '15:57 20-4-2020', '20-4-2020', '15:57', 'Staff', '', '', 'Zoya / Juddia', '', '', '', ''),
('in', '6808286137088', 'Hendele Mandla', '', '', '', '07:38 07-5-2020', '2020/07/05', '07:38', 'Staff', '', '', 'Hendele  / Mandla', '', 'work', '', ''),
('in', '6808286137088', 'mhendele', '', '', '', '07:40 06-5-2020', '2020/06/05', '07:40', 'Staff', '', '', 'm / hendele', '', 'work', '', ''),
('in', '6808286137088', 'MWHedela', '', '', '', '07:33 11-5-2020', '2020/11/05', '07:33', 'Staff', '', '', 'MW / Hedela', '', 'M', '', ''),
('in', '6808286137088', 'MWHedele,', '', '', '', '07:26 29-4-2020', '29-4-2020', '07:26', 'Staff', '', '', 'MW / Hedele,', '', '', '', ''),
('in', '6808286137088', 'MWHendele', '', '', '', '07:28 08-5-2020', '2020/08/05', '07:28', 'Staff', '', '', 'MW / Hendele', '', 'M', '', ''),
('in', '6808286137088', 'MWHendele', '', '', '', '07:39 04-5-2020', '2020/04/05', '07:39', 'Staff', '', '', 'MW / Hendele', '', 'Mantainance', '', ''),
('in', '6808286137088', 'NwHedele', '', '', '', '07:32 30-4-2020', '30-4-2020', '07:32', 'Staff', '', '', 'Nw / Hedele', '', '', '', ''),
('out', '6808286137088', '', '', '', '', '16:23 08-5-2020', '2020/08/05', '16:23', 'Staff', '', '', 'MW / Hendele', '', 'M', '', ''),
('out', '6808286137088', '', '', '', '', '16:26 07-5-2020', '2020/07/05', '16:26', 'Staff', '', '', 'Hendele  / Mandla', '', 'work', '', ''),
('out', '6808286137088', '', '', '', '', '16:29 06-5-2020', '2020/06/05', '16:29', 'Staff', '', '', 'm / hendele', '', 'work', '', ''),
('out', '6808286137088', '', '', '', '', '16:27 04-5-2020', '2020/04/05', '16:27', 'Staff', '', '', 'MW / Hendele', '', 'Mantainance', '', ''),
('out', '6808286137088', '', '', '', '', '16:28 30-4-2020', '30-4-2020', '16:28', 'Staff', '', '', 'Nw / Hedele', '', '', '', ''),
('out', '6808286137088', '', '', '', '', '16:28 29-4-2020', '29-4-2020', '16:28', 'Staff', '', '', 'MW / Hedele,', '', '', '', ''),
('in', '6811195008085', 'PJVAN DEN HEEVER', 'SPAR', '', '6811195008085', '12:29 15-4-2020', '15-4-2020', '12:29', 'Contractors', '', 'PJ / VAN DEN HEEVER', '', '', '', 'SPAR', ''),
('out', '6901055500108', '', '', '', 'LIVINA X-GEAR', '19:04 08-5-2020', '2020/08/05', '19:04', 'Visitors', '', '', '', '', '', '', ''),
('in', '6906065856082', 'VNqowana', '', '', '', '07:30 05-5-2020', '2020/05/05', '07:30', 'Staff', '', '', 'V / Nqowana', '', 'KG', '', ''),
('in', '6906065856082', 'VNqowana', '', '', '', '07:34 04-5-2020', '2020/04/05', '07:34', 'Staff', '', '', 'V / Nqowana', '', 'K G', '', ''),
('in', '6906065856082', 'VNqowana', '', '', '', '07:34 29-4-2020', '29-4-2020', '07:34', 'Staff', '', '', 'V / Nqowana', '', '', '', ''),
('in', '6906065856082', 'Vqawans', '', '', '', '07:31 30-4-2020', '30-4-2020', '07:31', 'Staff', '', '', 'V / qawans', '', '', '', ''),
('out', '6906065856082', '', '', '', '', '15:50 05-5-2020', '2020/05/05', '15:50', 'Staff', '', '', 'V / Nqowana', '', 'KG', '', ''),
('out', '6906065856082', '', '', '', '', '15:47 04-5-2020', '2020/04/05', '15:47', 'Staff', '', '', 'V / Nqowana', '', 'K G', '', ''),
('out', '6906065856082', '', '', '', '', '16:02 30-4-2020', '30-4-2020', '16:02', 'Staff', '', '', 'V / qawans', '', '', '', ''),
('out', '6906065856082', '', '', '', '', '16:02 29-4-2020', '29-4-2020', '16:02', 'Staff', '', '', 'V / Nqowana', '', '', '', ''),
('in', '6906205214085', 'RLE ROUX', '', '', '6906205214085', '16:00 30-4-2020', '30-4-2020', '16:00', 'Conference Visitors', 'Expired driver licence', '', '', '', '', '', ''),
('out', '6907125674085', 'null null', '', '', 'C16SE02DR6935', '18:37 27-4-2020', '27-4-2020', '18:37', 'Visitors', 'In/Out custom field value doesn\'t match', 'Thembekile Teyise / T. Teyise', '', '', '', '', '128'),
('in', '6907125674085', 'Thembekile TeyiseT. Teyise', '', '', 'C16SE02DR6935', '18:20 27-4-2020', '27-4-2020', '18:20', 'Visitors', '', 'Thembekile Teyise / T. Teyise', '', '', '', '', '128'),
('out', '6907125674085', '', '', '', '', '06:53 28-4-2020', '28-4-2020', '06:53', 'Visitors', '', '', '', '', '', '', ''),
('out', '6907125674085', '', '', '', '', '18:21 21-4-2020', '21-4-2020', '18:21', 'Visitors', '', 'ET / Thembekil Teyise', '', '', '', '', '128d'),
('out', '6907125674085', '', '', '', '', '08:09 19-4-2020', '19-4-2020', '08:09', 'Visitors', 'In/Out custom field value doesn\'t match', 'ET / TEYISE', '', '', '', '', '128d'),
('in', '6908205550088', '6908205550088e r mavikela', '', '', 'LIVINA X-GEAR', '18:12 07-5-2020', '2020/07/05', '18:12', 'Visitors', '', '6908205550088 / e r mavikela', '', '', '', '', 'frail care'),
('in', '6908205550088', 'PRMAVIKELA', '', '', '6908205550088', '06:33 09-5-2020', '2020/09/05', '06:33', 'Conference Visitors', '', '', '', '', '', '', ''),
('in', '6908205550088', 'PRMAVIKELA', '', '', '6908205550088', '06:47 24-4-2020', '24-4-2020', '06:47', 'Visitors', '', 'PR / MAVIKELA', '', '', '', '', 'Care center'),
('in', '6908205550088', 'Richard MavikelaR Mavikela', '', '', '', '18:37 21-4-2020', '21-4-2020', '18:37', 'Visitors', '', 'Richard Mavikela / R Mavikela', '', '', '', '', 'Frail care'),
('out', '6908205550088', '', '', '', 'LIVINA X-GEAR', '17:27 07-5-2020', '2020/07/05', '17:27', 'Visitors', 'In/Out custom field value doesn\'t match', 'PR / MAVIKELA', '', '', '', '', 'Frail care'),
('out', '6908205550088', '', '', '', 'LIVINA X-GEAR', '18:23 02-5-2020', '2020/02/05', '18:23', 'Visitors', '', '', '', '', '', '', ''),
('in', '6910300683087', 'Mbelekan Thotyelwa', '', '', '', '07:52 07-5-2020', '2020/07/05', '07:52', 'Staff', '', '', 'Mbelekan  / Thotyelwa', '', 'work', '', ''),
('in', '6910300683087', 'tmbelekani', '', '', '', '07:53 06-5-2020', '2020/06/05', '07:53', 'Staff', '', '', 't / mbelekani', '', 'work', '', ''),
('in', '6910300683087', 'TMMbelekani', '', '', '', '07:45 08-5-2020', '2020/08/05', '07:45', 'Staff', '', '', 'TM / Mbelekani', '', 'Unit 112', '', ''),
('in', '6910300683087', 'TNMbelekana', '', '', '', '07:34 11-5-2020', '2020/11/05', '07:34', 'Staff', '', '', 'TN / Mbelekana', '', '112', '', ''),
('out', '6910300683087', '', '', '', '', '12:15 11-5-2020', '2020/11/05', '12:15', 'Staff', '', '', 'TN / Mbelekana', '', '112', '', ''),
('out', '6910300683087', '', '', '', '', '13:00 08-5-2020', '2020/08/05', '13:00', 'Staff', '', '', 'TM / Mbelekani', '', 'Unit 112', '', ''),
('out', '6910300683087', '', '', '', '', '11:56 07-5-2020', '2020/07/05', '11:56', 'Staff', '', '', 'Mbelekan  / Thotyelwa', '', 'work', '', ''),
('out', '6910300683087', '', '', '', '', '12:26 06-5-2020', '2020/06/05', '12:26', 'Staff', '', '', 't / mbelekani', '', 'work', '', ''),
('in', '7005036271080', 'VRMsesiwe', '', '', '', '07:27 04-5-2020', '2020/04/05', '07:27', 'Staff', '', '', 'VR / Msesiwe', '', 'Mantainance', '', ''),
('in', '7005036271080', 'VRMsesiwe', '', '', '', '07:26 24-4-2020', '24-4-2020', '07:26', 'Staff', '', '', 'VR / Msesiwe', '', '', '', ''),
('in', '7005036271080', 'VUYO RICHARDMSESIWE', '', '', '7005036271080', '07:35 11-5-2020', '2020/11/05', '07:35', 'Staff', '', '', 'VUYO RICHARD / MSESIWE', '', 'M', '', ''),
('in', '7005036271080', 'VUYO RICHARDMSESIWE', '', '', '7005036271080', '07:35 08-5-2020', '2020/08/05', '07:35', 'Staff', '', '', 'VUYO RICHARD / MSESIWE', '', 'M', '', ''),
('out', '7005036271080', 'VUYO RICHARDMSESIWE', '', '', '7005036271080', '16:26 08-5-2020', '2020/08/05', '16:26', 'Staff', '', '', 'VUYO RICHARD / MSESIWE', '', 'M', '', ''),
('out', '7005036271080', 'VUYO RICHARDMSESIWE', '', '', '7005036271080', '16:29 07-5-2020', '2020/07/05', '16:29', 'Staff', '', '', '', '', '', '', ''),
('in', '7005036271080', 'VUYO RICHARDMSESIWE', '', '', '7005036271080', '07:37 05-5-2020', '2020/05/05', '07:37', 'Staff', '', '', 'VUYO RICHARD / MSESIWE', '', 'M', '', ''),
('out', '7005036271080', 'VUYO RICHARDMSESIWE', '', '', '7005036271080', '16:27 05-5-2020', '2020/05/05', '16:27', 'Staff', '', '', 'VUYO RICHARD / MSESIWE', '', 'M', '', ''),
('in', '7005036271080', 'VUYO RICHARDMSESIWE', '', '', '7005036271080', '07:24 30-4-2020', '30-4-2020', '07:24', 'Staff', '', '', 'VUYO RICHARD / MSESIWE', '', '', '', ''),
('out', '7005036271080', 'VUYO RICHARDMSESIWE', '', '', '7005036271080', '16:30 30-4-2020', '30-4-2020', '16:30', 'Staff', '', '', 'VUYO RICHARD / MSESIWE', '', '', '', ''),
('in', '7005036271080', 'VUYO RICHARDMSESIWE', '', '', '7005036271080', '07:44 29-4-2020', '29-4-2020', '07:44', 'Staff', '', '', 'VUYO RICHARD / MSESIWE', '', '', '', ''),
('in', '7005036271080', 'VUYO RICHARDMSESIWE', '', '', '7005036271080', '07:26 28-4-2020', '28-4-2020', '07:26', 'Staff', '', '', 'VUYO RICHARD / MSESIWE', '', '', '', ''),
('out', '7005036271080', 'VUYO RICHARDMSESIWE', '', '', '7005036271080', '16:30 28-4-2020', '28-4-2020', '16:30', 'Staff', '', '', 'VUYO RICHARD / MSESIWE', '', '', '', ''),
('out', '7005036271080', '', '', '', '', '16:32 06-5-2020', '2020/06/05', '16:32', 'Staff', '', '', '', '', '', '', ''),
('out', '7005036271080', '', '', '', '', '16:28 04-5-2020', '2020/04/05', '16:28', 'Staff', '', '', 'VR / Msesiwe', '', 'Mantainance', '', ''),
('out', '7005036271080', '', '', '', '', '16:28 29-4-2020', '29-4-2020', '16:28', 'Staff', '', '', 'VUYO RICHARD / MSESIWE', '', '', '', ''),
('in', '7005200806083', 'KangelwaNdiyana', '', '', '', '15:57 14-4-2020', '14-4-2020', '15:57', 'Staff', '', '', 'Kangelwa / Ndiyana', '', '', '', ''),
('in', '7005200806083', 'KangelwaNdiyane', '', '', '', '16:14 07-5-2020', '2020/07/05', '16:14', 'Staff', '', '', 'Kangelwa / Ndiyane', '', '232', '', ''),
('in', '7005200806083', 'KGilane', '', '', '', '16:10 06-5-2020', '2020/06/05', '16:10', 'Staff', '', '', 'K / Gilane', '', '232', '', ''),
('in', '7005200806083', 'KhangelaNdiyana', '', '', '', '08:28 13-4-2020', '13-4-2020', '08:28', 'Staff', '', '', 'Khangela / Ndiyana', '', '', '', ''),
('in', '7005200806083', 'Khangelwa Ndiyanak Ndiyana', '', '', '', '16:04 13-4-2020', '13-4-2020', '16:04', 'Staff', '', '', 'Khangelwa Ndiyana / k Ndiyana', '', '', '', ''),
('in', '7005200806083', 'KhangelwaNdiyana', '', '', '', '08:32 07-5-2020', '2020/07/05', '08:32', 'Staff', '', '', 'Khangelwa / Ndiyana', '', 'work', '', ''),
('in', '7005200806083', 'KhangelwaNdiyana', '', '', '', '15:57 25-4-2020', '25-4-2020', '15:57', 'Staff', '', '', 'Khangelwa / Ndiyana', '', '', '', ''),
('in', '7005200806083', 'KNdiyana', '', '', '', '08:32 10-5-2020', '2020/10/05', '08:32', 'Staff', '', '', 'K / Ndiyana', '', '232', '', ''),
('in', '7005200806083', 'KNdiyana', '', '', '', '16:02 10-5-2020', '2020/10/05', '16:02', 'Staff', '', '', 'K / Ndiyana', '', '232', '', ''),
('in', '7005200806083', 'KNdiyana', '', '', '', '08:31 09-5-2020', '2020/09/05', '08:31', 'Staff', '', '', 'K / Ndiyana', '', '232', '', ''),
('in', '7005200806083', 'KNdiyana', '', '', '', '16:01 09-5-2020', '2020/09/05', '16:01', 'Staff', '', '', 'K / Ndiyana', '', '232', '', ''),
('in', '7005200806083', 'KNdiyana', '', '', '', '08:38 08-5-2020', '2020/08/05', '08:38', 'Staff', '', '', 'K / Ndiyana', '', 'Unit 232', '', ''),
('in', '7005200806083', 'KNdiyana', '', '', '', '16:14 08-5-2020', '2020/08/05', '16:14', 'Staff', '', '', 'K / Ndiyana', '', 'Unit 232', '', ''),
('in', '7005200806083', 'kndiyana', '', '', '', '08:23 06-5-2020', '2020/06/05', '08:23', 'Staff', '', '', 'k / ndiyana', '', 'work', '', ''),
('in', '7005200806083', 'KNdiyana', '', '', '', '16:03 05-5-2020', '2020/05/05', '16:03', 'Staff', '', '', 'K / Ndiyana', '', '232', '', ''),
('in', '7005200806083', 'KNdiyana', '', '', '', '08:26 04-5-2020', '2020/04/05', '08:26', 'Staff', '', '', 'K / Ndiyana', '', 'Unit 232', '', ''),
('in', '7005200806083', 'KNdiyana', '', '', '', '16:10 01-5-2020', '2020/01/05', '16:10', 'Staff', '', '', 'K / Ndiyana', '', '232', '', ''),
('in', '7005200806083', 'KNdiyana', '', '', '', '16:10 30-4-2020', '30-4-2020', '16:10', 'Staff', '', '', 'K / Ndiyana', '', '', '', ''),
('in', '7005200806083', 'KNdiyana', '', '', '', '08:22 29-4-2020', '29-4-2020', '08:22', 'Staff', '', '', 'K / Ndiyana', '', '', '', ''),
('in', '7005200806083', 'KNdiyana', '', '', '', '16:04 29-4-2020', '29-4-2020', '16:04', 'Staff', '', '', 'K / Ndiyana', '', '', '', ''),
('in', '7005200806083', 'KNdiyana', '', '', '', '08:32 28-4-2020', '28-4-2020', '08:32', 'Staff', '', '', 'K / Ndiyana', '', '', '', ''),
('in', '7005200806083', 'KNdiyana', '', '', '', '16:11 28-4-2020', '28-4-2020', '16:11', 'Staff', '', '', 'K / Ndiyana', '', '', '', ''),
('in', '7005200806083', 'KNdiyana', '', '', '', '08:32 27-4-2020', '27-4-2020', '08:32', 'Staff', '', '', 'K / Ndiyana', '', '', '', ''),
('in', '7005200806083', 'KNdiyana', '', '', '', '16:14 27-4-2020', '27-4-2020', '16:14', 'Staff', '', '', 'K / Ndiyana', '', '', '', ''),
('in', '7005200806083', 'KNdiyana', '', '', '', '08:28 26-4-2020', '26-4-2020', '08:28', 'Staff', '', '', 'K / Ndiyana', '', '', '', ''),
('in', '7005200806083', 'KNdiyana', '', '', '', '16:04 26-4-2020', '26-4-2020', '16:04', 'Staff', '', '', 'K / Ndiyana', '', '', '', ''),
('in', '7005200806083', 'KNdiyana', '', '', '', '08:29 25-4-2020', '25-4-2020', '08:29', 'Staff', '', '', 'K / Ndiyana', '', '', '', ''),
('in', '7005200806083', 'KNdiyana', '', '', '', '16:02 23-4-2020', '23-4-2020', '16:02', 'Staff', '', '', 'K / Ndiyana', '', '', '', ''),
('in', '7005200806083', 'KNdiyana', '', '', '', '08:25 17-4-2020', '17-4-2020', '08:25', 'Staff', '', '', 'K / Ndiyana', '', '', '', ''),
('in', '7005200806083', 'KNdiyana', '', '', '', '15:54 17-4-2020', '17-4-2020', '15:54', 'Staff', '', '', 'K / Ndiyana', '', '', '', ''),
('in', '7005200806083', 'Kndiyana', '', '', '', '08:28 16-4-2020', '16-4-2020', '08:28', 'Staff', '', '', 'K / ndiyana', '', '', '', ''),
('in', '7005200806083', 'KNdiyana', '', '', '', '16:12 16-4-2020', '16-4-2020', '16:12', 'Staff', '', '', 'K / Ndiyana', '', '', '', ''),
('in', '7005200806083', 'KNdiyana', '', '', '', '16:07 15-4-2020', '15-4-2020', '16:07', 'Staff', '', '', 'K / Ndiyana', '', '', '', ''),
('in', '7005200806083', 'KNdiyana', '', '', '', '08:24 14-4-2020', '14-4-2020', '08:24', 'Staff', '', '', 'K / Ndiyana', '', '', '', ''),
('in', '7005200806083', 'KNdiyana', '', '', '', '16:08 12-4-2020', '2020/12/04', '16:08', 'Staff', '', '', 'K / Ndiyana', '', '', '', ''),
('in', '7005200806083', 'KNdiyana', '', '', '', '16:04 11-4-2020', '2020/11/04', '16:04', 'Staff', '', '', 'K / Ndiyana', '', '', '', ''),
('in', '7005200806083', 'KNdiyane', '', '', '', '08:30 01-5-2020', '2020/01/05', '08:30', 'Staff', '', '', 'K / Ndiyane', '', '232', '', ''),
('in', '7005200806083', 'KNdiyani', '', '', '', '07:50 24-4-2020', '24-4-2020', '07:50', 'Staff', '', '', 'K / Ndiyani', '', '', '', ''),
('in', '7005200806083', 'Kndiyani', '', '', '', '08:29 23-4-2020', '23-4-2020', '08:29', 'Staff', '', '', 'K / ndiyani', '', '', '', ''),
('in', '7005200806083', 'KNdiysna', '', '', '', '08:30 30-4-2020', '30-4-2020', '08:30', 'Staff', '', '', 'K / Ndiysna', '', '', '', ''),
('in', '7005200806083', 'KNgiyana', '', '', '', '08:32 11-5-2020', '2020/11/05', '08:32', 'Staff', '', '', 'K / Ngiyana', '', '232', '', ''),
('in', '7005200806083', 'Kngiyana', '', '', '', '08:32 12-4-2020', '2020/12/04', '08:32', 'Staff', '', '', 'K / ngiyana', '', '', '', ''),
('in', '7005200806083', 'Ndiyanak', '', '', '', '08:30 15-4-2020', '15-4-2020', '08:30', 'Staff', '', '', 'Ndiyana / k', '', '', '', ''),
('in', '7005200806083', 'ndiyanak', '', '', '', '08:32 11-4-2020', '2020/11/04', '08:32', 'Staff', '', '', 'ndiyana / k', '', '', '', ''),
('out', '7005200806083', '', '', '', '', '11:50 11-5-2020', '2020/11/05', '11:50', 'Staff', '', '', 'K / Ngiyana', '', '232', '', ''),
('out', '7005200806083', '', '', '', '', '11:10 10-5-2020', '2020/10/05', '11:10', 'Staff', '', '', 'K / Ndiyana', '', '232', '', ''),
('out', '7005200806083', '', '', '', '', '17:03 10-5-2020', '2020/10/05', '17:03', 'Staff', '', '', 'K / Ndiyana', '', '232', '', ''),
('out', '7005200806083', '', '', '', '', '11:27 09-5-2020', '2020/09/05', '11:27', 'Staff', '', '', 'K / Ndiyana', '', '232', '', ''),
('out', '7005200806083', '', '', '', '', '17:03 09-5-2020', '2020/09/05', '17:03', 'Staff', '', '', 'K / Ndiyana', '', '232', '', ''),
('out', '7005200806083', '', '', '', '', '12:19 08-5-2020', '2020/08/05', '12:19', 'Staff', '', '', 'K / Ndiyana', '', 'Unit 232', '', ''),
('out', '7005200806083', '', '', '', '', '17:13 08-5-2020', '2020/08/05', '17:13', 'Staff', '', '', 'K / Ndiyana', '', 'Unit 232', '', ''),
('out', '7005200806083', '', '', '', '', '11:07 07-5-2020', '2020/07/05', '11:07', 'Staff', '', '', 'Khangelwa / Ndiyana', '', 'work', '', ''),
('out', '7005200806083', '', '', '', '', '17:21 07-5-2020', '2020/07/05', '17:21', 'Staff', '', '', 'Kangelwa / Ndiyane', '', '232', '', ''),
('out', '7005200806083', '', '', '', '', '11:27 06-5-2020', '2020/06/05', '11:27', 'Staff', '', '', 'k / ndiyana', '', 'work', '', ''),
('out', '7005200806083', '', '', '', '', '17:06 06-5-2020', '2020/06/05', '17:06', 'Staff', '', '', 'K / Gilane', '', '232', '', ''),
('out', '7005200806083', '', '', '', '', '12:01 05-5-2020', '2020/05/05', '12:01', 'Staff', '', '', '', '', '', '', ''),
('out', '7005200806083', '', '', '', '', '17:06 05-5-2020', '2020/05/05', '17:06', 'Staff', '', '', 'K / Ndiyana', '', '232', '', ''),
('out', '7005200806083', '', '', '', '', '11:40 04-5-2020', '2020/04/05', '11:40', 'Staff', '', '', 'K / Ndiyana', '', 'Unit 232', '', ''),
('out', '7005200806083', '', '', '', '', '16:10 04-5-2020', '2020/04/05', '16:10', 'Staff', '', '', '', '', '', '', ''),
('out', '7005200806083', '', '', '', '', '17:00 04-5-2020', '2020/04/05', '17:00', 'Staff', '', '', '', '', '', '', ''),
('out', '7005200806083', '', '', '', '', '12:33 01-5-2020', '2020/01/05', '12:33', 'Staff', '', '', 'K / Ndiyane', '', '232', '', ''),
('out', '7005200806083', '', '', '', '', '17:18 01-5-2020', '2020/01/05', '17:18', 'Staff', '', '', 'K / Ndiyana', '', '232', '', ''),
('out', '7005200806083', '', '', '', '', '11:25 30-4-2020', '30-4-2020', '11:25', 'Staff', '', '', 'K / Ndiysna', '', '', '', ''),
('out', '7005200806083', '', '', '', '', '16:57 30-4-2020', '30-4-2020', '16:57', 'Staff', '', '', 'K / Ndiyana', '', '', '', ''),
('out', '7005200806083', '', '', '', '', '11:04 29-4-2020', '29-4-2020', '11:04', 'Staff', '', '', 'K / Ndiyana', '', '', '', ''),
('out', '7005200806083', '', '', '', '', '17:05 29-4-2020', '29-4-2020', '17:05', 'Staff', '', '', 'K / Ndiyana', '', '', '', ''),
('out', '7005200806083', '', '', '', '', '11:38 28-4-2020', '28-4-2020', '11:38', 'Staff', '', '', 'K / Ndiyana', '', '', '', ''),
('out', '7005200806083', '', '', '', '', '16:11 28-4-2020', '28-4-2020', '16:11', 'Staff', '', '', '', '', '', '', ''),
('out', '7005200806083', '', '', '', '', '16:57 28-4-2020', '28-4-2020', '16:57', 'Staff', '', '', 'K / Ndiyana', '', '', '', ''),
('out', '7005200806083', '', '', '', '', '11:13 27-4-2020', '27-4-2020', '11:13', 'Staff', '', '', 'K / Ndiyana', '', '', '', ''),
('out', '7005200806083', '', '', '', '', '16:58 27-4-2020', '27-4-2020', '16:58', 'Staff', '', '', 'K / Ndiyana', '', '', '', ''),
('out', '7005200806083', '', '', '', '', '11:10 26-4-2020', '26-4-2020', '11:10', 'Staff', '', '', 'K / Ndiyana', '', '', '', ''),
('out', '7005200806083', '', '', '', '', '17:10 26-4-2020', '26-4-2020', '17:10', 'Staff', '', '', 'K / Ndiyana', '', '', '', ''),
('out', '7005200806083', '', '', '', '', '11:18 25-4-2020', '25-4-2020', '11:18', 'Staff', '', '', 'K / Ndiyana', '', '', '', ''),
('out', '7005200806083', '', '', '', '', '17:06 25-4-2020', '25-4-2020', '17:06', 'Staff', '', '', 'Khangelwa / Ndiyana', '', '', '', ''),
('out', '7005200806083', '', '', '', '', '16:57 24-4-2020', '24-4-2020', '16:57', 'Staff', '', '', 'K / Ndiyani', '', '', '', ''),
('out', '7005200806083', '', '', '', '', '11:21 23-4-2020', '23-4-2020', '11:21', 'Staff', '', '', 'K / ndiyani', '', '', '', ''),
('out', '7005200806083', '', '', '', '', '17:11 23-4-2020', '23-4-2020', '17:11', 'Staff', '', '', 'K / Ndiyana', '', '', '', ''),
('out', '7005200806083', '', '', '', '', '11:22 17-4-2020', '17-4-2020', '11:22', 'Staff', '', '', 'K / Ndiyana', '', '', '', ''),
('out', '7005200806083', '', '', '', '', '17:16 17-4-2020', '17-4-2020', '17:16', 'Staff', '', '', 'K / Ndiyana', '', '', '', ''),
('out', '7005200806083', '', '', '', '', '11:06 16-4-2020', '16-4-2020', '11:06', 'Staff', '', '', 'K / ndiyana', '', '', '', ''),
('out', '7005200806083', '', '', '', '', '17:03 16-4-2020', '16-4-2020', '17:03', 'Staff', '', '', 'K / Ndiyana', '', '', '', ''),
('out', '7005200806083', '', '', '', '', '11:04 15-4-2020', '15-4-2020', '11:04', 'Staff', '', '', 'Ndiyana / k', '', '', '', ''),
('out', '7005200806083', '', '', '', '', '17:01 15-4-2020', '15-4-2020', '17:01', 'Staff', '', '', 'K / Ndiyana', '', '', '', ''),
('out', '7005200806083', '', '', '', '', '11:38 14-4-2020', '14-4-2020', '11:38', 'Staff', '', '', 'K / Ndiyana', '', '', '', ''),
('out', '7005200806083', '', '', '', '', '17:19 14-4-2020', '14-4-2020', '17:19', 'Staff', '', '', 'Kangelwa / Ndiyana', '', '', '', ''),
('out', '7005200806083', '', '', '', '', '11:09 13-4-2020', '13-4-2020', '11:09', 'Staff', '', '', 'Khangela / Ndiyana', '', '', '', ''),
('out', '7005200806083', '', '', '', '', '17:08 13-4-2020', '13-4-2020', '17:08', 'Staff', '', '', 'Khangelwa Ndiyana / k Ndiyana', '', '', '', ''),
('out', '7005200806083', '', '', '', '', '11:11 12-4-2020', '2020/12/04', '11:11', 'Staff', '', '', 'K / ngiyana', '', '', '', ''),
('out', '7005200806083', '', '', '', '', '17:01 12-4-2020', '2020/12/04', '17:01', 'Staff', '', '', 'K / Ndiyana', '', '', '', ''),
('out', '7005200806083', '', '', '', '', '11:14 11-4-2020', '2020/11/04', '11:14', 'Staff', '', '', 'ndiyana / k', '', '', '', ''),
('out', '7005200806083', '', '', '', '', '17:04 11-4-2020', '2020/11/04', '17:04', 'Staff', '', '', 'K / Ndiyana', '', '', '', ''),
('in', '7010175337080', 'TDZono', '', '', '', '07:38 08-5-2020', '2020/08/05', '07:38', 'Staff', '', '', 'TD / Zono', '', 'M', '', ''),
('in', '7010175337080', 'TDZono', '', '', '', '07:40 05-5-2020', '2020/05/05', '07:40', 'Staff', '', '', 'TD / Zono', '', 'M', '', ''),
('in', '7010175337080', 'TDZono', '', '', '', '07:40 04-5-2020', '2020/04/05', '07:40', 'Staff', '', '', 'TD / Zono', '', 'Mantainance', '', ''),
('in', '7010175337080', 'Tzono', '', '', '', '07:29 06-5-2020', '2020/06/05', '07:29', 'Staff', '', '', 'T / zono', '', 'work', '', ''),
('in', '7010175337080', 'zonoThembekile', '', '', '', '07:34 07-5-2020', '2020/07/05', '07:34', 'Staff', '', '', 'zono / Thembekile', '', 'work', '', ''),
('out', '7010175337080', '', '', '', '', '16:25 08-5-2020', '2020/08/05', '16:25', 'Staff', '', '', 'TD / Zono', '', 'M', '', ''),
('out', '7010175337080', '', '', '', '', '16:29 07-5-2020', '2020/07/05', '16:29', 'Staff', '', '', 'zono / Thembekile', '', 'work', '', ''),
('out', '7010175337080', '', '', '', '', '16:29 06-5-2020', '2020/06/05', '16:29', 'Staff', '', '', 'T / zono', '', 'work', '', ''),
('out', '7010175337080', '', '', '', '', '16:26 05-5-2020', '2020/05/05', '16:26', 'Staff', '', '', 'TD / Zono', '', 'M', '', ''),
('out', '7010175337080', '', '', '', '', '16:29 04-5-2020', '2020/04/05', '16:29', 'Staff', '', '', 'TD / Zono', '', 'Mantainance', '', ''),
('in', '7010285804086', 'KNosilela', '', '', '', '07:30 11-5-2020', '2020/11/05', '07:30', 'Staff', '', '', 'K / Nosilela', '', 'M,', '', ''),
('in', '7010285804086', 'KNosilela', '', '', '', '07:16 08-5-2020', '2020/08/05', '07:16', 'Staff', '', '', 'K / Nosilela', '', 'M', '', ''),
('in', '7010285804086', 'knosilela', '', '', '', '07:15 06-5-2020', '2020/06/05', '07:15', 'Staff', '', '', 'k / nosilela', '', 'work', '', ''),
('in', '7010285804086', 'KNosilela', '', '', '', '07:25 05-5-2020', '2020/05/05', '07:25', 'Staff', '', '', 'K / Nosilela', '', 'Mantainance', '', ''),
('in', '7010285804086', 'KNosilela', '', '', '', '07:17 04-5-2020', '2020/04/05', '07:17', 'Staff', '', '', 'K / Nosilela', '', 'Maintanance', '', ''),
('in', '7010285804086', 'Nosilela KadekilN m', '', '', '', '07:21 07-5-2020', '2020/07/05', '07:21', 'Staff', '', '', 'Nosilela Kadekil / N m', '', 'work', '', ''),
('out', '7010285804086', '', '', '', '', '16:28 08-5-2020', '2020/08/05', '16:28', 'Staff', '', '', 'K / Nosilela', '', 'M', '', ''),
('out', '7010285804086', '', '', '', '', '16:26 07-5-2020', '2020/07/05', '16:26', 'Staff', '', '', 'Nosilela Kadekil / N m', '', 'work', '', ''),
('out', '7010285804086', '', '', '', '', '16:28 06-5-2020', '2020/06/05', '16:28', 'Staff', '', '', 'k / nosilela', '', 'work', '', ''),
('out', '7010285804086', '', '', '', '', '16:26 05-5-2020', '2020/05/05', '16:26', 'Staff', '', '', 'K / Nosilela', '', 'Mantainance', '', ''),
('out', '7010285804086', '', '', '', '', '16:27 04-5-2020', '2020/04/05', '16:27', 'Staff', '', '', 'K / Nosilela', '', 'Maintanance', '', ''),
('in', '7012075408084', 'DAVID MZUKISIBEYI', '', '', '7012075409084', '06:47 21-4-2020', '21-4-2020', '06:47', 'Staff', '', '', 'DAVID MZUKISI / BEYI', '', '', '', ''),
('out', '7012075409084', 'DAVID MZUKISIBEYI', '', '', '7012075409084', '13:14 08-5-2020', '2020/08/05', '13:14', 'Staff', '', '', '', '', '', '', ''),
('out', '7012075409084', 'DAVID MZUKISIBEYI', '', '', '7012075409084', '16:13 06-5-2020', '2020/06/05', '16:13', 'Staff', '', '', '', '', '', '', ''),
('out', '7012075409084', 'DAVID MZUKISIBEYI', '', '', '7012075409084', '16:05 05-5-2020', '2020/05/05', '16:05', 'Staff', '', '', '', '', '', '', ''),
('out', '7012075409084', 'DAVID MZUKISIBEYI', '', '', '7012075409084', '16:04 04-5-2020', '2020/04/05', '16:04', 'Staff', '', '', '', '', '', '', ''),
('in', '7012075409084', 'DAVID MZUKISIBEYI', '', '', '7012075409084', '07:39 28-4-2020', '28-4-2020', '07:39', 'Staff', '', '', 'DAVID MZUKISI / BEYI', '', '', '', ''),
('out', '7012075409084', 'DAVID MZUKISIBEYI', '', '', '7012075409084', '16:07 28-4-2020', '28-4-2020', '16:07', 'Staff', '', '', 'DAVID MZUKISI / BEYI', '', '', '', ''),
('out', '7012075409084', 'DAVID MZUKISIBEYI', '', '', '7012075409084', '15:59 21-4-2020', '21-4-2020', '15:59', 'Staff', '', '', '', '', '', '', ''),
('in', '7012075409084', 'DAVID MZUKISIBEYI', '', '', '7012075409084', '07:15 20-4-2020', '20-4-2020', '07:15', 'Staff', '', '', 'DAVID MZUKISI / BEYI', '', '', '', ''),
('out', '7012075409084', 'DAVID MZUKISIBEYI', '', '', '7012075409084', '16:09 20-4-2020', '20-4-2020', '16:09', 'Staff', '', '', 'DAVID MZUKISI / BEYI', '', '', '', ''),
('out', '7012075409084', '', '', '', '', '16:07 07-5-2020', '2020/07/05', '16:07', 'Staff', '', '', '', '', '', '', ''),
('in', '7101010836087', 'ZCTolwana', '', '', '', '08:52 11-5-2020', '2020/11/05', '08:52', 'Staff', '', '', 'ZC / Tolwana', '', '176', '', ''),
('out', '7103051000086', 'NOMANGESI SHEILLAPETA', '', '', '7103051000086', '07:02 09-5-2020', '2020/09/05', '07:02', 'Staff', '', '', '', '', '', '', ''),
('in', '7103051000086', 'NOMANGESI SHEILLAPETA', '', '', '7103051000086', '06:51 02-5-2020', '2020/02/05', '06:51', 'Staff', '', '', 'NOMANGESI SHEILLA / PETA', '', 'Unit 190', '', ''),
('out', '7103051000086', 'NOMANGESI SHEILLAPETA', '', '', '7103051000086', '07:07 27-4-2020', '27-4-2020', '07:07', 'Staff', '', '', '', '', '', '', ''),
('out', '7103051000086', 'NOMANGESI SHEILLAPETA', '', '', '7103051000086', '18:50 18-4-2020', '18-4-2020', '18:50', 'Staff', '', '', 'NS / Peta', '', '', '', ''),
('out', '7103051000086', 'NOMANGESI SHEILLAPETA', '', '', '7103051000086', '07:02 12-4-2020', '2020/12/04', '07:02', 'Staff', '', '', '', '', '', '', ''),
('in', '7103051000086', 'NSPeta', '', '', '', '06:54 03-5-2020', '2020/03/05', '06:54', 'Staff', '', '', 'NS / Peta', '', 'U-190', '', ''),
('in', '7103051000086', 'NSPeta', '', '', '', '07:01 18-4-2020', '18-4-2020', '07:01', 'Staff', '', '', 'NS / Peta', '', '', '', ''),
('out', '7103051000086', '', '', '', '', '07:01 11-5-2020', '2020/11/05', '07:01', 'Staff', '', '', '', '', '', '', ''),
('out', '7103051000086', '', '', '', '', '07:03 10-5-2020', '2020/10/05', '07:03', 'Staff', '', '', '', '', '', '', ''),
('out', '7103051000086', '', '', '', '', '07:04 06-5-2020', '2020/06/05', '07:04', 'Staff', '', '', '', '', '', '', ''),
('out', '7103051000086', '', '', '', '', '07:04 01-5-2020', '2020/01/05', '07:04', 'Staff', '', '', '', '', '', '', ''),
('out', '7103051000086', '', '', '', '', '07:05 30-4-2020', '30-4-2020', '07:05', 'Staff', '', '', '', '', '', '', ''),
('out', '7103051000086', '', '', '', '', '07:04 25-4-2020', '25-4-2020', '07:04', 'Staff', '', '', '', '', '', '', ''),
('out', '7103051000086', '', '', '', '', '07:03 22-4-2020', '22-4-2020', '07:03', 'Staff', '', '', '', '', '', '', ''),
('out', '7103051000086', '', '', '', '', '07:02 21-4-2020', '21-4-2020', '07:02', 'Staff', '', '', '', '', '', '', ''),
('out', '7103051000086', '', '', '', '', '18:44 19-4-2020', '19-4-2020', '18:44', 'Staff', '', '', '', '', '', '', ''),
('out', '7103051000086', '', '', '', '', '07:02 17-4-2020', '17-4-2020', '07:02', 'Staff', '', '', '', '', '', '', ''),
('out', '7103051000086', '', '', '', '', '07:00 16-4-2020', '16-4-2020', '07:00', 'Staff', '', '', '', '', '', '', ''),
('out', '7103051000086', '', '', '', '', '07:02 11-4-2020', '2020/11/04', '07:02', 'Staff', '', '', '', '', '', '', ''),
('in', '7105225406081', 'MKHAMKHAM', '', '', '7105225406081', '06:55 05-5-2020', '2020/05/05', '06:55', 'Visitors', 'Expired driver licence', 'M / KHAMKHAM', '', '', '', '', 'Care Centre'),
('in', '7110075621086', 'Qokosipho', '', '', '', '07:32 07-5-2020', '2020/07/05', '07:32', 'Staff', '', '', 'Qoko / sipho', '', 'work', '', ''),
('in', '7110075621086', 'SQoko', '', '', '', '07:16 11-5-2020', '2020/11/05', '07:16', 'Staff', '', '', 'S / Qoko', '', 'M', '', ''),
('in', '7110075621086', 'SQoko', '', '', '', '07:09 08-5-2020', '2020/08/05', '07:09', 'Staff', '', '', 'S / Qoko', '', 'KG', '', ''),
('in', '7110075621086', 'sqoko', '', '', '', '07:45 06-5-2020', '2020/06/05', '07:45', 'Staff', '', '', 's / qoko', '', 'work', '', ''),
('in', '7110075621086', 'SQoko', '', '', '', '07:21 05-5-2020', '2020/05/05', '07:21', 'Staff', '', '', 'S / Qoko', '', 'Mantainance', '', ''),
('in', '7110075621086', 'SQoko', '', '', '', '07:49 04-5-2020', '2020/04/05', '07:49', 'Staff', '', '', 'S / Qoko', '', 'Mantainance', '', ''),
('in', '7110075621086', 'Sqoko', '', '', '', '07:14 30-4-2020', '30-4-2020', '07:14', 'Staff', '', '', 'S / qoko', '', '', '', ''),
('in', '7110075621086', 'SQoko', '', '', '', '07:44 29-4-2020', '29-4-2020', '07:44', 'Staff', '', '', 'S / Qoko', '', '', '', ''),
('in', '7110075621086', 'SQoko', '', '', '', '07:22 28-4-2020', '28-4-2020', '07:22', 'Staff', '', '', 'S / Qoko', '', '', '', ''),
('in', '7110075621086', 'SQoko', '', '', '', '07:34 24-4-2020', '24-4-2020', '07:34', 'Staff', '', '', 'S / Qoko', '', '', '', ''),
('out', '7110075621086', '', '', '', '', '16:25 08-5-2020', '2020/08/05', '16:25', 'Staff', '', '', 'S / Qoko', '', 'KG', '', ''),
('out', '7110075621086', '', '', '', '', '16:31 07-5-2020', '2020/07/05', '16:31', 'Staff', '', '', 'Qoko / sipho', '', 'work', '', ''),
('out', '7110075621086', '', '', '', '', '16:29 06-5-2020', '2020/06/05', '16:29', 'Staff', '', '', 's / qoko', '', 'work', '', ''),
('out', '7110075621086', '', '', '', '', '16:25 05-5-2020', '2020/05/05', '16:25', 'Staff', '', '', 'S / Qoko', '', 'Mantainance', '', ''),
('out', '7110075621086', '', '', '', '', '16:28 04-5-2020', '2020/04/05', '16:28', 'Staff', '', '', 'S / Qoko', '', 'Mantainance', '', ''),
('out', '7110075621086', '', '', '', '', '16:28 30-4-2020', '30-4-2020', '16:28', 'Staff', '', '', 'S / qoko', '', '', '', ''),
('out', '7110075621086', '', '', '', '', '16:29 29-4-2020', '29-4-2020', '16:29', 'Staff', '', '', 'S / Qoko', '', '', '', ''),
('out', '7110075621086', '', '', '', '', '16:29 28-4-2020', '28-4-2020', '16:29', 'Staff', '', '', 'S / Qoko', '', '', '', ''),
('out', '7110075621086', '', '', '', '', '16:28 24-4-2020', '24-4-2020', '16:28', 'Staff', '', '', 'S / Qoko', '', '', '', ''),
('in', '7112195064080', 'MCRIELLY', '', '', '7112195064080', '12:38 05-5-2020', '2020/05/05', '12:38', 'Visitors', 'Expired car licence', 'MC / RIELLY', '', '', '', '', 'Del');
INSERT INTO `atthegate` (`direction`, `license`, `name`, `company`, `category`, `dr_license`, `creation`, `recdate`, `rectime`, `profile`, `incidents`, `dr_name`, `name_in`, `name_out`, `going`, `company2`, `visiting`) VALUES
('in', '7201110094080', 'RBOTHA', '', '', '7201110094080', '07:06 11-5-2020', '2020/11/05', '07:06', 'Staff', '', '', 'R / BOTHA', '', 'C', '', ''),
('in', '7201155766089', 'XMBANDEZI', '', '', '7201155766089', '18:50 03-5-2020', '2020/03/05', '18:50', 'Visitors', '', 'XM / BANDEZI', '', '', '', '', 'Patrol'),
('in', '7203126037087', 'Tuku Zanenvulaz Tuku', '', '', '', '07:08 07-5-2020', '2020/07/05', '07:08', 'Staff', '', '', 'Tuku Zanenvula / z Tuku', '', 'Gardin', '', ''),
('in', '7203126037087', 'zanemvulatuku', '', '', '', '07:03 06-5-2020', '2020/06/05', '07:03', 'Staff', '', '', 'zanemvula / tuku', '', 'work', '', ''),
('in', '7203126037087', 'ZTuku', '', '', '', '07:03 11-5-2020', '2020/11/05', '07:03', 'Staff', '', '', 'Z / Tuku', '', 'KG', '', ''),
('in', '7203126037087', 'ZTuku', '', '', '', '07:08 08-5-2020', '2020/08/05', '07:08', 'Staff', '', '', 'Z / Tuku', '', 'KG', '', ''),
('in', '7203126037087', 'ZTuku', '', '', '', '07:15 05-5-2020', '2020/05/05', '07:15', 'Staff', '', '', 'Z / Tuku', '', 'K G', '', ''),
('in', '7203126037087', 'ZTuku', '', '', '', '06:57 04-5-2020', '2020/04/05', '06:57', 'Staff', '', '', 'Z / Tuku ', '', 'Kenton Garden Services', '', ''),
('in', '7203126037087', 'ZTuku', '', '', '', '07:08 30-4-2020', '30-4-2020', '07:08', 'Staff', '', '', 'Z / Tuku', '', '', '', ''),
('in', '7203126037087', 'ZTuku', '', '', '', '07:07 29-4-2020', '29-4-2020', '07:07', 'Staff', '', '', 'Z / Tuku', '', '', '', ''),
('out', '7203126037087', '', '', '', '', '16:16 08-5-2020', '2020/08/05', '16:16', 'Staff', '', '', 'Z / Tuku', '', 'KG', '', ''),
('out', '7203126037087', '', '', '', '', '16:23 07-5-2020', '2020/07/05', '16:23', 'Staff', '', '', 'Tuku Zanenvula / z Tuku', '', 'Gardin', '', ''),
('out', '7203126037087', '', '', '', '', '16:28 06-5-2020', '2020/06/05', '16:28', 'Staff', '', '', 'zanemvula / tuku', '', 'work', '', ''),
('out', '7203126037087', '', '', '', '', '16:24 05-5-2020', '2020/05/05', '16:24', 'Staff', '', '', 'Z / Tuku', '', 'K G', '', ''),
('out', '7203126037087', '', '', '', '', '16:24 04-5-2020', '2020/04/05', '16:24', 'Staff', '', '', 'Z / Tuku ', '', 'Kenton Garden Services', '', ''),
('out', '7203126037087', '', '', '', '', '16:03 30-4-2020', '30-4-2020', '16:03', 'Staff', '', '', 'Z / Tuku', '', '', '', ''),
('out', '7203126037087', '', '', '', '', '16:24 29-4-2020', '29-4-2020', '16:24', 'Staff', '', '', 'Z / Tuku', '', '', '', ''),
('out', '7203126037087', '', '', '', '', '16:25 28-4-2020', '28-4-2020', '16:25', 'Staff', '', '', '', '', '', '', ''),
('out', '7205290610086', '', '', '', '', '06:52 02-5-2020', '2020/02/05', '06:52', 'Staff', '', '', '', '', '', '', ''),
('out', '7205290610086', '', '', '', '', '07:02 28-4-2020', '28-4-2020', '07:02', 'Staff', '', '', '', '', '', '', ''),
('in', '7206270071083', 'AtkinsonAtkinson', '', '', '', '18:03 18-4-2020', '18-4-2020', '18:03', 'Visitors', '', 'Atkinson / Atkinson', '', '', '', '', '128'),
('', 'Licence', 'Name', 'Company', 'Category', 'Driver Lic ID', 'Creation date', 'Date', 'Time', 'App profile', 'Incidents', 'Scan Drivers Licence(in)', 'Name and Surname(in)', 'Name and Surname(out)', 'Where are you going(in)', 'Company Name(in)', 'Resident visiting(in)'),
('out', '0004281248080', 'DANIELLEFOURIE', '', '', '0004281248080', '14:21 03-5-2020', '2020/03/05', '14:21', 'Staff', '', '', 'DANIELLE / FOURIE', '', 'Hibiscus', '', ''),
('in', '6013000089', 'sTuku', '', '', '', '07:49 05-5-2020', '2020/05/05', '07:49', 'Staff', '', '', 's / Tuku', '', 'm', '', ''),
('in', '53063621087', 'NOMBUYISELO FLORENCEMAGAWU', '', '', '5306250231087', '07:59 24-4-2020', '24-4-2020', '07:59', 'Staff', '', '', 'NOMBUYISELO FLORENCE / MAGAWU', '', '', '', ''),
('in', '74040613089', 'TTsitsi', '', '', '', '08:26 02-5-2020', '2020/02/05', '08:26', 'Staff', '', '', 'T / Tsitsi', '', 'Unit 39', '', ''),
('out', '78119505080', 'NOMFUSIJAMES', '', '', '7811050502080', '17:36 25-4-2020', '25-4-2020', '17:36', 'Staff', '', '', '', '', '', '', ''),
('in', '89030804089', 'PUMEZANTLOKWANA', '', '', '8903080498089', '06:58 15-4-2020', '15-4-2020', '06:58', 'Staff', '', '', 'PUMEZA / NTLOKWANA', '', '', '', ''),
('in', '700503671080', 'VUYO RICHARDMSESIWE', '', '', '7005036271080', '07:36 07-5-2020', '2020/07/05', '07:36', 'Staff', '', '', 'VUYO RICHARD / MSESIWE', '', 'work', '', ''),
('in', '740705326086', 'XMKhamkham', '', '', '', '07:15 17-4-2020', '17-4-2020', '07:15', 'Staff', '', '', 'XM / Khamkham', '', '', '', ''),
('in', '780109025080', 'DMJACU', '', '', '7801090235080', '18:41 13-4-2020', '13-4-2020', '18:41', 'Staff', '', '', 'D / MJACU', '', '', '', ''),
('in', '790250017081', 'MilliscentGaseba', '', '', '', '17:58 21-4-2020', '21-4-2020', '17:58', 'Staff', '', '', 'Milliscent / Gaseba', '', '', '', ''),
('out', '810195340087', 'MZIWETHUMAFANI', '', '', '8101095340087', '17:05 25-4-2020', '25-4-2020', '17:05', 'Staff', '', '', '', '', '', '', ''),
('in', '810930099083', 'LYNDRO URSULAJORDAAN', '', '', '8109300099083', '18:38 18-4-2020', '18-4-2020', '18:38', 'Staff', '', '', 'LYNDRO URSULA / JORDAAN', '', '', '', ''),
('in', '830507024081', 'LUNGISWAGANGQU', '', '', '8305070242081', '07:33 19-4-2020', '19-4-2020', '07:33', 'Staff', '', '', 'LUNGISWA / GANGQU', '', '', '', ''),
('in', '870317563808', 'ZMNyanya', '', '', '', '07:38 28-4-2020', '28-4-2020', '07:38', 'Staff', '', '', 'ZM / Nyanya', '', '', '', ''),
('in', '3503260002084', 'MAHOBBS', '', '', '3503260002084', '08:15 10-5-2020', '2020/10/05', '08:15', 'Visitors', 'Expired car licence', 'MA / HOBBS', '', '', '', '', '180'),
('out', '3512160325081', 'F.AWerner', '', '', '', '10:36 14-4-2020', '14-4-2020', '10:36', 'Resident', '', '', '', 'F.A / Werner', '', '', ''),
('out', '3801210057186', 'IrisClough', '', '', '', '09:53 07-5-2020', '2020/07/05', '09:53', 'Resident', '', '', '', 'Iris / Clough', '', '', ''),
('in', '3811115050087', 'JTHROOS', '', '', '3811115050087', '16:02 09-5-2020', '2020/09/05', '16:02', 'Visitors', 'Expired driver licence', 'JTH / ROOS', '', '', '', '', '10'),
('in', '3812090063087', 'JENIFER HELENSIMPSON', '', '', '3812090063087', '10:56 08-5-2020', '2020/08/05', '10:56', 'Resident', '', '', 'JENIFER HELEN / SIMPSON', '', '', '', ''),
('in', '3903120064086', 'AEALSTON', '', '', '3803165088083', '11:18 09-5-2020', '2020/09/05', '11:18', 'Visitors', 'Expired car licence', 'AE / ALSTON', '', '', '', '', '111'),
('in', '4009090011088', 'RDNelson', '', '', '', '09:20 29-4-2020', '29-4-2020', '09:20', 'Visitors', 'Expired car licence', 'RD / Nelson', '', '', '', '', '188'),
('out', '4211305048083', 'Charles pellew', '', '', '', '13:34 07-5-2020', '2020/07/05', '13:34', 'Resident', 'Expired car licence', '', '', 'Charles  / pellew', '', '', ''),
('out', '4304020062081', 'SpearmanMaureen', '', '', '', '12:43 07-5-2020', '2020/07/05', '12:43', 'Resident', '', '', '', 'Spearman / Maureen', '', '', ''),
('out', '4401250054182', 'CollettRobin', '', '', '', '10:08 07-5-2020', '2020/07/05', '10:08', 'Resident', '', '', '', 'Collett / Robin', '', '', ''),
('in', '4409265015080', 'AELMS', '', '', '4409265015080', '06:32 28-4-2020', '28-4-2020', '06:32', 'Visitors', '', 'A / ELMS', '', '', '', '', '190'),
('in', '4501190496185', 'FMSpieker', '', '', '', '10:37 10-5-2020', '2020/10/05', '10:37', 'Visitors', '', 'FM / Spieker', '', '', '', '', '158'),
('in', '4603100040184', 'SAReijman', '', '', '', '16:34 29-4-2020', '29-4-2020', '16:34', 'Visitors', '', 'SA / Reijman', '', '', '', '', '169'),
('in', '4805155336082', 'MGClayton', '', '', '', '09:54 11-5-2020', '2020/11/05', '09:54', 'Visitors', '', 'MG / Clayton', '', '', '', '', '100'),
('in', '5006070037082', 'E.M.MMacMahon', '', '', '', '06:49 20-4-2020', '20-4-2020', '06:49', 'Staff', '', '', 'E.M.M / MacMahon', '', '', '', ''),
('in', '5103230472083', 'SINDISWA CYNTHIAGXOYIYA', '', '', '5103230472083', '08:43 08-5-2020', '2020/08/05', '08:43', 'Staff', '', '', 'SINDISWA CYNTHIA / GXOYIYA', '', 'Unit 132', '', ''),
('in', '5306250231087', 'NOMBUYISELO FLORENCEMAGAWU', '', '', '5306250231087', '08:06 20-4-2020', '20-4-2020', '08:06', 'Staff', '', '', 'NOMBUYISELO FLORENCE / MAGAWU', '', '', '', ''),
('in', '5606150031085', 'CLCOATES', '', '', '5606150031085', '12:48 28-4-2020', '28-4-2020', '12:48', 'Visitors', '', 'CL / COATES', '', '', '', '', '161'),
('in', '5706030367086', 'n GwebileN Jullian', '', '', '', '07:26 07-5-2020', '2020/07/05', '07:26', 'Staff', '', '', 'n Gwebile / N Jullian', '', 'work', '', ''),
('in', '5706160208085', 'MajorieCampbell', '', '', '', '18:04 10-5-2020', '2020/10/05', '18:04', 'Staff', '', '', 'Majorie / Campbell', '', '144', '', ''),
('out', '5707135793086', 'ZANDISILEQAKAMFANA', '', '', '5707135793086', '16:23 07-5-2020', '2020/07/05', '16:23', 'Staff', '', '', '', '', '', '', ''),
('in', '5807016108089', 'Gongqavukile', '', '', '', '07:35 07-5-2020', '2020/07/05', '07:35', 'Staff', '', '', 'Gongqa / vukile', '', 'work', '', ''),
('out', '5811280758082', 'MAVISTEMBENI', '', '', '5811280758082', '07:34 08-5-2020', '2020/08/05', '07:34', 'Staff', '', '', 'MAVIS / TEMBENI', '', '212', '', ''),
('in', '5812050320087', 'MYani Faku', '', '', '', '06:41 02-5-2020', '2020/02/05', '06:41', 'Staff', '', '', 'M / Yani Faku', '', 'Kitchen', '', ''),
('in', '5812050320087', 'PatriciaRayi', '', '', '', '07:02 13-4-2020', '13-4-2020', '07:02', 'Staff', '', '', 'Patricia / Rayi', '', '', '', ''),
('in', '5901030766087', 'TFHoboshe', '', '', '', '06:47 18-4-2020', '18-4-2020', '06:47', 'Staff', '', '', 'TF / Hoboshe', '', '', '', ''),
('in', '5901075574081', 'Daweti MadidaD M', '', '', '', '07:09 07-5-2020', '2020/07/05', '07:09', 'Staff', '', '', 'Daweti Madida / D M', '', 'Gardin', '', ''),
('in', '5901260650084', 'Mpandepumla', '', '', '', '08:02 07-5-2020', '2020/07/05', '08:02', 'Staff', '', '', 'Mpande / pumla', '', 'work', '', ''),
('in', '5903100648088', 'TNkombisa', '', '', '', '07:57 11-5-2020', '2020/11/05', '07:57', 'Staff', '', '', 'T / Nkombisa', '', '71', '', ''),
('in', '6007120590087', 'BMMemani', '', '', '', '08:50 10-5-2020', '2020/10/05', '08:50', 'Staff', '', '', 'BM / Memani', '', '114', '', ''),
('out', '6010135284084', 'BONISILE GEORGEPETER', '', '', '6010135284084', '15:50 05-5-2020', '2020/05/05', '15:50', 'Staff', '', '', 'BG / Peter', '', 'KG', '', ''),
('in', '6104150342081', 'NomakulaNgxingo', '', '', '', '07:35 13-4-2020', '13-4-2020', '07:35', 'Staff', '', '', 'Nomakula / Ngxingo', '', '', '', ''),
('in', '6111235691085', 'DuruweGeofrey', '', '', '', '07:37 07-5-2020', '2020/07/05', '07:37', 'Staff', '', '', 'Duruwe / Geofrey', '', 'work', '', ''),
('in', '6201260710080', 'JaniceMatthews', '', '', '', '18:35 21-4-2020', '21-4-2020', '18:35', 'Staff', '', '', 'Janice / Matthews', '', '', '', ''),
('in', '6209200634088', 'Belewasiziwe', '', '', '', '07:37 07-5-2020', '2020/07/05', '07:37', 'Staff', '', '', 'Belewa / siziwe', '', 'work', '', ''),
('in', '6209200634088', 'FBelewa', '', '', '', '07:08 01-5-2020', '2020/01/05', '07:08', 'Staff', '', '', 'F / Belewa', '', '167', '', ''),
('in', '6209200634088', 'FBelewa', '', '', '', '06:59 16-4-2020', '16-4-2020', '06:59', 'Staff', '', '', 'F / Belewa', '', '', '', ''),
('in', '6209200634088', 'FlorenceBelewa', '', '', '', '06:57 13-4-2020', '13-4-2020', '06:57', 'Staff', '', '', 'Florence / Belewa', '', '', '', ''),
('in', '6209200634088', 'FVBelewa', '', '', '', '07:33 30-4-2020', '30-4-2020', '07:33', 'Staff', '', '', 'FV / Belewa', '', '', '', ''),
('in', '6209200634088', 'S.F.Belewa', '', '', '', '07:05 14-4-2020', '14-4-2020', '07:05', 'Staff', '', '', 'S.F. / Belewa', '', '', '', ''),
('in', '6209200634088', 'S.FBelewa', '', '', '', '06:59 20-4-2020', '20-4-2020', '06:59', 'Staff', '', '', 'S.F / Belewa', '', '', '', ''),
('in', '6209200634088', 'SFBelewa', '', '', '', '07:25 11-5-2020', '2020/11/05', '07:25', 'Staff', '', '', 'SF / Belewa', '', '167', '', ''),
('in', '6209200634088', 'SFBelewa', '', '', '', '07:05 08-5-2020', '2020/08/05', '07:05', 'Staff', '', '', 'SF / Belewa', '', 'Unit 167', '', ''),
('in', '6209200634088', 'SFBelewa', '', '', '', '07:26 05-5-2020', '2020/05/05', '07:26', 'Staff', '', '', 'SF / Belewa', '', 'Unit 167', '', ''),
('in', '6209200634088', 'SFBelewa', '', '', '', '07:28 29-4-2020', '29-4-2020', '07:28', 'Staff', '', '', 'SF / Belewa', '', '', '', ''),
('in', '6209200634088', 'SFBelewa', '', '', '', '07:31 28-4-2020', '28-4-2020', '07:31', 'Staff', '', '', 'SF / Belewa', '', '', '', ''),
('in', '6209200634088', 'SFBelewa', '', '', '', '07:03 27-4-2020', '27-4-2020', '07:03', 'Staff', '', '', 'SF / Belewa', '', '', '', ''),
('in', '6209200634088', 'SFBelewa', '', '', '', '07:10 24-4-2020', '24-4-2020', '07:10', 'Staff', '', '', 'SF / Belewa', '', '', '', ''),
('in', '6209200634088', 'SFBelewa', '', '', '', '07:05 23-4-2020', '23-4-2020', '07:05', 'Staff', '', '', 'SF / Belewa', '', '', '', ''),
('in', '6209200634088', 'SFBelewa', '', '', '', '07:02 22-4-2020', '22-4-2020', '07:02', 'Staff', '', '', 'SF / Belewa', '', '', '', ''),
('in', '6209200634088', 'SFBelewa', '', '', '', '07:00 17-4-2020', '17-4-2020', '07:00', 'Staff', '', '', 'SF / Belewa', '', '', '', ''),
('in', '6209200634088', 'SFBrlees', '', '', '', '06:57 21-4-2020', '21-4-2020', '06:57', 'Staff', '', '', 'SF / Brlees', '', '', '', ''),
('out', '6209200634088', '', '', '', '', '17:04 08-5-2020', '2020/08/05', '17:04', 'Staff', '', '', 'SF / Belewa', '', 'Unit 167', '', ''),
('out', '6209200634088', '', '', '', '', '17:04 07-5-2020', '2020/07/05', '17:04', 'Staff', '', '', 'Belewa / siziwe', '', 'work', '', ''),
('out', '6209200634088', '', '', '', '', '17:03 06-5-2020', '2020/06/05', '17:03', 'Staff', '', '', '', '', '', '', ''),
('out', '6209200634088', '', '', '', '', '17:09 05-5-2020', '2020/05/05', '17:09', 'Staff', '', '', 'SF / Belewa', '', 'Unit 167', '', ''),
('out', '6209200634088', '', '', '', '', '09:08 01-5-2020', '2020/01/05', '09:08', 'Staff', '', '', 'F / Belewa', '', '167', '', ''),
('out', '6209200634088', '', '', '', '', '16:58 30-4-2020', '30-4-2020', '16:58', 'Staff', '', '', 'FV / Belewa', '', '', '', ''),
('out', '6209200634088', '', '', '', '', '17:06 29-4-2020', '29-4-2020', '17:06', 'Staff', '', '', 'SF / Belewa', '', '', '', ''),
('out', '6209200634088', '', '', '', '', '16:58 28-4-2020', '28-4-2020', '16:58', 'Staff', '', '', 'SF / Belewa', '', '', '', ''),
('out', '6209200634088', '', '', '', '', '17:10 27-4-2020', '27-4-2020', '17:10', 'Staff', '', '', 'SF / Belewa', '', '', '', ''),
('out', '6209200634088', '', '', '', '', '17:27 24-4-2020', '24-4-2020', '17:27', 'Staff', '', '', 'SF / Belewa', '', '', '', ''),
('out', '6209200634088', '', '', '', '', '17:34 23-4-2020', '23-4-2020', '17:34', 'Staff', '', '', 'SF / Belewa', '', '', '', ''),
('out', '6209200634088', '', '', '', '', '17:38 22-4-2020', '22-4-2020', '17:38', 'Staff', '', '', 'SF / Belewa', '', '', '', ''),
('out', '6209200634088', '', '', '', '', '17:16 21-4-2020', '21-4-2020', '17:16', 'Staff', '', '', 'SF / Brlees', '', '', '', ''),
('out', '6209200634088', '', '', '', '', '17:15 20-4-2020', '20-4-2020', '17:15', 'Staff', '', '', 'S.F / Belewa', '', '', '', ''),
('out', '6209200634088', '', '', '', '', '17:16 17-4-2020', '17-4-2020', '17:16', 'Staff', '', '', 'SF / Belewa', '', '', '', ''),
('out', '6209200634088', '', '', '', '', '17:16 16-4-2020', '16-4-2020', '17:16', 'Staff', '', '', 'F / Belewa', '', '', '', ''),
('out', '6209200634088', '', '', '', '', '17:20 14-4-2020', '14-4-2020', '17:20', 'Staff', '', '', 'S.F. / Belewa', '', '', '', ''),
('out', '6209200634088', '', '', '', '', '17:03 13-4-2020', '13-4-2020', '17:03', 'Staff', '', '', 'Florence / Belewa', '', '', '', ''),
('in', '6210280109082', 'LeslyPottet', '', '', '', '15:19 25-4-2020', '25-4-2020', '15:19', 'Visitors', '', 'Lesly / Pottet', '', '', '', '', 'G1'),
('in', '6210280109082', 'LJPorter', '', '', '', '14:02 24-4-2020', '24-4-2020', '14:02', 'Visitors', '', 'LJ / Porter', '', '', '', '', 'G1'),
('in', '6210280109082', 'LJPorter', '', '', '', '10:22 23-4-2020', '23-4-2020', '10:22', 'Visitors', '', 'LJ / Porter', '', '', '', '', 'G1'),
('in', '6210280109082', 'LrdlryBota', '', '', '', '13:49 22-4-2020', '22-4-2020', '13:49', 'Visitors', '', 'Lrdlry / Bota', '', '', '', '', '3'),
('in', '6212120482083', 'nntantisi', '', '', '', '08:01 06-5-2020', '2020/06/05', '08:01', 'Staff', '', '', 'n / ntantisi', '', 'work', '', ''),
('in', '6212120482083', 'NP Ntantiso', '', '', '', '08:31 20-4-2020', '20-4-2020', '08:31', 'Staff', '', '', 'NP  / Ntantiso', '', '', '', ''),
('in', '6212120482083', 'Ntantiso NompumeleloN Nompumelelo', '', '', '', '08:15 07-5-2020', '2020/07/05', '08:15', 'Staff', '', '', 'Ntantiso Nompumelelo / N Nompumelelo', '', 'work', '', ''),
('in', '6212120482083', 'NVNtantiso', '', '', '', '07:52 11-5-2020', '2020/11/05', '07:52', 'Staff', '', '', 'NV / Ntantiso', '', 'O', '', ''),
('in', '6212120482083', 'NVNtantiso', '', '', '', '07:52 08-5-2020', '2020/08/05', '07:52', 'Staff', '', '', 'NV / Ntantiso', '', 'Adminn', '', ''),
('in', '6212120482083', 'NVNtantiso', '', '', '', '08:14 05-5-2020', '2020/05/05', '08:14', 'Staff', '', '', 'NV / Ntantiso', '', 'Admin', '', ''),
('in', '6212120482083', 'NVNtantiso', '', '', '', '08:16 04-5-2020', '2020/04/05', '08:16', 'Staff', '', '', 'NV / Ntantiso', '', 'O', '', ''),
('in', '6212120482083', 'NVNtantiso', '', '', '', '08:09 29-4-2020', '29-4-2020', '08:09', 'Staff', '', '', 'NV / Ntantiso', '', '', '', ''),
('in', '6212120482083', 'NVNtantiso', '', '', '', '08:29 28-4-2020', '28-4-2020', '08:29', 'Staff', '', '', 'NV / Ntantiso', '', '', '', ''),
('in', '6212120482083', 'NVNtantiso', '', '', '', '08:23 24-4-2020', '24-4-2020', '08:23', 'Staff', '', '', 'NV / Ntantiso', '', '', '', ''),
('in', '6212120482083', 'NVNtantiso', '', '', '', '08:37 23-4-2020', '23-4-2020', '08:37', 'Staff', '', '', 'NV / Ntantiso', '', '', '', ''),
('in', '6212120482083', 'NVNtantiso', '', '', '', '08:18 17-4-2020', '17-4-2020', '08:18', 'Staff', '', '', 'NV / Ntantiso', '', '', '', ''),
('in', '6212120482083', 'NVNtsntido', '', '', '', '08:33 22-4-2020', '22-4-2020', '08:33', 'Staff', '', '', 'NV / Ntsntido', '', '', '', ''),
('in', '6212120482083', 'NVNtsntiso', '', '', '', '08:11 30-4-2020', '30-4-2020', '08:11', 'Staff', '', '', 'NV / Ntsntiso', '', '', '', ''),
('in', '6212120482083', 'Nvntsntiso', '', '', '', '08:31 16-4-2020', '16-4-2020', '08:31', 'Staff', '', '', 'Nv / ntsntiso', '', '', '', ''),
('in', '6212120482083', 'VNntsntido', '', '', '', '08:19 21-4-2020', '21-4-2020', '08:19', 'Staff', '', '', 'VN / ntsntido', '', '', '', ''),
('out', '6212120482083', '', '', '', '', '16:35 08-5-2020', '2020/08/05', '16:35', 'Staff', '', '', 'NV / Ntantiso', '', 'Adminn', '', ''),
('out', '6212120482083', '', '', '', '', '16:36 07-5-2020', '2020/07/05', '16:36', 'Staff', '', '', 'Ntantiso Nompumelelo / N Nompumelelo', '', 'work', '', ''),
('out', '6212120482083', '', '', '', '', '16:36 06-5-2020', '2020/06/05', '16:36', 'Staff', '', '', 'n / ntantisi', '', 'work', '', ''),
('out', '6212120482083', '', '', '', '', '16:31 05-5-2020', '2020/05/05', '16:31', 'Staff', '', '', 'NV / Ntantiso', '', 'Admin', '', ''),
('out', '6212120482083', '', '', '', '', '16:39 04-5-2020', '2020/04/05', '16:39', 'Staff', '', '', 'NV / Ntantiso', '', 'O', '', ''),
('out', '6212120482083', '', '', '', '', '16:26 30-4-2020', '30-4-2020', '16:26', 'Staff', '', '', 'NV / Ntsntiso', '', '', '', ''),
('out', '6212120482083', '', '', '', '', '16:54 29-4-2020', '29-4-2020', '16:54', 'Staff', '', '', 'NV / Ntantiso', '', '', '', ''),
('out', '6212120482083', '', '', '', '', '16:58 28-4-2020', '28-4-2020', '16:58', 'Staff', '', '', 'NV / Ntantiso', '', '', '', ''),
('out', '6212120482083', '', '', '', '', '16:42 22-4-2020', '22-4-2020', '16:42', 'Staff', '', '', 'NV / Ntsntido', '', '', '', ''),
('out', '6212120482083', '', '', '', '', '16:35 21-4-2020', '21-4-2020', '16:35', 'Staff', '', '', 'VN / ntsntido', '', '', '', ''),
('out', '6212120482083', '', '', '', '', '16:34 20-4-2020', '20-4-2020', '16:34', 'Staff', '', '', 'NP  / Ntantiso', '', '', '', ''),
('out', '6212120482083', '', '', '', '', '16:54 17-4-2020', '17-4-2020', '16:54', 'Staff', '', '', 'NV / Ntantiso', '', '', '', ''),
('in', '6303095010080', 'JLPhillips', '', '', '', '15:44 27-4-2020', '27-4-2020', '15:44', 'Visitors', 'Expired car licence', 'JL / Phillips', '', '', '', '', '122'),
('in', '6303095010080', 'JLPHILLIPS', '', '', '6303095010080', '16:26 27-4-2020', '27-4-2020', '16:26', 'Visitors', 'Expired driver licence, Expired car licence', 'JL / PHILLIPS', '', '', '', '', '122'),
('in', '6308245423083', 'NJBATINI', 'PA Butchery', '', '6308245423083', '15:02 04-5-2020', '2020/04/05', '15:02', 'Contractors', 'Expired car licence', 'NJ / BATINI', '', '', '', 'PA Butchery', ''),
('in', '6311125777081', 'Belwan linoilr', '', '', '', '07:56 07-5-2020', '2020/07/05', '07:56', 'Staff', '', '', 'Belwan  / linoilr', '', 'work', '', ''),
('in', '6311125777081', 'LBelwana', '', '', '', '07:37 11-5-2020', '2020/11/05', '07:37', 'Staff', '', '', 'L / Belwana', '', 'M', '', ''),
('in', '6311125777081', 'LBelwana', '', '', '', '07:41 08-5-2020', '2020/08/05', '07:41', 'Staff', '', '', 'L / Belwana', '', 'M', '', ''),
('in', '6311125777081', 'LBelwana', '', '', '', '07:48 05-5-2020', '2020/05/05', '07:48', 'Staff', '', '', 'L / Belwana', '', 'M', '', ''),
('in', '6311125777081', 'Lbhelwana', '', '', '', '07:48 06-5-2020', '2020/06/05', '07:48', 'Staff', '', '', 'L / bhelwana', '', 'work', '', ''),
('out', '6311125777081', 'THANDEKILEKOMENI', '', '', '6507205851080', '16:30 06-5-2020', '2020/06/05', '16:30', 'Staff', '', '', 'L / bhelwana', '', 'work', '', ''),
('out', '6311125777081', '', '', '', '', '16:28 08-5-2020', '2020/08/05', '16:28', 'Staff', '', '', 'L / Belwana', '', 'M', '', ''),
('out', '6311125777081', '', '', '', '', '16:29 07-5-2020', '2020/07/05', '16:29', 'Staff', '', '', 'Belwan  / linoilr', '', 'work', '', ''),
('out', '6311125777081', '', '', '', '', '16:28 05-5-2020', '2020/05/05', '16:28', 'Staff', '', '', 'L / Belwana', '', 'M', '', ''),
('in', '6311235954083', 'GladmanSontsonga', '', '', '', '08:05 20-4-2020', '20-4-2020', '08:05', 'Staff', '', '', 'Gladman / Sontsonga', '', '', '', ''),
('in', '6311235954083', 'GSontsonga', '', '', '', '07:36 08-5-2020', '2020/08/05', '07:36', 'Staff', '', '', 'G / Sontsonga', '', 'M', '', ''),
('in', '6311235954083', 'gsontsonga', '', '', '', '07:37 06-5-2020', '2020/06/05', '07:37', 'Staff', '', '', 'g / sontsonga', '', 'work', '', ''),
('in', '6311235954083', 'GSontsonga', '', '', '', '07:39 05-5-2020', '2020/05/05', '07:39', 'Staff', '', '', 'G / Sontsonga', '', 'M', '', ''),
('in', '6311235954083', 'GSontsonga', '', '', '', '07:44 04-5-2020', '2020/04/05', '07:44', 'Staff', '', '', 'G / Sontsonga', '', 'Mantainance', '', ''),
('in', '6311235954083', 'GSontsonga', '', '', '', '07:41 30-4-2020', '30-4-2020', '07:41', 'Staff', '', '', 'G / Sontsonga', '', '', '', ''),
('in', '6311235954083', 'GSontsonga', '', '', '', '07:43 29-4-2020', '29-4-2020', '07:43', 'Staff', '', '', 'G / Sontsonga', '', '', '', ''),
('in', '6311235954083', 'GSontsonga', '', '', '', '08:07 28-4-2020', '28-4-2020', '08:07', 'Staff', '', '', 'G / Sontsonga', '', '', '', ''),
('in', '6311235954083', 'GSontsonga', '', '', '', '07:35 24-4-2020', '24-4-2020', '07:35', 'Staff', '', '', 'G / Sontsonga', '', '', '', ''),
('in', '6311235954083', 'GSontsonga', '', '', '', '07:51 23-4-2020', '23-4-2020', '07:51', 'Staff', '', '', 'G / Sontsonga', '', '', '', ''),
('in', '6311235954083', 'GSontsonga', '', '', '', '07:47 22-4-2020', '22-4-2020', '07:47', 'Staff', '', '', 'G / Sontsonga', '', '', '', ''),
('in', '6311235954083', 'GSontsonga', '', '', '', '07:47 21-4-2020', '21-4-2020', '07:47', 'Staff', '', '', 'G / Sontsonga', '', '', '', ''),
('in', '6311235954083', 'GSontsonga', '', '', '', '08:03 17-4-2020', '17-4-2020', '08:03', 'Staff', '', '', 'G / Sontsonga', '', '', '', ''),
('in', '6311235954083', 'GSontsonga', '', '', '', '08:07 14-4-2020', '14-4-2020', '08:07', 'Staff', '', '', 'G / Sontsonga', '', '', '', ''),
('in', '6311235954083', 'sintsladmans', '', '', '', '07:59 15-4-2020', '15-4-2020', '07:59', 'Staff', '', '', 'sintsladman / s', '', '', '', ''),
('in', '6311235954083', 'Sontsonga Gladman', '', '', '', '07:50 07-5-2020', '2020/07/05', '07:50', 'Staff', '', '', 'Sontsonga  / Gladman', '', 'work', '', ''),
('in', '6311235954083', 'SSontsongs', '', '', '', '07:54 11-5-2020', '2020/11/05', '07:54', 'Staff', '', '', 'S / Sontsongs', '', 'M,', '', ''),
('out', '6311235954083', '', '', '', '', '16:25 08-5-2020', '2020/08/05', '16:25', 'Staff', '', '', 'G / Sontsonga', '', 'M', '', ''),
('out', '6311235954083', '', '', '', '', '16:27 07-5-2020', '2020/07/05', '16:27', 'Staff', '', '', 'Sontsonga  / Gladman', '', 'work', '', ''),
('out', '6311235954083', '', '', '', '', '16:28 06-5-2020', '2020/06/05', '16:28', 'Staff', '', '', 'g / sontsonga', '', 'work', '', ''),
('out', '6311235954083', '', '', '', '', '16:26 05-5-2020', '2020/05/05', '16:26', 'Staff', '', '', 'G / Sontsonga', '', 'M', '', ''),
('out', '6311235954083', '', '', '', '', '16:27 04-5-2020', '2020/04/05', '16:27', 'Staff', '', '', 'G / Sontsonga', '', 'Mantainance', '', ''),
('out', '6311235954083', '', '', '', '', '16:28 30-4-2020', '30-4-2020', '16:28', 'Staff', '', '', 'G / Sontsonga', '', '', '', ''),
('out', '6311235954083', '', '', '', '', '16:27 29-4-2020', '29-4-2020', '16:27', 'Staff', '', '', 'G / Sontsonga', '', '', '', ''),
('out', '6311235954083', '', '', '', '', '16:30 28-4-2020', '28-4-2020', '16:30', 'Staff', '', '', 'G / Sontsonga', '', '', '', ''),
('out', '6311235954083', '', '', '', '', '16:29 24-4-2020', '24-4-2020', '16:29', 'Staff', '', '', 'G / Sontsonga', '', '', '', ''),
('out', '6311235954083', '', '', '', '', '16:34 23-4-2020', '23-4-2020', '16:34', 'Staff', '', '', 'G / Sontsonga', '', '', '', ''),
('out', '6311235954083', '', '', '', '', '16:30 22-4-2020', '22-4-2020', '16:30', 'Staff', '', '', 'G / Sontsonga', '', '', '', ''),
('out', '6311235954083', '', '', '', '', '16:30 21-4-2020', '21-4-2020', '16:30', 'Staff', '', '', 'G / Sontsonga', '', '', '', ''),
('out', '6311235954083', '', '', '', '', '12:15 20-4-2020', '20-4-2020', '12:15', 'Staff', '', '', 'Gladman / Sontsonga', '', '', '', ''),
('out', '6311235954083', '', '', '', '', '10:58 17-4-2020', '17-4-2020', '10:58', 'Staff', '', '', 'G / Sontsonga', '', '', '', ''),
('out', '6311235954083', '', '', '', '', '10:04 15-4-2020', '15-4-2020', '10:04', 'Staff', '', '', 'sintsladman / s', '', '', '', ''),
('out', '6311235954083', '', '', '', '', '10:38 14-4-2020', '14-4-2020', '10:38', 'Staff', '', '', 'G / Sontsonga', '', '', '', ''),
('in', '6312030723087', 'E.PTsolekile', '', '', '', '17:53 27-4-2020', '27-4-2020', '17:53', 'Staff', '', '', 'E.P / Tsolekile', '', '', '', ''),
('in', '6312030723087', 'E.PTsolekile', '', '', '', '17:39 23-4-2020', '23-4-2020', '17:39', 'Staff', '', '', 'E.P / Tsolekile', '', '', '', ''),
('in', '6312030723087', 'E.PTsolekile', '', '', '', '17:54 22-4-2020', '22-4-2020', '17:54', 'Staff', '', '', 'E.P / Tsolekile', '', '', '', ''),
('in', '6312030723087', 'E.PTsolekile', '', '', '', '18:12 17-4-2020', '17-4-2020', '18:12', 'Staff', '', '', 'E.P / Tsolekile', '', '', '', ''),
('in', '6312030723087', 'ellicia pumzatsolekile', '', '', '', '17:57 19-4-2020', '19-4-2020', '17:57', 'Staff', '', '', 'ellicia pumza / tsolekile', '', '', '', ''),
('in', '6312030723087', 'Ellicia Tsolekilepumza', '', '', '', '17:46 06-5-2020', '2020/06/05', '17:46', 'Staff', '', '', 'Ellicia Tsolekile / pumza', '', '208', '', ''),
('in', '6312030723087', 'ElliciaTsolekile', '', '', '', '18:00 03-5-2020', '2020/03/05', '18:00', 'Staff', '', '', 'Ellicia / Tsolekile', '', '208', '', ''),
('in', '6312030723087', 'elliciatsolekule', '', '', '', '18:05 18-4-2020', '18-4-2020', '18:05', 'Staff', '', '', 'ellicia / tsolekule', '', '', '', ''),
('in', '6312030723087', 'EPTsolekile', '', '', '', '17:56 28-4-2020', '28-4-2020', '17:56', 'Staff', '', '', 'EP / Tsolekile', '', '', '', ''),
('in', '6312030723087', 'Phumza TsolekileAlicia Tsolekil', '', '', '', '17:45 13-4-2020', '13-4-2020', '17:45', 'Staff', '', '', 'Phumza Tsolekile / Alicia Tsolekil', '', '', '', ''),
('in', '6312030723087', 'Pumza TsolekileAllicia Tsolekile', '', '', '', '18:05 14-4-2020', '14-4-2020', '18:05', 'Staff', '', '', 'Pumza Tsolekile / Allicia Tsolekile', '', '', '', ''),
('in', '6312030723087', 'tsolekileellicia', '', '', '', '17:54 02-5-2020', '2020/02/05', '17:54', 'Staff', '', '', 'tsolekile / ellicia', '', '208', '', ''),
('in', '6312030723087', 'tsolekileellicia', '', '', '', '17:51 01-5-2020', '2020/01/05', '17:51', 'Staff', '', '', 'tsolekile / ellicia', '', '208', '', ''),
('in', '6312030723087', 'tsolekilepumza', '', '', '', '17:45 07-5-2020', '2020/07/05', '17:45', 'Staff', '', '', 'tsolekile / pumza', '', '208', '', ''),
('out', '6312030723087', '', '', '', '', '06:59 08-5-2020', '2020/08/05', '06:59', 'Staff', '', '', 'tsolekile / pumza', '', '208', '', ''),
('out', '6312030723087', '', '', '', '', '07:14 07-5-2020', '2020/07/05', '07:14', 'Staff', '', '', 'Ellicia Tsolekile / pumza', '', '208', '', ''),
('out', '6312030723087', '', '', '', '', '07:10 04-5-2020', '2020/04/05', '07:10', 'Staff', '', '', 'Ellicia / Tsolekile', '', '208', '', ''),
('out', '6312030723087', '', '', '', '', '07:01 03-5-2020', '2020/03/05', '07:01', 'Staff', '', '', 'tsolekile / ellicia', '', '208', '', ''),
('out', '6312030723087', '', '', '', '', '07:16 02-5-2020', '2020/02/05', '07:16', 'Staff', '', '', 'tsolekile / ellicia', '', '208', '', ''),
('out', '6312030723087', '', '', '', '', '07:08 29-4-2020', '29-4-2020', '07:08', 'Staff', '', '', 'EP / Tsolekile', '', '', '', ''),
('out', '6312030723087', '', '', '', '', '07:08 28-4-2020', '28-4-2020', '07:08', 'Staff', '', '', 'E.P / Tsolekile', '', '', '', ''),
('out', '6312030723087', '', '', '', '', '07:10 24-4-2020', '24-4-2020', '07:10', 'Staff', '', '', 'E.P / Tsolekile', '', '', '', ''),
('out', '6312030723087', '', '', '', '', '07:02 23-4-2020', '23-4-2020', '07:02', 'Staff', '', '', 'E.P / Tsolekile', '', '', '', ''),
('out', '6312030723087', '', '', '', '', '07:03 20-4-2020', '20-4-2020', '07:03', 'Staff', '', '', 'ellicia pumza / tsolekile', '', '', '', ''),
('out', '6312030723087', '', '', '', '', '06:47 19-4-2020', '19-4-2020', '06:47', 'Staff', '', '', 'ellicia / tsolekule', '', '', '', ''),
('out', '6312030723087', '', '', '', '', '06:40 18-4-2020', '18-4-2020', '06:40', 'Staff', '', '', 'E.P / Tsolekile', '', '', '', ''),
('out', '6312030723087', '', '', '', '', '07:03 15-4-2020', '15-4-2020', '07:03', 'Staff', '', '', 'Pumza Tsolekile / Allicia Tsolekile', '', '', '', ''),
('out', '6312030723087', '', '', '', '', '07:09 14-4-2020', '14-4-2020', '07:09', 'Staff', '', '', 'Phumza Tsolekile / Alicia Tsolekil', '', '', '', ''),
('in', '6401016265088', 'GrootboomThamsanqa', '', '', '', '07:18 07-5-2020', '2020/07/05', '07:18', 'Staff', '', '', 'Grootboom / Thamsanqa', '', 'work', '', ''),
('in', '6401016265088', 'T.RGrootboom', '', '', '', '07:24 05-5-2020', '2020/05/05', '07:24', 'Staff', '', '', 'T.R / Grootboom', '', 'K G', '', ''),
('in', '6401016265088', 'TRGrootboom', '', '', '', '07:26 11-5-2020', '2020/11/05', '07:26', 'Staff', '', '', 'TR / Grootboom', '', 'KG', '', ''),
('in', '6401016265088', 'TRGrootboom', '', '', '', '07:26 08-5-2020', '2020/08/05', '07:26', 'Staff', '', '', 'TR / Grootboom', '', 'KG', '', ''),
('in', '6401016265088', 'TRGrootboom', '', '', '', '07:19 04-5-2020', '2020/04/05', '07:19', 'Staff', '', '', 'TR / Grootboom', '', 'Kenton Gardens', '', ''),
('in', '6401016265088', 'TRGrootboom', '', '', '', '07:03 30-4-2020', '30-4-2020', '07:03', 'Staff', '', '', 'TR / Grootboom', '', '', '', ''),
('out', '6401016265088', '', '', '', '', '16:16 08-5-2020', '2020/08/05', '16:16', 'Staff', '', '', 'TR / Grootboom', '', 'KG', '', ''),
('out', '6401016265088', '', '', '', '', '16:25 07-5-2020', '2020/07/05', '16:25', 'Staff', '', '', 'Grootboom / Thamsanqa', '', 'work', '', ''),
('out', '6401016265088', '', '', '', '', '16:25 05-5-2020', '2020/05/05', '16:25', 'Staff', '', '', 'T.R / Grootboom', '', 'K G', '', ''),
('out', '6401016265088', '', '', '', '', '16:25 04-5-2020', '2020/04/05', '16:25', 'Staff', '', '', 'TR / Grootboom', '', 'Kenton Gardens', '', ''),
('out', '6401016265088', '', '', '', '', '07:49 30-4-2020', '30-4-2020', '07:49', 'Staff', '', '', 'TR / Grootboom', '', '', '', ''),
('out', '6402290463084', '', '', '', '', '07:06 11-5-2020', '2020/11/05', '07:06', 'Staff', '', '', '', '', '', '', ''),
('out', '6402290463084', '', '', '', '', '07:09 10-5-2020', '2020/10/05', '07:09', 'Staff', '', '', '', '', '', '', ''),
('out', '6402290463084', '', '', '', '', '07:10 06-5-2020', '2020/06/05', '07:10', 'Staff', '', '', '', '', '', '', ''),
('out', '6402290463084', '', '', '', '', '07:15 05-5-2020', '2020/05/05', '07:15', 'Staff', '', '', '', '', '', '', ''),
('out', '6402290463084', '', '', '', '', '06:59 01-5-2020', '2020/01/05', '06:59', 'Staff', '', '', '', '', '', '', ''),
('out', '6402290463084', '', '', '', '', '06:48 30-4-2020', '30-4-2020', '06:48', 'Staff', '', '', '', '', '', '', ''),
('out', '6402290463084', '', '', '', '', '07:08 27-4-2020', '27-4-2020', '07:08', 'Staff', '', '', '', '', '', '', ''),
('out', '6402290463084', '', '', '', '', '07:03 26-4-2020', '26-4-2020', '07:03', 'Staff', '', '', '', '', '', '', ''),
('out', '6402290463084', '', '', '', '', '07:05 25-4-2020', '25-4-2020', '07:05', 'Staff', '', '', '', '', '', '', ''),
('out', '6402290463084', '', '', '', '', '07:07 22-4-2020', '22-4-2020', '07:07', 'Staff', '', '', '', '', '', '', ''),
('out', '6402290463084', '', '', '', '', '07:11 21-4-2020', '21-4-2020', '07:11', 'Staff', '', '', '', '', '', '', ''),
('out', '6402290463084', '', '', '', '', '07:07 17-4-2020', '17-4-2020', '07:07', 'Staff', '', '', '', '', '', '', ''),
('out', '6402290463084', '', '', '', '', '07:09 16-4-2020', '16-4-2020', '07:09', 'Staff', '', '', '', '', '', '', ''),
('out', '6402290463084', '', '', '', '', '07:07 12-4-2020', '2020/12/04', '07:07', 'Staff', '', '', '', '', '', '', ''),
('out', '6402290463084', '', '', '', '', '06:57 11-4-2020', '2020/11/04', '06:57', 'Staff', '', '', '', '', '', '', ''),
('in', '6501010740083', 'FMGengqani', '', '', '', '07:53 11-5-2020', '2020/11/05', '07:53', 'Staff', '', '', 'FM / Gengqani', '', '175', '', ''),
('in', '6501010740083', 'FUNEKA MIRRIAMQENGQANI', '', '', '6501010740083', '08:00 08-5-2020', '2020/08/05', '08:00', 'Staff', '', '', 'FUNEKA MIRRIAM / QENGQANI', '', '175', '', ''),
('out', '6501010740083', 'FUNEKA MIRRIAMQENGQANI', '', '', '6501010740083', '12:46 08-5-2020', '2020/08/05', '12:46', 'Staff', '', '', 'FUNEKA MIRRIAM / QENGQANI', '', '175', '', ''),
('in', '6501010740083', 'FUNEKA MIRRIAMQENGQANI', '', '', '6501010740083', '07:57 07-5-2020', '2020/07/05', '07:57', 'Staff', '', '', 'FUNEKA MIRRIAM / QENGQANI', '', 'work', '', ''),
('out', '6501010740083', '', '', '', '', '13:21 07-5-2020', '2020/07/05', '13:21', 'Staff', '', '', 'FUNEKA MIRRIAM / QENGQANI', '', 'work', '', ''),
('out', '6501010740083', '', '', '', '', '15:01 06-5-2020', '2020/06/05', '15:01', 'Staff', '', '', '', '', '', '', ''),
('out', '6503165013084', '', '', '', '', '11:05 24-4-2020', '24-4-2020', '11:05', 'Visitors', '', '', '', '', '', '', ''),
('in', '6507205851080', 'THANDEKILEKOMENI', '', '', '6507205851080', '07:37 08-5-2020', '2020/08/05', '07:37', 'Staff', '', '', 'THANDEKILE / KOMENI', '', 'M', '', ''),
('out', '6507205851080', 'THANDEKILEKOMENI', '', '', '6507205851080', '16:27 08-5-2020', '2020/08/05', '16:27', 'Staff', '', '', 'THANDEKILE / KOMENI', '', 'M', '', ''),
('in', '6507205851080', 'THANDEKILEKOMENI', '', '', '6507205851080', '07:39 07-5-2020', '2020/07/05', '07:39', 'Staff', '', '', 'THANDEKILE / KOMENI', '', 'Work', '', ''),
('out', '6507205851080', 'THANDEKILEKOMENI', '', '', '6507205851080', '16:29 07-5-2020', '2020/07/05', '16:29', 'Staff', '', '', 'THANDEKILE / KOMENI', '', 'Work', '', ''),
('in', '6507205851080', 'THANDEKILEKOMENI', '', '', '6507205851080', '07:44 04-5-2020', '2020/04/05', '07:44', 'Staff', '', '', 'THANDEKILE / KOMENI', '', 'Mantainance', '', ''),
('out', '6507205851080', 'THANDEKILEKOMENI', '', '', '6507205851080', '16:28 04-5-2020', '2020/04/05', '16:28', 'Staff', '', '', 'THANDEKILE / KOMENI', '', 'Mantainance', '', ''),
('in', '6507205851080', 'THANDEKILEKOMENI', '', '', '6507205851080', '07:41 30-4-2020', '30-4-2020', '07:41', 'Staff', '', '', 'THANDEKILE / KOMENI', '', '', '', ''),
('out', '6507205851080', 'THANDEKILEKOMENI', '', '', '6507205851080', '16:29 30-4-2020', '30-4-2020', '16:29', 'Staff', '', '', 'THANDEKILE / KOMENI', '', '', '', ''),
('out', '6507205851080', 'THANDEKILEKOMENI', '', '', '6507205851080', '16:28 29-4-2020', '29-4-2020', '16:28', 'Staff', '', '', 'T / Nkomeni', '', '', '', ''),
('out', '6507205851080', 'THANDEKILEKOMENI', '', '', '6507205851080', '16:32 28-4-2020', '28-4-2020', '16:32', 'Staff', '', '', 'T / Nkomeni', '', '', '', ''),
('in', '6507205851080', 'Tk', '', '', '', '07:55 11-5-2020', '2020/11/05', '07:55', 'Staff', '', '', 'T / k', '', 'm', '', ''),
('in', '6507205851080', 'tkhumeni', '', '', '', '07:30 06-5-2020', '2020/06/05', '07:30', 'Staff', '', '', 't / khumeni', '', 'work', '', ''),
('in', '6507205851080', 'TKomene', '', '', '', '07:39 05-5-2020', '2020/05/05', '07:39', 'Staff', '', '', 'T / Komene', '', 'M', '', ''),
('in', '6507205851080', 'TNkomeni', '', '', '', '07:43 29-4-2020', '29-4-2020', '07:43', 'Staff', '', '', 'T / Nkomeni', '', '', '', ''),
('in', '6507205851080', 'TNkomeni', '', '', '', '08:08 28-4-2020', '28-4-2020', '08:08', 'Staff', '', '', 'T / Nkomeni', '', '', '', ''),
('out', '6507205851080', '', '', '', '', '16:26 05-5-2020', '2020/05/05', '16:26', 'Staff', '', '', 'T / Komene', '', 'M', '', ''),
('in', '6509100150089', 'NontsikeleloThonga', '', '', '', '08:06 20-4-2020', '20-4-2020', '08:06', 'Staff', '', '', 'Nontsikelelo / Thonga', '', '', '', ''),
('in', '6509100150089', 'NontsikeleloThonga', '', '', '', '08:02 14-4-2020', '14-4-2020', '08:02', 'Staff', '', '', 'Nontsikelelo / Thonga', '', '', '', ''),
('in', '6509100150089', 'NThonga', '', '', '', '08:00 09-5-2020', '2020/09/05', '08:00', 'Staff', '', '', 'N / Thonga', '', '157', '', ''),
('in', '6509100150089', 'NThonga', '', '', '', '07:59 08-5-2020', '2020/08/05', '07:59', 'Staff', '', '', 'N / Thonga', '', '157', '', ''),
('in', '6509100150089', 'NThonga', '', '', '', '10:16 06-5-2020', '2020/06/05', '10:16', 'Staff', '', '', 'N / Thonga', '', 'work', '', ''),
('in', '6509100150089', 'NThonga', '', '', '', '08:03 05-5-2020', '2020/05/05', '08:03', 'Staff', '', '', 'N / Thonga', '', 'Unit 157', '', ''),
('in', '6509100150089', 'NThonga', '', '', '', '08:01 04-5-2020', '2020/04/05', '08:01', 'Staff', '', '', 'N / Thonga', '', 'Unit 157', '', ''),
('in', '6509100150089', 'NThonga', '', '', '', '08:07 01-5-2020', '2020/01/05', '08:07', 'Staff', '', '', 'N / Thonga', '', '157', '', ''),
('in', '6509100150089', 'NThonga', '', '', '', '08:00 30-4-2020', '30-4-2020', '08:00', 'Staff', '', '', 'N / Thonga', '', '', '', ''),
('in', '6509100150089', 'NThonga', '', '', '', '08:08 29-4-2020', '29-4-2020', '08:08', 'Staff', '', '', 'N / Thonga', '', '', '', ''),
('in', '6509100150089', 'NThonga', '', '', '', '10:01 28-4-2020', '28-4-2020', '10:01', 'Staff', '', '', 'N / Thonga', '', '', '', ''),
('in', '6509100150089', 'NThonga', '', '', '', '08:08 27-4-2020', '27-4-2020', '08:08', 'Staff', '', '', 'N / Thonga', '', '', '', ''),
('in', '6509100150089', 'NThonga', '', '', '', '08:11 25-4-2020', '25-4-2020', '08:11', 'Staff', '', '', 'N / Thonga', '', '', '', ''),
('in', '6509100150089', 'NThonga', '', '', '', '08:08 24-4-2020', '24-4-2020', '08:08', 'Staff', '', '', 'N / Thonga', '', '', '', ''),
('in', '6509100150089', 'NThonga', '', '', '', '08:07 23-4-2020', '23-4-2020', '08:07', 'Staff', '', '', 'N / Thonga', '', '', '', ''),
('in', '6509100150089', 'NThonga', '', '', '', '08:05 22-4-2020', '22-4-2020', '08:05', 'Staff', '', '', 'N / Thonga', '', '', '', ''),
('in', '6509100150089', 'NThonga', '', '', '', '08:09 21-4-2020', '21-4-2020', '08:09', 'Staff', '', '', 'N / Thonga', '', '', '', ''),
('in', '6509100150089', 'NThonga', '', '', '', '08:11 18-4-2020', '18-4-2020', '08:11', 'Staff', '', '', 'N / Thonga', '', '', '', ''),
('in', '6509100150089', 'NThonga', '', '', '', '08:04 17-4-2020', '17-4-2020', '08:04', 'Staff', '', '', 'N / Thonga', '', '', '', ''),
('in', '6509100150089', 'NThonga', '', '', '', '08:09 16-4-2020', '16-4-2020', '08:09', 'Staff', '', '', 'N / Thonga', '', '', '', ''),
('in', '6509100150089', 'NThonga', '', '', '', '08:02 11-4-2020', '2020/11/04', '08:02', 'Staff', '', '', 'N / Thonga', '', '', '', ''),
('in', '6509100150089', 'NtsikiThonga', '', '', '', '09:28 02-5-2020', '2020/02/05', '09:28', 'Staff', '', '', 'Ntsiki / Thonga', '', '157', '', ''),
('in', '6509100150089', 'Thongan', '', '', '', '08:26 15-4-2020', '15-4-2020', '08:26', 'Staff', '', '', 'Thonga / n', '', '', '', ''),
('in', '6509100150089', 'ThongaNontsikelelo', '', '', '', '07:57 07-5-2020', '2020/07/05', '07:57', 'Staff', '', '', 'Thonga / Nontsikelelo', '', 'work', '', ''),
('in', '6509100150089', 'TThonga', '', '', '', '07:59 11-5-2020', '2020/11/05', '07:59', 'Staff', '', '', 'T / Thonga', '', '157', '', ''),
('out', '6509100150089', '', '', '', '', '13:12 09-5-2020', '2020/09/05', '13:12', 'Staff', '', '', 'N / Thonga', '', '157', '', ''),
('out', '6509100150089', '', '', '', '', '15:11 08-5-2020', '2020/08/05', '15:11', 'Staff', '', '', 'N / Thonga', '', '157', '', ''),
('out', '6509100150089', '', '', '', '', '15:05 07-5-2020', '2020/07/05', '15:05', 'Staff', '', '', 'Thonga / Nontsikelelo', '', 'work', '', ''),
('out', '6509100150089', '', '', '', '', '15:08 06-5-2020', '2020/06/05', '15:08', 'Staff', '', '', 'N / Thonga', '', 'work', '', ''),
('out', '6509100150089', '', '', '', '', '15:19 05-5-2020', '2020/05/05', '15:19', 'Staff', '', '', 'N / Thonga', '', 'Unit 157', '', ''),
('out', '6509100150089', '', '', '', '', '15:13 04-5-2020', '2020/04/05', '15:13', 'Staff', '', '', 'N / Thonga', '', 'Unit 157', '', ''),
('out', '6509100150089', '', '', '', '', '13:24 02-5-2020', '2020/02/05', '13:24', 'Staff', '', '', 'Ntsiki / Thonga', '', '157', '', ''),
('out', '6509100150089', '', '', '', '', '15:08 01-5-2020', '2020/01/05', '15:08', 'Staff', '', '', 'N / Thonga', '', '157', '', ''),
('out', '6509100150089', '', '', '', '', '14:10 30-4-2020', '30-4-2020', '14:10', 'Staff', '', '', 'N / Thonga', '', '', '', ''),
('out', '6509100150089', '', '', '', '', '14:09 29-4-2020', '29-4-2020', '14:09', 'Staff', '', '', 'N / Thonga', '', '', '', ''),
('out', '6509100150089', '', '', '', '', '15:13 28-4-2020', '28-4-2020', '15:13', 'Staff', '', '', 'N / Thonga', '', '', '', ''),
('out', '6509100150089', '', '', '', '', '15:01 27-4-2020', '27-4-2020', '15:01', 'Staff', '', '', 'N / Thonga', '', '', '', ''),
('out', '6509100150089', '', '', '', '', '13:30 25-4-2020', '25-4-2020', '13:30', 'Staff', '', '', 'N / Thonga', '', '', '', ''),
('out', '6509100150089', '', '', '', '', '15:05 24-4-2020', '24-4-2020', '15:05', 'Staff', '', '', 'N / Thonga', '', '', '', ''),
('out', '6509100150089', '', '', '', '', '15:09 23-4-2020', '23-4-2020', '15:09', 'Staff', '', '', 'N / Thonga', '', '', '', ''),
('out', '6509100150089', '', '', '', '', '15:11 22-4-2020', '22-4-2020', '15:11', 'Staff', '', '', 'N / Thonga', '', '', '', ''),
('out', '6509100150089', '', '', '', '', '15:10 21-4-2020', '21-4-2020', '15:10', 'Staff', '', '', 'N / Thonga', '', '', '', ''),
('out', '6509100150089', '', '', '', '', '15:18 20-4-2020', '20-4-2020', '15:18', 'Staff', '', '', 'Nontsikelelo / Thonga', '', '', '', ''),
('out', '6509100150089', '', '', '', '', '09:28 19-4-2020', '19-4-2020', '09:28', 'Staff', '', '', 'N / Thonga', '', '', '', ''),
('out', '6509100150089', '', '', '', '', '15:09 17-4-2020', '17-4-2020', '15:09', 'Staff', '', '', 'N / Thonga', '', '', '', ''),
('out', '6509100150089', '', '', '', '', '15:08 16-4-2020', '16-4-2020', '15:08', 'Staff', '', '', 'N / Thonga', '', '', '', ''),
('out', '6509100150089', '', '', '', '', '15:05 15-4-2020', '15-4-2020', '15:05', 'Staff', '', '', 'Thonga / n', '', '', '', ''),
('out', '6509100150089', '', '', '', '', '15:08 14-4-2020', '14-4-2020', '15:08', 'Staff', '', '', 'Nontsikelelo / Thonga', '', '', '', ''),
('out', '6509100150089', '', '', '', '', '12:55 11-4-2020', '2020/11/04', '12:55', 'Staff', '', '', 'N / Thonga', '', '', '', ''),
('in', '6512260276082', 'JMposelwa', '', '', '', '07:48 08-5-2020', '2020/08/05', '07:48', 'Staff', '', '', 'J / Mposelwa', '', 'Unit 226', '', ''),
('in', '6609160323087', 'Ditalap', '', '', '', '08:00 15-4-2020', '15-4-2020', '08:00', 'Staff', '', '', 'Ditala / p', '', '', '', ''),
('in', '6609160323087', 'DitanaPindiwe', '', '', '', '07:52 13-4-2020', '13-4-2020', '07:52', 'Staff', '', '', 'Ditana / Pindiwe', '', '', '', ''),
('in', '6609160323087', 'PD', '', '', '', '07:53 09-5-2020', '2020/09/05', '07:53', 'Staff', '', '', 'P / D', '', 'l', '', ''),
('in', '6609160323087', 'PDitala', '', '', '', '07:48 11-5-2020', '2020/11/05', '07:48', 'Staff', '', '', 'P / Ditala', '', 'L', '', ''),
('in', '6609160323087', 'PDitala', '', '', '', '07:50 05-5-2020', '2020/05/05', '07:50', 'Staff', '', '', 'P / Ditala', '', 'L', '', ''),
('in', '6609160323087', 'PDitala', '', '', '', '08:04 29-4-2020', '29-4-2020', '08:04', 'Staff', '', '', 'P / Ditala', '', '', '', ''),
('in', '6609160323087', 'PDitala', '', '', '', '07:48 27-4-2020', '27-4-2020', '07:48', 'Staff', '', '', 'P / Ditala', '', '', '', ''),
('in', '6609160323087', 'PDitala', '', '', '', '07:47 25-4-2020', '25-4-2020', '07:47', 'Staff', '', '', 'P / Ditala', '', '', '', ''),
('in', '6609160323087', 'PDitala', '', '', '', '08:15 24-4-2020', '24-4-2020', '08:15', 'Staff', '', '', 'P / Ditala', '', '', '', ''),
('in', '6609160323087', 'PDitala', '', '', '', '08:16 23-4-2020', '23-4-2020', '08:16', 'Staff', '', '', 'P / Ditala', '', '', '', ''),
('in', '6609160323087', 'PDitala', '', '', '', '07:49 22-4-2020', '22-4-2020', '07:49', 'Staff', '', '', 'P / Ditala', '', '', '', ''),
('in', '6609160323087', 'PDitala', '', '', '', '07:50 17-4-2020', '17-4-2020', '07:50', 'Staff', '', '', 'P / Ditala', '', '', '', ''),
('in', '6609160323087', 'PDitala', '', '', '', '07:52 11-4-2020', '2020/11/04', '07:52', 'Staff', '', '', 'P / Ditala', '', '', '', ''),
('in', '6609160323087', 'PDitals', '', '', '', '07:50 28-4-2020', '28-4-2020', '07:50', 'Staff', '', '', 'P / Ditals', '', '', '', ''),
('in', '6609160323087', 'PDitana', '', '', '', '07:52 04-5-2020', '2020/04/05', '07:52', 'Staff', '', '', 'P / Ditana', '', 'Laundry', '', ''),
('in', '6609160323087', 'PDitana', '', '', '', '07:50 01-5-2020', '2020/01/05', '07:50', 'Staff', '', '', 'P / Ditana', '', 'laundry', '', ''),
('in', '6609160323087', 'PDitani', '', '', '', '07:47 08-5-2020', '2020/08/05', '07:47', 'Staff', '', '', 'P / Ditani', '', 'Laundry', '', ''),
('in', '6609160323087', 'PDitsla', '', '', '', '07:50 30-4-2020', '30-4-2020', '07:50', 'Staff', '', '', 'P / Ditsla', '', '', '', ''),
('in', '6609160323087', 'Pditsos', '', '', '', '07:50 16-4-2020', '16-4-2020', '07:50', 'Staff', '', '', 'P / ditsos', '', '', '', ''),
('in', '6609160323087', 'PindiweDitana', '', '', '', '07:50 20-4-2020', '20-4-2020', '07:50', 'Staff', '', '', 'Pindiwe / Ditana', '', '', '', ''),
('in', '6609160323087', 'PindiweDitana', '', '', '', '07:52 14-4-2020', '14-4-2020', '07:52', 'Staff', '', '', 'Pindiwe / Ditana', '', '', '', ''),
('in', '6609160323087', 'PPDitala', '', '', '', '07:52 21-4-2020', '21-4-2020', '07:52', 'Staff', '', '', 'PP / Ditala', '', '', '', ''),
('out', '6609160323087', '', '', '', '', '12:46 09-5-2020', '2020/09/05', '12:46', 'Staff', '', '', 'P / D', '', 'l', '', ''),
('out', '6609160323087', '', '', '', '', '15:57 08-5-2020', '2020/08/05', '15:57', 'Staff', '', '', 'P / Ditani', '', 'Laundry', '', ''),
('out', '6609160323087', '', '', '', '', '15:57 05-5-2020', '2020/05/05', '15:57', 'Staff', '', '', 'P / Ditala', '', 'L', '', ''),
('out', '6609160323087', '', '', '', '', '15:58 04-5-2020', '2020/04/05', '15:58', 'Staff', '', '', 'P / Ditana', '', 'Laundry', '', ''),
('out', '6609160323087', '', '', '', '', '15:56 01-5-2020', '2020/01/05', '15:56', 'Staff', '', '', 'P / Ditana', '', 'laundry', '', ''),
('out', '6609160323087', '', '', '', '', '15:57 30-4-2020', '30-4-2020', '15:57', 'Staff', '', '', 'P / Ditsla', '', '', '', ''),
('out', '6609160323087', '', '', '', '', '15:58 29-4-2020', '29-4-2020', '15:58', 'Staff', '', '', 'P / Ditala', '', '', '', ''),
('out', '6609160323087', '', '', '', '', '15:57 28-4-2020', '28-4-2020', '15:57', 'Staff', '', '', 'P / Ditals', '', '', '', ''),
('out', '6609160323087', '', '', '', '', '15:52 27-4-2020', '27-4-2020', '15:52', 'Staff', '', '', 'P / Ditala', '', '', '', ''),
('out', '6609160323087', '', '', '', '', '13:06 25-4-2020', '25-4-2020', '13:06', 'Staff', '', '', 'P / Ditala', '', '', '', ''),
('out', '6609160323087', '', '', '', '', '15:51 24-4-2020', '24-4-2020', '15:51', 'Staff', '', '', 'P / Ditala', '', '', '', ''),
('out', '6609160323087', '', '', '', '', '15:53 23-4-2020', '23-4-2020', '15:53', 'Staff', '', '', 'P / Ditala', '', '', '', ''),
('out', '6609160323087', '', '', '', '', '16:01 22-4-2020', '22-4-2020', '16:01', 'Staff', '', '', 'P / Ditala', '', '', '', ''),
('out', '6609160323087', '', '', '', '', '15:58 21-4-2020', '21-4-2020', '15:58', 'Staff', '', '', 'PP / Ditala', '', '', '', ''),
('out', '6609160323087', '', '', '', '', '15:55 20-4-2020', '20-4-2020', '15:55', 'Staff', '', '', 'Pindiwe / Ditana', '', '', '', ''),
('out', '6609160323087', '', '', '', '', '15:56 17-4-2020', '17-4-2020', '15:56', 'Staff', '', '', 'P / Ditala', '', '', '', ''),
('out', '6609160323087', '', '', '', '', '16:04 16-4-2020', '16-4-2020', '16:04', 'Staff', '', '', 'P / ditsos', '', '', '', ''),
('out', '6609160323087', '', '', '', '', '15:55 15-4-2020', '15-4-2020', '15:55', 'Staff', '', '', 'Ditala / p', '', '', '', ''),
('out', '6609160323087', '', '', '', '', '15:51 14-4-2020', '14-4-2020', '15:51', 'Staff', '', '', 'Pindiwe / Ditana', '', '', '', '');
INSERT INTO `atthegate` (`direction`, `license`, `name`, `company`, `category`, `dr_license`, `creation`, `recdate`, `rectime`, `profile`, `incidents`, `dr_name`, `name_in`, `name_out`, `going`, `company2`, `visiting`) VALUES
('out', '6609160323087', '', '', '', '', '15:51 13-4-2020', '13-4-2020', '15:51', 'Staff', '', '', 'Ditana / Pindiwe', '', '', '', ''),
('out', '6609160323087', '', '', '', '', '12:55 11-4-2020', '2020/11/04', '12:55', 'Staff', '', '', 'P / Ditala', '', '', '', ''),
('in', '6703130360087', 'L.E.Norongwa', '', '', '', '06:57 20-4-2020', '20-4-2020', '06:57', 'Staff', '', '', 'L.E. / Norongwa', '', '', '', ''),
('in', '6703130360087', 'L.E.Norongwana', '', '', '', '07:00 14-4-2020', '14-4-2020', '07:00', 'Staff', '', '', 'L.E. / Norongwana', '', '', '', ''),
('in', '6703130360087', 'LE Norongwana', '', '', '', '07:02 08-5-2020', '2020/08/05', '07:02', 'Staff', '', '', 'LE  / Norongwana', '', 'Care Centre', '', ''),
('in', '6703130360087', 'LE Norongwana', '', '', '', '07:01 05-5-2020', '2020/05/05', '07:01', 'Staff', '', '', 'LE  / Norongwana', '', 'Care Centre', '', ''),
('in', '6703130360087', 'LENigwala', '', '', '', '06:57 21-4-2020', '21-4-2020', '06:57', 'Staff', '', '', 'LE / Nigwala', '', '', '', ''),
('in', '6703130360087', 'LENorongwana', '', '', '', '06:56 11-5-2020', '2020/11/05', '06:56', 'Staff', '', '', 'LE / Norongwana', '', 'C/C', '', ''),
('in', '6703130360087', 'LENorongwana', '', '', '', '07:00 04-5-2020', '2020/04/05', '07:00', 'Staff', '', '', 'LE / Norongwana', '', 'Care Cenntre', '', ''),
('in', '6703130360087', 'LENorongwana', '', '', '', '07:02 30-4-2020', '30-4-2020', '07:02', 'Staff', '', '', 'LE / Norongwana', '', '', '', ''),
('in', '6703130360087', 'LENorongwana', '', '', '', '07:00 29-4-2020', '29-4-2020', '07:00', 'Staff', '', '', 'LE / Norongwana', '', '', '', ''),
('in', '6703130360087', 'LENorongwana', '', '', '', '06:55 28-4-2020', '28-4-2020', '06:55', 'Staff', '', '', 'LE / Norongwana', '', '', '', ''),
('in', '6703130360087', 'LENorongwana', '', '', '', '07:05 24-4-2020', '24-4-2020', '07:05', 'Staff', '', '', 'LE / Norongwana', '', '', '', ''),
('in', '6703130360087', 'LENorongwana', '', '', '', '07:05 23-4-2020', '23-4-2020', '07:05', 'Staff', '', '', 'LE / Norongwana', '', '', '', ''),
('in', '6703130360087', 'LENorongwana', '', '', '', '07:01 22-4-2020', '22-4-2020', '07:01', 'Staff', '', '', 'LE / Norongwana', '', '', '', ''),
('in', '6703130360087', 'LENorongwana', '', '', '', '07:04 17-4-2020', '17-4-2020', '07:04', 'Staff', '', '', 'LE / Norongwana', '', '', '', ''),
('in', '6703130360087', 'LENorongwana', '', '', '', '07:04 16-4-2020', '16-4-2020', '07:04', 'Staff', '', '', 'LE / Norongwana', '', '', '', ''),
('in', '6703130360087', 'LENorongwana', '', '', '', '07:08 15-4-2020', '15-4-2020', '07:08', 'Staff', '', '', 'LE / Norongwana', '', '', '', ''),
('in', '6703130360087', 'Lindelwa Norongwanl Norongwsna', '', '', '', '07:06 07-5-2020', '2020/07/05', '07:06', 'Staff', '', '', 'Lindelwa Norongwan / l Norongwsna', '', 'Frail care', '', ''),
('in', '6703130360087', 'lindelwanorhongwana', '', '', '', '07:01 06-5-2020', '2020/06/05', '07:01', 'Staff', '', '', 'lindelwa / norhongwana', '', 'frail care', '', ''),
('out', '6703130360087', '', '', '', '', '13:01 08-5-2020', '2020/08/05', '13:01', 'Staff', '', '', 'LE  / Norongwana', '', 'Care Centre', '', ''),
('out', '6703130360087', '', '', '', '', '15:54 07-5-2020', '2020/07/05', '15:54', 'Staff', '', '', 'Lindelwa Norongwan / l Norongwsna', '', 'Frail care', '', ''),
('out', '6703130360087', '', '', '', '', '15:54 06-5-2020', '2020/06/05', '15:54', 'Staff', '', '', 'lindelwa / norhongwana', '', 'frail care', '', ''),
('out', '6703130360087', '', '', '', '', '15:56 05-5-2020', '2020/05/05', '15:56', 'Staff', '', '', 'LE  / Norongwana', '', 'Care Centre', '', ''),
('out', '6703130360087', '', '', '', '', '15:53 04-5-2020', '2020/04/05', '15:53', 'Staff', '', '', 'LE / Norongwana', '', 'Care Cenntre', '', ''),
('out', '6703130360087', '', '', '', '', '15:54 30-4-2020', '30-4-2020', '15:54', 'Staff', '', '', 'LE / Norongwana', '', '', '', ''),
('out', '6703130360087', '', '', '', '', '15:55 29-4-2020', '29-4-2020', '15:55', 'Staff', '', '', 'LE / Norongwana', '', '', '', ''),
('out', '6703130360087', '', '', '', '', '15:55 28-4-2020', '28-4-2020', '15:55', 'Staff', '', '', 'LE / Norongwana', '', '', '', ''),
('out', '6703130360087', '', '', '', '', '13:01 24-4-2020', '24-4-2020', '13:01', 'Staff', '', '', 'LE / Norongwana', '', '', '', ''),
('out', '6703130360087', '', '', '', '', '15:52 23-4-2020', '23-4-2020', '15:52', 'Staff', '', '', 'LE / Norongwana', '', '', '', ''),
('out', '6703130360087', '', '', '', '', '15:59 22-4-2020', '22-4-2020', '15:59', 'Staff', '', '', 'LE / Norongwana', '', '', '', ''),
('out', '6703130360087', '', '', '', '', '15:48 21-4-2020', '21-4-2020', '15:48', 'Staff', '', '', 'LE / Nigwala', '', '', '', ''),
('out', '6703130360087', '', '', '', '', '15:52 20-4-2020', '20-4-2020', '15:52', 'Staff', '', '', 'L.E. / Norongwa', '', '', '', ''),
('out', '6703130360087', '', '', '', '', '13:01 17-4-2020', '17-4-2020', '13:01', 'Staff', '', '', 'LE / Norongwana', '', '', '', ''),
('out', '6703130360087', '', '', '', '', '15:53 16-4-2020', '16-4-2020', '15:53', 'Staff', '', '', 'LE / Norongwana', '', '', '', ''),
('out', '6703130360087', '', '', '', '', '15:53 15-4-2020', '15-4-2020', '15:53', 'Staff', '', '', 'LE / Norongwana', '', '', '', ''),
('out', '6703130360087', '', '', '', '', '15:53 14-4-2020', '14-4-2020', '15:53', 'Staff', '', '', 'L.E. / Norongwana', '', '', '', ''),
('in', '6704195587085', 'A CNobebe', '', '', '', '07:19 05-5-2020', '2020/05/05', '07:19', 'Staff', '', '', 'A C / Nobebe', '', 'K G,', '', ''),
('in', '6704195587085', 'A NobebeA B', '', '', '', '07:25 07-5-2020', '2020/07/05', '07:25', 'Staff', '', '', 'A Nobebe / A B', '', 'worj', '', ''),
('in', '6704195587085', 'A.CNobebe', '', '', '', '07:21 04-5-2020', '2020/04/05', '07:21', 'Staff', '', '', 'A.C / Nobebe', '', 'Kenton Gardens', '', ''),
('in', '6704195587085', 'ACNobebe', '', '', '', '07:22 11-5-2020', '2020/11/05', '07:22', 'Staff', '', '', 'AC / Nobebe', '', 'KG', '', ''),
('in', '6704195587085', 'ACNobebe', '', '', '', '07:24 08-5-2020', '2020/08/05', '07:24', 'Staff', '', '', 'AC / Nobebe', '', 'M', '', ''),
('in', '6704195587085', 'acnobebe', '', '', '', '07:19 06-5-2020', '2020/06/05', '07:19', 'Staff', '', '', 'ac / nobebe', '', 'work', '', ''),
('in', '6704195587085', 'ACNobebe', '', '', '', '07:23 30-4-2020', '30-4-2020', '07:23', 'Staff', '', '', 'AC / Nobebe', '', '', '', ''),
('out', '6704195587085', '', '', '', '', '16:01 08-5-2020', '2020/08/05', '16:01', 'Staff', '', '', 'AC / Nobebe', '', 'M', '', ''),
('out', '6704195587085', '', '', '', '', '16:25 07-5-2020', '2020/07/05', '16:25', 'Staff', '', '', 'A Nobebe / A B', '', 'worj', '', ''),
('out', '6704195587085', '', '', '', '', '16:28 06-5-2020', '2020/06/05', '16:28', 'Staff', '', '', 'ac / nobebe', '', 'work', '', ''),
('out', '6704195587085', '', '', '', '', '16:25 05-5-2020', '2020/05/05', '16:25', 'Staff', '', '', 'A C / Nobebe', '', 'K G,', '', ''),
('out', '6704195587085', '', '', '', '', '16:26 04-5-2020', '2020/04/05', '16:26', 'Staff', '', '', 'A.C / Nobebe', '', 'Kenton Gardens', '', ''),
('out', '6704195587085', '', '', '', '', '16:04 30-4-2020', '30-4-2020', '16:04', 'Staff', '', '', 'AC / Nobebe', '', '', '', ''),
('out', '6704195587085', '', '', '', '', '16:26 29-4-2020', '29-4-2020', '16:26', 'Staff', '', '', '', '', '', '', ''),
('in', '6705285756084', 'Mthwaloqondile', '', '', '', '07:30 07-5-2020', '2020/07/05', '07:30', 'Staff', '', '', 'Mthwalo / qondile', '', 'work', '', ''),
('in', '6705285756084', 'QMthwalo', '', '', '', '07:26 11-5-2020', '2020/11/05', '07:26', 'Staff', '', '', 'Q / Mthwalo', '', 'M', '', ''),
('in', '6705285756084', 'QMthwalo', '', '', '', '07:25 08-5-2020', '2020/08/05', '07:25', 'Staff', '', '', 'Q / Mthwalo', '', 'M', '', ''),
('out', '6705285756084', '', '', '', '', '16:23 08-5-2020', '2020/08/05', '16:23', 'Staff', '', '', 'Q / Mthwalo', '', 'M', '', ''),
('out', '6705285756084', '', '', '', '', '16:25 07-5-2020', '2020/07/05', '16:25', 'Staff', '', '', 'Mthwalo / qondile', '', 'work', '', ''),
('in', '6706030367086', 'N.JGwebile', '', '', '', '07:34 20-4-2020', '20-4-2020', '07:34', 'Staff', '', '', 'N.J / Gwebile', '', '', '', ''),
('in', '6706030367086', 'NJGwebile', '', '', '', '07:19 30-4-2020', '30-4-2020', '07:19', 'Staff', '', '', 'NJ / Gwebile', '', '', '', ''),
('in', '6706030367086', 'NJGwebile', '', '', '', '08:01 15-4-2020', '15-4-2020', '08:01', 'Staff', '', '', 'NJ / Gwebile', '', '', '', ''),
('in', '6706030367086', 'NjGwebilenj', '', '', '', '07:22 23-4-2020', '23-4-2020', '07:22', 'Staff', '', '', 'NjGwebile / nj', '', '', '', ''),
('out', '6706030367086', '', '', '', '', '12:12 07-5-2020', '2020/07/05', '12:12', 'Staff', '', '', '', '', '', '', ''),
('out', '6706030367086', '', '', '', '', '12:03 30-4-2020', '30-4-2020', '12:03', 'Staff', '', '', 'NJ / Gwebile', '', '', '', ''),
('out', '6706030367086', '', '', '', '', '12:11 23-4-2020', '23-4-2020', '12:11', 'Staff', '', '', 'NjGwebile / nj', '', '', '', ''),
('out', '6706030367086', '', '', '', '', '12:40 20-4-2020', '20-4-2020', '12:40', 'Staff', '', '', 'N.J / Gwebile', '', '', '', ''),
('out', '6706030367086', '', '', '', '', '13:07 15-4-2020', '15-4-2020', '13:07', 'Staff', '', '', 'NJ / Gwebile', '', '', '', ''),
('in', '6707100226084', 'MONICABOUWER', '', '', '6707100666084', '07:49 14-4-2020', '14-4-2020', '07:49', 'Staff', '', '', 'MONICA / BOUWER', '', '', '', ''),
('in', '6707100666084', 'bouirm', '', '', '', '07:56 15-4-2020', '15-4-2020', '07:56', 'Staff', '', '', 'bouir / m', '', '', '', ''),
('in', '6707100666084', 'MBouer', '', '', '', '07:48 05-5-2020', '2020/05/05', '07:48', 'Staff', '', '', 'M / Bouer', '', 'G3', '', ''),
('in', '6707100666084', 'MBouer', '', '', '', '08:02 24-4-2020', '24-4-2020', '08:02', 'Staff', '', '', 'M / Bouer', '', '', '', ''),
('in', '6707100666084', 'MBoure,', '', '', '', '08:00 22-4-2020', '22-4-2020', '08:00', 'Staff', '', '', 'M / Boure,', '', '', '', ''),
('in', '6707100666084', 'MBouwer', '', '', '', '07:39 08-5-2020', '2020/08/05', '07:39', 'Staff', '', '', 'M / Bouwer', '', 'Unit G3', '', ''),
('in', '6707100666084', 'MBouwer', '', '', '', '07:38 04-5-2020', '2020/04/05', '07:38', 'Staff', '', '', 'M / Bouwer', '', 'G3', '', ''),
('in', '6707100666084', 'MBouwer', '', '', '', '07:53 01-5-2020', '2020/01/05', '07:53', 'Staff', '', '', 'M / Bouwer', '', 'G3', '', ''),
('in', '6707100666084', 'MBouwer', '', '', '', '07:48 28-4-2020', '28-4-2020', '07:48', 'Staff', '', '', 'M / Bouwer', '', '', '', ''),
('in', '6707100666084', 'MBouwer', '', '', '', '07:54 21-4-2020', '21-4-2020', '07:54', 'Staff', '', '', 'M / Bouwer', '', '', '', ''),
('in', '6707100666084', 'Mbouwer', '', '', '', '08:01 16-4-2020', '16-4-2020', '08:01', 'Staff', '', '', 'M / bouwer', '', '', '', ''),
('out', '6707100666084', 'MONICABOUWER', '', '', '6707100666084', '12:33 11-5-2020', '2020/11/05', '12:33', 'Staff', '', '', '', '', '', '', ''),
('in', '6707100666084', 'MONICABOUWER', '', '', '6707100666084', '07:51 07-5-2020', '2020/07/05', '07:51', 'Staff', '', '', 'MONICA / BOUWER', '', 'work', '', ''),
('out', '6707100666084', 'MONICABOUWER', '', '', '6707100666084', '14:28 07-5-2020', '2020/07/05', '14:28', 'Staff', '', '', 'MONICA / BOUWER', '', 'work', '', ''),
('out', '6707100666084', 'MONICABOUWER', '', '', '6707100666084', '14:17 06-5-2020', '2020/06/05', '14:17', 'Staff', '', '', '', '', '', '', ''),
('out', '6707100666084', 'MONICABOUWER', '', '', '6707100666084', '14:20 01-5-2020', '2020/01/05', '14:20', 'Staff', '', '', 'M / Bouwer', '', 'G3', '', ''),
('in', '6707100666084', 'MONICABOUWER', '', '', '6707100666084', '07:51 30-4-2020', '30-4-2020', '07:51', 'Staff', '', '', 'MONICA / BOUWER', '', '', '', ''),
('in', '6707100666084', 'MONICABOUWER', '', '', '6707100666084', '07:47 29-4-2020', '29-4-2020', '07:47', 'Staff', '', '', 'MONICA / BOUWER', '', '', '', ''),
('in', '6707100666084', 'MONICABOUWER', '', '', '6707100666084', '07:50 27-4-2020', '27-4-2020', '07:50', 'Staff', '', '', 'MONICA / BOUWER', '', '', '', ''),
('out', '6707100666084', 'MONICABOUWER', '', '', '6707100666084', '13:46 27-4-2020', '27-4-2020', '13:46', 'Staff', '', '', 'MONICA / BOUWER', '', '', '', ''),
('in', '6707100666084', 'MONICABOUWER', '', '', '6707100666084', '08:12 25-4-2020', '25-4-2020', '08:12', 'Staff', '', '', 'MONICA / BOUWER', '', '', '', ''),
('out', '6707100666084', 'MONICABOUWER', '', '', '6707100666084', '13:30 25-4-2020', '25-4-2020', '13:30', 'Staff', '', '', 'MONICA / BOUWER', '', '', '', ''),
('out', '6707100666084', 'MONICABOUWER', '', '', '6707100666084', '14:11 23-4-2020', '23-4-2020', '14:11', 'Staff', '', '', '', '', '', '', ''),
('out', '6707100666084', 'MONICABOUWER', '', '', '6707100666084', '14:21 22-4-2020', '22-4-2020', '14:21', 'Staff', '', '', 'M / Boure,', '', '', '', ''),
('out', '6707100666084', 'MONICABOUWER', '', '', '6707100666084', '16:07 21-4-2020', '21-4-2020', '16:07', 'Staff', '', '', 'M / Bouwer', '', '', '', ''),
('in', '6707100666084', 'MONICABOUWER', '', '', '6707100666084', '07:53 20-4-2020', '20-4-2020', '07:53', 'Staff', '', '', 'MONICA / BOUWER', '', '', '', ''),
('out', '6707100666084', 'MONICABOUWER', '', '', '6707100666084', '13:48 20-4-2020', '20-4-2020', '13:48', 'Staff', '', '', 'MONICA / BOUWER', '', '', '', ''),
('in', '6707100666084', 'MONICABOUWER', '', '', '6707100666084', '07:53 17-4-2020', '17-4-2020', '07:53', 'Staff', '', '', 'MONICA / BOUWER', '', '', '', ''),
('out', '6707100666084', 'MONICABOUWER', '', '', '6707100666084', '13:35 16-4-2020', '16-4-2020', '13:35', 'Staff', '', '', 'M / bouwer', '', '', '', ''),
('out', '6707100666084', 'MONICABOUWER', '', '', '6707100666084', '16:01 14-4-2020', '14-4-2020', '16:01', 'Staff', '', '', '', '', '', '', ''),
('in', '6707100666084', 'MonicaBouwer', '', '', '', '07:55 13-4-2020', '13-4-2020', '07:55', 'Staff', '', '', 'Monica / Bouwer', '', '', '', ''),
('out', '6707100666084', '', '', '', '', '13:38 08-5-2020', '2020/08/05', '13:38', 'Staff', '', '', 'M / Bouwer', '', 'Unit G3', '', ''),
('out', '6707100666084', '', '', '', '', '07:46 06-5-2020', '2020/06/05', '07:46', 'Staff', '', '', '', '', '', '', ''),
('out', '6707100666084', '', '', '', '', '16:05 05-5-2020', '2020/05/05', '16:05', 'Staff', '', '', 'M / Bouer', '', 'G3', '', ''),
('out', '6707100666084', '', '', '', '', '13:32 04-5-2020', '2020/04/05', '13:32', 'Staff', '', '', 'M / Bouwer', '', 'G3', '', ''),
('out', '6707100666084', '', '', '', '', '13:56 30-4-2020', '30-4-2020', '13:56', 'Staff', '', '', 'MONICA / BOUWER', '', '', '', ''),
('out', '6707100666084', '', '', '', '', '14:04 29-4-2020', '29-4-2020', '14:04', 'Staff', '', '', 'MONICA / BOUWER', '', '', '', ''),
('out', '6707100666084', '', '', '', '', '14:41 24-4-2020', '24-4-2020', '14:41', 'Staff', '', '', 'M / Bouer', '', '', '', ''),
('out', '6707100666084', '', '', '', '', '13:52 17-4-2020', '17-4-2020', '13:52', 'Staff', '', '', 'MONICA / BOUWER', '', '', '', ''),
('out', '6707100666084', '', '', '', '', '13:51 15-4-2020', '15-4-2020', '13:51', 'Staff', '', '', 'bouir / m', '', '', '', ''),
('out', '6707100666084', '', '', '', '', '13:49 13-4-2020', '13-4-2020', '13:49', 'Staff', '', '', 'Monica / Bouwer', '', '', '', ''),
('in', '6707100667084', 'MONICABOUWER', '', '', '6707100666084', '08:00 23-4-2020', '23-4-2020', '08:00', 'Staff', '', '', 'MONICA / BOUWER', '', '', '', ''),
('out', '6707200666084', 'MONICABOUWER', '', '', '6707100666084', '16:06 28-4-2020', '28-4-2020', '16:06', 'Staff', '', '', '', '', '', '', ''),
('in', '6801165052080', 'RMSPARKS', '', '', '6801165052080', '15:14 28-4-2020', '28-4-2020', '15:14', 'Visitors', '', 'RM / SPARKS', '', '', '', '', '30'),
('in', '6804020781083', 'ziwazoya', '', '', '', '07:38 07-5-2020', '2020/07/05', '07:38', 'Staff', '', '', 'ziwa / zoya', '', 'work', '', ''),
('in', '6804020781083', 'ZJJiwa', '', '', '', '07:38 04-5-2020', '2020/04/05', '07:38', 'Staff', '', '', 'ZJ / Jiwa', '', 'Care Centre', '', ''),
('in', '6804020781083', 'ZJziea', '', '', '', '07:45 23-4-2020', '23-4-2020', '07:45', 'Staff', '', '', 'ZJ / ziea', '', '', '', ''),
('in', '6804020781083', 'ZJZiwa', '', '', '', '07:35 11-5-2020', '2020/11/05', '07:35', 'Staff', '', '', 'ZJ / Ziwa', '', 'Cc', '', ''),
('in', '6804020781083', 'ZJZiwa', '', '', '', '07:43 08-5-2020', '2020/08/05', '07:43', 'Staff', '', '', 'ZJ / Ziwa', '', 'CC', '', ''),
('in', '6804020781083', 'ZJZiwa', '', '', '', '07:38 05-5-2020', '2020/05/05', '07:38', 'Staff', '', '', 'ZJ / Ziwa', '', 'Admin', '', ''),
('in', '6804020781083', 'ZjZiwa', '', '', '', '07:47 30-4-2020', '30-4-2020', '07:47', 'Staff', '', '', 'Zj / Ziwa', '', '', '', ''),
('in', '6804020781083', 'ZJZiwa', '', '', '', '07:47 29-4-2020', '29-4-2020', '07:47', 'Staff', '', '', 'ZJ / Ziwa', '', '', '', ''),
('in', '6804020781083', 'ZJZiwa', '', '', '', '07:52 28-4-2020', '28-4-2020', '07:52', 'Staff', '', '', 'ZJ / Ziwa', '', '', '', ''),
('in', '6804020781083', 'Zjziwa', '', '', '', '07:47 24-4-2020', '24-4-2020', '07:47', 'Staff', '', '', 'Zj / ziwa', '', '', '', ''),
('in', '6804020781083', 'ZJZiwa', '', '', '', '07:49 22-4-2020', '22-4-2020', '07:49', 'Staff', '', '', 'ZJ / Ziwa', '', '', '', ''),
('in', '6804020781083', 'ZJZiwa', '', '', '', '07:39 21-4-2020', '21-4-2020', '07:39', 'Staff', '', '', 'ZJ / Ziwa', '', '', '', ''),
('in', '6804020781083', 'ZoyaJuddia', '', '', '', '08:36 20-4-2020', '20-4-2020', '08:36', 'Staff', '', '', 'Zoya / Juddia', '', '', '', ''),
('in', '6804020781083', 'zziwa', '', '', '', '07:39 06-5-2020', '2020/06/05', '07:39', 'Staff', '', '', 'z / ziwa', '', 'work', '', ''),
('out', '6804020781083', '', '', '', '', '15:57 08-5-2020', '2020/08/05', '15:57', 'Staff', '', '', 'ZJ / Ziwa', '', 'CC', '', ''),
('out', '6804020781083', '', '', '', '', '16:04 07-5-2020', '2020/07/05', '16:04', 'Staff', '', '', 'ziwa / zoya', '', 'work', '', ''),
('out', '6804020781083', '', '', '', '', '16:16 06-5-2020', '2020/06/05', '16:16', 'Staff', '', '', 'z / ziwa', '', 'work', '', ''),
('out', '6804020781083', '', '', '', '', '16:25 05-5-2020', '2020/05/05', '16:25', 'Staff', '', '', 'ZJ / Ziwa', '', 'Admin', '', ''),
('out', '6804020781083', '', '', '', '', '16:10 04-5-2020', '2020/04/05', '16:10', 'Staff', '', '', 'ZJ / Jiwa', '', 'Care Centre', '', ''),
('out', '6804020781083', '', '', '', '', '15:57 30-4-2020', '30-4-2020', '15:57', 'Staff', '', '', 'Zj / Ziwa', '', '', '', ''),
('out', '6804020781083', '', '', '', '', '15:58 29-4-2020', '29-4-2020', '15:58', 'Staff', '', '', 'ZJ / Ziwa', '', '', '', ''),
('out', '6804020781083', '', '', '', '', '15:57 28-4-2020', '28-4-2020', '15:57', 'Staff', '', '', 'ZJ / Ziwa', '', '', '', ''),
('out', '6804020781083', '', '', '', '', '15:51 24-4-2020', '24-4-2020', '15:51', 'Staff', '', '', 'Zj / ziwa', '', '', '', ''),
('out', '6804020781083', '', '', '', '', '15:53 23-4-2020', '23-4-2020', '15:53', 'Staff', '', '', 'ZJ / ziea', '', '', '', ''),
('out', '6804020781083', '', '', '', '', '16:01 22-4-2020', '22-4-2020', '16:01', 'Staff', '', '', 'ZJ / Ziwa', '', '', '', ''),
('out', '6804020781083', '', '', '', '', '15:58 21-4-2020', '21-4-2020', '15:58', 'Staff', '', '', 'ZJ / Ziwa', '', '', '', ''),
('out', '6804020781083', '', '', '', '', '15:57 20-4-2020', '20-4-2020', '15:57', 'Staff', '', '', 'Zoya / Juddia', '', '', '', ''),
('in', '6808286137088', 'Hendele Mandla', '', '', '', '07:38 07-5-2020', '2020/07/05', '07:38', 'Staff', '', '', 'Hendele  / Mandla', '', 'work', '', ''),
('in', '6808286137088', 'mhendele', '', '', '', '07:40 06-5-2020', '2020/06/05', '07:40', 'Staff', '', '', 'm / hendele', '', 'work', '', ''),
('in', '6808286137088', 'MWHedela', '', '', '', '07:33 11-5-2020', '2020/11/05', '07:33', 'Staff', '', '', 'MW / Hedela', '', 'M', '', ''),
('in', '6808286137088', 'MWHedele,', '', '', '', '07:26 29-4-2020', '29-4-2020', '07:26', 'Staff', '', '', 'MW / Hedele,', '', '', '', ''),
('in', '6808286137088', 'MWHendele', '', '', '', '07:28 08-5-2020', '2020/08/05', '07:28', 'Staff', '', '', 'MW / Hendele', '', 'M', '', ''),
('in', '6808286137088', 'MWHendele', '', '', '', '07:39 04-5-2020', '2020/04/05', '07:39', 'Staff', '', '', 'MW / Hendele', '', 'Mantainance', '', ''),
('in', '6808286137088', 'NwHedele', '', '', '', '07:32 30-4-2020', '30-4-2020', '07:32', 'Staff', '', '', 'Nw / Hedele', '', '', '', ''),
('out', '6808286137088', '', '', '', '', '16:23 08-5-2020', '2020/08/05', '16:23', 'Staff', '', '', 'MW / Hendele', '', 'M', '', ''),
('out', '6808286137088', '', '', '', '', '16:26 07-5-2020', '2020/07/05', '16:26', 'Staff', '', '', 'Hendele  / Mandla', '', 'work', '', ''),
('out', '6808286137088', '', '', '', '', '16:29 06-5-2020', '2020/06/05', '16:29', 'Staff', '', '', 'm / hendele', '', 'work', '', ''),
('out', '6808286137088', '', '', '', '', '16:27 04-5-2020', '2020/04/05', '16:27', 'Staff', '', '', 'MW / Hendele', '', 'Mantainance', '', ''),
('out', '6808286137088', '', '', '', '', '16:28 30-4-2020', '30-4-2020', '16:28', 'Staff', '', '', 'Nw / Hedele', '', '', '', ''),
('out', '6808286137088', '', '', '', '', '16:28 29-4-2020', '29-4-2020', '16:28', 'Staff', '', '', 'MW / Hedele,', '', '', '', ''),
('in', '6811195008085', 'PJVAN DEN HEEVER', 'SPAR', '', '6811195008085', '12:29 15-4-2020', '15-4-2020', '12:29', 'Contractors', '', 'PJ / VAN DEN HEEVER', '', '', '', 'SPAR', ''),
('out', '6901055500108', '', '', '', 'LIVINA X-GEAR', '19:04 08-5-2020', '2020/08/05', '19:04', 'Visitors', '', '', '', '', '', '', ''),
('in', '6906065856082', 'VNqowana', '', '', '', '07:30 05-5-2020', '2020/05/05', '07:30', 'Staff', '', '', 'V / Nqowana', '', 'KG', '', ''),
('in', '6906065856082', 'VNqowana', '', '', '', '07:34 04-5-2020', '2020/04/05', '07:34', 'Staff', '', '', 'V / Nqowana', '', 'K G', '', ''),
('in', '6906065856082', 'VNqowana', '', '', '', '07:34 29-4-2020', '29-4-2020', '07:34', 'Staff', '', '', 'V / Nqowana', '', '', '', ''),
('in', '6906065856082', 'Vqawans', '', '', '', '07:31 30-4-2020', '30-4-2020', '07:31', 'Staff', '', '', 'V / qawans', '', '', '', ''),
('out', '6906065856082', '', '', '', '', '15:50 05-5-2020', '2020/05/05', '15:50', 'Staff', '', '', 'V / Nqowana', '', 'KG', '', ''),
('out', '6906065856082', '', '', '', '', '15:47 04-5-2020', '2020/04/05', '15:47', 'Staff', '', '', 'V / Nqowana', '', 'K G', '', ''),
('out', '6906065856082', '', '', '', '', '16:02 30-4-2020', '30-4-2020', '16:02', 'Staff', '', '', 'V / qawans', '', '', '', ''),
('out', '6906065856082', '', '', '', '', '16:02 29-4-2020', '29-4-2020', '16:02', 'Staff', '', '', 'V / Nqowana', '', '', '', ''),
('in', '6906205214085', 'RLE ROUX', '', '', '6906205214085', '16:00 30-4-2020', '30-4-2020', '16:00', 'Conference Visitors', 'Expired driver licence', '', '', '', '', '', ''),
('in', '6907125674085', 'ETTEYISE', '', '', '6907125674085, C16SE02DR6935', '07:59 19-4-2020', '19-4-2020', '07:59', 'Visitors', '', 'ET / TEYISE', '', '', '', '', '128d'),
('in', '6907125674085', 'ETThembekil Teyise', '', '', '6907125674085, C16SE02DR6935', '18:08 21-4-2020', '21-4-2020', '18:08', 'Visitors', '', 'ET / Thembekil Teyise', '', '', '', '', '128d'),
('out', '6907125674085', 'null null', '', '', 'C16SE02DR6935', '18:37 27-4-2020', '27-4-2020', '18:37', 'Visitors', 'In/Out custom field value doesn\'t match', 'Thembekile Teyise / T. Teyise', '', '', '', '', '128'),
('in', '6907125674085', 'Thembekile TeyiseT. Teyise', '', '', 'C16SE02DR6935', '18:20 27-4-2020', '27-4-2020', '18:20', 'Visitors', '', 'Thembekile Teyise / T. Teyise', '', '', '', '', '128'),
('out', '6907125674085', '', '', '', '', '06:53 28-4-2020', '28-4-2020', '06:53', 'Visitors', '', '', '', '', '', '', ''),
('out', '6907125674085', '', '', '', '', '18:21 21-4-2020', '21-4-2020', '18:21', 'Visitors', '', 'ET / Thembekil Teyise', '', '', '', '', '128d'),
('out', '6907125674085', '', '', '', '', '08:09 19-4-2020', '19-4-2020', '08:09', 'Visitors', 'In/Out custom field value doesn\'t match', 'ET / TEYISE', '', '', '', '', '128d'),
('in', '6907257823012', 'PRMAVIKELA', '', '', '6908205550088, LIVINA X-GEAR', '18:12 04-5-2020', '2020/04/05', '18:12', 'Visitors', '', 'PR / MAVIKELA', '', '', '', '', 'Frail care'),
('in', '6908205550088', '6908205550088e r mavikela', '', '', 'LIVINA X-GEAR', '18:12 07-5-2020', '2020/07/05', '18:12', 'Visitors', '', '6908205550088 / e r mavikela', '', '', '', '', 'frail care'),
('in', '6908205550088', 'PRMAVIKELA', '', '', '6908205550088', '06:33 09-5-2020', '2020/09/05', '06:33', 'Conference Visitors', '', '', '', '', '', '', ''),
('in', '6908205550088', 'PRMAVIKELA', '', '', '6908205550088, LIVINA X-GEAR', '17:14 07-5-2020', '2020/07/05', '17:14', 'Visitors', '', 'PR / MAVIKELA', '', '', '', '', 'Frail care'),
('in', '6908205550088', 'PRMAVIKELA', '', '', '6908205550088, LIVINA X-GEAR', '18:32 04-5-2020', '2020/04/05', '18:32', 'Visitors', '', 'PR / MAVIKELA', '', '', '', '', 'Frail care'),
('in', '6908205550088', 'PRMAVIKELA', '', '', '6908205550088', '06:47 24-4-2020', '24-4-2020', '06:47', 'Visitors', '', 'PR / MAVIKELA', '', '', '', '', 'Care center'),
('in', '6908205550088', 'Richard MavikelaR Mavikela', '', '', '', '18:37 21-4-2020', '21-4-2020', '18:37', 'Visitors', '', 'Richard Mavikela / R Mavikela', '', '', '', '', 'Frail care'),
('out', '6908205550088', '', '', '', 'LIVINA X-GEAR', '17:27 07-5-2020', '2020/07/05', '17:27', 'Visitors', 'In/Out custom field value doesn\'t match', 'PR / MAVIKELA', '', '', '', '', 'Frail care'),
('out', '6908205550088', '', '', '', 'LIVINA X-GEAR', '18:23 02-5-2020', '2020/02/05', '18:23', 'Visitors', '', '', '', '', '', '', ''),
('in', '6910300683087', 'Mbelekan Thotyelwa', '', '', '', '07:52 07-5-2020', '2020/07/05', '07:52', 'Staff', '', '', 'Mbelekan  / Thotyelwa', '', 'work', '', ''),
('in', '6910300683087', 'tmbelekani', '', '', '', '07:53 06-5-2020', '2020/06/05', '07:53', 'Staff', '', '', 't / mbelekani', '', 'work', '', ''),
('in', '6910300683087', 'TMMbelekani', '', '', '', '07:45 08-5-2020', '2020/08/05', '07:45', 'Staff', '', '', 'TM / Mbelekani', '', 'Unit 112', '', ''),
('in', '6910300683087', 'TNMbelekana', '', '', '', '07:34 11-5-2020', '2020/11/05', '07:34', 'Staff', '', '', 'TN / Mbelekana', '', '112', '', ''),
('out', '6910300683087', '', '', '', '', '12:15 11-5-2020', '2020/11/05', '12:15', 'Staff', '', '', 'TN / Mbelekana', '', '112', '', ''),
('out', '6910300683087', '', '', '', '', '13:00 08-5-2020', '2020/08/05', '13:00', 'Staff', '', '', 'TM / Mbelekani', '', 'Unit 112', '', ''),
('out', '6910300683087', '', '', '', '', '11:56 07-5-2020', '2020/07/05', '11:56', 'Staff', '', '', 'Mbelekan  / Thotyelwa', '', 'work', '', ''),
('out', '6910300683087', '', '', '', '', '12:26 06-5-2020', '2020/06/05', '12:26', 'Staff', '', '', 't / mbelekani', '', 'work', '', ''),
('in', '7005036271080', 'VRMsesiwe', '', '', '', '07:27 04-5-2020', '2020/04/05', '07:27', 'Staff', '', '', 'VR / Msesiwe', '', 'Mantainance', '', ''),
('in', '7005036271080', 'VRMsesiwe', '', '', '', '07:26 24-4-2020', '24-4-2020', '07:26', 'Staff', '', '', 'VR / Msesiwe', '', '', '', ''),
('in', '7005036271080', 'VUYO RICHARDMSESIWE', '', '', '7005036271080', '07:35 11-5-2020', '2020/11/05', '07:35', 'Staff', '', '', 'VUYO RICHARD / MSESIWE', '', 'M', '', ''),
('in', '7005036271080', 'VUYO RICHARDMSESIWE', '', '', '7005036271080', '07:35 08-5-2020', '2020/08/05', '07:35', 'Staff', '', '', 'VUYO RICHARD / MSESIWE', '', 'M', '', ''),
('out', '7005036271080', 'VUYO RICHARDMSESIWE', '', '', '7005036271080', '16:26 08-5-2020', '2020/08/05', '16:26', 'Staff', '', '', 'VUYO RICHARD / MSESIWE', '', 'M', '', ''),
('out', '7005036271080', 'VUYO RICHARDMSESIWE', '', '', '7005036271080', '16:29 07-5-2020', '2020/07/05', '16:29', 'Staff', '', '', '', '', '', '', ''),
('in', '7005036271080', 'VUYO RICHARDMSESIWE', '', '', '7005036271080', '07:37 05-5-2020', '2020/05/05', '07:37', 'Staff', '', '', 'VUYO RICHARD / MSESIWE', '', 'M', '', ''),
('out', '7005036271080', 'VUYO RICHARDMSESIWE', '', '', '7005036271080', '16:27 05-5-2020', '2020/05/05', '16:27', 'Staff', '', '', 'VUYO RICHARD / MSESIWE', '', 'M', '', ''),
('in', '7005036271080', 'VUYO RICHARDMSESIWE', '', '', '7005036271080', '07:24 30-4-2020', '30-4-2020', '07:24', 'Staff', '', '', 'VUYO RICHARD / MSESIWE', '', '', '', ''),
('out', '7005036271080', 'VUYO RICHARDMSESIWE', '', '', '7005036271080', '16:30 30-4-2020', '30-4-2020', '16:30', 'Staff', '', '', 'VUYO RICHARD / MSESIWE', '', '', '', ''),
('in', '7005036271080', 'VUYO RICHARDMSESIWE', '', '', '7005036271080', '07:44 29-4-2020', '29-4-2020', '07:44', 'Staff', '', '', 'VUYO RICHARD / MSESIWE', '', '', '', ''),
('in', '7005036271080', 'VUYO RICHARDMSESIWE', '', '', '7005036271080', '07:26 28-4-2020', '28-4-2020', '07:26', 'Staff', '', '', 'VUYO RICHARD / MSESIWE', '', '', '', ''),
('out', '7005036271080', 'VUYO RICHARDMSESIWE', '', '', '7005036271080', '16:30 28-4-2020', '28-4-2020', '16:30', 'Staff', '', '', 'VUYO RICHARD / MSESIWE', '', '', '', ''),
('out', '7005036271080', '', '', '', '', '16:32 06-5-2020', '2020/06/05', '16:32', 'Staff', '', '', '', '', '', '', ''),
('out', '7005036271080', '', '', '', '', '16:28 04-5-2020', '2020/04/05', '16:28', 'Staff', '', '', 'VR / Msesiwe', '', 'Mantainance', '', ''),
('out', '7005036271080', '', '', '', '', '16:28 29-4-2020', '29-4-2020', '16:28', 'Staff', '', '', 'VUYO RICHARD / MSESIWE', '', '', '', ''),
('in', '7005200806083', 'KangelwaNdiyana', '', '', '', '15:57 14-4-2020', '14-4-2020', '15:57', 'Staff', '', '', 'Kangelwa / Ndiyana', '', '', '', ''),
('in', '7005200806083', 'KangelwaNdiyane', '', '', '', '16:14 07-5-2020', '2020/07/05', '16:14', 'Staff', '', '', 'Kangelwa / Ndiyane', '', '232', '', ''),
('in', '7005200806083', 'KGilane', '', '', '', '16:10 06-5-2020', '2020/06/05', '16:10', 'Staff', '', '', 'K / Gilane', '', '232', '', ''),
('in', '7005200806083', 'KhangelaNdiyana', '', '', '', '08:28 13-4-2020', '13-4-2020', '08:28', 'Staff', '', '', 'Khangela / Ndiyana', '', '', '', ''),
('in', '7005200806083', 'Khangelwa Ndiyanak Ndiyana', '', '', '', '16:04 13-4-2020', '13-4-2020', '16:04', 'Staff', '', '', 'Khangelwa Ndiyana / k Ndiyana', '', '', '', ''),
('in', '7005200806083', 'KhangelwaNdiyana', '', '', '', '08:32 07-5-2020', '2020/07/05', '08:32', 'Staff', '', '', 'Khangelwa / Ndiyana', '', 'work', '', ''),
('in', '7005200806083', 'KhangelwaNdiyana', '', '', '', '15:57 25-4-2020', '25-4-2020', '15:57', 'Staff', '', '', 'Khangelwa / Ndiyana', '', '', '', ''),
('in', '7005200806083', 'KNdiyana', '', '', '', '08:32 10-5-2020', '2020/10/05', '08:32', 'Staff', '', '', 'K / Ndiyana', '', '232', '', ''),
('in', '7005200806083', 'KNdiyana', '', '', '', '16:02 10-5-2020', '2020/10/05', '16:02', 'Staff', '', '', 'K / Ndiyana', '', '232', '', ''),
('in', '7005200806083', 'KNdiyana', '', '', '', '08:31 09-5-2020', '2020/09/05', '08:31', 'Staff', '', '', 'K / Ndiyana', '', '232', '', ''),
('in', '7005200806083', 'KNdiyana', '', '', '', '16:01 09-5-2020', '2020/09/05', '16:01', 'Staff', '', '', 'K / Ndiyana', '', '232', '', ''),
('in', '7005200806083', 'KNdiyana', '', '', '', '08:38 08-5-2020', '2020/08/05', '08:38', 'Staff', '', '', 'K / Ndiyana', '', 'Unit 232', '', ''),
('in', '7005200806083', 'KNdiyana', '', '', '', '16:14 08-5-2020', '2020/08/05', '16:14', 'Staff', '', '', 'K / Ndiyana', '', 'Unit 232', '', ''),
('in', '7005200806083', 'kndiyana', '', '', '', '08:23 06-5-2020', '2020/06/05', '08:23', 'Staff', '', '', 'k / ndiyana', '', 'work', '', ''),
('in', '7005200806083', 'KNdiyana', '', '', '', '16:03 05-5-2020', '2020/05/05', '16:03', 'Staff', '', '', 'K / Ndiyana', '', '232', '', ''),
('in', '7005200806083', 'KNdiyana', '', '', '', '08:26 04-5-2020', '2020/04/05', '08:26', 'Staff', '', '', 'K / Ndiyana', '', 'Unit 232', '', ''),
('in', '7005200806083', 'KNdiyana', '', '', '', '16:10 01-5-2020', '2020/01/05', '16:10', 'Staff', '', '', 'K / Ndiyana', '', '232', '', ''),
('in', '7005200806083', 'KNdiyana', '', '', '', '16:10 30-4-2020', '30-4-2020', '16:10', 'Staff', '', '', 'K / Ndiyana', '', '', '', ''),
('in', '7005200806083', 'KNdiyana', '', '', '', '08:22 29-4-2020', '29-4-2020', '08:22', 'Staff', '', '', 'K / Ndiyana', '', '', '', ''),
('in', '7005200806083', 'KNdiyana', '', '', '', '16:04 29-4-2020', '29-4-2020', '16:04', 'Staff', '', '', 'K / Ndiyana', '', '', '', ''),
('in', '7005200806083', 'KNdiyana', '', '', '', '08:32 28-4-2020', '28-4-2020', '08:32', 'Staff', '', '', 'K / Ndiyana', '', '', '', ''),
('in', '7005200806083', 'KNdiyana', '', '', '', '16:11 28-4-2020', '28-4-2020', '16:11', 'Staff', '', '', 'K / Ndiyana', '', '', '', ''),
('in', '7005200806083', 'KNdiyana', '', '', '', '08:32 27-4-2020', '27-4-2020', '08:32', 'Staff', '', '', 'K / Ndiyana', '', '', '', ''),
('in', '7005200806083', 'KNdiyana', '', '', '', '16:14 27-4-2020', '27-4-2020', '16:14', 'Staff', '', '', 'K / Ndiyana', '', '', '', ''),
('in', '7005200806083', 'KNdiyana', '', '', '', '08:28 26-4-2020', '26-4-2020', '08:28', 'Staff', '', '', 'K / Ndiyana', '', '', '', ''),
('in', '7005200806083', 'KNdiyana', '', '', '', '16:04 26-4-2020', '26-4-2020', '16:04', 'Staff', '', '', 'K / Ndiyana', '', '', '', ''),
('in', '7005200806083', 'KNdiyana', '', '', '', '08:29 25-4-2020', '25-4-2020', '08:29', 'Staff', '', '', 'K / Ndiyana', '', '', '', ''),
('in', '7005200806083', 'KNdiyana', '', '', '', '16:02 23-4-2020', '23-4-2020', '16:02', 'Staff', '', '', 'K / Ndiyana', '', '', '', ''),
('in', '7005200806083', 'KNdiyana', '', '', '', '08:25 17-4-2020', '17-4-2020', '08:25', 'Staff', '', '', 'K / Ndiyana', '', '', '', ''),
('in', '7005200806083', 'KNdiyana', '', '', '', '15:54 17-4-2020', '17-4-2020', '15:54', 'Staff', '', '', 'K / Ndiyana', '', '', '', ''),
('in', '7005200806083', 'Kndiyana', '', '', '', '08:28 16-4-2020', '16-4-2020', '08:28', 'Staff', '', '', 'K / ndiyana', '', '', '', ''),
('in', '7005200806083', 'KNdiyana', '', '', '', '16:12 16-4-2020', '16-4-2020', '16:12', 'Staff', '', '', 'K / Ndiyana', '', '', '', ''),
('in', '7005200806083', 'KNdiyana', '', '', '', '16:07 15-4-2020', '15-4-2020', '16:07', 'Staff', '', '', 'K / Ndiyana', '', '', '', ''),
('in', '7005200806083', 'KNdiyana', '', '', '', '08:24 14-4-2020', '14-4-2020', '08:24', 'Staff', '', '', 'K / Ndiyana', '', '', '', ''),
('in', '7005200806083', 'KNdiyana', '', '', '', '16:08 12-4-2020', '2020/12/04', '16:08', 'Staff', '', '', 'K / Ndiyana', '', '', '', ''),
('in', '7005200806083', 'KNdiyana', '', '', '', '16:04 11-4-2020', '2020/11/04', '16:04', 'Staff', '', '', 'K / Ndiyana', '', '', '', ''),
('in', '7005200806083', 'KNdiyane', '', '', '', '08:30 01-5-2020', '2020/01/05', '08:30', 'Staff', '', '', 'K / Ndiyane', '', '232', '', ''),
('in', '7005200806083', 'KNdiyani', '', '', '', '07:50 24-4-2020', '24-4-2020', '07:50', 'Staff', '', '', 'K / Ndiyani', '', '', '', ''),
('in', '7005200806083', 'Kndiyani', '', '', '', '08:29 23-4-2020', '23-4-2020', '08:29', 'Staff', '', '', 'K / ndiyani', '', '', '', ''),
('in', '7005200806083', 'KNdiysna', '', '', '', '08:30 30-4-2020', '30-4-2020', '08:30', 'Staff', '', '', 'K / Ndiysna', '', '', '', ''),
('in', '7005200806083', 'KNgiyana', '', '', '', '08:32 11-5-2020', '2020/11/05', '08:32', 'Staff', '', '', 'K / Ngiyana', '', '232', '', ''),
('in', '7005200806083', 'Kngiyana', '', '', '', '08:32 12-4-2020', '2020/12/04', '08:32', 'Staff', '', '', 'K / ngiyana', '', '', '', ''),
('in', '7005200806083', 'Ndiyanak', '', '', '', '08:30 15-4-2020', '15-4-2020', '08:30', 'Staff', '', '', 'Ndiyana / k', '', '', '', ''),
('in', '7005200806083', 'ndiyanak', '', '', '', '08:32 11-4-2020', '2020/11/04', '08:32', 'Staff', '', '', 'ndiyana / k', '', '', '', ''),
('out', '7005200806083', '', '', '', '', '11:50 11-5-2020', '2020/11/05', '11:50', 'Staff', '', '', 'K / Ngiyana', '', '232', '', ''),
('out', '7005200806083', '', '', '', '', '11:10 10-5-2020', '2020/10/05', '11:10', 'Staff', '', '', 'K / Ndiyana', '', '232', '', ''),
('out', '7005200806083', '', '', '', '', '17:03 10-5-2020', '2020/10/05', '17:03', 'Staff', '', '', 'K / Ndiyana', '', '232', '', ''),
('out', '7005200806083', '', '', '', '', '11:27 09-5-2020', '2020/09/05', '11:27', 'Staff', '', '', 'K / Ndiyana', '', '232', '', ''),
('out', '7005200806083', '', '', '', '', '17:03 09-5-2020', '2020/09/05', '17:03', 'Staff', '', '', 'K / Ndiyana', '', '232', '', ''),
('out', '7005200806083', '', '', '', '', '12:19 08-5-2020', '2020/08/05', '12:19', 'Staff', '', '', 'K / Ndiyana', '', 'Unit 232', '', ''),
('out', '7005200806083', '', '', '', '', '17:13 08-5-2020', '2020/08/05', '17:13', 'Staff', '', '', 'K / Ndiyana', '', 'Unit 232', '', ''),
('out', '7005200806083', '', '', '', '', '11:07 07-5-2020', '2020/07/05', '11:07', 'Staff', '', '', 'Khangelwa / Ndiyana', '', 'work', '', ''),
('out', '7005200806083', '', '', '', '', '17:21 07-5-2020', '2020/07/05', '17:21', 'Staff', '', '', 'Kangelwa / Ndiyane', '', '232', '', ''),
('out', '7005200806083', '', '', '', '', '11:27 06-5-2020', '2020/06/05', '11:27', 'Staff', '', '', 'k / ndiyana', '', 'work', '', ''),
('out', '7005200806083', '', '', '', '', '17:06 06-5-2020', '2020/06/05', '17:06', 'Staff', '', '', 'K / Gilane', '', '232', '', ''),
('out', '7005200806083', '', '', '', '', '12:01 05-5-2020', '2020/05/05', '12:01', 'Staff', '', '', '', '', '', '', ''),
('out', '7005200806083', '', '', '', '', '17:06 05-5-2020', '2020/05/05', '17:06', 'Staff', '', '', 'K / Ndiyana', '', '232', '', ''),
('out', '7005200806083', '', '', '', '', '11:40 04-5-2020', '2020/04/05', '11:40', 'Staff', '', '', 'K / Ndiyana', '', 'Unit 232', '', ''),
('out', '7005200806083', '', '', '', '', '16:10 04-5-2020', '2020/04/05', '16:10', 'Staff', '', '', '', '', '', '', ''),
('out', '7005200806083', '', '', '', '', '17:00 04-5-2020', '2020/04/05', '17:00', 'Staff', '', '', '', '', '', '', ''),
('out', '7005200806083', '', '', '', '', '12:33 01-5-2020', '2020/01/05', '12:33', 'Staff', '', '', 'K / Ndiyane', '', '232', '', ''),
('out', '7005200806083', '', '', '', '', '17:18 01-5-2020', '2020/01/05', '17:18', 'Staff', '', '', 'K / Ndiyana', '', '232', '', ''),
('out', '7005200806083', '', '', '', '', '11:25 30-4-2020', '30-4-2020', '11:25', 'Staff', '', '', 'K / Ndiysna', '', '', '', ''),
('out', '7005200806083', '', '', '', '', '16:57 30-4-2020', '30-4-2020', '16:57', 'Staff', '', '', 'K / Ndiyana', '', '', '', ''),
('out', '7005200806083', '', '', '', '', '11:04 29-4-2020', '29-4-2020', '11:04', 'Staff', '', '', 'K / Ndiyana', '', '', '', ''),
('out', '7005200806083', '', '', '', '', '17:05 29-4-2020', '29-4-2020', '17:05', 'Staff', '', '', 'K / Ndiyana', '', '', '', ''),
('out', '7005200806083', '', '', '', '', '11:38 28-4-2020', '28-4-2020', '11:38', 'Staff', '', '', 'K / Ndiyana', '', '', '', ''),
('out', '7005200806083', '', '', '', '', '16:11 28-4-2020', '28-4-2020', '16:11', 'Staff', '', '', '', '', '', '', ''),
('out', '7005200806083', '', '', '', '', '16:57 28-4-2020', '28-4-2020', '16:57', 'Staff', '', '', 'K / Ndiyana', '', '', '', ''),
('out', '7005200806083', '', '', '', '', '11:13 27-4-2020', '27-4-2020', '11:13', 'Staff', '', '', 'K / Ndiyana', '', '', '', ''),
('out', '7005200806083', '', '', '', '', '16:58 27-4-2020', '27-4-2020', '16:58', 'Staff', '', '', 'K / Ndiyana', '', '', '', ''),
('out', '7005200806083', '', '', '', '', '11:10 26-4-2020', '26-4-2020', '11:10', 'Staff', '', '', 'K / Ndiyana', '', '', '', ''),
('out', '7005200806083', '', '', '', '', '17:10 26-4-2020', '26-4-2020', '17:10', 'Staff', '', '', 'K / Ndiyana', '', '', '', ''),
('out', '7005200806083', '', '', '', '', '11:18 25-4-2020', '25-4-2020', '11:18', 'Staff', '', '', 'K / Ndiyana', '', '', '', ''),
('out', '7005200806083', '', '', '', '', '17:06 25-4-2020', '25-4-2020', '17:06', 'Staff', '', '', 'Khangelwa / Ndiyana', '', '', '', ''),
('out', '7005200806083', '', '', '', '', '16:57 24-4-2020', '24-4-2020', '16:57', 'Staff', '', '', 'K / Ndiyani', '', '', '', ''),
('out', '7005200806083', '', '', '', '', '11:21 23-4-2020', '23-4-2020', '11:21', 'Staff', '', '', 'K / ndiyani', '', '', '', ''),
('out', '7005200806083', '', '', '', '', '17:11 23-4-2020', '23-4-2020', '17:11', 'Staff', '', '', 'K / Ndiyana', '', '', '', ''),
('out', '7005200806083', '', '', '', '', '11:22 17-4-2020', '17-4-2020', '11:22', 'Staff', '', '', 'K / Ndiyana', '', '', '', ''),
('out', '7005200806083', '', '', '', '', '17:16 17-4-2020', '17-4-2020', '17:16', 'Staff', '', '', 'K / Ndiyana', '', '', '', ''),
('out', '7005200806083', '', '', '', '', '11:06 16-4-2020', '16-4-2020', '11:06', 'Staff', '', '', 'K / ndiyana', '', '', '', ''),
('out', '7005200806083', '', '', '', '', '17:03 16-4-2020', '16-4-2020', '17:03', 'Staff', '', '', 'K / Ndiyana', '', '', '', ''),
('out', '7005200806083', '', '', '', '', '11:04 15-4-2020', '15-4-2020', '11:04', 'Staff', '', '', 'Ndiyana / k', '', '', '', ''),
('out', '7005200806083', '', '', '', '', '17:01 15-4-2020', '15-4-2020', '17:01', 'Staff', '', '', 'K / Ndiyana', '', '', '', ''),
('out', '7005200806083', '', '', '', '', '11:38 14-4-2020', '14-4-2020', '11:38', 'Staff', '', '', 'K / Ndiyana', '', '', '', ''),
('out', '7005200806083', '', '', '', '', '17:19 14-4-2020', '14-4-2020', '17:19', 'Staff', '', '', 'Kangelwa / Ndiyana', '', '', '', ''),
('out', '7005200806083', '', '', '', '', '11:09 13-4-2020', '13-4-2020', '11:09', 'Staff', '', '', 'Khangela / Ndiyana', '', '', '', ''),
('out', '7005200806083', '', '', '', '', '17:08 13-4-2020', '13-4-2020', '17:08', 'Staff', '', '', 'Khangelwa Ndiyana / k Ndiyana', '', '', '', ''),
('out', '7005200806083', '', '', '', '', '11:11 12-4-2020', '2020/12/04', '11:11', 'Staff', '', '', 'K / ngiyana', '', '', '', ''),
('out', '7005200806083', '', '', '', '', '17:01 12-4-2020', '2020/12/04', '17:01', 'Staff', '', '', 'K / Ndiyana', '', '', '', ''),
('out', '7005200806083', '', '', '', '', '11:14 11-4-2020', '2020/11/04', '11:14', 'Staff', '', '', 'ndiyana / k', '', '', '', ''),
('out', '7005200806083', '', '', '', '', '17:04 11-4-2020', '2020/11/04', '17:04', 'Staff', '', '', 'K / Ndiyana', '', '', '', ''),
('in', '7010175337080', 'TDZono', '', '', '', '07:38 08-5-2020', '2020/08/05', '07:38', 'Staff', '', '', 'TD / Zono', '', 'M', '', ''),
('in', '7010175337080', 'TDZono', '', '', '', '07:40 05-5-2020', '2020/05/05', '07:40', 'Staff', '', '', 'TD / Zono', '', 'M', '', ''),
('in', '7010175337080', 'TDZono', '', '', '', '07:40 04-5-2020', '2020/04/05', '07:40', 'Staff', '', '', 'TD / Zono', '', 'Mantainance', '', ''),
('in', '7010175337080', 'Tzono', '', '', '', '07:29 06-5-2020', '2020/06/05', '07:29', 'Staff', '', '', 'T / zono', '', 'work', '', ''),
('in', '7010175337080', 'zonoThembekile', '', '', '', '07:34 07-5-2020', '2020/07/05', '07:34', 'Staff', '', '', 'zono / Thembekile', '', 'work', '', ''),
('out', '7010175337080', '', '', '', '', '16:25 08-5-2020', '2020/08/05', '16:25', 'Staff', '', '', 'TD / Zono', '', 'M', '', ''),
('out', '7010175337080', '', '', '', '', '16:29 07-5-2020', '2020/07/05', '16:29', 'Staff', '', '', 'zono / Thembekile', '', 'work', '', ''),
('out', '7010175337080', '', '', '', '', '16:29 06-5-2020', '2020/06/05', '16:29', 'Staff', '', '', 'T / zono', '', 'work', '', ''),
('out', '7010175337080', '', '', '', '', '16:26 05-5-2020', '2020/05/05', '16:26', 'Staff', '', '', 'TD / Zono', '', 'M', '', ''),
('out', '7010175337080', '', '', '', '', '16:29 04-5-2020', '2020/04/05', '16:29', 'Staff', '', '', 'TD / Zono', '', 'Mantainance', '', ''),
('in', '7010285804086', 'KNosilela', '', '', '', '07:30 11-5-2020', '2020/11/05', '07:30', 'Staff', '', '', 'K / Nosilela', '', 'M,', '', ''),
('in', '7010285804086', 'KNosilela', '', '', '', '07:16 08-5-2020', '2020/08/05', '07:16', 'Staff', '', '', 'K / Nosilela', '', 'M', '', ''),
('in', '7010285804086', 'knosilela', '', '', '', '07:15 06-5-2020', '2020/06/05', '07:15', 'Staff', '', '', 'k / nosilela', '', 'work', '', ''),
('in', '7010285804086', 'KNosilela', '', '', '', '07:25 05-5-2020', '2020/05/05', '07:25', 'Staff', '', '', 'K / Nosilela', '', 'Mantainance', '', ''),
('in', '7010285804086', 'KNosilela', '', '', '', '07:17 04-5-2020', '2020/04/05', '07:17', 'Staff', '', '', 'K / Nosilela', '', 'Maintanance', '', ''),
('in', '7010285804086', 'Nosilela KadekilN m', '', '', '', '07:21 07-5-2020', '2020/07/05', '07:21', 'Staff', '', '', 'Nosilela Kadekil / N m', '', 'work', '', ''),
('out', '7010285804086', '', '', '', '', '16:28 08-5-2020', '2020/08/05', '16:28', 'Staff', '', '', 'K / Nosilela', '', 'M', '', ''),
('out', '7010285804086', '', '', '', '', '16:26 07-5-2020', '2020/07/05', '16:26', 'Staff', '', '', 'Nosilela Kadekil / N m', '', 'work', '', ''),
('out', '7010285804086', '', '', '', '', '16:28 06-5-2020', '2020/06/05', '16:28', 'Staff', '', '', 'k / nosilela', '', 'work', '', ''),
('out', '7010285804086', '', '', '', '', '16:26 05-5-2020', '2020/05/05', '16:26', 'Staff', '', '', 'K / Nosilela', '', 'Mantainance', '', ''),
('out', '7010285804086', '', '', '', '', '16:27 04-5-2020', '2020/04/05', '16:27', 'Staff', '', '', 'K / Nosilela', '', 'Maintanance', '', ''),
('in', '7012075408084', 'DAVID MZUKISIBEYI', '', '', '7012075409084', '06:47 21-4-2020', '21-4-2020', '06:47', 'Staff', '', '', 'DAVID MZUKISI / BEYI', '', '', '', ''),
('out', '7012075409084', 'DAVID MZUKISIBEYI', '', '', '7012075409084', '13:14 08-5-2020', '2020/08/05', '13:14', 'Staff', '', '', '', '', '', '', ''),
('out', '7012075409084', 'DAVID MZUKISIBEYI', '', '', '7012075409084', '16:13 06-5-2020', '2020/06/05', '16:13', 'Staff', '', '', '', '', '', '', ''),
('out', '7012075409084', 'DAVID MZUKISIBEYI', '', '', '7012075409084', '16:05 05-5-2020', '2020/05/05', '16:05', 'Staff', '', '', '', '', '', '', ''),
('out', '7012075409084', 'DAVID MZUKISIBEYI', '', '', '7012075409084', '16:04 04-5-2020', '2020/04/05', '16:04', 'Staff', '', '', '', '', '', '', ''),
('in', '7012075409084', 'DAVID MZUKISIBEYI', '', '', '7012075409084', '07:39 28-4-2020', '28-4-2020', '07:39', 'Staff', '', '', 'DAVID MZUKISI / BEYI', '', '', '', ''),
('out', '7012075409084', 'DAVID MZUKISIBEYI', '', '', '7012075409084', '16:07 28-4-2020', '28-4-2020', '16:07', 'Staff', '', '', 'DAVID MZUKISI / BEYI', '', '', '', ''),
('out', '7012075409084', 'DAVID MZUKISIBEYI', '', '', '7012075409084', '15:59 21-4-2020', '21-4-2020', '15:59', 'Staff', '', '', '', '', '', '', ''),
('in', '7012075409084', 'DAVID MZUKISIBEYI', '', '', '7012075409084', '07:15 20-4-2020', '20-4-2020', '07:15', 'Staff', '', '', 'DAVID MZUKISI / BEYI', '', '', '', ''),
('out', '7012075409084', 'DAVID MZUKISIBEYI', '', '', '7012075409084', '16:09 20-4-2020', '20-4-2020', '16:09', 'Staff', '', '', 'DAVID MZUKISI / BEYI', '', '', '', ''),
('out', '7012075409084', '', '', '', '', '16:07 07-5-2020', '2020/07/05', '16:07', 'Staff', '', '', '', '', '', '', ''),
('in', '7101010836087', 'ZCTolwana', '', '', '', '08:52 11-5-2020', '2020/11/05', '08:52', 'Staff', '', '', 'ZC / Tolwana', '', '176', '', ''),
('out', '7103051000086', 'NOMANGESI SHEILLAPETA', '', '', '7103051000086', '07:02 09-5-2020', '2020/09/05', '07:02', 'Staff', '', '', '', '', '', '', ''),
('in', '7103051000086', 'NOMANGESI SHEILLAPETA', '', '', '7103051000086', '06:51 02-5-2020', '2020/02/05', '06:51', 'Staff', '', '', 'NOMANGESI SHEILLA / PETA', '', 'Unit 190', '', ''),
('out', '7103051000086', 'NOMANGESI SHEILLAPETA', '', '', '7103051000086', '07:07 27-4-2020', '27-4-2020', '07:07', 'Staff', '', '', '', '', '', '', ''),
('out', '7103051000086', 'NOMANGESI SHEILLAPETA', '', '', '7103051000086', '18:50 18-4-2020', '18-4-2020', '18:50', 'Staff', '', '', 'NS / Peta', '', '', '', ''),
('out', '7103051000086', 'NOMANGESI SHEILLAPETA', '', '', '7103051000086', '07:02 12-4-2020', '2020/12/04', '07:02', 'Staff', '', '', '', '', '', '', ''),
('in', '7103051000086', 'NSPeta', '', '', '', '06:54 03-5-2020', '2020/03/05', '06:54', 'Staff', '', '', 'NS / Peta', '', 'U-190', '', ''),
('in', '7103051000086', 'NSPeta', '', '', '', '07:01 18-4-2020', '18-4-2020', '07:01', 'Staff', '', '', 'NS / Peta', '', '', '', ''),
('out', '7103051000086', '', '', '', '', '07:01 11-5-2020', '2020/11/05', '07:01', 'Staff', '', '', '', '', '', '', ''),
('out', '7103051000086', '', '', '', '', '07:03 10-5-2020', '2020/10/05', '07:03', 'Staff', '', '', '', '', '', '', ''),
('out', '7103051000086', '', '', '', '', '07:04 06-5-2020', '2020/06/05', '07:04', 'Staff', '', '', '', '', '', '', ''),
('out', '7103051000086', '', '', '', '', '07:04 01-5-2020', '2020/01/05', '07:04', 'Staff', '', '', '', '', '', '', ''),
('out', '7103051000086', '', '', '', '', '07:05 30-4-2020', '30-4-2020', '07:05', 'Staff', '', '', '', '', '', '', ''),
('out', '7103051000086', '', '', '', '', '07:04 25-4-2020', '25-4-2020', '07:04', 'Staff', '', '', '', '', '', '', ''),
('out', '7103051000086', '', '', '', '', '07:03 22-4-2020', '22-4-2020', '07:03', 'Staff', '', '', '', '', '', '', ''),
('out', '7103051000086', '', '', '', '', '07:02 21-4-2020', '21-4-2020', '07:02', 'Staff', '', '', '', '', '', '', ''),
('out', '7103051000086', '', '', '', '', '18:44 19-4-2020', '19-4-2020', '18:44', 'Staff', '', '', '', '', '', '', ''),
('out', '7103051000086', '', '', '', '', '07:02 17-4-2020', '17-4-2020', '07:02', 'Staff', '', '', '', '', '', '', ''),
('out', '7103051000086', '', '', '', '', '07:00 16-4-2020', '16-4-2020', '07:00', 'Staff', '', '', '', '', '', '', ''),
('out', '7103051000086', '', '', '', '', '07:02 11-4-2020', '2020/11/04', '07:02', 'Staff', '', '', '', '', '', '', ''),
('in', '7105225406081', 'MKHAMKHAM', '', '', '7105225406081', '06:55 05-5-2020', '2020/05/05', '06:55', 'Visitors', 'Expired driver licence', 'M / KHAMKHAM', '', '', '', '', 'Care Centre'),
('in', '7110075621086', 'Qokosipho', '', '', '', '07:32 07-5-2020', '2020/07/05', '07:32', 'Staff', '', '', 'Qoko / sipho', '', 'work', '', ''),
('in', '7110075621086', 'SQoko', '', '', '', '07:16 11-5-2020', '2020/11/05', '07:16', 'Staff', '', '', 'S / Qoko', '', 'M', '', ''),
('in', '7110075621086', 'SQoko', '', '', '', '07:09 08-5-2020', '2020/08/05', '07:09', 'Staff', '', '', 'S / Qoko', '', 'KG', '', ''),
('in', '7110075621086', 'sqoko', '', '', '', '07:45 06-5-2020', '2020/06/05', '07:45', 'Staff', '', '', 's / qoko', '', 'work', '', ''),
('in', '7110075621086', 'SQoko', '', '', '', '07:21 05-5-2020', '2020/05/05', '07:21', 'Staff', '', '', 'S / Qoko', '', 'Mantainance', '', ''),
('in', '7110075621086', 'SQoko', '', '', '', '07:49 04-5-2020', '2020/04/05', '07:49', 'Staff', '', '', 'S / Qoko', '', 'Mantainance', '', '');
INSERT INTO `atthegate` (`direction`, `license`, `name`, `company`, `category`, `dr_license`, `creation`, `recdate`, `rectime`, `profile`, `incidents`, `dr_name`, `name_in`, `name_out`, `going`, `company2`, `visiting`) VALUES
('in', '7110075621086', 'Sqoko', '', '', '', '07:14 30-4-2020', '30-4-2020', '07:14', 'Staff', '', '', 'S / qoko', '', '', '', ''),
('in', '7110075621086', 'SQoko', '', '', '', '07:44 29-4-2020', '29-4-2020', '07:44', 'Staff', '', '', 'S / Qoko', '', '', '', ''),
('in', '7110075621086', 'SQoko', '', '', '', '07:22 28-4-2020', '28-4-2020', '07:22', 'Staff', '', '', 'S / Qoko', '', '', '', ''),
('in', '7110075621086', 'SQoko', '', '', '', '07:34 24-4-2020', '24-4-2020', '07:34', 'Staff', '', '', 'S / Qoko', '', '', '', ''),
('out', '7110075621086', '', '', '', '', '16:25 08-5-2020', '2020/08/05', '16:25', 'Staff', '', '', 'S / Qoko', '', 'KG', '', ''),
('out', '7110075621086', '', '', '', '', '16:31 07-5-2020', '2020/07/05', '16:31', 'Staff', '', '', 'Qoko / sipho', '', 'work', '', ''),
('out', '7110075621086', '', '', '', '', '16:29 06-5-2020', '2020/06/05', '16:29', 'Staff', '', '', 's / qoko', '', 'work', '', ''),
('out', '7110075621086', '', '', '', '', '16:25 05-5-2020', '2020/05/05', '16:25', 'Staff', '', '', 'S / Qoko', '', 'Mantainance', '', ''),
('out', '7110075621086', '', '', '', '', '16:28 04-5-2020', '2020/04/05', '16:28', 'Staff', '', '', 'S / Qoko', '', 'Mantainance', '', ''),
('out', '7110075621086', '', '', '', '', '16:28 30-4-2020', '30-4-2020', '16:28', 'Staff', '', '', 'S / qoko', '', '', '', ''),
('out', '7110075621086', '', '', '', '', '16:29 29-4-2020', '29-4-2020', '16:29', 'Staff', '', '', 'S / Qoko', '', '', '', ''),
('out', '7110075621086', '', '', '', '', '16:29 28-4-2020', '28-4-2020', '16:29', 'Staff', '', '', 'S / Qoko', '', '', '', ''),
('out', '7110075621086', '', '', '', '', '16:28 24-4-2020', '24-4-2020', '16:28', 'Staff', '', '', 'S / Qoko', '', '', '', ''),
('in', '7112195064080', 'MCRIELLY', '', '', '7112195064080', '12:38 05-5-2020', '2020/05/05', '12:38', 'Visitors', 'Expired car licence', 'MC / RIELLY', '', '', '', '', 'Del'),
('in', '7201110094080', 'RBOTHA', '', '', '7201110094080', '07:06 11-5-2020', '2020/11/05', '07:06', 'Staff', '', '', 'R / BOTHA', '', 'C', '', ''),
('in', '7201155766089', 'XMBANDEZI', '', '', '7201155766089', '18:50 03-5-2020', '2020/03/05', '18:50', 'Visitors', '', 'XM / BANDEZI', '', '', '', '', 'Patrol'),
('in', '7203126037087', 'Tuku Zanenvulaz Tuku', '', '', '', '07:08 07-5-2020', '2020/07/05', '07:08', 'Staff', '', '', 'Tuku Zanenvula / z Tuku', '', 'Gardin', '', ''),
('in', '7203126037087', 'zanemvulatuku', '', '', '', '07:03 06-5-2020', '2020/06/05', '07:03', 'Staff', '', '', 'zanemvula / tuku', '', 'work', '', ''),
('in', '7203126037087', 'ZTuku', '', '', '', '07:03 11-5-2020', '2020/11/05', '07:03', 'Staff', '', '', 'Z / Tuku', '', 'KG', '', ''),
('in', '7203126037087', 'ZTuku', '', '', '', '07:08 08-5-2020', '2020/08/05', '07:08', 'Staff', '', '', 'Z / Tuku', '', 'KG', '', ''),
('in', '7203126037087', 'ZTuku', '', '', '', '07:15 05-5-2020', '2020/05/05', '07:15', 'Staff', '', '', 'Z / Tuku', '', 'K G', '', ''),
('in', '7203126037087', 'ZTuku', '', '', '', '06:57 04-5-2020', '2020/04/05', '06:57', 'Staff', '', '', 'Z / Tuku ', '', 'Kenton Garden Services', '', ''),
('in', '7203126037087', 'ZTuku', '', '', '', '07:08 30-4-2020', '30-4-2020', '07:08', 'Staff', '', '', 'Z / Tuku', '', '', '', ''),
('in', '7203126037087', 'ZTuku', '', '', '', '07:07 29-4-2020', '29-4-2020', '07:07', 'Staff', '', '', 'Z / Tuku', '', '', '', ''),
('out', '7203126037087', '', '', '', '', '16:16 08-5-2020', '2020/08/05', '16:16', 'Staff', '', '', 'Z / Tuku', '', 'KG', '', ''),
('out', '7203126037087', '', '', '', '', '16:23 07-5-2020', '2020/07/05', '16:23', 'Staff', '', '', 'Tuku Zanenvula / z Tuku', '', 'Gardin', '', ''),
('out', '7203126037087', '', '', '', '', '16:28 06-5-2020', '2020/06/05', '16:28', 'Staff', '', '', 'zanemvula / tuku', '', 'work', '', ''),
('out', '7203126037087', '', '', '', '', '16:24 05-5-2020', '2020/05/05', '16:24', 'Staff', '', '', 'Z / Tuku', '', 'K G', '', ''),
('out', '7203126037087', '', '', '', '', '16:24 04-5-2020', '2020/04/05', '16:24', 'Staff', '', '', 'Z / Tuku ', '', 'Kenton Garden Services', '', ''),
('out', '7203126037087', '', '', '', '', '16:03 30-4-2020', '30-4-2020', '16:03', 'Staff', '', '', 'Z / Tuku', '', '', '', ''),
('out', '7203126037087', '', '', '', '', '16:24 29-4-2020', '29-4-2020', '16:24', 'Staff', '', '', 'Z / Tuku', '', '', '', ''),
('out', '7203126037087', '', '', '', '', '16:25 28-4-2020', '28-4-2020', '16:25', 'Staff', '', '', '', '', '', '', ''),
('out', '7205290610086', '', '', '', '', '06:52 02-5-2020', '2020/02/05', '06:52', 'Staff', '', '', '', '', '', '', ''),
('out', '7205290610086', '', '', '', '', '07:02 28-4-2020', '28-4-2020', '07:02', 'Staff', '', '', '', '', '', '', ''),
('in', '7206270071083', 'AtkinsonAtkinson', '', '', '', '18:03 18-4-2020', '18-4-2020', '18:03', 'Visitors', '', 'Atkinson / Atkinson', '', '', '', '', '128'),
('in', '7206270071083', 'LTimm', '', '', '', '10:35 01-5-2020', '2020/01/05', '10:35', 'Staff', '', '', 'L / Timm', '', '128D', '', ''),
('in', '7303051071083', 'N.PTyuwa', '', '', '', '06:46 14-4-2020', '14-4-2020', '06:46', 'Staff', '', '', 'N.P / Tyuwa', '', '', '', ''),
('in', '7303051071083', 'NombuleloTyuwa', '', '', '', '06:39 20-4-2020', '20-4-2020', '06:39', 'Staff', '', '', 'Nombulelo / Tyuwa', '', '', '', ''),
('in', '7303051071083', 'Notyuea', '', '', '', '06:32 29-4-2020', '29-4-2020', '06:32', 'Staff', '', '', 'No / tyuea', '', '', '', ''),
('in', '7303051071083', 'NpTyuwa', '', '', '', '06:30 01-5-2020', '2020/01/05', '06:30', 'Staff', '', '', 'Np / Tyuwa', '', 'ketchen', '', ''),
('in', '7303051071083', 'NPTyuwa', '', '', '', '06:32 30-4-2020', '30-4-2020', '06:32', 'Staff', '', '', 'NP / Tyuwa', '', '', '', ''),
('in', '7303051071083', 'NPTyuwa', '', '', '', '06:35 28-4-2020', '28-4-2020', '06:35', 'Staff', '', '', 'NP / Tyuwa', '', '', '', ''),
('in', '7303051071083', 'Nptyuwa', '', '', '', '06:34 27-4-2020', '27-4-2020', '06:34', 'Staff', '', '', 'Np / tyuwa', '', '', '', ''),
('in', '7303051071083', 'NPTyuwa', '', '', '', '06:36 24-4-2020', '24-4-2020', '06:36', 'Staff', '', '', 'NP / Tyuwa', '', '', '', ''),
('in', '7303051071083', 'NPTyuwa', '', '', '', '06:35 23-4-2020', '23-4-2020', '06:35', 'Staff', '', '', 'NP / Tyuwa', '', '', '', ''),
('in', '7303051071083', 'Nptyuwa', '', '', '', '06:41 21-4-2020', '21-4-2020', '06:41', 'Staff', '', '', 'Np / tyuwa', '', '', '', ''),
('in', '7303051071083', 'NPTyuwa', '', '', '', '06:43 17-4-2020', '17-4-2020', '06:43', 'Staff', '', '', 'NP / Tyuwa', '', '', '', ''),
('in', '7303051071083', 'NPTyuwa', '', '', '', '06:43 16-4-2020', '16-4-2020', '06:43', 'Staff', '', '', 'NP / Tyuwa', '', '', '', ''),
('in', '7303051071083', 'NPTyuwa', '', '', '', '06:51 15-4-2020', '15-4-2020', '06:51', 'Staff', '', '', 'NP / Tyuwa', '', '', '', ''),
('in', '7303051071083', 'NPTyuwa', '', '', '', '06:52 11-4-2020', '2020/11/04', '06:52', 'Staff', '', '', 'NP / Tyuwa', '', '', '', ''),
('in', '7303051071083', 'PTyuwa', '', '', '', '06:31 22-4-2020', '22-4-2020', '06:31', 'Staff', '', '', 'P / Tyuwa', '', '', '', ''),
('out', '7303051071083', '', '', '', '', '13:19 01-5-2020', '2020/01/05', '13:19', 'Staff', '', '', 'Np / Tyuwa', '', 'ketchen', '', ''),
('out', '7303051071083', '', '', '', '', '17:16 30-4-2020', '30-4-2020', '17:16', 'Staff', '', '', 'NP / Tyuwa', '', '', '', ''),
('out', '7303051071083', '', '', '', '', '17:15 29-4-2020', '29-4-2020', '17:15', 'Staff', '', '', 'No / tyuea', '', '', '', ''),
('out', '7303051071083', '', '', '', '', '17:15 28-4-2020', '28-4-2020', '17:15', 'Staff', '', '', 'NP / Tyuwa', '', '', '', ''),
('out', '7303051071083', '', '', '', '', '17:33 27-4-2020', '27-4-2020', '17:33', 'Staff', '', '', 'Np / tyuwa', '', '', '', ''),
('out', '7303051071083', '', '', '', '', '13:20 24-4-2020', '24-4-2020', '13:20', 'Staff', '', '', 'NP / Tyuwa', '', '', '', ''),
('out', '7303051071083', '', '', '', '', '17:38 23-4-2020', '23-4-2020', '17:38', 'Staff', '', '', 'NP / Tyuwa', '', '', '', ''),
('out', '7303051071083', '', '', '', '', '14:45 22-4-2020', '22-4-2020', '14:45', 'Staff', '', '', 'P / Tyuwa', '', '', '', ''),
('out', '7303051071083', '', '', '', '', '17:04 21-4-2020', '21-4-2020', '17:04', 'Staff', '', '', 'Np / tyuwa', '', '', '', ''),
('out', '7303051071083', '', '', '', '', '17:06 20-4-2020', '20-4-2020', '17:06', 'Staff', '', '', 'Nombulelo / Tyuwa', '', '', '', ''),
('out', '7303051071083', '', '', '', '', '14:00 17-4-2020', '17-4-2020', '14:00', 'Staff', '', '', 'NP / Tyuwa', '', '', '', ''),
('out', '7303051071083', '', '', '', '', '16:58 16-4-2020', '16-4-2020', '16:58', 'Staff', '', '', 'NP / Tyuwa', '', '', '', ''),
('out', '7303051071083', '', '', '', '', '17:13 15-4-2020', '15-4-2020', '17:13', 'Staff', '', '', 'NP / Tyuwa', '', '', '', ''),
('out', '7303051071083', '', '', '', '', '17:37 14-4-2020', '14-4-2020', '17:37', 'Staff', '', '', 'N.P / Tyuwa', '', '', '', ''),
('out', '7303051071083', '', '', '', '', '16:10 11-4-2020', '2020/11/04', '16:10', 'Staff', '', '', 'NP / Tyuwa', '', '', '', ''),
('in', '7307045739085', 'NTTUKU', '', '', '7307045739085', '07:32 11-5-2020', '2020/11/05', '07:32', 'Staff', '', '', 'NT / TUKU', '', 'M', '', ''),
('out', '7307045739085', 'NTTUKU', '', '', '7307045739085', '16:40 08-5-2020', '2020/08/05', '16:40', 'Staff', '', '', '', '', '', '', ''),
('out', '7307045739085', 'NTTUKU', '', '', '7307045739085', '16:33 07-5-2020', '2020/07/05', '16:33', 'Staff', '', '', 'N / TUKU', '', 'Work', '', ''),
('out', '7307045739085', 'NTTUKU', '', '', '7307045739085', '16:41 05-5-2020', '2020/05/05', '16:41', 'Staff', '', '', '', '', '', '', ''),
('in', '7307045739085', 'NTTUKU', '', '', '7307045739085', '08:12 04-5-2020', '2020/04/05', '08:12', 'Staff', '', '', 'NT / TUKU', '', 'Mantainance', '', ''),
('out', '7307045739085', 'NTTUKU', '', '', '7307045739085', '16:29 04-5-2020', '2020/04/05', '16:29', 'Staff', '', '', 'NT / TUKU', '', 'Mantainance', '', ''),
('in', '7307045739085', 'NTTUKU', '', '', '7307045739085', '07:40 30-4-2020', '30-4-2020', '07:40', 'Staff', '', '', 'NT / TUKU', '', '', '', ''),
('in', '7307045739085', 'NTTUKU', '', '', '7307045739085', '07:42 29-4-2020', '29-4-2020', '07:42', 'Staff', '', '', 'NT / TUKU', '', '', '', ''),
('out', '7307045739085', 'NTTUKU', '', '', '7307045739085', '16:33 29-4-2020', '29-4-2020', '16:33', 'Staff', '', '', 'NT / TUKU', '', '', '', ''),
('in', '7307045739085', 'NTTUKU', '', '', '7307045739085', '08:06 28-4-2020', '28-4-2020', '08:06', 'Staff', '', '', 'NT / TUKU', '', '', '', ''),
('out', '7307045739085', 'NTTUKU', '', '', '7307045739085', '16:35 24-4-2020', '24-4-2020', '16:35', 'Staff', '', '', '', '', '', '', ''),
('in', '7307045739085', 'NTUKU', '', '', '7307045739085', '07:47 07-5-2020', '2020/07/05', '07:47', 'Staff', '', '', 'N / TUKU', '', 'Work', '', ''),
('in', '7311190288088', 'N.Quma', '', '', '', '06:55 26-4-2020', '26-4-2020', '06:55', 'Staff', '', '', 'N. / Quma', '', '', '', ''),
('in', '7311190288088', 'N.Quma', '', '', '', '06:52 20-4-2020', '20-4-2020', '06:52', 'Staff', '', '', 'N. / Quma', '', '', '', ''),
('in', '7311190288088', 'NGuma', '', '', '', '06:33 24-4-2020', '24-4-2020', '06:33', 'Staff', '', '', 'N / Guma', '', '', '', ''),
('in', '7311190288088', 'Nnquma', '', '', '', '06:59 21-4-2020', '21-4-2020', '06:59', 'Staff', '', '', 'N / nquma', '', '', '', ''),
('in', '7311190288088', 'NQuma', '', '', '', '06:40 10-5-2020', '2020/10/05', '06:40', 'Staff', '', '', 'N / Quma', '', 'K', '', ''),
('in', '7311190288088', 'NQuma', '', '', '', '06:54 08-5-2020', '2020/08/05', '06:54', 'Staff', '', '', 'N / Quma', '', 'K', '', ''),
('in', '7311190288088', 'NQuma', '', '', '', '06:53 05-5-2020', '2020/05/05', '06:53', 'Staff', '', '', 'N / Quma', '', 'Kitchen', '', ''),
('in', '7311190288088', 'NQuma', '', '', '', '07:05 04-5-2020', '2020/04/05', '07:05', 'Staff', '', '', 'N / Quma', '', 'kitchen', '', ''),
('in', '7311190288088', 'NQuma', '', '', '', '08:19 01-5-2020', '2020/01/05', '08:19', 'Staff', '', '', 'N / Quma', '', 'kitch', '', ''),
('in', '7311190288088', 'NQuma', '', '', '', '06:52 30-4-2020', '30-4-2020', '06:52', 'Staff', '', '', 'N / Quma', '', '', '', ''),
('in', '7311190288088', 'NQuma', '', '', '', '06:54 29-4-2020', '29-4-2020', '06:54', 'Staff', '', '', 'N / Quma', '', '', '', ''),
('in', '7311190288088', 'NQuma', '', '', '', '06:52 17-4-2020', '17-4-2020', '06:52', 'Staff', '', '', 'N / Quma', '', '', '', ''),
('in', '7311190288088', 'NQuma', '', '', '', '06:56 16-4-2020', '16-4-2020', '06:56', 'Staff', '', '', 'N / Quma', '', '', '', ''),
('in', '7311190288088', 'NQuma', '', '', '', '06:56 15-4-2020', '15-4-2020', '06:56', 'Staff', '', '', 'N / Quma', '', '', '', ''),
('in', '7311190288088', 'NQuma', '', '', '', '07:02 12-4-2020', '2020/12/04', '07:02', 'Staff', '', '', 'N / Quma', '', '', '', ''),
('in', '7311190288088', 'NQuma', '', '', '', '06:50 11-4-2020', '2020/11/04', '06:50', 'Staff', '', '', 'N / Quma', '', '', '', ''),
('in', '7311190288088', 'Nqweniquma', '', '', '', '06:47 25-4-2020', '25-4-2020', '06:47', 'Staff', '', '', 'Nqweni / quma', '', '', '', ''),
('out', '7311190288088', '', '', '', '', '17:33 10-5-2020', '2020/10/05', '17:33', 'Staff', '', '', 'N / Quma', '', 'K', '', ''),
('out', '7311190288088', '', '', '', '', '17:37 08-5-2020', '2020/08/05', '17:37', 'Staff', '', '', 'N / Quma', '', 'K', '', ''),
('out', '7311190288088', '', '', '', '', '17:29 05-5-2020', '2020/05/05', '17:29', 'Staff', '', '', 'N / Quma', '', 'Kitchen', '', ''),
('out', '7311190288088', '', '', '', '', '16:58 04-5-2020', '2020/04/05', '16:58', 'Staff', '', '', 'N / Quma', '', 'kitchen', '', ''),
('out', '7311190288088', '', '', '', '', '13:16 01-5-2020', '2020/01/05', '13:16', 'Staff', '', '', 'N / Quma', '', 'kitch', '', ''),
('out', '7311190288088', '', '', '', '', '17:30 30-4-2020', '30-4-2020', '17:30', 'Staff', '', '', 'N / Quma', '', '', '', ''),
('out', '7311190288088', '', '', '', '', '17:03 29-4-2020', '29-4-2020', '17:03', 'Staff', '', '', 'N / Quma', '', '', '', ''),
('out', '7311190288088', '', '', '', '', '16:57 26-4-2020', '26-4-2020', '16:57', 'Staff', '', '', 'N. / Quma', '', '', '', ''),
('out', '7311190288088', '', '', '', '', '17:37 25-4-2020', '25-4-2020', '17:37', 'Staff', '', '', 'Nqweni / quma', '', '', '', ''),
('out', '7311190288088', '', '', '', '', '17:07 24-4-2020', '24-4-2020', '17:07', 'Staff', '', '', 'N / Guma', '', '', '', ''),
('out', '7311190288088', '', '', '', '', '17:04 21-4-2020', '21-4-2020', '17:04', 'Staff', '', '', 'N / nquma', '', '', '', ''),
('out', '7311190288088', '', '', '', '', '17:43 20-4-2020', '20-4-2020', '17:43', 'Staff', '', '', 'N. / Quma', '', '', '', ''),
('out', '7311190288088', '', '', '', '', '14:00 17-4-2020', '17-4-2020', '14:00', 'Staff', '', '', 'N / Quma', '', '', '', ''),
('out', '7311190288088', '', '', '', '', '16:58 16-4-2020', '16-4-2020', '16:58', 'Staff', '', '', 'N / Quma', '', '', '', ''),
('out', '7311190288088', '', '', '', '', '17:02 12-4-2020', '2020/12/04', '17:02', 'Staff', '', '', 'N / Quma', '', '', '', ''),
('out', '7311190288088', '', '', '', '', '17:03 11-4-2020', '2020/11/04', '17:03', 'Staff', '', '', 'N / Quma', '', '', '', ''),
('in', '7403105853088', 'PBooi', '', '', '', '07:21 11-5-2020', '2020/11/05', '07:21', 'Staff', '', '', 'P / Booi', '', 'Admin', '', ''),
('in', '7403105853088', 'PBOOI', '', '', '7403105853088', '07:24 08-5-2020', '2020/08/05', '07:24', 'Staff', '', '', 'P / BOOI', '', 'Admin', '', ''),
('out', '7403105853088', 'PBOOI', '', '', '7403105853088', '16:38 08-5-2020', '2020/08/05', '16:38', 'Staff', '', '', 'P / BOOI', '', 'Admin', '', ''),
('in', '7403105853088', 'PBooi', '', '', '', '09:21 07-5-2020', '2020/07/05', '09:21', 'Staff', '', '', 'P / Booi', '', 'Admin', '', ''),
('in', '7403105853088', 'pbooi', '', '', '', '07:32 06-5-2020', '2020/06/05', '07:32', 'Staff', '', '', 'p / booi', '', 'work', '', ''),
('in', '7403105853088', 'PBooi', '', '', '', '07:35 05-5-2020', '2020/05/05', '07:35', 'Staff', '', '', 'P / Booi', '', 'Admin', '', ''),
('in', '7403105853088', 'PBooi', '', '', '', '07:42 04-5-2020', '2020/04/05', '07:42', 'Staff', '', '', 'P / Booi', '', 'Admin', '', ''),
('in', '7403105853088', 'PBooi', '', '', '', '07:42 29-4-2020', '29-4-2020', '07:42', 'Staff', '', '', 'P / Booi', '', '', '', ''),
('in', '7403105853088', 'PBooi', '', '', '', '08:07 28-4-2020', '28-4-2020', '08:07', 'Staff', '', '', 'P / Booi', '', '', '', ''),
('in', '7403105853088', 'Pbooi', '', '', '', '07:49 24-4-2020', '24-4-2020', '07:49', 'Staff', '', '', 'P / booi', '', '', '', ''),
('in', '7403105853088', 'PBooi', '', '', '', '07:49 23-4-2020', '23-4-2020', '07:49', 'Staff', '', '', 'P / Booi', '', '', '', ''),
('in', '7403105853088', 'PBooi', '', '', '', '16:12 23-4-2020', '23-4-2020', '16:12', 'Staff', '', '', 'P / Booi', '', '', '', ''),
('in', '7403105853088', 'PBOOI', '', '', '7403105853088', '07:46 22-4-2020', '22-4-2020', '07:46', 'Staff', '', '', 'P / BOOI', '', '', '', ''),
('in', '7403105853088', 'PBOOI', '', '', '7403105853088', '07:45 21-4-2020', '21-4-2020', '07:45', 'Staff', '', '', 'P / BOOI', '', '', '', ''),
('out', '7403105853088', 'PBOOI', '', '', '7403105853088', '16:35 21-4-2020', '21-4-2020', '16:35', 'Staff', '', '', 'P / BOOI', '', '', '', ''),
('in', '7403105853088', 'PBOOI', '', '', '7403105853088', '08:02 20-4-2020', '20-4-2020', '08:02', 'Staff', '', '', 'P / BOOI', '', '', '', ''),
('in', '7403105853088', 'PBOOI', '', '', '7403105853088', '08:01 17-4-2020', '17-4-2020', '08:01', 'Staff', '', '', 'P / BOOI', '', '', '', ''),
('in', '7403105853088', 'PBooi', '', '', '', '09:51 14-4-2020', '14-4-2020', '09:51', 'Staff', '', '', 'P / Booi', '', '', '', ''),
('out', '7403105853088', '', '', '', '', '15:36 07-5-2020', '2020/07/05', '15:36', 'Staff', '', '', 'P / Booi', '', 'Admin', '', ''),
('out', '7403105853088', '', '', '', '', '16:31 05-5-2020', '2020/05/05', '16:31', 'Staff', '', '', 'P / Booi', '', 'Admin', '', ''),
('out', '7403105853088', '', '', '', '', '16:46 04-5-2020', '2020/04/05', '16:46', 'Staff', '', '', 'P / Booi', '', 'Admin', '', ''),
('out', '7403105853088', '', '', '', '', '16:58 28-4-2020', '28-4-2020', '16:58', 'Staff', '', '', 'P / Booi', '', '', '', ''),
('out', '7403105853088', '', '', '', '', '16:42 22-4-2020', '22-4-2020', '16:42', 'Staff', '', '', 'P / BOOI', '', '', '', ''),
('out', '7403105853088', '', '', '', '', '14:44 14-4-2020', '14-4-2020', '14:44', 'Staff', '', '', 'P / Booi', '', '', '', ''),
('in', '7404290613089', 'TCTsiitsi', '', '', '', '07:07 15-4-2020', '15-4-2020', '07:07', 'Staff', '', '', 'TC / Tsiitsi', '', '', '', ''),
('in', '7404290613089', 'TCTsitsi', '', '', '', '07:08 16-4-2020', '16-4-2020', '07:08', 'Staff', '', '', 'TC / Tsitsi', '', '', '', ''),
('in', '7404290613089', 'TTsitsi', '', '', '', '08:44 03-5-2020', '2020/03/05', '08:44', 'Staff', '', '', 'T / Tsitsi', '', '39', '', ''),
('in', '7404290613089', 'TTsitsi', '', '', '', '08:12 01-5-2020', '2020/01/05', '08:12', 'Staff', '', '', 'T / Tsitsi', '', '39', '', ''),
('in', '7404290613089', 'TTTsitsi', '', '', '', '08:10 10-5-2020', '2020/10/05', '08:10', 'Staff', '', '', 'TT / Tsitsi', '', '39', '', ''),
('out', '7404290613089', '', '', '', '', '13:14 10-5-2020', '2020/10/05', '13:14', 'Staff', '', '', 'TT / Tsitsi', '', '39', '', ''),
('out', '7404290613089', '', '', '', '', '16:17 03-5-2020', '2020/03/05', '16:17', 'Staff', '', '', 'T / Tsitsi', '', '39', '', ''),
('out', '7404290613089', '', '', '', '', '17:14 01-5-2020', '2020/01/05', '17:14', 'Staff', '', '', 'T / Tsitsi', '', '39', '', ''),
('out', '7404290613089', '', '', '', '', '17:49 16-4-2020', '16-4-2020', '17:49', 'Staff', '', '', 'TC / Tsitsi', '', '', '', ''),
('out', '7404290613089', '', '', '', '', '17:53 15-4-2020', '15-4-2020', '17:53', 'Staff', '', '', 'TC / Tsiitsi', '', '', '', ''),
('in', '7407055326086', 'MXKakam', '', '', '', '06:36 04-5-2020', '2020/04/05', '06:36', 'Staff', '', '', 'MX / Kakam', '', 'Kitchen', '', ''),
('in', '7407055326086', 'XMKamkam', '', '', '', '06:38 08-5-2020', '2020/08/05', '06:38', 'Staff', '', '', 'XM / Kamkam', '', 'Kitchen', '', ''),
('in', '7407055326086', 'XOLA MELVINKAMKAM', '', '', '7407055326086', '06:43 11-5-2020', '2020/11/05', '06:43', 'Staff', '', '', 'XOLA MELVIN / KAMKAM', '', 'Kitchen', '', ''),
('in', '7407055326086', 'XOLA MELVINKAMKAM', '', '', '7407055326086', '06:39 07-5-2020', '2020/07/05', '06:39', 'Staff', '', '', 'XOLA MELVIN / KAMKAM', '', 'Kitchen', '', ''),
('in', '7407055326086', 'XOLA MELVINKAMKAM', '', '', '7407055326086', '06:37 05-5-2020', '2020/05/05', '06:37', 'Staff', '', '', 'XOLA MELVIN / KAMKAM', '', 'Kitchen', '', ''),
('out', '7407055326086', 'XOLA MELVINKAMKAM', '', '', '7407055326086', '16:42 05-5-2020', '2020/05/05', '16:42', 'Staff', '', '', 'XOLA MELVIN / KAMKAM', '', 'Kitchen', '', ''),
('out', '7407055326086', '', '', '', '', '16:29 08-5-2020', '2020/08/05', '16:29', 'Staff', '', '', 'XM / Kamkam', '', 'Kitchen', '', ''),
('out', '7407055326086', '', '', '', '', '17:03 07-5-2020', '2020/07/05', '17:03', 'Staff', '', '', 'XOLA MELVIN / KAMKAM', '', 'Kitchen', '', ''),
('out', '7407055326086', '', '', '', '', '16:40 04-5-2020', '2020/04/05', '16:40', 'Staff', '', '', 'MX / Kakam', '', 'Kitchen', '', ''),
('out', '7407055326086', '', '', '', '', '07:43 17-4-2020', '17-4-2020', '07:43', 'Staff', '', '', '', '', '', '', ''),
('in', '7410106834082', 'BansXolan', '', '', '', '07:39 07-5-2020', '2020/07/05', '07:39', 'Staff', '', '', 'Bans / Xolan', '', 'work', '', ''),
('in', '7410106834082', 'xbans', '', '', '', '07:36 06-5-2020', '2020/06/05', '07:36', 'Staff', '', '', 'x / bans', '', 'work', '', ''),
('in', '7410106834082', 'XEBani', '', '', '', '07:27 04-5-2020', '2020/04/05', '07:27', 'Staff', '', '', 'XE / Bani', '', 'Maintanance', '', ''),
('in', '7410106834082', 'XEBans', '', '', '', '07:34 08-5-2020', '2020/08/05', '07:34', 'Staff', '', '', 'XE / Bans', '', 'M', '', ''),
('in', '7410106834082', 'XEBans', '', '', '', '07:34 05-5-2020', '2020/05/05', '07:34', 'Staff', '', '', 'XE / Bans', '', 'M', '', ''),
('in', '7410106834082', 'XRBans', '', '', '', '07:36 11-5-2020', '2020/11/05', '07:36', 'Staff', '', '', 'XR / Bans', '', 'M', '', ''),
('out', '7410106834082', '', '', '', '', '16:27 08-5-2020', '2020/08/05', '16:27', 'Staff', '', '', 'XE / Bans', '', 'M', '', ''),
('out', '7410106834082', '', '', '', '', '16:28 07-5-2020', '2020/07/05', '16:28', 'Staff', '', '', 'Bans / Xolan', '', 'work', '', ''),
('out', '7410106834082', '', '', '', '', '16:29 06-5-2020', '2020/06/05', '16:29', 'Staff', '', '', 'x / bans', '', 'work', '', ''),
('out', '7410106834082', '', '', '', '', '16:29 05-5-2020', '2020/05/05', '16:29', 'Staff', '', '', 'XE / Bans', '', 'M', '', ''),
('out', '7410106834082', '', '', '', '', '16:28 04-5-2020', '2020/04/05', '16:28', 'Staff', '', '', 'XE / Bani', '', 'Maintanance', '', ''),
('in', '7410265350086', 'MatikincaMzwanel', '', '', '', '07:19 07-5-2020', '2020/07/05', '07:19', 'Staff', '', '', 'Matikinca / Mzwanel', '', 'work', '', ''),
('in', '7410265350086', 'mmatikinca', '', '', '', '07:09 06-5-2020', '2020/06/05', '07:09', 'Staff', '', '', 'm / matikinca', '', 'work', '', ''),
('in', '7410265350086', 'MWMatikinca', '', '', '', '07:12 11-5-2020', '2020/11/05', '07:12', 'Staff', '', '', 'MW / Matikinca', '', 'KG', '', ''),
('in', '7410265350086', 'MWMatikinca', '', '', '', '07:13 08-5-2020', '2020/08/05', '07:13', 'Staff', '', '', 'MW / Matikinca', '', 'KG', '', ''),
('in', '7410265350086', 'MWMatikinca', '', '', '', '07:02 05-5-2020', '2020/05/05', '07:02', 'Staff', '', '', 'MW / Matikinca', '', 'KG', '', ''),
('in', '7410265350086', 'MWMatikinca', '', '', '', '07:07 04-5-2020', '2020/04/05', '07:07', 'Staff', '', '', 'MW / Matikinca', '', 'Kento Gardens', '', ''),
('in', '7410265350086', 'MWMatikinca', '', '', '', '07:08 30-4-2020', '30-4-2020', '07:08', 'Staff', '', '', 'MW / Matikinca', '', '', '', ''),
('in', '7410265350086', 'MWMatikinca', '', '', '', '07:06 29-4-2020', '29-4-2020', '07:06', 'Staff', '', '', 'MW / Matikinca', '', '', '', ''),
('out', '7410265350086', '', '', '', '', '16:15 08-5-2020', '2020/08/05', '16:15', 'Staff', '', '', 'MW / Matikinca', '', 'KG', '', ''),
('out', '7410265350086', '', '', '', '', '16:25 07-5-2020', '2020/07/05', '16:25', 'Staff', '', '', 'Matikinca / Mzwanel', '', 'work', '', ''),
('out', '7410265350086', '', '', '', '', '16:27 06-5-2020', '2020/06/05', '16:27', 'Staff', '', '', 'm / matikinca', '', 'work', '', ''),
('out', '7410265350086', '', '', '', '', '16:24 05-5-2020', '2020/05/05', '16:24', 'Staff', '', '', 'MW / Matikinca', '', 'KG', '', ''),
('out', '7410265350086', '', '', '', '', '16:26 04-5-2020', '2020/04/05', '16:26', 'Staff', '', '', 'MW / Matikinca', '', 'Kento Gardens', '', ''),
('out', '7410265350086', '', '', '', '', '16:03 30-4-2020', '30-4-2020', '16:03', 'Staff', '', '', 'MW / Matikinca', '', '', '', ''),
('out', '7410265350086', '', '', '', '', '16:25 29-4-2020', '29-4-2020', '16:25', 'Staff', '', '', 'MW / Matikinca', '', '', '', ''),
('in', '7411280437080', 'P.PSabani', '', '', '', '17:42 23-4-2020', '23-4-2020', '17:42', 'Staff', '', '', 'P.P / Sabani', '', '', '', ''),
('in', '7411280437080', 'P.PSabani', '', '', '', '07:01 20-4-2020', '20-4-2020', '07:01', 'Staff', '', '', 'P.P / Sabani', '', '', '', ''),
('in', '7411280437080', 'pathiswa sabani', '', '', '', '18:03 25-4-2020', '25-4-2020', '18:03', 'Staff', '', '', 'pathiswa  / sabani', '', '', '', ''),
('in', '7411280437080', 'PatriciaSabani', '', '', '', '16:32 14-4-2020', '14-4-2020', '16:32', 'Staff', '', '', 'Patricia / Sabani', '', '', '', ''),
('in', '7411280437080', 'PatriciaSabani', '', '', '', '16:33 13-4-2020', '13-4-2020', '16:33', 'Staff', '', '', 'Patricia / Sabani', '', '', '', ''),
('in', '7411280437080', 'phathekasabane', '', '', '', '17:56 10-5-2020', '2020/10/05', '17:56', 'Staff', '', '', 'phatheka / sabane', '', '128D', '', ''),
('in', '7411280437080', 'Phathiswa NN phathiswa', '', '', '', '18:11 26-4-2020', '26-4-2020', '18:11', 'Staff', '', '', 'Phathiswa N / N phathiswa', '', '', '', ''),
('in', '7411280437080', 'Phatiswa sabaniP sabani', '', '', '', '18:12 24-4-2020', '24-4-2020', '18:12', 'Staff', '', '', 'Phatiswa sabani / P sabani', '', '', '', ''),
('in', '7411280437080', 'Phatiswa Sabanip Sabani', '', '', '', '07:53 19-4-2020', '19-4-2020', '07:53', 'Staff', '', '', 'Phatiswa Sabani / p Sabani', '', '', '', ''),
('in', '7411280437080', 'PhatiswaSabani', '', '', '', '17:59 09-5-2020', '2020/09/05', '17:59', 'Staff', '', '', 'Phatiswa / Sabani', '', '128D', '', ''),
('in', '7411280437080', 'phatiswasabani', '', '', '', '07:08 06-5-2020', '2020/06/05', '07:08', 'Staff', '', '', 'phatiswa / sabani', '', 'frail care', '', ''),
('in', '7411280437080', 'PPJekana', '', '', '', '16:33 15-4-2020', '15-4-2020', '16:33', 'Staff', '', '', 'PP / Jekana', '', '', '', ''),
('in', '7411280437080', 'Ppsabana', '', '', '', '16:31 16-4-2020', '16-4-2020', '16:31', 'Staff', '', '', 'Pp / sabana', '', '', '', ''),
('in', '7411280437080', 'Ppsabane', '', '', '', '07:17 23-4-2020', '23-4-2020', '07:17', 'Staff', '', '', 'Pp / sabane', '', '', '', ''),
('in', '7411280437080', 'PPSabani', '', '', '', '06:57 05-5-2020', '2020/05/05', '06:57', 'Staff', '', '', 'PP / Sabani', '', 'Unit 128D', '', ''),
('in', '7411280437080', 'PPSabani', '', '', '', '07:04 04-5-2020', '2020/04/05', '07:04', 'Staff', '', '', 'PP / Sabani', '', 'Kitchen', '', ''),
('in', '7411280437080', 'PPSabani', '', '', '', '07:50 29-4-2020', '29-4-2020', '07:50', 'Staff', '', '', 'PP / Sabani', '', '', '', ''),
('in', '7411280437080', 'PPSabani', '', '', '', '06:53 22-4-2020', '22-4-2020', '06:53', 'Staff', '', '', 'PP / Sabani', '', '', '', ''),
('in', '7411280437080', 'PPSabani', '', '', '', '06:55 21-4-2020', '21-4-2020', '06:55', 'Staff', '', '', 'PP / Sabani', '', '', '', ''),
('in', '7411280437080', 'PPSabani', '', '', '', '07:57 18-4-2020', '18-4-2020', '07:57', 'Staff', '', '', 'PP / Sabani', '', '', '', ''),
('in', '7411280437080', 'PPSabani', '', '', '', '07:51 12-4-2020', '2020/12/04', '07:51', 'Staff', '', '', 'PP / Sabani', '', '', '', ''),
('in', '7411280437080', 'PPSabani', '', '', '', '07:52 11-4-2020', '2020/11/04', '07:52', 'Staff', '', '', 'PP / Sabani', '', '', '', ''),
('in', '7411280437080', 'Psabane', '', '', '', '07:50 30-4-2020', '30-4-2020', '07:50', 'Staff', '', '', 'P / sabane', '', '', '', ''),
('in', '7411280437080', 'PSabani', '', '', '', '07:49 01-5-2020', '2020/01/05', '07:49', 'Staff', '', '', 'P / Sabani', '', '128', '', ''),
('in', '7411280437080', 'Saban phatiswssPhathisws', '', '', '', '06:55 07-5-2020', '2020/07/05', '06:55', 'Staff', '', '', 'Saban phatisws / sPhathisws', '', '128d', '', ''),
('in', '7411280437080', 'sabaniphathiswa', '', '', '', '17:50 08-5-2020', '2020/08/05', '17:50', 'Staff', '', '', 'sabani / phathiswa', '', '128d', '', ''),
('out', '7411280437080', '', '', '', '', '07:19 11-5-2020', '2020/11/05', '07:19', 'Staff', '', '', 'phatheka / sabane', '', '128D', '', ''),
('out', '7411280437080', '', '', '', '', '07:22 10-5-2020', '2020/10/05', '07:22', 'Staff', '', '', 'Phatiswa / Sabani', '', '128D', '', ''),
('out', '7411280437080', '', '', '', '', '07:05 09-5-2020', '2020/09/05', '07:05', 'Staff', '', '', 'sabani / phathiswa', '', '128d', '', ''),
('out', '7411280437080', '', '', '', '', '07:16 08-5-2020', '2020/08/05', '07:16', 'Staff', '', '', 'Saban phatisws / sPhathisws', '', '128d', '', ''),
('out', '7411280437080', '', '', '', '', '18:37 06-5-2020', '2020/06/05', '18:37', 'Staff', '', '', 'phatiswa / sabani', '', 'frail care', '', ''),
('out', '7411280437080', '', '', '', '', '18:51 05-5-2020', '2020/05/05', '18:51', 'Staff', '', '', 'PP / Sabani', '', 'Unit 128D', '', ''),
('out', '7411280437080', '', '', '', '', '18:53 04-5-2020', '2020/04/05', '18:53', 'Staff', '', '', 'PP / Sabani', '', 'Kitchen', '', ''),
('out', '7411280437080', '', '', '', '', '16:41 01-5-2020', '2020/01/05', '16:41', 'Staff', '', '', 'P / Sabani', '', '128', '', ''),
('out', '7411280437080', '', '', '', '', '16:44 30-4-2020', '30-4-2020', '16:44', 'Staff', '', '', 'P / sabane', '', '', '', ''),
('out', '7411280437080', '', '', '', '', '16:43 29-4-2020', '29-4-2020', '16:43', 'Staff', '', '', 'PP / Sabani', '', '', '', ''),
('out', '7411280437080', '', '', '', '', '06:59 28-4-2020', '28-4-2020', '06:59', 'Staff', '', '', '', '', '', '', ''),
('out', '7411280437080', '', '', '', '', '16:40 28-4-2020', '28-4-2020', '16:40', 'Staff', '', '', '', '', '', '', ''),
('out', '7411280437080', '', '', '', '', '07:26 27-4-2020', '27-4-2020', '07:26', 'Staff', '', '', 'Phathiswa N / N phathiswa', '', '', '', ''),
('out', '7411280437080', '', '', '', '', '07:15 26-4-2020', '26-4-2020', '07:15', 'Staff', '', '', 'pathiswa  / sabani', '', '', '', ''),
('out', '7411280437080', '', '', '', '', '07:14 25-4-2020', '25-4-2020', '07:14', 'Staff', '', '', 'Phatiswa sabani / P sabani', '', '', '', ''),
('out', '7411280437080', '', '', '', '', '07:13 24-4-2020', '24-4-2020', '07:13', 'Staff', '', '', 'P.P / Sabani', '', '', '', ''),
('out', '7411280437080', '', '', '', '', '18:21 21-4-2020', '21-4-2020', '18:21', 'Staff', '', '', 'PP / Sabani', '', '', '', ''),
('out', '7411280437080', '', '', '', '', '18:16 20-4-2020', '20-4-2020', '18:16', 'Staff', '', '', 'P.P / Sabani', '', '', '', ''),
('out', '7411280437080', '', '', '', '', '18:15 19-4-2020', '19-4-2020', '18:15', 'Staff', '', '', 'Phatiswa Sabani / p Sabani', '', '', '', ''),
('out', '7411280437080', '', '', '', '', '16:49 18-4-2020', '18-4-2020', '16:49', 'Staff', '', '', 'PP / Sabani', '', '', '', ''),
('out', '7411280437080', '', '', '', '', '08:14 17-4-2020', '17-4-2020', '08:14', 'Staff', '', '', 'Pp / sabana', '', '', '', ''),
('out', '7411280437080', '', '', '', '', '08:12 16-4-2020', '16-4-2020', '08:12', 'Staff', '', '', 'PP / Jekana', '', '', '', ''),
('out', '7411280437080', '', '', '', '', '08:15 15-4-2020', '15-4-2020', '08:15', 'Staff', '', '', 'Patricia / Sabani', '', '', '', ''),
('out', '7411280437080', '', '', '', '', '08:06 14-4-2020', '14-4-2020', '08:06', 'Staff', '', '', 'Patricia / Sabani', '', '', '', ''),
('out', '7411280437080', '', '', '', '', '08:13 13-4-2020', '13-4-2020', '08:13', 'Staff', '', '', 'PP / Sabani', '', '', '', ''),
('out', '7411280437080', '', '', '', '', '16:46 11-4-2020', '2020/11/04', '16:46', 'Staff', '', '', 'PP / Sabani', '', '', '', ''),
('in', '7501255562084', 'XDMtsatse', '', '', '', '07:17 11-5-2020', '2020/11/05', '07:17', 'Staff', '', '', 'XD / Mtsatse', '', 'M', '', ''),
('in', '7501255562084', 'XDMtsatse', '', '', '', '07:22 08-5-2020', '2020/08/05', '07:22', 'Staff', '', '', 'XD / Mtsatse', '', 'KG', '', ''),
('in', '7501255562084', 'XDMtsatse', '', '', '', '07:13 05-5-2020', '2020/05/05', '07:13', 'Staff', '', '', 'XD / Mtsatse', '', 'KG', '', ''),
('in', '7501255562084', 'XDMtsatse', '', '', '', '07:11 04-5-2020', '2020/04/05', '07:11', 'Staff', '', '', 'XD / Mtsatse', '', 'Kenton Gardens', '', ''),
('in', '7501255562084', 'XDMtsatse', '', '', '', '07:04 30-4-2020', '30-4-2020', '07:04', 'Staff', '', '', 'XD / Mtsatse', '', '', '', ''),
('in', '7501255562084', 'XDMtsatse', '', '', '', '07:05 29-4-2020', '29-4-2020', '07:05', 'Staff', '', '', 'XD / Mtsatse', '', '', '', ''),
('in', '7501255562084', 'Xmatsatse', '', '', '', '07:13 06-5-2020', '2020/06/05', '07:13', 'Staff', '', '', 'X / matsatse', '', 'work', '', ''),
('in', '7501255562084', 'Xolile Mtsatsex m', '', '', '', '07:11 07-5-2020', '2020/07/05', '07:11', 'Staff', '', '', 'Xolile Mtsatse / x m', '', 'kenton', '', ''),
('out', '7501255562084', '', '', '', '', '16:16 08-5-2020', '2020/08/05', '16:16', 'Staff', '', '', 'XD / Mtsatse', '', 'KG', '', ''),
('out', '7501255562084', '', '', '', '', '16:25 07-5-2020', '2020/07/05', '16:25', 'Staff', '', '', 'Xolile Mtsatse / x m', '', 'kenton', '', ''),
('out', '7501255562084', '', '', '', '', '16:28 06-5-2020', '2020/06/05', '16:28', 'Staff', '', '', 'X / matsatse', '', 'work', '', ''),
('out', '7501255562084', '', '', '', '', '16:24 05-5-2020', '2020/05/05', '16:24', 'Staff', '', '', 'XD / Mtsatse', '', 'KG', '', ''),
('out', '7501255562084', '', '', '', '', '16:25 04-5-2020', '2020/04/05', '16:25', 'Staff', '', '', 'XD / Mtsatse', '', 'Kenton Gardens', '', ''),
('out', '7501255562084', '', '', '', '', '16:03 30-4-2020', '30-4-2020', '16:03', 'Staff', '', '', 'XD / Mtsatse', '', '', '', ''),
('out', '7501255562084', '', '', '', '', '16:25 29-4-2020', '29-4-2020', '16:25', 'Staff', '', '', 'XD / Mtsatse', '', '', '', ''),
('in', '7504220136083', 'LINDY ROSEDOUBELL', '', '', '7504220136083', '07:09 05-5-2020', '2020/05/05', '07:09', 'Staff', 'TU driver license warning', '', 'LINDY ROSE / DOUBELL', '', 'Care Centre', '', ''),
('out', '7508255041084', '', '', '', '', '08:01 13-4-2020', '13-4-2020', '08:01', 'Visitors', '', '', '', '', '', '', ''),
('in', '7510130532089', 'NOMHIKI PATIENCEMGADI', '', '', '7510130532089', '06:54 05-5-2020', '2020/05/05', '06:54', 'Staff', '', '', 'NOMHIKI PATIENCE / MGADI', '', 'Village Inn', '', ''),
('out', '7510130532089', 'NOMHIKI PATIENCEMGADI', '', '', '7510130532089', '18:50 05-5-2020', '2020/05/05', '18:50', 'Staff', '', '', 'NOMHIKI PATIENCE / MGADI', '', 'Village Inn', '', ''),
('in', '7510130532089', 'NOMHIKI PATIENCEMGADI', '', '', '7510130532089', '06:59 04-5-2020', '2020/04/05', '06:59', 'Staff', '', '', 'NOMHIKI PATIENCE / MGADI', '', 'Village Inn,', '', ''),
('in', '7510130532089', 'NOMHIKI PATIENCEMGADI', '', '', '7510130532089', '06:49 26-4-2020', '26-4-2020', '06:49', 'Staff', '', '', 'NOMHIKI PATIENCE / MGADI', '', '', '', ''),
('out', '7510130532089', '', '', '', '', '18:47 04-5-2020', '2020/04/05', '18:47', 'Staff', '', '', 'NOMHIKI PATIENCE / MGADI', '', 'Village Inn,', '', ''),
('in', '7601055581084', 'CNgesi', '', '', '', '09:43 27-4-2020', '27-4-2020', '09:43', 'Staff', '', '', 'C / Ngesi', '', '', '', ''),
('in', '7601055581084', 'D ngesiingesi', '', '', '', '19:00 13-4-2020', '13-4-2020', '19:00', 'Staff', '', '', 'D ngesii / ngesi', '', '', '', ''),
('in', '7601055581084', 'Ngesix', '', '', '', '07:59 15-4-2020', '15-4-2020', '07:59', 'Staff', '', '', 'Ngesi / x', '', '', '', ''),
('in', '7601055581084', 'X Ngesi', '', '', '', '12:33 15-4-2020', '15-4-2020', '12:33', 'Staff', '', '', 'X  / Ngesi', '', '', '', ''),
('in', '7601055581084', 'XNgedi', '', '', '', '12:08 16-4-2020', '16-4-2020', '12:08', 'Staff', '', '', 'X / Ngedi', '', '', '', ''),
('in', '7601055581084', 'XNgesi', '', '', '', '07:38 08-5-2020', '2020/08/05', '07:38', 'Staff', '', '', 'X / Ngesi', '', 'M', '', ''),
('in', '7601055581084', 'xngesi', '', '', '', '07:38 06-5-2020', '2020/06/05', '07:38', 'Staff', '', '', 'x / ngesi', '', 'work', '', ''),
('in', '7601055581084', 'XNgesi', '', '', '', '07:38 05-5-2020', '2020/05/05', '07:38', 'Staff', '', '', 'X / Ngesi', '', 'M', '', ''),
('in', '7601055581084', 'XNgesi', '', '', '', '07:43 04-5-2020', '2020/04/05', '07:43', 'Staff', '', '', 'X / Ngesi', '', 'Mantainance', '', ''),
('in', '7601055581084', 'XNgesi', '', '', '', '14:49 03-5-2020', '2020/03/05', '14:49', 'Staff', '', '', 'X / Ngesi', '', '128', '', ''),
('in', '7601055581084', 'XNgesi', '', '', '', '18:23 03-5-2020', '2020/03/05', '18:23', 'Staff', '', '', 'X / Ngesi', '', '128D', '', ''),
('in', '7601055581084', 'XNgesi', '', '', '', '10:31 01-5-2020', '2020/01/05', '10:31', 'Staff', '', '', 'X / Ngesi', '', '136', '', ''),
('in', '7601055581084', 'XNgesi', '', '', '', '07:41 30-4-2020', '30-4-2020', '07:41', 'Staff', '', '', 'X / Ngesi', '', '', '', ''),
('in', '7601055581084', 'XNgesi', '', '', '', '07:42 29-4-2020', '29-4-2020', '07:42', 'Staff', '', '', 'X / Ngesi', '', '', '', ''),
('in', '7601055581084', 'XNgesi', '', '', '', '08:08 28-4-2020', '28-4-2020', '08:08', 'Staff', '', '', 'X / Ngesi', '', '', '', ''),
('in', '7601055581084', 'XNgesi', '', '', '', '07:36 24-4-2020', '24-4-2020', '07:36', 'Staff', '', '', 'X / Ngesi', '', '', '', ''),
('in', '7601055581084', 'XNgesi', '', '', '', '07:52 23-4-2020', '23-4-2020', '07:52', 'Staff', '', '', 'X / Ngesi', '', '', '', ''),
('in', '7601055581084', 'XNgesi', '', '', '', '07:48 22-4-2020', '22-4-2020', '07:48', 'Staff', '', '', 'X / Ngesi', '', '', '', ''),
('in', '7601055581084', 'XNgesi', '', '', '', '07:48 21-4-2020', '21-4-2020', '07:48', 'Staff', '', '', 'X / Ngesi', '', '', '', ''),
('in', '7601055581084', 'XNgesi', '', '', '', '13:57 20-4-2020', '20-4-2020', '13:57', 'Staff', '', '', 'X / Ngesi', '', '', '', ''),
('in', '7601055581084', 'XNgesi', '', '', '', '13:05 18-4-2020', '18-4-2020', '13:05', 'Staff', '', '', 'X / Ngesi', '', '', '', ''),
('in', '7601055581084', 'XNgesi', '', '', '', '08:03 17-4-2020', '17-4-2020', '08:03', 'Staff', '', '', 'X / Ngesi', '', '', '', ''),
('in', '7601055581084', 'XNgesi', '', '', '', '08:07 14-4-2020', '14-4-2020', '08:07', 'Staff', '', '', 'X / Ngesi', '', '', '', ''),
('in', '7601055581084', 'XNgesi', '', '', '', '12:15 14-4-2020', '14-4-2020', '12:15', 'Staff', '', '', 'X / Ngesi', '', '', '', ''),
('in', '7601055581084', 'XNgesiM', '', '', '', '07:54 11-5-2020', '2020/11/05', '07:54', 'Staff', '', '', 'XNgesi / M', '', 'M', '', ''),
('in', '7601055581084', 'Xngrsi', '', '', '', '08:00 16-4-2020', '16-4-2020', '08:00', 'Staff', '', '', 'X / ngrsi', '', '', '', ''),
('in', '7601055581084', 'Xolani Ngesi', '', '', '', '11:42 02-5-2020', '2020/02/05', '11:42', 'Staff', '', '', 'Xolani  / Ngesi', '', '37,19', '', ''),
('in', '7601055581084', 'XolaniNgesi', '', '', '', '07:50 07-5-2020', '2020/07/05', '07:50', 'Staff', '', '', 'Xolani / Ngesi', '', 'work', '', ''),
('in', '7601055581084', 'XolaniNgesi', '', '', '', '08:04 20-4-2020', '20-4-2020', '08:04', 'Staff', '', '', 'Xolani / Ngesi', '', '', '', ''),
('out', '7601055581084', '', '', '', '', '16:25 08-5-2020', '2020/08/05', '16:25', 'Staff', '', '', 'X / Ngesi', '', 'M', '', ''),
('out', '7601055581084', '', '', '', '', '16:27 07-5-2020', '2020/07/05', '16:27', 'Staff', '', '', 'Xolani / Ngesi', '', 'work', '', ''),
('out', '7601055581084', '', '', '', '', '16:29 06-5-2020', '2020/06/05', '16:29', 'Staff', '', '', 'x / ngesi', '', 'work', '', ''),
('out', '7601055581084', '', '', '', '', '16:26 05-5-2020', '2020/05/05', '16:26', 'Staff', '', '', 'X / Ngesi', '', 'M', '', ''),
('out', '7601055581084', '', '', '', '', '16:27 04-5-2020', '2020/04/05', '16:27', 'Staff', '', '', 'X / Ngesi', '', 'Mantainance', '', ''),
('out', '7601055581084', '', '', '', '', '15:47 03-5-2020', '2020/03/05', '15:47', 'Staff', '', '', 'X / Ngesi', '', '128', '', ''),
('out', '7601055581084', '', '', '', '', '18:55 03-5-2020', '2020/03/05', '18:55', 'Staff', '', '', 'X / Ngesi', '', '128D', '', ''),
('out', '7601055581084', '', '', '', '', '12:03 02-5-2020', '2020/02/05', '12:03', 'Staff', '', '', 'Xolani  / Ngesi', '', '37,19', '', ''),
('out', '7601055581084', '', '', '', '', '12:39 01-5-2020', '2020/01/05', '12:39', 'Staff', '', '', 'X / Ngesi', '', '136', '', ''),
('out', '7601055581084', '', '', '', '', '16:29 30-4-2020', '30-4-2020', '16:29', 'Staff', '', '', 'X / Ngesi', '', '', '', ''),
('out', '7601055581084', '', '', '', '', '16:30 29-4-2020', '29-4-2020', '16:30', 'Staff', '', '', 'X / Ngesi', '', '', '', ''),
('out', '7601055581084', '', '', '', '', '16:29 28-4-2020', '28-4-2020', '16:29', 'Staff', '', '', 'X / Ngesi', '', '', '', ''),
('out', '7601055581084', '', '', '', '', '10:52 27-4-2020', '27-4-2020', '10:52', 'Staff', '', '', 'C / Ngesi', '', '', '', ''),
('out', '7601055581084', '', '', '', '', '16:32 24-4-2020', '24-4-2020', '16:32', 'Staff', '', '', 'X / Ngesi', '', '', '', ''),
('out', '7601055581084', '', '', '', '', '16:35 23-4-2020', '23-4-2020', '16:35', 'Staff', '', '', 'X / Ngesi', '', '', '', ''),
('out', '7601055581084', '', '', '', '', '16:30 22-4-2020', '22-4-2020', '16:30', 'Staff', '', '', 'X / Ngesi', '', '', '', ''),
('out', '7601055581084', '', '', '', '', '16:30 21-4-2020', '21-4-2020', '16:30', 'Staff', '', '', 'X / Ngesi', '', '', '', ''),
('out', '7601055581084', '', '', '', '', '12:15 20-4-2020', '20-4-2020', '12:15', 'Staff', '', '', 'Xolani / Ngesi', '', '', '', ''),
('out', '7601055581084', '', '', '', '', '14:23 20-4-2020', '20-4-2020', '14:23', 'Staff', '', '', 'X / Ngesi', '', '', '', ''),
('out', '7601055581084', '', '', '', '', '14:15 18-4-2020', '18-4-2020', '14:15', 'Staff', '', '', 'X / Ngesi', '', '', '', ''),
('out', '7601055581084', '', '', '', '', '11:07 17-4-2020', '17-4-2020', '11:07', 'Staff', '', '', 'X / Ngesi', '', '', '', ''),
('out', '7601055581084', '', '', '', '', '10:15 16-4-2020', '16-4-2020', '10:15', 'Staff', '', '', 'X / ngrsi', '', '', '', ''),
('out', '7601055581084', '', '', '', '', '12:51 16-4-2020', '16-4-2020', '12:51', 'Staff', '', '', 'X / Ngedi', '', '', '', ''),
('out', '7601055581084', '', '', '', '', '10:04 15-4-2020', '15-4-2020', '10:04', 'Staff', '', '', 'Ngesi / x', '', '', '', ''),
('out', '7601055581084', '', '', '', '', '12:59 15-4-2020', '15-4-2020', '12:59', 'Staff', '', '', 'X  / Ngesi', '', '', '', ''),
('out', '7601055581084', '', '', '', '', '10:40 14-4-2020', '14-4-2020', '10:40', 'Staff', '', '', 'X / Ngesi', '', '', '', ''),
('out', '7601055581084', '', '', '', '', '13:18 14-4-2020', '14-4-2020', '13:18', 'Staff', '', '', 'X / Ngesi', '', '', '', ''),
('out', '7601055581084', '', '', '', '', '19:12 13-4-2020', '13-4-2020', '19:12', 'Staff', '', '', 'D ngesii / ngesi', '', '', '', ''),
('in', '7602270330080', 'BUKELWANGANGQU', '', '', '7602270330083', '06:35 26-4-2020', '26-4-2020', '06:35', 'Staff', 'TU driver license warning', '', 'BUKELWA / NGANGQU', '', '', '', ''),
('in', '7602270330083', 'BGanqu', '', '', '', '06:17 11-5-2020', '2020/11/05', '06:17', 'Staff', '', '', 'B / Ganqu', '', '122', '', ''),
('out', '7602270330083', 'BUKELWANGANGQU', '', '', '7602270330083', '18:44 07-5-2020', '2020/07/05', '18:44', 'Staff', 'TU driver license warning', '', 'Bukelws Ngangqu / B Ngangqu', '', '122', '', ''),
('out', '7602270330083', 'BUKELWANGANGQU', '', '', '7602270330083', '18:51 06-5-2020', '2020/06/05', '18:51', 'Staff', 'TU driver license warning', '', '', '', '', '', ''),
('in', '7602270330083', 'BukelwaNgangqu', '', '', '', '06:38 03-5-2020', '2020/03/05', '06:38', 'Staff', '', '', 'Bukelwa / Ngangqu', '', 'U-122', '', ''),
('out', '7602270330083', 'BUKELWANGANGQU', '', '', '7602270330083', '17:49 03-5-2020', '2020/03/05', '17:49', 'Staff', 'TU driver license warning', '', 'Bukelwa / Ngangqu', '', 'U-122', '', ''),
('in', '7602270330083', 'BUKELWANGANGQU', '', '', '7602270330083', '06:34 02-5-2020', '2020/02/05', '06:34', 'Staff', 'TU driver license warning', '', 'BUKELWA / NGANGQU', '', '122', '', ''),
('in', '7602270330083', 'BUKELWANGANGQU', '', '', '7602270330083', '06:55 01-5-2020', '2020/01/05', '06:55', 'Staff', 'TU driver license warning', '', 'BUKELWA / NGANGQU', '', 'Fc', '', ''),
('in', '7602270330083', 'BUKELWANGANGQU', '', '', '7602270330083', '06:35 28-4-2020', '28-4-2020', '06:35', 'Staff', 'TU driver license warning', '', 'BUKELWA / NGANGQU', '', '', '', ''),
('out', '7602270330083', 'BUKELWANGANGQU', '', '', '7602270330083', '18:50 28-4-2020', '28-4-2020', '18:50', 'Staff', 'TU driver license warning', '', 'BUKELWA / NGANGQU', '', '', '', ''),
('in', '7602270330083', 'BUKELWANGANGQU', '', '', '7602270330083', '06:32 27-4-2020', '27-4-2020', '06:32', 'Staff', 'TU driver license warning', '', 'BUKELWA / NGANGQU', '', '', '', ''),
('in', '7602270330083', 'BUKELWANGANGQU', '', '', '7602270330083', '06:38 25-4-2020', '25-4-2020', '06:38', 'Staff', 'TU driver license warning', '', 'BUKELWA / NGANGQU', '', '', '', ''),
('out', '7602270330083', 'BUKELWANGANGQU', '', '', '7602270330083', '18:40 25-4-2020', '25-4-2020', '18:40', 'Staff', 'TU driver license warning', '', 'BUKELWA / NGANGQU', '', '', '', ''),
('in', '7602270330083', 'BUKELWANGANGQU', '', '', '7602270330083', '06:40 24-4-2020', '24-4-2020', '06:40', 'Staff', 'TU driver license warning', '', 'BUKELWA / NGANGQU', '', '', '', ''),
('out', '7602270330083', 'BUKELWANGANGQU', '', '', '7602270330083', '18:40 24-4-2020', '24-4-2020', '18:40', 'Staff', 'TU driver license warning', '', 'BUKELWA / NGANGQU', '', '', '', ''),
('in', '7602270330083', 'BUKELWANGANGQU', '', '', '7602270330083', '06:30 19-4-2020', '19-4-2020', '06:30', 'Staff', 'TU driver license warning', '', 'BUKELWA / NGANGQU', '', '', '', ''),
('out', '7602270330083', 'BUKELWANGANGQU', '', '', '7602270330083', '18:40 18-4-2020', '18-4-2020', '18:40', 'Staff', 'TU driver license warning', '', '', '', '', '', ''),
('in', '7602270330083', 'BUKELWANGANGQU', '', '', '7602270330083', '06:45 17-4-2020', '17-4-2020', '06:45', 'Staff', 'TU driver license warning', '', 'BUKELWA / NGANGQU', '', '', '', ''),
('in', '7602270330083', 'BUKELWANGANGQU', '', '', '7602270330083', '06:36 14-4-2020', '14-4-2020', '06:36', 'Staff', 'TU driver license warning', '', 'BUKELWA / NGANGQU', '', '', '', ''),
('out', '7602270330083', 'BUKELWANGANGQU', '', '', '7602270330083', '18:49 14-4-2020', '14-4-2020', '18:49', 'Staff', 'TU driver license warning', '', 'BUKELWA / NGANGQU', '', '', '', ''),
('in', '7602270330083', 'BUKELWANGANGQU', '', '', '7602270330083', '06:36 13-4-2020', '13-4-2020', '06:36', 'Staff', 'TU driver license warning', '', 'BUKELWA / NGANGQU', '', '', '', ''),
('in', '7602270330083', 'Bukelws NgangquB Ngangqu', '', '', '', '06:43 07-5-2020', '2020/07/05', '06:43', 'Staff', '', '', 'Bukelws Ngangqu / B Ngangqu', '', '122', '', ''),
('out', '7602270330083', '', '', '', '', '17:15 02-5-2020', '2020/02/05', '17:15', 'Staff', '', '', 'BUKELWA / NGANGQU', '', '122', '', ''),
('out', '7602270330083', '', '', '', '', '18:48 27-4-2020', '27-4-2020', '18:48', 'Staff', '', '', 'BUKELWA / NGANGQU', '', '', '', ''),
('out', '7602270330083', '', '', '', '', '18:55 26-4-2020', '26-4-2020', '18:55', 'Staff', '', '', '', '', '', '', ''),
('out', '7602270330083', '', '', '', '', '18:43 17-4-2020', '17-4-2020', '18:43', 'Staff', '', '', 'BUKELWA / NGANGQU', '', '', '', ''),
('in', '7603075001085', 'ALIEBENBERG', '', '', '7603075001085', '14:50 04-5-2020', '2020/04/05', '14:50', 'Conference Visitors', '', '', '', '', '', '', ''),
('in', '7603370440083', 'BUKELWANGANGQU', '', '', '7602270330083', '06:39 18-4-2020', '18-4-2020', '06:39', 'Staff', 'TU driver license warning', '', 'BUKELWA / NGANGQU', '', '', '', ''),
('in', '7608075454085', 'MMthathi', '', '', '', '07:22 29-4-2020', '29-4-2020', '07:22', 'Staff', '', '', 'M / Mthathi', '', '', '', ''),
('in', '7608075454085', 'MMthathi', '', '', '', '07:24 23-4-2020', '23-4-2020', '07:24', 'Staff', '', '', 'M / Mthathi', '', '', '', ''),
('in', '7608075454085', 'MZIWANELEMTHATHI', '', '', '7608075454085', '07:24 08-5-2020', '2020/08/05', '07:24', 'Staff', '', '', 'MZIWANELE / MTHATHI', '', 'M', '', ''),
('in', '7608075454085', 'MZIWANELEMTHATHI', '', '', '7608075454085', '07:29 07-5-2020', '2020/07/05', '07:29', 'Staff', '', '', 'MZIWANELE / MTHATHI', '', 'work', '', ''),
('out', '7608075454085', 'MZIWANELEMTHATHI', '', '', '7608075454085', '16:27 07-5-2020', '2020/07/05', '16:27', 'Staff', '', '', 'MZIWANELE / MTHATHI', '', 'work', '', ''),
('in', '7608075454085', 'MZIWANELEMTHATHI', '', '', '7608075454085', '07:18 05-5-2020', '2020/05/05', '07:18', 'Staff', '', '', 'MZIWANELE / MTHATHI', '', 'Mantainance', '', ''),
('in', '7608075454085', 'MZIWANELEMTHATHI', '', '', '7608075454085', '07:26 04-5-2020', '2020/04/05', '07:26', 'Staff', '', '', 'MZIWANELE / MTHATHI', '', 'Maintance', '', ''),
('out', '7608075454085', 'MZIWANELEMTHATHI', '', '', '7608075454085', '16:28 04-5-2020', '2020/04/05', '16:28', 'Staff', '', '', 'MZIWANELE / MTHATHI', '', 'Maintance', '', ''),
('in', '7608075454085', 'MZIWANELEMTHATHI', '', '', '7608075454085', '07:24 30-4-2020', '30-4-2020', '07:24', 'Staff', '', '', 'MZIWANELE / MTHATHI', '', '', '', ''),
('out', '7608075454085', 'MZIWANELEMTHATHI', '', '', '7608075454085', '16:30 29-4-2020', '29-4-2020', '16:30', 'Staff', '', '', 'M / Mthathi', '', '', '', ''),
('in', '7608075454085', 'MZIWANELEMTHATHI', '', '', '7608075454085', '07:24 28-4-2020', '28-4-2020', '07:24', 'Staff', '', '', 'MZIWANELE / MTHATHI', '', '', '', ''),
('out', '7608075454085', 'MZIWANELEMTHATHI', '', '', '7608075454085', '16:24 23-4-2020', '23-4-2020', '16:24', 'Staff', '', '', 'M / Mthathi', '', '', '', '');
INSERT INTO `atthegate` (`direction`, `license`, `name`, `company`, `category`, `dr_license`, `creation`, `recdate`, `rectime`, `profile`, `incidents`, `dr_name`, `name_in`, `name_out`, `going`, `company2`, `visiting`) VALUES
('out', '7608075454085', '', '', '', '', '16:15 08-5-2020', '2020/08/05', '16:15', 'Staff', '', '', 'MZIWANELE / MTHATHI', '', 'M', '', ''),
('out', '7608075454085', '', '', '', '', '16:30 06-5-2020', '2020/06/05', '16:30', 'Staff', '', '', '', '', '', '', ''),
('out', '7608075454085', '', '', '', '', '16:25 05-5-2020', '2020/05/05', '16:25', 'Staff', '', '', 'MZIWANELE / MTHATHI', '', 'Mantainance', '', ''),
('out', '7608075454085', '', '', '', '', '16:27 30-4-2020', '30-4-2020', '16:27', 'Staff', '', '', 'MZIWANELE / MTHATHI', '', '', '', ''),
('out', '7608075454085', '', '', '', '', '16:31 28-4-2020', '28-4-2020', '16:31', 'Staff', '', '', 'MZIWANELE / MTHATHI', '', '', '', ''),
('out', '7609130517080', 'XOLISWAJIBILIZA', '', '', '7609130517080', '10:17 08-5-2020', '2020/08/05', '10:17', 'Staff', '', '', '', '', '', '', ''),
('in', '7609130517080', 'XOLISWAJIBILIZA', '', '', '7609130517080', '08:56 04-5-2020', '2020/04/05', '08:56', 'Staff', '', '', 'XOLISWA / JIBILIZA', '', '106', '', ''),
('out', '7609130517080', 'XOLISWAJIBILIZA', '', '', '7609130517080', '07:04 01-5-2020', '2020/01/05', '07:04', 'Staff', '', '', '', '', '', '', ''),
('out', '7609130517080', 'XOLISWAJIBILIZA', '', '', '7609130517080', '06:59 30-4-2020', '30-4-2020', '06:59', 'Staff', '', '', '', '', '', '', ''),
('out', '7609130517080', 'XOLISWAJIBILIZA', '', '', '7609130517080', '07:00 27-4-2020', '27-4-2020', '07:00', 'Staff', '', '', '', '', '', '', ''),
('out', '7609130517080', 'XOLISWAJIBILIZA', '', '', '7609130517080', '06:57 26-4-2020', '26-4-2020', '06:57', 'Staff', '', '', '', '', '', '', ''),
('out', '7609130517080', 'XOLISWAJIBILIZA', '', '', '7609130517080', '07:05 25-4-2020', '25-4-2020', '07:05', 'Staff', '', '', '', '', '', '', ''),
('out', '7609130517080', 'XOLISWAJIBILIZA', '', '', '7609130517080', '06:58 12-4-2020', '2020/12/04', '06:58', 'Staff', '', '', '', '', '', '', ''),
('out', '7609130517080', 'XOLISWAJIBILIZA', '', '', '7609130517080', '07:00 11-4-2020', '2020/11/04', '07:00', 'Staff', '', '', '', '', '', '', ''),
('out', '7609130517080', '', '', '', '', '07:14 24-4-2020', '24-4-2020', '07:14', 'Staff', '', '', '', '', '', '', ''),
('out', '7609130517080', '', '', '', '', '06:55 17-4-2020', '17-4-2020', '06:55', 'Staff', '', '', '', '', '', '', ''),
('out', '7609130517080', '', '', '', '', '07:03 13-4-2020', '13-4-2020', '07:03', 'Staff', '', '', '', '', '', '', ''),
('in', '7701225616081', 'lk', '', '', '', '12:55 06-5-2020', '2020/06/05', '12:55', 'Staff', 'Expired car licence', '', 'l / k', '', 'k', '', ''),
('in', '7705051137088', 'RoserttaWhiteboy', '', '', '', '08:12 08-5-2020', '2020/08/05', '08:12', 'Staff', '', '', 'Rosertta / Whiteboy', '', 'G1', '', ''),
('in', '7705051137088', 'Rosetta WhiteboyR whiteboy', '', '', '', '07:41 19-4-2020', '19-4-2020', '07:41', 'Staff', '', '', 'Rosetta Whiteboy / R whiteboy', '', '', '', ''),
('in', '7705051137088', 'rossetawhiteboy', '', '', '', '07:40 12-4-2020', '2020/12/04', '07:40', 'Staff', '', '', 'rosseta / whiteboy', '', '', '', ''),
('in', '7705051137088', 'rrosssrt', '', '', '', '07:48 24-4-2020', '24-4-2020', '07:48', 'Staff', '', '', 'r / rosssrt', '', '', '', ''),
('in', '7705051137088', 'RWhiteboy', '', '', '', '07:47 10-5-2020', '2020/10/05', '07:47', 'Staff', '', '', 'R / Whiteboy', '', 'g3', '', ''),
('in', '7705051137088', 'RWhiteboy', '', '', '', '07:45 09-5-2020', '2020/09/05', '07:45', 'Staff', '', '', 'R / Whiteboy', '', 'G3', '', ''),
('in', '7705051137088', 'RWhiteboy', '', '', '', '08:21 04-5-2020', '2020/04/05', '08:21', 'Resident', '', '', 'R / Whiteboy', '', '', '', ''),
('in', '7705051137088', 'RWhiteboy', '', '', '', '07:45 03-5-2020', '2020/03/05', '07:45', 'Staff', '', '', 'R / Whiteboy', '', 'G3', '', ''),
('in', '7705051137088', 'RWhiteboy', '', '', '', '07:59 02-5-2020', '2020/02/05', '07:59', 'Staff', '', '', 'R / Whiteboy', '', 'Unit G3', '', ''),
('in', '7705051137088', 'RWhiteboy', '', '', '', '08:02 01-5-2020', '2020/01/05', '08:02', 'Staff', '', '', 'R / Whiteboy', '', 'unit G1', '', ''),
('in', '7705051137088', 'RWhiteboy', '', '', '', '12:29 29-4-2020', '29-4-2020', '12:29', 'Staff', '', '', 'R / Whiteboy', '', '', '', ''),
('in', '7705051137088', 'RWhiteboy', '', '', '', '07:57 27-4-2020', '27-4-2020', '07:57', 'Staff', '', '', 'R / Whiteboy', '', '', '', ''),
('in', '7705051137088', 'RWhiteboy', '', '', '', '07:41 26-4-2020', '26-4-2020', '07:41', 'Staff', '', '', 'R / Whiteboy', '', '', '', ''),
('in', '7705051137088', 'RWhiteboy', '', '', '', '07:53 21-4-2020', '21-4-2020', '07:53', 'Staff', '', '', 'R / Whiteboy', '', '', '', ''),
('in', '7705051137088', 'RWhiteboy', '', '', '', '07:40 11-4-2020', '2020/11/04', '07:40', 'Staff', '', '', 'R / Whiteboy', '', '', '', ''),
('out', '7705051137088', '', '', '', '', '12:25 10-5-2020', '2020/10/05', '12:25', 'Staff', '', '', 'R / Whiteboy', '', 'g3', '', ''),
('out', '7705051137088', '', '', '', '', '12:26 09-5-2020', '2020/09/05', '12:26', 'Staff', '', '', 'R / Whiteboy', '', 'G3', '', ''),
('out', '7705051137088', '', '', '', '', '11:43 08-5-2020', '2020/08/05', '11:43', 'Staff', '', '', 'Rosertta / Whiteboy', '', 'G1', '', ''),
('out', '7705051137088', '', '', '', '', '11:49 04-5-2020', '2020/04/05', '11:49', 'Staff', '', '', '', '', '', '', ''),
('out', '7705051137088', '', '', '', '', '12:24 03-5-2020', '2020/03/05', '12:24', 'Staff', '', '', 'R / Whiteboy', '', 'G3', '', ''),
('out', '7705051137088', '', '', '', '', '13:09 02-5-2020', '2020/02/05', '13:09', 'Staff', '', '', 'R / Whiteboy', '', 'Unit G3', '', ''),
('out', '7705051137088', '', '', '', '', '12:08 01-5-2020', '2020/01/05', '12:08', 'Staff', '', '', 'R / Whiteboy', '', 'unit G1', '', ''),
('out', '7705051137088', '', '', '', '', '13:45 29-4-2020', '29-4-2020', '13:45', 'Staff', '', '', 'R / Whiteboy', '', '', '', ''),
('out', '7705051137088', '', '', '', '', '12:00 27-4-2020', '27-4-2020', '12:00', 'Staff', '', '', 'R / Whiteboy', '', '', '', ''),
('out', '7705051137088', '', '', '', '', '12:37 26-4-2020', '26-4-2020', '12:37', 'Staff', '', '', 'R / Whiteboy', '', '', '', ''),
('out', '7705051137088', '', '', '', '', '12:10 24-4-2020', '24-4-2020', '12:10', 'Staff', '', '', 'r / rosssrt', '', '', '', ''),
('out', '7705051137088', '', '', '', '', '13:08 21-4-2020', '21-4-2020', '13:08', 'Staff', '', '', 'R / Whiteboy', '', '', '', ''),
('out', '7705051137088', '', '', '', '', '12:29 19-4-2020', '19-4-2020', '12:29', 'Staff', '', '', 'Rosetta Whiteboy / R whiteboy', '', '', '', ''),
('out', '7705051137088', '', '', '', '', '12:34 18-4-2020', '18-4-2020', '12:34', 'Staff', '', '', '', '', '', '', ''),
('out', '7705051137088', '', '', '', '', '12:29 12-4-2020', '2020/12/04', '12:29', 'Staff', '', '', 'rosseta / whiteboy', '', '', '', ''),
('out', '7705051137088', '', '', '', '', '12:29 11-4-2020', '2020/11/04', '12:29', 'Staff', '', '', 'R / Whiteboy', '', '', '', ''),
('in', '7707075348089', 'DMTsitsi', '', '', '', '07:30 05-5-2020', '2020/05/05', '07:30', 'Staff', '', '', 'DM / Tsitsi', '', 'KG', '', ''),
('in', '7707075348089', 'DMTsitsi', '', '', '', '07:34 04-5-2020', '2020/04/05', '07:34', 'Staff', '', '', 'DM / Tsitsi', '', 'K G', '', ''),
('in', '7707075348089', 'DMTsitsi', '', '', '', '07:35 29-4-2020', '29-4-2020', '07:35', 'Staff', '', '', 'DM / Tsitsi', '', '', '', ''),
('in', '7707075348089', 'DTsitsu', '', '', '', '07:30 30-4-2020', '30-4-2020', '07:30', 'Staff', '', '', 'D / Tsitsu', '', '', '', ''),
('out', '7707075348089', '', '', '', '', '15:49 05-5-2020', '2020/05/05', '15:49', 'Staff', '', '', 'DM / Tsitsi', '', 'KG', '', ''),
('out', '7707075348089', '', '', '', '', '15:46 04-5-2020', '2020/04/05', '15:46', 'Staff', '', '', 'DM / Tsitsi', '', 'K G', '', ''),
('out', '7707075348089', '', '', '', '', '16:02 30-4-2020', '30-4-2020', '16:02', 'Staff', '', '', 'D / Tsitsu', '', '', '', ''),
('out', '7707075348089', '', '', '', '', '16:01 29-4-2020', '29-4-2020', '16:01', 'Staff', '', '', 'DM / Tsitsi', '', '', '', ''),
('in', '7707190232085', 'PSeti', '', '', '', '07:24 11-5-2020', '2020/11/05', '07:24', 'Staff', '', '', 'P / Seti', '', 'M', '', ''),
('in', '7707190232085', 'PSeti', '', '', '', '07:31 08-5-2020', '2020/08/05', '07:31', 'Staff', '', '', 'P / Seti', '', 'M', '', ''),
('in', '7707190232085', 'pseti', '', '', '', '07:17 06-5-2020', '2020/06/05', '07:17', 'Staff', '', '', 'p / seti', '', 'work', '', ''),
('in', '7707190232085', 'PSeti', '', '', '', '07:20 05-5-2020', '2020/05/05', '07:20', 'Staff', '', '', 'P / Seti', '', 'Mantainance', '', ''),
('in', '7707190232085', 'PSeti', '', '', '', '07:24 04-5-2020', '2020/04/05', '07:24', 'Staff', '', '', 'P / Seti', '', 'Maintainance', '', ''),
('in', '7707190232085', 'setiphumeza', '', '', '', '07:25 07-5-2020', '2020/07/05', '07:25', 'Staff', '', '', 'seti / phumeza', '', 'work', '', ''),
('out', '7707190232085', '', '', '', '', '16:28 08-5-2020', '2020/08/05', '16:28', 'Staff', '', '', 'P / Seti', '', 'M', '', ''),
('out', '7707190232085', '', '', '', '', '16:29 07-5-2020', '2020/07/05', '16:29', 'Staff', '', '', 'seti / phumeza', '', 'work', '', ''),
('out', '7707190232085', '', '', '', '', '16:30 06-5-2020', '2020/06/05', '16:30', 'Staff', '', '', 'p / seti', '', 'work', '', ''),
('out', '7707190232085', '', '', '', '', '16:29 05-5-2020', '2020/05/05', '16:29', 'Staff', '', '', 'P / Seti', '', 'Mantainance', '', ''),
('out', '7707190232085', '', '', '', '', '16:31 04-5-2020', '2020/04/05', '16:31', 'Staff', '', '', 'P / Seti', '', 'Maintainance', '', ''),
('in', '7707280413082', 'NNtenyi', '', '', '', '13:41 24-4-2020', '24-4-2020', '13:41', 'Staff', '', '', 'N / Ntenyi', '', '', '', ''),
('in', '7707280413082', 'nnteyi', '', '', '', '07:50 06-5-2020', '2020/06/05', '07:50', 'Staff', '', '', 'n / nteyi', '', '25', '', ''),
('in', '7707280413082', 'NNteyi', '', '', '', '07:49 03-5-2020', '2020/03/05', '07:49', 'Staff', '', '', 'N / Nteyi', '', '25', '', ''),
('in', '7707280413082', 'NNteyi', '', '', '', '07:41 01-5-2020', '2020/01/05', '07:41', 'Staff', '', '', 'N / Nteyi', '', '25', '', ''),
('in', '7707280413082', 'NNteyi', '', '', '', '07:42 27-4-2020', '27-4-2020', '07:42', 'Staff', '', '', 'N / Nteyi', '', '', '', ''),
('in', '7707280413082', 'nntryl', '', '', '', '06:46 15-4-2020', '15-4-2020', '06:46', 'Staff', '', '', 'n / ntryl', '', '', '', ''),
('in', '7707280413082', 'Nomsa NteyiNteyi', '', '', '', '06:36 20-4-2020', '20-4-2020', '06:36', 'Staff', '', '', 'Nomsa Nteyi / Nteyi', '', '', '', ''),
('in', '7707280413082', 'NOMSANTEYI', '', '', '7707280413082', '08:01 11-5-2020', '2020/11/05', '08:01', 'Staff', '', '', 'NOMSA / NTEYI', '', '25', '', ''),
('in', '7707280413082', 'NomsaNteyi', '', '', '', '07:50 07-5-2020', '2020/07/05', '07:50', 'Staff', '', '', 'Nomsa / Nteyi', '', 'work', '', ''),
('in', '7707280413082', 'NOMSANTEYI', '', '', '7707280413082', '07:49 02-5-2020', '2020/02/05', '07:49', 'Staff', '', '', 'NOMSA / NTEYI', '', 'Unit 25', '', ''),
('out', '7707280413082', 'NOMSANTEYI', '', '', '7707280413082', '17:59 01-5-2020', '2020/01/05', '17:59', 'Staff', '', '', 'N / Nteyi', '', '25', '', ''),
('in', '7707280413082', 'NOMSANTEYI', '', '', '7707280413082', '07:57 28-4-2020', '28-4-2020', '07:57', 'Staff', '', '', 'NOMSA / NTEYI', '', '', '', ''),
('out', '7707280413082', 'NOMSANTEYI', '', '', '7707280413082', '17:51 28-4-2020', '28-4-2020', '17:51', 'Staff', '', '', 'NOMSA / NTEYI', '', '', '', ''),
('out', '7707280413082', 'NOMSANTEYI', '', '', '7707280413082', '17:51 27-4-2020', '27-4-2020', '17:51', 'Staff', '', '', 'N / Nteyi', '', '', '', ''),
('in', '7707280413082', 'NOMSANTEYI', '', '', '7707280413082', '06:44 16-4-2020', '16-4-2020', '06:44', 'Staff', '', '', 'NOMSA / NTEYI', '', '', '', ''),
('in', '7707280413082', 'NOMSANTEYI', '', '', '7707280413082', '06:41 12-4-2020', '2020/12/04', '06:41', 'Staff', '', '', 'NOMSA / NTEYI', '', '', '', ''),
('out', '7707280413082', 'NOMSANTEYI', '', '', '7707280413082', '19:12 11-4-2020', '2020/11/04', '19:12', 'Staff', '', '', '', '', '', '', ''),
('out', '7707280413082', '', '', '', '', '18:02 06-5-2020', '2020/06/05', '18:02', 'Staff', '', '', 'n / nteyi', '', '25', '', ''),
('out', '7707280413082', '', '', '', '', '18:01 03-5-2020', '2020/03/05', '18:01', 'Staff', '', '', 'N / Nteyi', '', '25', '', ''),
('out', '7707280413082', '', '', '', '', '18:00 02-5-2020', '2020/02/05', '18:00', 'Staff', '', '', 'NOMSA / NTEYI', '', 'Unit 25', '', ''),
('out', '7707280413082', '', '', '', '', '15:57 24-4-2020', '24-4-2020', '15:57', 'Staff', '', '', 'N / Ntenyi', '', '', '', ''),
('out', '7707280413082', '', '', '', '', '09:17 20-4-2020', '20-4-2020', '09:17', 'Staff', '', '', 'Nomsa Nteyi / Nteyi', '', '', '', ''),
('out', '7707280413082', '', '', '', '', '18:53 16-4-2020', '16-4-2020', '18:53', 'Staff', '', '', 'NOMSA / NTEYI', '', '', '', ''),
('out', '7707280413082', '', '', '', '', '18:50 15-4-2020', '15-4-2020', '18:50', 'Staff', '', '', 'n / ntryl', '', '', '', ''),
('out', '7707280413082', '', '', '', '', '18:45 12-4-2020', '2020/12/04', '18:45', 'Staff', '', '', 'NOMSA / NTEYI', '', '', '', ''),
('out', '7801090235080', 'DMJACU', '', '', '7801090235080', '16:57 10-5-2020', '2020/10/05', '16:57', 'Staff', '', '', '', '', '', '', ''),
('in', '7801090235080', 'DMJACU', '', '', '7801090235080', '08:19 09-5-2020', '2020/09/05', '08:19', 'Staff', '', '', 'D / MJACU', '', '208', '', ''),
('out', '7801090235080', 'DMJACU', '', '', '7801090235080', '16:57 09-5-2020', '2020/09/05', '16:57', 'Staff', '', '', 'D / MJACU', '', '208', '', ''),
('out', '7801090235080', 'DMJACU', '', '', '7801090235080', '06:58 08-5-2020', '2020/08/05', '06:58', 'Staff', '', '', 'D / MJACU', '', '6', '', ''),
('in', '7801090235080', 'DMJACU', '', '', '7801090235080', '18:41 06-5-2020', '2020/06/05', '18:41', 'Staff', '', '', 'D / MJACU', '', '6', '', ''),
('out', '7801090235080', 'DMJACU', '', '', '7801090235080', '06:57 02-5-2020', '2020/02/05', '06:57', 'Staff', '', '', 'D / MJACU', '', '6', '', ''),
('in', '7801090235080', 'DMJACU', '', '', '7801090235080', '18:41 02-5-2020', '2020/02/05', '18:41', 'Staff', '', '', 'D / MJACU', '', '6', '', ''),
('in', '7801090235080', 'DMJACU', '', '', '7801090235080', '18:41 01-5-2020', '2020/01/05', '18:41', 'Staff', '', '', 'D / MJACU', '', '6', '', ''),
('out', '7801090235080', 'DMJACU', '', '', '7801090235080', '07:01 29-4-2020', '29-4-2020', '07:01', 'Staff', '', '', '', '', '', '', ''),
('out', '7801090235080', 'DMJACU', '', '', '7801090235080', '07:02 28-4-2020', '28-4-2020', '07:02', 'Staff', '', '', 'D / MJACU', '', '', '', ''),
('in', '7801090235080', 'DMJACU', '', '', '7801090235080', '18:40 27-4-2020', '27-4-2020', '18:40', 'Staff', '', '', 'D / MJACU', '', '', '', ''),
('out', '7801090235080', 'DMJACU', '', '', '7801090235080', '07:02 24-4-2020', '24-4-2020', '07:02', 'Staff', '', '', 'D / MJACU', '', '', '', ''),
('in', '7801090235080', 'DMJACU', '', '', '7801090235080', '18:37 23-4-2020', '23-4-2020', '18:37', 'Staff', '', '', 'D / MJACU', '', '', '', ''),
('out', '7801090235080', 'DMJACU', '', '', '7801090235080', '07:04 15-4-2020', '15-4-2020', '07:04', 'Staff', '', '', 'D / MJACU', '', '', '', ''),
('in', '7801090235080', 'DMjacu', '', '', '', '07:06 14-4-2020', '14-4-2020', '07:06', 'Staff', '', '', 'D / Mjacu', '', '', '', ''),
('in', '7801090235080', 'DMJACU', '', '', '7801090235080', '18:39 14-4-2020', '14-4-2020', '18:39', 'Staff', '', '', 'D / MJACU', '', '', '', ''),
('out', '7801090235080', 'DMJACU', '', '', '7801090235080', '16:57 12-4-2020', '2020/12/04', '16:57', 'Staff', '', '', '', '', '', '', ''),
('in', '7801090235080', 'DMJACU', '', '', '7801090235080', '08:04 11-4-2020', '2020/11/04', '08:04', 'Staff', '', '', 'D / MJACU', '', '', '', ''),
('out', '7801090235080', 'DMJACU', '', '', '7801090235080', '16:55 11-4-2020', '2020/11/04', '16:55', 'Staff', '', '', 'D / MJACU', '', '', '', ''),
('out', '7801090235080', '', '', '', '', '06:58 03-5-2020', '2020/03/05', '06:58', 'Staff', '', '', 'D / MJACU', '', '6', '', ''),
('in', '7801090325080', 'DMJACU', '', '', '7801090235080', '07:59 12-4-2020', '2020/12/04', '07:59', 'Staff', '', '', 'D / MJACU', '', '', '', ''),
('in', '7809010235080', 'DMJACU', '', '', '7801090235080', '18:39 28-4-2020', '28-4-2020', '18:39', 'Staff', '', '', 'D / MJACU', '', '', '', ''),
('in', '7811050502080', 'NJames', '', '', '', '07:22 26-4-2020', '26-4-2020', '07:22', 'Staff', '', '', 'N / James', '', '', '', ''),
('in', '7811050502080', 'NomfudiJames', '', '', '', '09:23 25-4-2020', '25-4-2020', '09:23', 'Staff', '', '', 'Nomfudi / James', '', '', '', ''),
('in', '7811050502080', 'NOMFUSIJAMES', '', '', '7811050502080', '06:37 04-5-2020', '2020/04/05', '06:37', 'Staff', '', '', 'NOMFUSI / JAMES', '', 'Kitchen', '', ''),
('in', '7811050502080', 'NOMFUSIJAMES', '', '', '7811050502080', '08:09 20-4-2020', '20-4-2020', '08:09', 'Staff', '', '', 'NOMFUSI / JAMES', '', '', '', ''),
('in', '7812230297088', 'Nfunda', '', '', '', '06:53 01-5-2020', '2020/01/05', '06:53', 'Staff', '', '', 'N / funda', '', 'kich', '', ''),
('in', '7812230297088', 'NFunde', '', '', '', '06:50 11-5-2020', '2020/11/05', '06:50', 'Staff', '', '', 'N / Funde', '', 'Kitchen', '', ''),
('in', '7812230297088', 'NFunde', '', '', '', '06:56 02-5-2020', '2020/02/05', '06:56', 'Staff', '', '', 'N / Funde', '', 'Kitchen', '', ''),
('in', '7812230297088', 'NTOMBOSINDISOFUNDE', '', '', '7812230297088', '06:54 07-5-2020', '2020/07/05', '06:54', 'Staff', '', '', 'NTOMBOSINDISO / FUNDE', '', 'Kitchin', '', ''),
('in', '7812230297088', 'NtombosindisoFunde', '', '', '', '06:32 03-5-2020', '2020/03/05', '06:32', 'Staff', '', '', 'Ntombosindiso / Funde', '', 'Kitchen', '', ''),
('out', '7812230297088', 'NTOMBOSINDISOFUNDE', '', '', '7812230297088', '17:14 02-5-2020', '2020/02/05', '17:14', 'Staff', '', '', 'N / Funde', '', 'Kitchen', '', ''),
('out', '7812230297088', '', '', '', '', '17:08 07-5-2020', '2020/07/05', '17:08', 'Staff', '', '', 'NTOMBOSINDISO / FUNDE', '', 'Kitchin', '', ''),
('out', '7812230297088', '', '', '', '', '17:28 06-5-2020', '2020/06/05', '17:28', 'Staff', '', '', '', '', '', '', ''),
('out', '7812230297088', '', '', '', '', '16:44 03-5-2020', '2020/03/05', '16:44', 'Staff', '', '', 'Ntombosindiso / Funde', '', 'Kitchen', '', ''),
('in', '7902175701085', 'Kfaku', '', '', '', '06:46 03-5-2020', '2020/03/05', '06:46', 'Staff', '', '', 'K / faku', '', 'k', '', ''),
('in', '7902175701085', 'M.Yani Faku', '', '', '', '06:50 14-4-2020', '14-4-2020', '06:50', 'Staff', '', '', 'M. / Yani Faku', '', '', '', ''),
('in', '7902175701085', 'melikhayayali', '', '', '', '06:53 06-5-2020', '2020/06/05', '06:53', 'Staff', '', '', 'melikhaya / yali', '', 'kitchen', '', ''),
('in', '7902175701085', 'Melukhaya yaniMelikays yani', '', '', '', '06:53 19-4-2020', '19-4-2020', '06:53', 'Staff', '', '', 'Melukhaya yani / Melikays yani', '', '', '', ''),
('in', '7902175701085', 'MFaku', '', '', '', '06:35 27-4-2020', '27-4-2020', '06:35', 'Staff', '', '', 'M / Faku', '', '', '', ''),
('in', '7902175701085', 'MYali', '', '', '', '06:28 24-4-2020', '24-4-2020', '06:28', 'Staff', '', '', 'M / Yali', '', '', '', ''),
('in', '7902175701085', 'myani', '', '', '', '06:24 23-4-2020', '23-4-2020', '06:24', 'Staff', '', '', 'm / yani', '', '', '', ''),
('in', '7902175701085', 'MYani Faku', '', '', '', '06:37 28-4-2020', '28-4-2020', '06:37', 'Staff', '', '', 'M / Yani Faku', '', '', '', ''),
('in', '7902175701085', 'MYani Faku', '', '', '', '06:57 22-4-2020', '22-4-2020', '06:57', 'Staff', '', '', 'M / Yani Faku', '', '', '', ''),
('in', '7902175701085', 'MYani Faku', '', '', '', '07:00 18-4-2020', '18-4-2020', '07:00', 'Staff', '', '', 'M / Yani Faku', '', '', '', ''),
('in', '7902175701085', 'MYani Faku', '', '', '', '06:51 17-4-2020', '17-4-2020', '06:51', 'Staff', '', '', 'M / Yani Faku', '', '', '', ''),
('in', '7902175701085', 'NYani', '', '', '', '06:37 01-5-2020', '2020/01/05', '06:37', 'Staff', '', '', 'N / Yani', '', 'k', '', ''),
('in', '7902175701085', 'yani melikaysy m', '', '', '', '07:10 07-5-2020', '2020/07/05', '07:10', 'Staff', '', '', 'yani melikays / y m', '', 'kitchin', '', ''),
('out', '7902175701085', '', '', '', '', '17:08 07-5-2020', '2020/07/05', '17:08', 'Staff', '', '', 'yani melikays / y m', '', 'kitchin', '', ''),
('out', '7902175701085', '', '', '', '', '17:05 06-5-2020', '2020/06/05', '17:05', 'Staff', '', '', 'melikhaya / yali', '', 'kitchen', '', ''),
('out', '7902175701085', '', '', '', '', '17:01 03-5-2020', '2020/03/05', '17:01', 'Staff', '', '', 'K / faku', '', 'k', '', ''),
('out', '7902175701085', '', '', '', '', '17:12 02-5-2020', '2020/02/05', '17:12', 'Staff', '', '', '', '', '', '', ''),
('out', '7902175701085', '', '', '', '', '13:16 01-5-2020', '2020/01/05', '13:16', 'Staff', '', '', 'N / Yani', '', 'k', '', ''),
('out', '7902175701085', '', '', '', '', '17:36 28-4-2020', '28-4-2020', '17:36', 'Staff', '', '', 'M / Yani Faku', '', '', '', ''),
('out', '7902175701085', '', '', '', '', '17:11 27-4-2020', '27-4-2020', '17:11', 'Staff', '', '', 'M / Faku', '', '', '', ''),
('out', '7902175701085', '', '', '', '', '13:19 24-4-2020', '24-4-2020', '13:19', 'Staff', '', '', 'M / Yali', '', '', '', ''),
('out', '7902175701085', '', '', '', '', '17:07 23-4-2020', '23-4-2020', '17:07', 'Staff', '', '', 'm / yani', '', '', '', ''),
('out', '7902175701085', '', '', '', '', '17:36 22-4-2020', '22-4-2020', '17:36', 'Staff', '', '', 'M / Yani Faku', '', '', '', ''),
('out', '7902175701085', '', '', '', '', '17:10 19-4-2020', '19-4-2020', '17:10', 'Staff', '', '', 'Melukhaya yani / Melikays yani', '', '', '', ''),
('out', '7902175701085', '', '', '', '', '17:13 18-4-2020', '18-4-2020', '17:13', 'Staff', '', '', 'M / Yani Faku', '', '', '', ''),
('out', '7902175701085', '', '', '', '', '17:14 17-4-2020', '17-4-2020', '17:14', 'Staff', '', '', 'M / Yani Faku', '', '', '', ''),
('out', '7902175701085', '', '', '', '', '17:09 14-4-2020', '14-4-2020', '17:09', 'Staff', '', '', 'M. / Yani Faku', '', '', '', ''),
('in', '7904066133089', 'Falteinsiseko', '', '', '', '07:33 07-5-2020', '2020/07/05', '07:33', 'Staff', '', '', 'Faltein / siseko', '', 'work', '', ''),
('in', '7904066133089', 'Galteuns', '', '', '', '07:57 15-4-2020', '15-4-2020', '07:57', 'Staff', '', '', 'Galteun / s', '', '', '', ''),
('in', '7904066133089', 'SFaltein', '', '', '', '07:37 11-5-2020', '2020/11/05', '07:37', 'Staff', '', '', 'S / Faltein', '', 'M', '', ''),
('in', '7904066133089', 'SFaltein', '', '', '', '07:36 08-5-2020', '2020/08/05', '07:36', 'Staff', '', '', 'S / Faltein', '', 'M', '', ''),
('in', '7904066133089', 'SFaltein', '', '', '', '07:37 05-5-2020', '2020/05/05', '07:37', 'Staff', '', '', 'S / Faltein', '', 'M', '', ''),
('in', '7904066133089', 'SFaltein', '', '', '', '07:39 04-5-2020', '2020/04/05', '07:39', 'Staff', '', '', 'S / Faltein', '', 'Mantainance', '', ''),
('in', '7904066133089', 'SFaltein', '', '', '', '07:23 30-4-2020', '30-4-2020', '07:23', 'Staff', '', '', 'S / Faltein', '', '', '', ''),
('in', '7904066133089', 'SFaltein', '', '', '', '07:43 29-4-2020', '29-4-2020', '07:43', 'Staff', '', '', 'S / Faltein', '', '', '', ''),
('in', '7904066133089', 'SFaltein', '', '', '', '07:40 28-4-2020', '28-4-2020', '07:40', 'Staff', '', '', 'S / Faltein', '', '', '', ''),
('in', '7904066133089', 'SFaltein', '', '', '', '08:24 24-4-2020', '24-4-2020', '08:24', 'Staff', '', '', 'S / Faltein', '', '', '', ''),
('in', '7904066133089', 'SFaltein', '', '', '', '07:50 23-4-2020', '23-4-2020', '07:50', 'Staff', '', '', 'S / Faltein', '', '', '', ''),
('in', '7904066133089', 'SFaltein', '', '', '', '07:47 22-4-2020', '22-4-2020', '07:47', 'Staff', '', '', 'S / Faltein', '', '', '', ''),
('in', '7904066133089', 'SFaltein', '', '', '', '07:46 21-4-2020', '21-4-2020', '07:46', 'Staff', '', '', 'S / Faltein', '', '', '', ''),
('in', '7904066133089', 'SFaltein', '', '', '', '08:02 17-4-2020', '17-4-2020', '08:02', 'Staff', '', '', 'S / Faltein', '', '', '', ''),
('in', '7904066133089', 'SFaltein', '', '', '', '08:07 14-4-2020', '14-4-2020', '08:07', 'Staff', '', '', 'S / Faltein', '', '', '', ''),
('in', '7904066133089', 'sfalteni', '', '', '', '07:40 06-5-2020', '2020/06/05', '07:40', 'Staff', '', '', 's / falteni', '', 'work', '', ''),
('in', '7904066133089', 'SisekoFaltein', '', '', '', '08:03 20-4-2020', '20-4-2020', '08:03', 'Staff', '', '', 'Siseko / Faltein', '', '', '', ''),
('out', '7904066133089', '', '', '', '', '16:27 08-5-2020', '2020/08/05', '16:27', 'Staff', '', '', 'S / Faltein', '', 'M', '', ''),
('out', '7904066133089', '', '', '', '', '16:30 07-5-2020', '2020/07/05', '16:30', 'Staff', '', '', 'Faltein / siseko', '', 'work', '', ''),
('out', '7904066133089', '', '', '', '', '16:30 06-5-2020', '2020/06/05', '16:30', 'Staff', '', '', 's / falteni', '', 'work', '', ''),
('out', '7904066133089', '', '', '', '', '16:28 05-5-2020', '2020/05/05', '16:28', 'Staff', '', '', 'S / Faltein', '', 'M', '', ''),
('out', '7904066133089', '', '', '', '', '16:29 04-5-2020', '2020/04/05', '16:29', 'Staff', '', '', 'S / Faltein', '', 'Mantainance', '', ''),
('out', '7904066133089', '', '', '', '', '16:26 30-4-2020', '30-4-2020', '16:26', 'Staff', '', '', 'S / Faltein', '', '', '', ''),
('out', '7904066133089', '', '', '', '', '16:27 29-4-2020', '29-4-2020', '16:27', 'Staff', '', '', 'S / Faltein', '', '', '', ''),
('out', '7904066133089', '', '', '', '', '16:31 28-4-2020', '28-4-2020', '16:31', 'Staff', '', '', 'S / Faltein', '', '', '', ''),
('out', '7904066133089', '', '', '', '', '16:29 24-4-2020', '24-4-2020', '16:29', 'Staff', '', '', 'S / Faltein', '', '', '', ''),
('out', '7904066133089', '', '', '', '', '16:34 23-4-2020', '23-4-2020', '16:34', 'Staff', '', '', 'S / Faltein', '', '', '', ''),
('out', '7904066133089', '', '', '', '', '16:31 22-4-2020', '22-4-2020', '16:31', 'Staff', '', '', 'S / Faltein', '', '', '', ''),
('out', '7904066133089', '', '', '', '', '16:30 21-4-2020', '21-4-2020', '16:30', 'Staff', '', '', 'S / Faltein', '', '', '', ''),
('out', '7904066133089', '', '', '', '', '12:15 20-4-2020', '20-4-2020', '12:15', 'Staff', '', '', 'Siseko / Faltein', '', '', '', ''),
('out', '7904066133089', '', '', '', '', '10:56 17-4-2020', '17-4-2020', '10:56', 'Staff', '', '', 'S / Faltein', '', '', '', ''),
('out', '7904066133089', '', '', '', '', '10:04 15-4-2020', '15-4-2020', '10:04', 'Staff', '', '', 'Galteun / s', '', '', '', ''),
('out', '7904066133089', '', '', '', '', '10:40 14-4-2020', '14-4-2020', '10:40', 'Staff', '', '', 'S / Faltein', '', '', '', ''),
('in', '7904095748089', '.nnzrmtsns', '', '', '', '07:32 30-4-2020', '30-4-2020', '07:32', 'Staff', '', '', '.nn / zrmtsns', '', '', '', ''),
('in', '7904095748089', 'NMzentaba', '', '', '', '07:32 05-5-2020', '2020/05/05', '07:32', 'Staff', '', '', 'N / Mzentaba', '', 'KG', '', ''),
('in', '7904095748089', 'NMzentaba', '', '', '', '07:35 04-5-2020', '2020/04/05', '07:35', 'Staff', '', '', 'N / Mzentaba', '', 'KG', '', ''),
('in', '7904095748089', 'NMzentaba', '', '', '', '07:36 29-4-2020', '29-4-2020', '07:36', 'Staff', '', '', 'N / Mzentaba', '', '', '', ''),
('out', '7904095748089', '', '', '', '', '15:50 05-5-2020', '2020/05/05', '15:50', 'Staff', '', '', 'N / Mzentaba', '', 'KG', '', ''),
('out', '7904095748089', '', '', '', '', '15:46 04-5-2020', '2020/04/05', '15:46', 'Staff', '', '', 'N / Mzentaba', '', 'KG', '', ''),
('out', '7904095748089', '', '', '', '', '16:02 30-4-2020', '30-4-2020', '16:02', 'Staff', '', '', '.nn / zrmtsns', '', '', '', ''),
('out', '7904095748089', '', '', '', '', '16:02 29-4-2020', '29-4-2020', '16:02', 'Staff', '', '', 'N / Mzentaba', '', '', '', ''),
('out', '7905230591086', '', '', '', '', '07:05 17-4-2020', '17-4-2020', '07:05', 'Staff', '', '', '', '', '', '', ''),
('out', '7905230591086', '', '', '', '', '07:05 16-4-2020', '16-4-2020', '07:05', 'Staff', '', '', '', '', '', '', ''),
('out', '7905230591086', '', '', '', '', '07:04 13-4-2020', '13-4-2020', '07:04', 'Staff', '', '', '', '', '', '', ''),
('out', '7905230591086', '', '', '', '', '07:07 12-4-2020', '2020/12/04', '07:07', 'Staff', '', '', '', '', '', '', ''),
('out', '7905230591086', '', '', '', '', '07:06 11-4-2020', '2020/11/04', '07:06', 'Staff', '', '', '', '', '', '', ''),
('in', '7908250017081', 'MGaseba', '', '', '', '17:01 08-5-2020', '2020/08/05', '17:01', 'Staff', '', '', 'M / Gaseba', '', 'Unit 148', '', ''),
('in', '7908250017081', 'MGaseba', '', '', '', '17:03 05-5-2020', '2020/05/05', '17:03', 'Staff', '', '', 'M / Gaseba', '', 'Unit 148', '', ''),
('in', '7908250017081', 'MGaseba', '', '', '', '17:07 04-5-2020', '2020/04/05', '17:07', 'Staff', '', '', 'M / Gaseba', '', 'Unit 148', '', ''),
('in', '7908250017081', 'MGaseba', '', '', '', '16:52 30-4-2020', '30-4-2020', '16:52', 'Staff', '', '', 'M / Gaseba', '', '148', '', ''),
('in', '7908250017081', 'MGaseba', '', '', '', '17:02 26-4-2020', '26-4-2020', '17:02', 'Staff', '', '', 'M / Gaseba', '', '', '', ''),
('in', '7908250017081', 'MGasebar', '', '', '', '17:05 09-5-2020', '2020/09/05', '17:05', 'Staff', '', '', 'M / Gasebar', '', 'U-148', '', ''),
('in', '7908250017081', 'millicent gaseba', '', '', '', '17:58 25-4-2020', '25-4-2020', '17:58', 'Staff', '', '', 'millicent  / gaseba', '', '', '', ''),
('in', '7908250017081', 'Millicent GasebaG Millicent', '', '', '', '17:52 20-4-2020', '20-4-2020', '17:52', 'Staff', '', '', 'Millicent Gaseba / G Millicent', '', '', '', ''),
('in', '7908250017081', 'millicentmellisa', '', '', '', '17:47 24-4-2020', '24-4-2020', '17:47', 'Staff', '', '', 'millicent / mellisa', '', '', '', ''),
('out', '7908250017081', '', '', '', '', '06:57 11-5-2020', '2020/11/05', '06:57', 'Staff', '', '', '', '', '', '', ''),
('out', '7908250017081', '', '', '', '', '06:59 10-5-2020', '2020/10/05', '06:59', 'Staff', '', '', 'M / Gasebar', '', 'U-148', '', ''),
('out', '7908250017081', '', '', '', '', '07:00 09-5-2020', '2020/09/05', '07:00', 'Staff', '', '', 'M / Gaseba', '', 'Unit 148', '', ''),
('out', '7908250017081', '', '', '', '', '06:56 06-5-2020', '2020/06/05', '06:56', 'Staff', '', '', 'M / Gaseba', '', 'Unit 148', '', ''),
('out', '7908250017081', '', '', '', '', '06:59 05-5-2020', '2020/05/05', '06:59', 'Staff', '', '', 'M / Gaseba', '', 'Unit 148', '', ''),
('out', '7908250017081', '', '', '', '', '17:01 05-5-2020', '2020/05/05', '17:01', 'Staff', '', '', '', '', '', '', ''),
('out', '7908250017081', '', '', '', '', '06:55 30-4-2020', '30-4-2020', '06:55', 'Staff', '', '', '', '', '', '', ''),
('out', '7908250017081', '', '', '', '', '06:55 27-4-2020', '27-4-2020', '06:55', 'Staff', '', '', 'M / Gaseba', '', '', '', ''),
('out', '7908250017081', '', '', '', '', '06:56 26-4-2020', '26-4-2020', '06:56', 'Staff', '', '', 'millicent  / gaseba', '', '', '', ''),
('out', '7908250017081', '', '', '', '', '06:59 22-4-2020', '22-4-2020', '06:59', 'Staff', '', '', 'Millicent Gaseba / G Millicent', '', '', '', ''),
('in', '7908250017082', 'MGaseba', '', '', '', '17:07 10-5-2020', '2020/10/05', '17:07', 'Staff', '', '', 'M / Gaseba', '', '148', '', ''),
('out', '7908250017801', '', '', '', '', '06:57 25-4-2020', '25-4-2020', '06:57', 'Staff', '', '', '', '', '', '', ''),
('out', '7908350017081', '', '', '', '', '17:14 29-4-2020', '29-4-2020', '17:14', 'Staff', '', '', '', '', '', '', ''),
('in', '7910210161082', 'AMRussion', '', '', '', '07:34 25-4-2020', '25-4-2020', '07:34', 'Staff', '', '', 'AM / Russion', '', '', '', ''),
('in', '7910210161082', 'russionm', '', '', '', '07:34 11-4-2020', '2020/11/04', '07:34', 'Staff', '', '', 'russion / m', '', '', '', ''),
('out', '7910210161082', '', '', '', '', '13:07 25-4-2020', '25-4-2020', '13:07', 'Staff', '', '', 'AM / Russion', '', '', '', ''),
('out', '7910210161082', '', '', '', '', '13:01 11-4-2020', '2020/11/04', '13:01', 'Staff', '', '', 'russion / m', '', '', '', ''),
('in', '7911105764089', 'Velile EnochDlokovu', '', '', '', '06:34 03-5-2020', '2020/03/05', '06:34', 'Staff', '', '', 'Velile Enoch / Dlokovu', '', 'Kitchen', '', ''),
('in', '7911105764089', 'VELILE ENOCKDLOKOVU', '', '', '7911105764089', '06:43 11-5-2020', '2020/11/05', '06:43', 'Staff', '', '', 'VELILE ENOCK / DLOKOVU', '', 'Kitchen', '', ''),
('in', '7911105764089', 'VELILE ENOCKDLOKOVU', '', '', '7911105764089', '06:22 06-5-2020', '2020/06/05', '06:22', 'Staff', '', '', 'VELILE ENOCK / DLOKOVU', '', 'kitchen', '', ''),
('in', '7911105764089', 'VELILE ENOCKDLOKOVU', '', '', '7911105764089', '06:37 02-5-2020', '2020/02/05', '06:37', 'Staff', '', '', 'VELILE ENOCK / DLOKOVU', '', 'Kitchen', '', ''),
('out', '7911105764089', 'VELILE ENOCKDLOKOVU', '', '', '7911105764089', '17:12 02-5-2020', '2020/02/05', '17:12', 'Staff', '', '', 'VELILE ENOCK / DLOKOVU', '', 'Kitchen', '', ''),
('in', '7911105764089', 'VELILE ENOCKDLOKOVU', '', '', '7911105764089', '07:03 01-5-2020', '2020/01/05', '07:03', 'Staff', '', '', 'VELILE ENOCK / DLOKOVU', '', 'Kitc', '', ''),
('out', '7911105764089', 'VELILE ENOCKDLOKOVU', '', '', '7911105764089', '17:08 01-5-2020', '2020/01/05', '17:08', 'Staff', '', '', 'VELILE ENOCK / DLOKOVU', '', 'Kitc', '', ''),
('out', '7911105764089', '', '', '', '', '16:09 07-5-2020', '2020/07/05', '16:09', 'Staff', '', '', '', '', '', '', ''),
('out', '7911105764089', '', '', '', '', '17:00 06-5-2020', '2020/06/05', '17:00', 'Staff', '', '', 'VELILE ENOCK / DLOKOVU', '', 'kitchen', '', ''),
('out', '7911105764089', '', '', '', '', '17:35 03-5-2020', '2020/03/05', '17:35', 'Staff', '', '', 'Velile Enoch / Dlokovu', '', 'Kitchen', '', ''),
('in', '7911160207081', 'Gp', '', '', '', '08:42 24-4-2020', '24-4-2020', '08:42', 'Staff', 'Expired car licence', '', 'G / p', '', '', '', ''),
('in', '7911160207081', 'LBrighyton', '', '', '', '05:48 11-5-2020', '2020/11/05', '05:48', 'Staff', 'Expired car licence', '', 'L / Brighyton', '', 'k', '', ''),
('in', '7911160207081', 'LSe', '', '', '', '08:58 29-4-2020', '29-4-2020', '08:58', 'Staff', 'Expired car licence', '', 'L / Se', '', '', '', ''),
('in', '7911160207081', 'N.Brighton', '', '', '', '06:54 14-4-2020', '14-4-2020', '06:54', 'Staff', 'Expired car licence', '', 'N. / Brighton', '', '', '', ''),
('in', '7911160207081', 'NATALIEBRIGHTON', '', '', '7911160207081', '06:44 10-5-2020', '2020/10/05', '06:44', 'Staff', 'Expired car licence', '', 'NATALIE / BRIGHTON', '', 'Kitchen', '', ''),
('in', '7911160207081', 'NATALIEBRIGHTON', '', '', '7911160207081', '06:52 28-4-2020', '28-4-2020', '06:52', 'Staff', 'Expired car licence', '', 'NATALIE / BRIGHTON', '', '', '', ''),
('in', '7911160207081', 'NatalieBrighton', '', '', '', '09:10 25-4-2020', '25-4-2020', '09:10', 'Staff', '', '', 'Natalie / Brighton', '', '', '', ''),
('in', '7911160207081', 'NATALIEBRIGHTON', '', '', '7911160207081', '06:54 24-4-2020', '24-4-2020', '06:54', 'Staff', 'Expired car licence', '', 'NATALIE / BRIGHTON', '', '', '', ''),
('in', '7911160207081', 'NBrighton', '', '', '', '07:34 10-5-2020', '2020/10/05', '07:34', 'Staff', 'Expired car licence', '', 'N / Brighton', '', 'K', '', ''),
('in', '7911160207081', 'NBrighton', '', '', '', '16:13 10-5-2020', '2020/10/05', '16:13', 'Staff', 'Expired car licence', '', 'N / Brighton', '', 'kitchen', '', ''),
('in', '7911160207081', 'NBrighton', '', '', '', '06:51 09-5-2020', '2020/09/05', '06:51', 'Staff', 'Expired car licence', '', 'N / Brighton', '', 'Kitchen', '', ''),
('in', '7911160207081', 'NBrighton', '', '', '', '08:38 09-5-2020', '2020/09/05', '08:38', 'Staff', 'Expired car licence', '', 'N / Brighton', '', 'Kitchen', '', ''),
('in', '7911160207081', 'NBrighton', '', '', '', '06:56 08-5-2020', '2020/08/05', '06:56', 'Staff', '', '', 'N / Brighton', '', 'K', '', ''),
('in', '7911160207081', 'NBrighton', '', '', '', '10:27 28-4-2020', '28-4-2020', '10:27', 'Staff', 'Expired car licence', '', 'N / Brighton', '', '', '', ''),
('in', '7911160207081', 'NBrighton', '', '', '', '06:29 26-4-2020', '26-4-2020', '06:29', 'Staff', 'Expired car licence', '', 'N / Brighton', '', '', '', ''),
('in', '7911160207081', 'NBrighton', '', '', '', '06:25 21-4-2020', '21-4-2020', '06:25', 'Staff', 'Expired car licence', '', 'N / Brighton', '', '', '', ''),
('in', '7911160207081', 'NBrighton', '', '', '', '09:38 17-4-2020', '17-4-2020', '09:38', 'Staff', 'Expired car licence', '', 'N / Brighton', '', '', '', ''),
('in', '7911160207081', 'NBrighton', '', '', '', '06:54 16-4-2020', '16-4-2020', '06:54', 'Staff', 'Expired car licence', '', 'N / Brighton', '', '', '', ''),
('in', '7911160207081', 'NBrighton', '', '', '', '08:43 14-4-2020', '14-4-2020', '08:43', 'Staff', 'Expired car licence', '', 'N / Brighton', '', '', '', ''),
('in', '7911160207081', 'NBrigton', '', '', '', '06:11 01-5-2020', '2020/01/05', '06:11', 'Staff', 'Expired car licence', '', 'N / Brigton', '', 'Kitchen', '', ''),
('in', '7911160207081', 'veruca', '', '', '', '08:13 12-4-2020', '2020/12/04', '08:13', 'Staff', 'Expired car licence', '', 'v / eruca', '', '', '', ''),
('out', '7911160207081', '', '', '', '', '13:42 24-4-2020', '24-4-2020', '13:42', 'Staff', '', '', 'G / p', '', '', '', ''),
('out', '7911160207081', '', '', '', '', '17:29 17-4-2020', '17-4-2020', '17:29', 'Staff', '', '', 'N / Brighton', '', '', '', ''),
('out', '7911160207081', '', '', '', '', '13:24 15-4-2020', '15-4-2020', '13:24', 'Staff', '', '', 'N / Brighton', '', '', '', ''),
('in', '7912126555084', 'b manyathib manyathi', '', '', '', '19:01 13-4-2020', '13-4-2020', '19:01', 'Staff', '', '', 'b manyathi / b manyathi', '', '', '', ''),
('in', '7912126555084', 'BManyathi', '', '', '', '10:31 01-5-2020', '2020/01/05', '10:31', 'Staff', '', '', 'B / Manyathi', '', '136', '', ''),
('in', '7912126555084', 'BMManyati', '', '', '', '12:33 15-4-2020', '15-4-2020', '12:33', 'Staff', '', '', 'BM / Manyati', '', '', '', ''),
('in', '7912126555084', 'BMsnyati', '', '', '', '07:32 30-4-2020', '30-4-2020', '07:32', 'Staff', '', '', 'B / Msnyati', '', '', '', ''),
('in', '7912126555084', 'BoyceManyathi', '', '', '', '18:24 03-5-2020', '2020/03/05', '18:24', 'Staff', '', '', 'Boyce / Manyathi', '', '128D', '', ''),
('in', '7912126555084', 'BoyceManyathi', '', '', '', '11:41 02-5-2020', '2020/02/05', '11:41', 'Staff', '', '', 'Boyce / Manyathi', '', '37,19', '', ''),
('in', '7912126555084', 'BoyceManyathi', '', '', '', '08:04 20-4-2020', '20-4-2020', '08:04', 'Staff', '', '', 'Boyce / Manyathi', '', '', '', ''),
('in', '7912126555084', 'BoyceManyathi', '', '', '', '19:37 15-4-2020', '15-4-2020', '19:37', 'Staff', '', '', 'Boyce / Manyathi', '', '', '', ''),
('in', '7912126555084', 'M.BManyati', '', '', '', '08:06 14-4-2020', '14-4-2020', '08:06', 'Staff', '', '', 'M.B / Manyati', '', '', '', ''),
('in', '7912126555084', 'ManyathiBoyce', '', '', '', '07:49 13-4-2020', '13-4-2020', '07:49', 'Staff', '', '', 'Manyathi / Boyce', '', '', '', ''),
('in', '7912126555084', 'manyathimxolisi', '', '', '', '20:17 26-4-2020', '26-4-2020', '20:17', 'Staff', '', '', 'manyathi / mxolisi', '', '', '', ''),
('in', '7912126555084', 'Manyathub', '', '', '', '07:57 15-4-2020', '15-4-2020', '07:57', 'Staff', '', '', 'Manyathu / b', '', '', '', ''),
('in', '7912126555084', 'Manyatmxolisi', '', '', '', '07:33 07-5-2020', '2020/07/05', '07:33', 'Staff', '', '', 'Manyat / mxolisi', '', 'work', '', ''),
('in', '7912126555084', 'MBManyathi', '', '', '', '08:01 16-4-2020', '16-4-2020', '08:01', 'Staff', '', '', 'MB / Manyathi', '', '', '', ''),
('in', '7912126555084', 'MBManyati', '', '', '', '07:31 11-5-2020', '2020/11/05', '07:31', 'Staff', '', '', 'MB / Manyati', '', 'M', '', ''),
('in', '7912126555084', 'MBManyati', '', '', '', '07:17 08-5-2020', '2020/08/05', '07:17', 'Staff', '', '', 'MB / Manyati', '', 'M', '', ''),
('in', '7912126555084', 'MBManyati', '', '', '', '07:27 05-5-2020', '2020/05/05', '07:27', 'Staff', '', '', 'MB / Manyati', '', 'Mantainance', '', ''),
('in', '7912126555084', 'MBManyati', '', '', '', '07:37 04-5-2020', '2020/04/05', '07:37', 'Staff', '', '', 'MB / Manyati', '', 'Mantainance', '', ''),
('in', '7912126555084', 'MBManyati', '', '', '', '14:49 03-5-2020', '2020/03/05', '14:49', 'Staff', '', '', 'MB / Manyati', '', '128', '', ''),
('in', '7912126555084', 'MBManyati', '', '', '', '07:38 29-4-2020', '29-4-2020', '07:38', 'Staff', '', '', 'MB / Manyati', '', '', '', ''),
('in', '7912126555084', 'MBManyati', '', '', '', '08:08 28-4-2020', '28-4-2020', '08:08', 'Staff', '', '', 'MB / Manyati', '', '', '', ''),
('in', '7912126555084', 'MBmanyati', '', '', '', '07:50 24-4-2020', '24-4-2020', '07:50', 'Staff', '', '', 'MB / manyati', '', '', '', ''),
('in', '7912126555084', 'MBManyati', '', '', '', '07:52 23-4-2020', '23-4-2020', '07:52', 'Staff', '', '', 'MB / Manyati', '', '', '', ''),
('in', '7912126555084', 'MBManyati', '', '', '', '07:48 22-4-2020', '22-4-2020', '07:48', 'Staff', '', '', 'MB / Manyati', '', '', '', ''),
('in', '7912126555084', 'MBManyati', '', '', '', '07:47 21-4-2020', '21-4-2020', '07:47', 'Staff', '', '', 'MB / Manyati', '', '', '', ''),
('in', '7912126555084', 'MBManyati', '', '', '', '13:05 18-4-2020', '18-4-2020', '13:05', 'Staff', '', '', 'MB / Manyati', '', '', '', ''),
('in', '7912126555084', 'MBManyati', '', '', '', '08:03 17-4-2020', '17-4-2020', '08:03', 'Staff', '', '', 'MB / Manyati', '', '', '', ''),
('in', '7912126555084', 'mmanyathi', '', '', '', '07:27 06-5-2020', '2020/06/05', '07:27', 'Staff', '', '', 'm / manyathi', '', 'work', '', ''),
('in', '7912126555084', 'MxolisiBoyce Manyathi', '', '', '', '12:16 14-4-2020', '14-4-2020', '12:16', 'Staff', '', '', 'Mxolisi / Boyce Manyathi', '', '', '', ''),
('in', '7912126555084', 'mxolisimanyathi', '', '', '', '20:02 25-4-2020', '25-4-2020', '20:02', 'Staff', '', '', 'mxolisi / manyathi', '', '', '', ''),
('in', '7912126555084', 'mxolisimanyathi', '', '', '', '20:41 25-4-2020', '25-4-2020', '20:41', 'Staff', '', '', 'mxolisi / manyathi', '', '', '', ''),
('out', '7912126555084', '', '', '', '', '16:25 08-5-2020', '2020/08/05', '16:25', 'Staff', '', '', 'MB / Manyati', '', 'M', '', ''),
('out', '7912126555084', '', '', '', '', '16:33 07-5-2020', '2020/07/05', '16:33', 'Staff', '', '', 'Manyat / mxolisi', '', 'work', '', ''),
('out', '7912126555084', '', '', '', '', '16:28 06-5-2020', '2020/06/05', '16:28', 'Staff', '', '', 'm / manyathi', '', 'work', '', ''),
('out', '7912126555084', '', '', '', '', '16:26 05-5-2020', '2020/05/05', '16:26', 'Staff', '', '', 'MB / Manyati', '', 'Mantainance', '', ''),
('out', '7912126555084', '', '', '', '', '16:26 04-5-2020', '2020/04/05', '16:26', 'Staff', '', '', 'MB / Manyati', '', 'Mantainance', '', ''),
('out', '7912126555084', '', '', '', '', '15:47 03-5-2020', '2020/03/05', '15:47', 'Staff', '', '', 'MB / Manyati', '', '128', '', ''),
('out', '7912126555084', '', '', '', '', '18:55 03-5-2020', '2020/03/05', '18:55', 'Staff', '', '', 'Boyce / Manyathi', '', '128D', '', ''),
('out', '7912126555084', '', '', '', '', '12:03 02-5-2020', '2020/02/05', '12:03', 'Staff', '', '', 'Boyce / Manyathi', '', '37,19', '', ''),
('out', '7912126555084', '', '', '', '', '12:39 01-5-2020', '2020/01/05', '12:39', 'Staff', '', '', 'B / Manyathi', '', '136', '', ''),
('out', '7912126555084', '', '', '', '', '16:28 30-4-2020', '30-4-2020', '16:28', 'Staff', '', '', 'B / Msnyati', '', '', '', ''),
('out', '7912126555084', '', '', '', '', '16:27 29-4-2020', '29-4-2020', '16:27', 'Staff', '', '', 'MB / Manyati', '', '', '', ''),
('out', '7912126555084', '', '', '', '', '16:29 28-4-2020', '28-4-2020', '16:29', 'Staff', '', '', 'MB / Manyati', '', '', '', ''),
('out', '7912126555084', '', '', '', '', '21:23 26-4-2020', '26-4-2020', '21:23', 'Staff', '', '', 'manyathi / mxolisi', '', '', '', ''),
('out', '7912126555084', '', '', '', '', '16:31 24-4-2020', '24-4-2020', '16:31', 'Staff', '', '', 'MB / manyati', '', '', '', ''),
('out', '7912126555084', '', '', '', '', '16:34 23-4-2020', '23-4-2020', '16:34', 'Staff', '', '', 'MB / Manyati', '', '', '', ''),
('out', '7912126555084', '', '', '', '', '16:30 22-4-2020', '22-4-2020', '16:30', 'Staff', '', '', 'MB / Manyati', '', '', '', ''),
('out', '7912126555084', '', '', '', '', '16:29 21-4-2020', '21-4-2020', '16:29', 'Staff', '', '', 'MB / Manyati', '', '', '', ''),
('out', '7912126555084', '', '', '', '', '12:16 20-4-2020', '20-4-2020', '12:16', 'Staff', '', '', 'Boyce / Manyathi', '', '', '', ''),
('out', '7912126555084', '', '', '', '', '14:15 18-4-2020', '18-4-2020', '14:15', 'Staff', '', '', 'MB / Manyati', '', '', '', ''),
('out', '7912126555084', '', '', '', '', '10:55 17-4-2020', '17-4-2020', '10:55', 'Staff', '', '', 'MB / Manyati', '', '', '', ''),
('out', '7912126555084', '', '', '', '', '10:15 16-4-2020', '16-4-2020', '10:15', 'Staff', '', '', 'MB / Manyathi', '', '', '', ''),
('out', '7912126555084', '', '', '', '', '10:04 15-4-2020', '15-4-2020', '10:04', 'Staff', '', '', 'Manyathu / b', '', '', '', ''),
('out', '7912126555084', '', '', '', '', '12:59 15-4-2020', '15-4-2020', '12:59', 'Staff', '', '', 'BM / Manyati', '', '', '', ''),
('out', '7912126555084', '', '', '', '', '19:48 15-4-2020', '15-4-2020', '19:48', 'Staff', '', '', 'Boyce / Manyathi', '', '', '', ''),
('out', '7912126555084', '', '', '', '', '10:40 14-4-2020', '14-4-2020', '10:40', 'Staff', '', '', 'M.B / Manyati', '', '', '', ''),
('out', '7912126555084', '', '', '', '', '13:18 14-4-2020', '14-4-2020', '13:18', 'Staff', '', '', 'Mxolisi / Boyce Manyathi', '', '', '', ''),
('out', '7912126555084', '', '', '', '', '09:08 13-4-2020', '13-4-2020', '09:08', 'Staff', '', '', 'Manyathi / Boyce', '', '', '', ''),
('out', '7912126555084', '', '', '', '', '19:11 13-4-2020', '13-4-2020', '19:11', 'Staff', '', '', 'b manyathi / b manyathi', '', '', '', ''),
('in', '8003046095085', 'Daymansizakel', '', '', '', '07:32 07-5-2020', '2020/07/05', '07:32', 'Staff', '', '', 'Dayman / sizakel', '', 'work', '', ''),
('in', '8003046095085', 'SDayimana', '', '', '', '07:32 05-5-2020', '2020/05/05', '07:32', 'Staff', '', '', 'S / Dayimana', '', 'Mantainance', '', ''),
('in', '8003046095085', 'SDayimani', '', '', '', '07:41 11-5-2020', '2020/11/05', '07:41', 'Staff', '', '', 'S / Dayimani', '', 'M', '', ''),
('in', '8003046095085', 'SDayimani', '', '', '', '07:30 08-5-2020', '2020/08/05', '07:30', 'Staff', '', '', 'S / Dayimani', '', 'M', '', ''),
('in', '8003046095085', 'sdayimani', '', '', '', '07:41 06-5-2020', '2020/06/05', '07:41', 'Staff', '', '', 's / dayimani', '', 'work', '', ''),
('in', '8003046095085', 'SDayimani', '', '', '', '07:44 04-5-2020', '2020/04/05', '07:44', 'Staff', '', '', 'S / Dayimani', '', 'Mantainance', '', ''),
('in', '8003046095085', 'SDayimani', '', '', '', '07:42 30-4-2020', '30-4-2020', '07:42', 'Staff', '', '', 'S / Dayimani', '', '', '', ''),
('in', '8003046095085', 'SDayimani', '', '', '', '07:39 29-4-2020', '29-4-2020', '07:39', 'Staff', '', '', 'S / Dayimani', '', '', '', ''),
('in', '8003046095085', 'SDayimani', '', '', '', '08:10 28-4-2020', '28-4-2020', '08:10', 'Staff', '', '', 'S / Dayimani', '', '', '', ''),
('in', '8003046095085', 'SDayimani', '', '', '', '07:49 24-4-2020', '24-4-2020', '07:49', 'Staff', '', '', 'S / Dayimani', '', '', '', ''),
('out', '8003046095085', '', '', '', '', '16:29 08-5-2020', '2020/08/05', '16:29', 'Staff', '', '', 'S / Dayimani', '', 'M', '', ''),
('out', '8003046095085', '', '', '', '', '16:30 07-5-2020', '2020/07/05', '16:30', 'Staff', '', '', 'Dayman / sizakel', '', 'work', '', ''),
('out', '8003046095085', '', '', '', '', '16:30 06-5-2020', '2020/06/05', '16:30', 'Staff', '', '', 's / dayimani', '', 'work', '', ''),
('out', '8003046095085', '', '', '', '', '16:27 05-5-2020', '2020/05/05', '16:27', 'Staff', '', '', 'S / Dayimana', '', 'Mantainance', '', ''),
('out', '8003046095085', '', '', '', '', '16:27 04-5-2020', '2020/04/05', '16:27', 'Staff', '', '', 'S / Dayimani', '', 'Mantainance', '', ''),
('out', '8003046095085', '', '', '', '', '16:28 30-4-2020', '30-4-2020', '16:28', 'Staff', '', '', 'S / Dayimani', '', '', '', ''),
('out', '8003046095085', '', '', '', '', '16:29 29-4-2020', '29-4-2020', '16:29', 'Staff', '', '', 'S / Dayimani', '', '', '', ''),
('out', '8003046095085', '', '', '', '', '16:30 28-4-2020', '28-4-2020', '16:30', 'Staff', '', '', 'S / Dayimani', '', '', '', ''),
('out', '8003046095085', '', '', '', '', '16:29 24-4-2020', '24-4-2020', '16:29', 'Staff', '', '', 'S / Dayimani', '', '', '', ''),
('in', '8101095340087', 'MMafani', '', '', '', '06:37 26-4-2020', '26-4-2020', '06:37', 'Staff', '', '', 'M / Mafani', '', '', '', ''),
('in', '8101095340087', 'MMafani', '', '', '', '06:26 20-4-2020', '20-4-2020', '06:26', 'Staff', '', '', 'M / Mafani', '', '', '', ''),
('in', '8101095340087', 'MZIWETHUMAFANI', '', '', '8101095340087', '06:30 10-5-2020', '2020/10/05', '06:30', 'Staff', '', '', 'MZIWETHU / MAFANI', '', 'Kitchen', '', ''),
('out', '8101095340087', 'MZIWETHUMAFANI', '', '', '8101095340087', '17:33 10-5-2020', '2020/10/05', '17:33', 'Staff', '', '', 'MZIWETHU / MAFANI', '', 'Kitchen', '', ''),
('in', '8101095340087', 'MZIWETHUMAFANI', '', '', '8101095340087', '06:54 09-5-2020', '2020/09/05', '06:54', 'Staff', '', '', 'MZIWETHU / MAFANI', '', 'Kitchen', '', ''),
('out', '8101095340087', 'MZIWETHUMAFANI', '', '', '8101095340087', '17:32 09-5-2020', '2020/09/05', '17:32', 'Staff', '', '', 'MZIWETHU / MAFANI', '', 'Kitchen', '', ''),
('in', '8101095340087', 'MZIWETHUMAFANI', '', '', '8101095340087', '06:56 08-5-2020', '2020/08/05', '06:56', 'Staff', '', '', 'MZIWETHU / MAFANI', '', 'K', '', ''),
('out', '8101095340087', 'MZIWETHUMAFANI', '', '', '8101095340087', '17:12 08-5-2020', '2020/08/05', '17:12', 'Staff', '', '', 'MZIWETHU / MAFANI', '', 'K', '', ''),
('in', '8101095340087', 'MZIWETHUMAFANI', '', '', '8101095340087', '06:24 05-5-2020', '2020/05/05', '06:24', 'Staff', '', '', 'MZIWETHU / MAFANI', '', 'Kitchen', '', ''),
('out', '8101095340087', 'MZIWETHUMAFANI', '', '', '8101095340087', '17:08 05-5-2020', '2020/05/05', '17:08', 'Staff', '', '', 'MZIWETHU / MAFANI', '', 'Kitchen', '', ''),
('in', '8101095340087', 'MZIWETHUMAFANI', '', '', '8101095340087', '06:21 04-5-2020', '2020/04/05', '06:21', 'Staff', '', '', 'MZIWETHU / MAFANI', '', 'Kitchen', '', ''),
('out', '8101095340087', 'MZIWETHUMAFANI', '', '', '8101095340087', '10:47 04-5-2020', '2020/04/05', '10:47', 'Staff', '', '', 'MZIWETHU / MAFANI', '', 'Kitchen', '', ''),
('in', '8101095340087', 'MZIWETHUMAFANI', '', '', '8101095340087', '06:48 01-5-2020', '2020/01/05', '06:48', 'Staff', '', '', 'MZIWETHU / MAFANI', '', 'Kitc', '', '');
INSERT INTO `atthegate` (`direction`, `license`, `name`, `company`, `category`, `dr_license`, `creation`, `recdate`, `rectime`, `profile`, `incidents`, `dr_name`, `name_in`, `name_out`, `going`, `company2`, `visiting`) VALUES
('in', '8101095340087', 'MZIWETHUMAFANI', '', '', '8101095340087', '06:26 30-4-2020', '30-4-2020', '06:26', 'Staff', '', '', 'MZIWETHU / MAFANI', '', '', '', ''),
('out', '8101095340087', 'MZIWETHUMAFANI', '', '', '8101095340087', '17:05 30-4-2020', '30-4-2020', '17:05', 'Staff', '', '', 'MZIWETHU / MAFANI', '', '', '', ''),
('in', '8101095340087', 'MZIWETHUMAFANI', '', '', '8101095340087', '06:34 29-4-2020', '29-4-2020', '06:34', 'Staff', '', '', 'MZIWETHU / MAFANI', '', '', '', ''),
('out', '8101095340087', 'MZIWETHUMAFANI', '', '', '8101095340087', '17:30 29-4-2020', '29-4-2020', '17:30', 'Staff', '', '', 'MZIWETHU / MAFANI', '', '', '', ''),
('out', '8101095340087', 'MZIWETHUMAFANI', '', '', '8101095340087', '06:59 27-4-2020', '27-4-2020', '06:59', 'Staff', '', '', '', '', '', '', ''),
('out', '8101095340087', 'MZIWETHUMAFANI', '', '', '8101095340087', '12:13 27-4-2020', '27-4-2020', '12:13', 'Staff', '', '', '', '', '', '', ''),
('in', '8101095340087', 'MZIWETHUMAFANI', '', '', '8101095340087', '06:38 24-4-2020', '24-4-2020', '06:38', 'Staff', '', '', 'MZIWETHU / MAFANI', '', '', '', ''),
('out', '8101095340087', 'MZIWETHUMAFANI', '', '', '8101095340087', '17:42 24-4-2020', '24-4-2020', '17:42', 'Staff', '', '', 'MZIWETHU / MAFANI', '', '', '', ''),
('in', '8101095340087', 'MZIWETHUMAFANI', '', '', '8101095340087', '07:38 21-4-2020', '21-4-2020', '07:38', 'Staff', '', '', 'MZIWETHU / MAFANI', '', '', '', ''),
('out', '8101095340087', 'MZIWETHUMAFANI', '', '', '8101095340087', '16:40 21-4-2020', '21-4-2020', '16:40', 'Staff', '', '', 'MZIWETHU / MAFANI', '', '', '', ''),
('in', '8101095340087', 'MZIWETHUMAFANI', '', '', '8101095340087', '06:32 17-4-2020', '17-4-2020', '06:32', 'Staff', '', '', 'MZIWETHU / MAFANI', '', '', '', ''),
('out', '8101095340087', 'MZIWETHUMAFANI', '', '', '8101095340087', '13:57 17-4-2020', '17-4-2020', '13:57', 'Staff', '', '', 'MZIWETHU / MAFANI', '', '', '', ''),
('in', '8101095340087', 'MZIWETHUMAFANI', '', '', '8101095340087', '06:50 16-4-2020', '16-4-2020', '06:50', 'Staff', '', '', 'MZIWETHU / MAFANI', '', '', '', ''),
('out', '8101095340087', 'MZIWETHUMAFANI', '', '', '8101095340087', '17:01 16-4-2020', '16-4-2020', '17:01', 'Staff', '', '', 'MZIWETHU / MAFANI', '', '', '', ''),
('in', '8101095340087', 'MZIWETHUMAFANI', '', '', '8101095340087', '06:32 15-4-2020', '15-4-2020', '06:32', 'Staff', '', '', 'MZIWETHU / MAFANI', '', '', '', ''),
('out', '8101095340087', 'MZIWETHUMAFANI', '', '', '8101095340087', '17:14 15-4-2020', '15-4-2020', '17:14', 'Staff', '', '', 'MZIWETHU / MAFANI', '', '', '', ''),
('in', '8101095340087', 'MZIWETHUMAFANI', '', '', '8101095340087', '06:34 12-4-2020', '2020/12/04', '06:34', 'Staff', '', '', 'MZIWETHU / MAFANI', '', '', '', ''),
('out', '8101095340087', 'MZIWETHUMAFANI', '', '', '8101095340087', '17:37 12-4-2020', '2020/12/04', '17:37', 'Staff', '', '', 'MZIWETHU / MAFANI', '', '', '', ''),
('in', '8101095340087', 'MZIWETHUMAFANI', '', '', '8101095340087', '06:36 11-4-2020', '2020/11/04', '06:36', 'Staff', '', '', 'MZIWETHU / MAFANI', '', '', '', ''),
('out', '8101095340087', 'MZIWETHUMAFANI', '', '', '8101095340087', '17:03 11-4-2020', '2020/11/04', '17:03', 'Staff', '', '', 'MZIWETHU / MAFANI', '', '', '', ''),
('out', '8101095340087', '', '', '', '', '16:57 26-4-2020', '26-4-2020', '16:57', 'Staff', '', '', 'M / Mafani', '', '', '', ''),
('out', '8101095340087', '', '', '', '', '17:25 20-4-2020', '20-4-2020', '17:25', 'Staff', '', '', 'M / Mafani', '', '', '', ''),
('in', '8101095340089', 'MZIWETHUMAFANI', '', '', '8101095340087', '06:36 25-4-2020', '25-4-2020', '06:36', 'Staff', '', '', 'MZIWETHU / MAFANI', '', '', '', ''),
('in', '8103120796085', 'gumrgel', '', '', '', '07:45 15-4-2020', '15-4-2020', '07:45', 'Staff', '', '', 'gumrge / l', '', '', '', ''),
('in', '8103120796085', 'L.MGumenge', '', '', '', '07:34 20-4-2020', '20-4-2020', '07:34', 'Staff', '', '', 'L.M / Gumenge', '', '', '', ''),
('in', '8103120796085', 'L.MGumenge', '', '', '', '07:20 14-4-2020', '14-4-2020', '07:20', 'Staff', '', '', 'L.M / Gumenge', '', '', '', ''),
('in', '8103120796085', 'LGumenge', '', '', '', '08:28 08-5-2020', '2020/08/05', '08:28', 'Staff', '', '', 'L / Gumenge', '', 'Unit 39', '', ''),
('in', '8103120796085', 'LMGumege', '', '', '', '08:25 05-5-2020', '2020/05/05', '08:25', 'Staff', '', '', 'LM / Gumege', '', '39', '', ''),
('in', '8103120796085', 'LMGumege', '', '', '', '07:48 27-4-2020', '27-4-2020', '07:48', 'Staff', '', '', 'LM / Gumege', '', '', '', ''),
('in', '8103120796085', 'LMGumege', '', '', '', '07:29 21-4-2020', '21-4-2020', '07:29', 'Staff', '', '', 'LM / Gumege', '', '', '', ''),
('in', '8103120796085', 'LMGumenge', '', '', '', '08:33 09-5-2020', '2020/09/05', '08:33', 'Staff', '', '', 'LM / Gumenge', '', '39', '', ''),
('in', '8103120796085', 'LMGumenge', '', '', '', '07:28 29-4-2020', '29-4-2020', '07:28', 'Staff', '', '', 'LM / Gumenge', '', '', '', ''),
('in', '8103120796085', 'LMGumenge', '', '', '', '07:22 28-4-2020', '28-4-2020', '07:22', 'Staff', '', '', 'LM / Gumenge', '', '', '', ''),
('in', '8103120796085', 'LMGumenge', '', '', '', '07:34 24-4-2020', '24-4-2020', '07:34', 'Staff', '', '', 'LM / Gumenge', '', '', '', ''),
('in', '8103120796085', 'LMGumenge', '', '', '', '07:29 23-4-2020', '23-4-2020', '07:29', 'Staff', '', '', 'LM / Gumenge', '', '', '', ''),
('in', '8103120796085', 'LMGumenge', '', '', '', '07:15 22-4-2020', '22-4-2020', '07:15', 'Staff', '', '', 'LM / Gumenge', '', '', '', ''),
('in', '8103120796085', 'LMGumenge', '', '', '', '07:29 16-4-2020', '16-4-2020', '07:29', 'Staff', '', '', 'LM / Gumenge', '', '', '', ''),
('in', '8103120796085', 'LMGumengge', '', '', '', '08:19 04-5-2020', '2020/04/05', '08:19', 'Staff', '', '', 'LM / Gumengge', '', 'Unit 39', '', ''),
('in', '8103120796085', 'LMgumrge', '', '', '', '07:29 17-4-2020', '17-4-2020', '07:29', 'Staff', '', '', 'LM / gumrge', '', '', '', ''),
('in', '8103120796085', 'LulekaGumenge', '', '', '', '07:21 13-4-2020', '13-4-2020', '07:21', 'Staff', '', '', 'Luleka / Gumenge', '', '', '', ''),
('in', '8103120796085', 'Luleks GumengeGumenge', '', '', '', '08:28 07-5-2020', '2020/07/05', '08:28', 'Staff', '', '', 'Luleks Gumenge / Gumenge', '', 'work', '', ''),
('out', '8103120796085', '', '', '', '', '14:08 09-5-2020', '2020/09/05', '14:08', 'Staff', '', '', 'LM / Gumenge', '', '39', '', ''),
('out', '8103120796085', '', '', '', '', '14:11 08-5-2020', '2020/08/05', '14:11', 'Staff', '', '', 'L / Gumenge', '', 'Unit 39', '', ''),
('out', '8103120796085', '', '', '', '', '15:59 07-5-2020', '2020/07/05', '15:59', 'Staff', '', '', 'Luleks Gumenge / Gumenge', '', 'work', '', ''),
('out', '8103120796085', '', '', '', '', '16:05 05-5-2020', '2020/05/05', '16:05', 'Staff', '', '', 'LM / Gumege', '', '39', '', ''),
('out', '8103120796085', '', '', '', '', '16:10 04-5-2020', '2020/04/05', '16:10', 'Staff', '', '', 'LM / Gumengge', '', 'Unit 39', '', ''),
('out', '8103120796085', '', '', '', '', '11:57 29-4-2020', '29-4-2020', '11:57', 'Staff', '', '', 'LM / Gumenge', '', '', '', ''),
('out', '8103120796085', '', '', '', '', '16:15 28-4-2020', '28-4-2020', '16:15', 'Staff', '', '', 'LM / Gumenge', '', '', '', ''),
('out', '8103120796085', '', '', '', '', '19:02 27-4-2020', '27-4-2020', '19:02', 'Staff', '', '', 'LM / Gumege', '', '', '', ''),
('out', '8103120796085', '', '', '', '', '17:09 24-4-2020', '24-4-2020', '17:09', 'Staff', '', '', 'LM / Gumenge', '', '', '', ''),
('out', '8103120796085', '', '', '', '', '17:10 23-4-2020', '23-4-2020', '17:10', 'Staff', '', '', 'LM / Gumenge', '', '', '', ''),
('out', '8103120796085', '', '', '', '', '17:03 22-4-2020', '22-4-2020', '17:03', 'Staff', '', '', 'LM / Gumenge', '', '', '', ''),
('out', '8103120796085', '', '', '', '', '16:57 21-4-2020', '21-4-2020', '16:57', 'Staff', '', '', 'LM / Gumege', '', '', '', ''),
('out', '8103120796085', '', '', '', '', '17:05 20-4-2020', '20-4-2020', '17:05', 'Staff', '', '', 'L.M / Gumenge', '', '', '', ''),
('out', '8103120796085', '', '', '', '', '17:08 17-4-2020', '17-4-2020', '17:08', 'Staff', '', '', 'LM / gumrge', '', '', '', ''),
('out', '8103120796085', '', '', '', '', '17:09 16-4-2020', '16-4-2020', '17:09', 'Staff', '', '', 'LM / Gumenge', '', '', '', ''),
('out', '8103120796085', '', '', '', '', '17:05 15-4-2020', '15-4-2020', '17:05', 'Staff', '', '', 'gumrge / l', '', '', '', ''),
('out', '8103120796085', '', '', '', '', '17:11 14-4-2020', '14-4-2020', '17:11', 'Staff', '', '', 'L.M / Gumenge', '', '', '', ''),
('out', '8103120796085', '', '', '', '', '17:01 13-4-2020', '13-4-2020', '17:01', 'Staff', '', '', 'Luleka / Gumenge', '', '', '', ''),
('in', '8103300099083', 'LYNDRO URSULAJORDAAN', '', '', '8109300099083', '18:36 23-4-2020', '23-4-2020', '18:36', 'Staff', '', '', 'LYNDRO URSULA / JORDAAN', '', '', '', ''),
('in', '8104210945087', 'L.Dumezweni', '', '', '', '07:13 26-4-2020', '26-4-2020', '07:13', 'Staff', '', '', 'L. / Dumezweni', '', '', '', ''),
('in', '8104210945087', 'LDumezweni', '', '', '', '07:00 16-4-2020', '16-4-2020', '07:00', 'Staff', '', '', 'L / Dumezweni', '', '', '', ''),
('in', '8104210945087', 'LUMKADUMEZWENI', '', '', '8104210945087', '06:50 10-5-2020', '2020/10/05', '06:50', 'Staff', '', '', 'LUMKA / DUMEZWENI', '', 'C/C', '', ''),
('out', '8104210945087', 'LUMKADUMEZWENI', '', '', '8104210945087', '17:07 10-5-2020', '2020/10/05', '17:07', 'Staff', '', '', 'LUMKA / DUMEZWENI', '', 'C/C', '', ''),
('in', '8104210945087', 'LUMKADUMEZWENI', '', '', '8104210945087', '07:06 29-4-2020', '29-4-2020', '07:06', 'Staff', '', '', 'LUMKA / DUMEZWENI', '', '', '', ''),
('in', '8104210945087', 'LUMKADUMEZWENI', '', '', '8104210945087', '06:57 24-4-2020', '24-4-2020', '06:57', 'Staff', '', '', 'LUMKA / DUMEZWENI', '', '', '', ''),
('in', '8104210945087', 'LUMKADUMEZWENI', '', '', '8104210945087', '06:59 15-4-2020', '15-4-2020', '06:59', 'Staff', '', '', 'LUMKA / DUMEZWENI', '', '', '', ''),
('out', '8104210945087', '', '', '', '', '17:17 26-4-2020', '26-4-2020', '17:17', 'Staff', '', '', 'L. / Dumezweni', '', '', '', ''),
('out', '8104210945087', '', '', '', '', '17:34 21-4-2020', '21-4-2020', '17:34', 'Staff', '', '', '', '', '', '', ''),
('out', '8104210945087', '', '', '', '', '17:14 16-4-2020', '16-4-2020', '17:14', 'Staff', '', '', 'L / Dumezweni', '', '', '', ''),
('in', '8106195450082', 'memanid', '', '', '', '00:47 06-5-2020', '2020/06/05', '00:47', 'Staff', '', '', 'memani / d', '', 'frail care', '', ''),
('in', '8106195450082', 'memanis', '', '', '', '00:50 06-5-2020', '2020/06/05', '00:50', 'Staff', '', '', 'memani / s', '', 'frail care', '', ''),
('out', '8106195450082', '', '', '', '', '00:49 06-5-2020', '2020/06/05', '00:49', 'Staff', '', '', '', '', '', '', ''),
('out', '8106195450082', '', '', '', '', '00:52 06-5-2020', '2020/06/05', '00:52', 'Staff', '', '', 'memani / s', '', 'frail care', '', ''),
('in', '8108300099083', 'LYNDRO URSULAJORDAAN', '', '', '8109300099083', '18:42 06-5-2020', '2020/06/05', '18:42', 'Staff', '', '', 'LYNDRO URSULA / JORDAAN', '', '190', '', ''),
('out', '8109300099083', 'LYNDRO URSULAJORDAAN', '', '', '8109300099083', '07:13 07-5-2020', '2020/07/05', '07:13', 'Staff', '', '', '', '', '', '', ''),
('out', '8109300099083', 'LYNDRO URSULAJORDAAN', '', '', '8109300099083', '06:57 03-5-2020', '2020/03/05', '06:57', 'Staff', '', '', 'LYNDRO URSULA / JORDAAN', '', '190', '', ''),
('in', '8109300099083', 'LYNDRO URSULAJORDAAN', '', '', '8109300099083', '18:40 02-5-2020', '2020/02/05', '18:40', 'Staff', '', '', 'LYNDRO URSULA / JORDAAN', '', '190', '', ''),
('in', '8109300099083', 'LYNDRO URSULAJORDAAN', '', '', '8109300099083', '18:40 01-5-2020', '2020/01/05', '18:40', 'Staff', '', '', 'LYNDRO URSULA / JORDAAN', '', '190', '', ''),
('out', '8109300099083', 'LYNDRO URSULAJORDAAN', '', '', '8109300099083', '06:59 28-4-2020', '28-4-2020', '06:59', 'Staff', '', '', 'LYNDRO URSULA / JORDAAN', '', '', '', ''),
('in', '8109300099083', 'LYNDRO URSULAJORDAAN', '', '', '8109300099083', '18:40 28-4-2020', '28-4-2020', '18:40', 'Staff', '', '', 'LYNDRO URSULA / JORDAAN', '', '', '', ''),
('in', '8109300099083', 'LYNDRO URSULAJORDAAN', '', '', '8109300099083', '18:40 27-4-2020', '27-4-2020', '18:40', 'Staff', '', '', 'LYNDRO URSULA / JORDAAN', '', '', '', ''),
('out', '8109300099083', 'LYNDRO URSULAJORDAAN', '', '', '8109300099083', '18:43 24-4-2020', '24-4-2020', '18:43', 'Staff', '', '', '', '', '', '', ''),
('out', '8109300099083', 'LYNDRO URSULAJORDAAN', '', '', '8109300099083', '07:09 18-4-2020', '18-4-2020', '07:09', 'Staff', '', '', 'LYNDRO URSULA / JORDAAN', '', '', '', ''),
('in', '8109300099083', 'LYNDRO URSULAJORDAAN', '', '', '8109300099083', '18:47 17-4-2020', '17-4-2020', '18:47', 'Staff', '', '', 'LYNDRO URSULA / JORDAAN', '', '', '', ''),
('out', '8109300099083', 'LYNDRO URSULAJORDAAN', '', '', '8109300099083', '07:03 15-4-2020', '15-4-2020', '07:03', 'Staff', '', '', 'LYNDRO URSULA / JORDAAN', '', '', '', ''),
('in', '8109300099083', 'LYNDRO URSULAJORDAAN', '', '', '8109300099083', '18:39 14-4-2020', '14-4-2020', '18:39', 'Staff', '', '', 'LYNDRO URSULA / JORDAAN', '', '', '', ''),
('out', '8109300099083', '', '', '', '', '06:58 08-5-2020', '2020/08/05', '06:58', 'Staff', '', '', '', '', '', '', ''),
('out', '8109300099083', '', '', '', '', '06:57 02-5-2020', '2020/02/05', '06:57', 'Staff', '', '', 'LYNDRO URSULA / JORDAAN', '', '190', '', ''),
('out', '8109300099083', '', '', '', '', '07:01 29-4-2020', '29-4-2020', '07:01', 'Staff', '', '', 'LYNDRO URSULA / JORDAAN', '', '', '', ''),
('out', '8109300099083', '', '', '', '', '07:03 14-4-2020', '14-4-2020', '07:03', 'Staff', '', '', '', '', '', '', ''),
('in', '8111030258088', 'SARensbrg', '', '', '', '07:49 11-5-2020', '2020/11/05', '07:49', 'Staff', '', '', 'SA / Rensbrg', '', 'L', '', ''),
('in', '8111030258088', 'SAVa Rensburg', '', '', '', '08:03 02-5-2020', '2020/02/05', '08:03', 'Staff', '', '', 'SA / Va Rensburg', '', 'Laundry', '', ''),
('in', '8111030258088', 'SAVandermerve', '', '', '', '07:42 18-4-2020', '18-4-2020', '07:42', 'Staff', '', '', 'SA / Vandermerve', '', '', '', ''),
('in', '8111030258088', 'SVanrensberg', '', '', '', '08:01 01-5-2020', '2020/01/05', '08:01', 'Staff', '', '', 'S / Vanrensberg', '', 'laundry', '', ''),
('out', '8111030258088', '', '', '', '', '13:10 02-5-2020', '2020/02/05', '13:10', 'Staff', '', '', 'SA / Va Rensburg', '', 'Laundry', '', ''),
('out', '8111030258088', '', '', '', '', '16:02 01-5-2020', '2020/01/05', '16:02', 'Staff', '', '', 'S / Vanrensberg', '', 'laundry', '', ''),
('out', '8111030258088', '', '', '', '', '13:27 18-4-2020', '18-4-2020', '13:27', 'Staff', '', '', 'SA / Vandermerve', '', '', '', ''),
('in', '8205190361086', 'Jde wet', '', '', '', '11:49 06-5-2020', '2020/06/05', '11:49', 'Staff', '', '', 'J / de wet', '', 'Maitanance', '', ''),
('in', '8205190361086', 'JDe Wet', '', '', '', '07:27 29-4-2020', '29-4-2020', '07:27', 'Staff', '', '', 'J / De Wet', '', '', '', ''),
('in', '8205190361086', 'JDe Wet', '', '', '', '07:30 24-4-2020', '24-4-2020', '07:30', 'Staff', '', '', 'J / De Wet', '', '', '', ''),
('in', '8205190361086', 'JDe Wet', '', '', '', '07:27 23-4-2020', '23-4-2020', '07:27', 'Staff', '', '', 'J / De Wet', '', '', '', ''),
('in', '8205190361086', 'JDeWet', '', '', '', '07:33 30-4-2020', '30-4-2020', '07:33', 'Staff', '', '', 'J / DeWet', '', '', '', ''),
('in', '8205190361086', 'JDWet', '', '', '', '07:34 11-5-2020', '2020/11/05', '07:34', 'Staff', '', '', 'J / DWet', '', 'M', '', ''),
('out', '8205190361086', 'JOHANNA SARIEDE WET', '', '', '8205190361086', '16:29 08-5-2020', '2020/08/05', '16:29', 'Staff', '', '', 'JS / DeWet', '', 'M', '', ''),
('in', '8205190361086', 'JOHANNA SARIEDE WET', '', '', '8205190361086', '07:34 07-5-2020', '2020/07/05', '07:34', 'Staff', '', '', 'JOHANNA SARIE / DE WET', '', 'work', '', ''),
('out', '8205190361086', 'JOHANNA SARIEDE WET', '', '', '8205190361086', '16:27 07-5-2020', '2020/07/05', '16:27', 'Staff', '', '', 'JOHANNA SARIE / DE WET', '', 'work', '', ''),
('in', '8205190361086', 'JOHANNA SARIEDE WET', '', '', '8205190361086', '07:23 05-5-2020', '2020/05/05', '07:23', 'Staff', '', '', 'JOHANNA SARIE / DE WET', '', 'Mantainance', '', ''),
('out', '8205190361086', 'JOHANNA SARIEDE WET', '', '', '8205190361086', '19:05 05-5-2020', '2020/05/05', '19:05', 'Staff', '', '', 'JOHANNA SARIE / DE WET', '', 'Mantainance', '', ''),
('out', '8205190361086', 'JOHANNA SARIEDE WET', '', '', '8205190361086', '16:30 04-5-2020', '2020/04/05', '16:30', 'Staff', '', '', 'JS  / Dewet', '', 'Mantainance', '', ''),
('out', '8205190361086', 'JOHANNA SARIEDE WET', '', '', '8205190361086', '16:32 29-4-2020', '29-4-2020', '16:32', 'Staff', '', '', 'J / De Wet', '', '', '', ''),
('out', '8205190361086', 'JOHANNA SARIEDE WET', '', '', '8205190361086', '16:32 24-4-2020', '24-4-2020', '16:32', 'Staff', '', '', 'J / De Wet', '', '', '', ''),
('in', '8205190361086', 'johhsnaDewet', '', '', '', '07:50 28-4-2020', '28-4-2020', '07:50', 'Staff', '', '', 'johhsna / Dewet', '', '', '', ''),
('in', '8205190361086', 'JS Dewet', '', '', '', '07:36 04-5-2020', '2020/04/05', '07:36', 'Staff', '', '', 'JS  / Dewet', '', 'Mantainance', '', ''),
('in', '8205190361086', 'JSDeWet', '', '', '', '07:40 08-5-2020', '2020/08/05', '07:40', 'Staff', '', '', 'JS / DeWet', '', 'M', '', ''),
('out', '8205190361086', '', '', '', '', '13:16 06-5-2020', '2020/06/05', '13:16', 'Staff', '', '', 'J / de wet', '', 'Maitanance', '', ''),
('out', '8205190361086', '', '', '', '', '16:27 30-4-2020', '30-4-2020', '16:27', 'Staff', '', '', 'J / DeWet', '', '', '', ''),
('in', '8209131357088', 'BNgqokoqwane', '', '', '', '06:49 11-5-2020', '2020/11/05', '06:49', 'Staff', '', '', 'B / Ngqokoqwane', '', 'Kitchen', '', ''),
('in', '8209131357088', 'Bngqokoqwane', '', '', '', '06:54 01-5-2020', '2020/01/05', '06:54', 'Staff', '', '', 'B / ngqokoqwane', '', 'kitc', '', ''),
('in', '8209131357088', 'BUSISIWE LOVEDALIANGQOKOQWANE', '', '', '8209131357088', '06:55 02-5-2020', '2020/02/05', '06:55', 'Staff', 'TU driver license warning', '', 'BUSISIWE LOVEDALIA / NGQOKOQWANE', '', 'Kitchen', '', ''),
('out', '8209131357088', 'BUSISIWE LOVEDALIANGQOKOQWANE', '', '', '8209131357088', '17:10 01-5-2020', '2020/01/05', '17:10', 'Staff', 'TU driver license warning', '', 'B / ngqokoqwane', '', 'kitc', '', ''),
('in', '8209131357088', 'Busisiwe Ngqokoqwans B Ngqokoqwana', '', '', '', '06:52 07-5-2020', '2020/07/05', '06:52', 'Staff', '', '', 'Busisiwe Ngqokoqwans  / B Ngqokoqwana', '', 'Kitchin', '', ''),
('in', '8209131357088', 'BusisiweNgqokoqwane', '', '', '', '06:31 03-5-2020', '2020/03/05', '06:31', 'Staff', '', '', 'Busisiwe / Ngqokoqwane', '', 'Kitchen', '', ''),
('out', '8209131357088', '', '', '', '', '17:34 07-5-2020', '2020/07/05', '17:34', 'Staff', '', '', 'Busisiwe Ngqokoqwans  / B Ngqokoqwana', '', 'Kitchin', '', ''),
('out', '8209131357088', '', '', '', '', '13:09 06-5-2020', '2020/06/05', '13:09', 'Staff', '', '', '', '', '', '', ''),
('out', '8209131357088', '', '', '', '', '16:44 03-5-2020', '2020/03/05', '16:44', 'Staff', '', '', 'Busisiwe / Ngqokoqwane', '', 'Kitchen', '', ''),
('out', '8209131357088', '', '', '', '', '17:36 02-5-2020', '2020/02/05', '17:36', 'Staff', '', '', 'BUSISIWE LOVEDALIA / NGQOKOQWANE', '', 'Kitchen', '', ''),
('in', '8302110399088', 'AndiswaSokuyeka', '', '', '', '06:37 03-5-2020', '2020/03/05', '06:37', 'Staff', '', '', 'Andiswa / Sokuyeka', '', 'Kitchen', '', ''),
('out', '8302110399088', '', '', '', '', '17:08 07-5-2020', '2020/07/05', '17:08', 'Staff', '', '', '', '', '', '', ''),
('out', '8302110399088', '', '', '', '', '17:28 06-5-2020', '2020/06/05', '17:28', 'Staff', '', '', '', '', '', '', ''),
('out', '8302110399088', '', '', '', '', '17:01 03-5-2020', '2020/03/05', '17:01', 'Staff', '', '', 'Andiswa / Sokuyeka', '', 'Kitchen', '', ''),
('in', '8304070283088', 'NZweni', '', '', '', '09:58 08-5-2020', '2020/08/05', '09:58', 'Staff', '', '', 'N / Zweni', '', 'Care Centre', '', ''),
('in', '8305070242081', 'gangqulungiswa', '', '', '', '06:53 25-4-2020', '25-4-2020', '06:53', 'Staff', '', '', 'gangqu / lungiswa', '', '', '', ''),
('in', '8305070242081', 'lganqgu', '', '', '', '07:41 12-4-2020', '2020/12/04', '07:41', 'Staff', '', '', 'l / ganqgu', '', '', '', ''),
('in', '8305070242081', 'LNgangqu', '', '', '', '06:59 30-4-2020', '30-4-2020', '06:59', 'Staff', '', '', 'L / Ngangqu', '', '', '', ''),
('in', '8305070242081', 'LUNGISWAGANGQU', '', '', '8305070242081', '06:59 10-5-2020', '2020/10/05', '06:59', 'Staff', '', '', 'LUNGISWA / GANGQU', '', 'G1', '', ''),
('in', '8305070242081', 'LUNGISWAGANGQU', '', '', '8305070242081', '07:02 04-5-2020', '2020/04/05', '07:02', 'Visitors', '', 'LUNGISWA / GANGQU', '', '', '', '', 'Resturant'),
('in', '8305070242081', 'LUNGISWAGANGQU', '', '', '8305070242081', '06:49 29-4-2020', '29-4-2020', '06:49', 'Staff', '', '', 'LUNGISWA / GANGQU', '', '', '', ''),
('out', '8305070242081', 'LUNGISWAGANGQU', '', '', '8305070242081', '18:42 29-4-2020', '29-4-2020', '18:42', 'Staff', '', '', 'LUNGISWA / GANGQU', '', '', '', ''),
('in', '8305070242081', 'LUNGISWAGANGQU', '', '', '8305070242081', '06:45 26-4-2020', '26-4-2020', '06:45', 'Staff', '', '', 'LUNGISWA / GANGQU', '', '', '', ''),
('out', '8305070242081', 'LUNGISWAGANGQU', '', '', '8305070242081', '18:39 25-4-2020', '25-4-2020', '18:39', 'Visitors', 'In/Out custom field value doesn\'t match', '', 'gangqu / lungiswa', '', '', '', ''),
('in', '8305070242081', 'LUNGISWAGANGQU', '', '', '8305070242081', '06:41 24-4-2020', '24-4-2020', '06:41', 'Staff', '', '', 'LUNGISWA / GANGQU', '', '', '', ''),
('out', '8305070242081', 'LUNGISWAGANGQU', '', '', '8305070242081', '18:48 24-4-2020', '24-4-2020', '18:48', 'Staff', '', '', 'LUNGISWA / GANGQU', '', '', '', ''),
('in', '8305070242081', 'LUNGISWAGANGQU', '', '', '8305070242081', '06:28 21-4-2020', '21-4-2020', '06:28', 'Staff', '', '', 'LUNGISWA / GANGQU', '', '', '', ''),
('in', '8305070242081', 'LUNGISWAGANGQU', '', '', '8305070242081', '06:59 20-4-2020', '20-4-2020', '06:59', 'Staff', '', '', 'LUNGISWA / GANGQU', '', '', '', ''),
('out', '8305070242081', 'LUNGISWAGANGQU', '', '', '8305070242081', '18:34 20-4-2020', '20-4-2020', '18:34', 'Staff', '', '', 'LUNGISWA / GANGQU', '', '', '', ''),
('in', '8305070242081', 'LUNGISWAGANGQU', '', '', '8305070242081', '07:43 18-4-2020', '18-4-2020', '07:43', 'Staff', '', '', 'LUNGISWA / GANGQU', '', '', '', ''),
('out', '8305070242081', 'LUNGISWAGANGQU', '', '', '8305070242081', '17:11 18-4-2020', '18-4-2020', '17:11', 'Staff', '', '', 'LUNGISWA / GANGQU', '', '', '', ''),
('in', '8305070242081', 'LUNGISWAGANGQU', '', '', '8305070242081', '06:52 16-4-2020', '16-4-2020', '06:52', 'Staff', '', '', 'LUNGISWA / GANGQU', '', '', '', ''),
('out', '8305070242081', 'LUNGISWAGANGQU', '', '', '8305070242081', '18:18 16-4-2020', '16-4-2020', '18:18', 'Staff', '', '', 'LUNGISWA / GANGQU', '', '', '', ''),
('in', '8305070242081', 'LUNGISWAGANGQU', '', '', '8305070242081', '06:58 15-4-2020', '15-4-2020', '06:58', 'Staff', '', '', 'LUNGISWA / GANGQU', '', '', '', ''),
('out', '8305070242081', 'LUNGISWAGANGQU', '', '', '8305070242081', '18:25 15-4-2020', '15-4-2020', '18:25', 'Staff', '', '', 'LUNGISWA / GANGQU', '', '', '', ''),
('in', '8305070242081', 'LUNGISWAGANGQU', '', '', '8305070242081', '07:43 11-4-2020', '2020/11/04', '07:43', 'Staff', '', '', 'LUNGISWA / GANGQU', '', '', '', ''),
('out', '8305070242081', 'LUNGISWAGANGQU', '', '', '8305070242081', '17:00 11-4-2020', '2020/11/04', '17:00', 'Staff', '', '', 'LUNGISWA / GANGQU', '', '', '', ''),
('out', '8305070242081', '', '', '', '', '19:01 30-4-2020', '30-4-2020', '19:01', 'Staff', '', '', 'L / Ngangqu', '', '', '', ''),
('out', '8305070242081', '', '', '', '', '18:01 26-4-2020', '26-4-2020', '18:01', 'Staff', '', '', 'LUNGISWA / GANGQU', '', '', '', ''),
('out', '8305070242081', '', '', '', '', '17:04 19-4-2020', '19-4-2020', '17:04', 'Staff', '', '', '', '', '', '', ''),
('out', '8305070242081', '', '', '', '', '17:02 12-4-2020', '2020/12/04', '17:02', 'Staff', '', '', 'l / ganqgu', '', '', '', ''),
('in', '8305075126081', 'DLMAX', '', '', '8305075126081', '13:29 09-5-2020', '2020/09/05', '13:29', 'Conference Visitors', '', '', '', '', '', '', ''),
('in', '8305190361086', 'JOHANNA SARIEDE WET', '', '', '8205190361086', '07:30 22-4-2020', '22-4-2020', '07:30', 'Staff', '', '', 'JOHANNA SARIE / DE WET', '', '', '', ''),
('in', '8306270273082', 'NE Qengqani', '', '', '', '06:48 04-5-2020', '2020/04/05', '06:48', 'Staff', '', '', 'NE  / Qengqani', '', 'Kitchen', '', ''),
('in', '8306270273082', 'NE Qengqani', '', '', '', '06:53 11-4-2020', '2020/11/04', '06:53', 'Staff', '', '', 'NE  / Qengqani', '', '', '', ''),
('in', '8306270273082', 'NEGeqgani', '', '', '', '06:32 30-4-2020', '30-4-2020', '06:32', 'Staff', '', '', 'NE / Geqgani', '', '', '', ''),
('in', '8306270273082', 'NEGrgani', '', '', '', '06:32 29-4-2020', '29-4-2020', '06:32', 'Staff', '', '', 'NE / Grgani', '', '', '', ''),
('in', '8306270273082', 'NEQengqani', '', '', '', '06:36 08-5-2020', '2020/08/05', '06:36', 'Staff', '', '', 'NE / Qengqani', '', 'Kitchen', '', ''),
('in', '8306270273082', 'NEQengqani', '', '', '', '06:34 05-5-2020', '2020/05/05', '06:34', 'Staff', '', '', 'NE / Qengqani', '', 'Kitchen', '', ''),
('in', '8306270273082', 'NEqengqani', '', '', '', '06:28 01-5-2020', '2020/01/05', '06:28', 'Staff', '', '', 'NE / qengqani', '', 'ketchen', '', ''),
('in', '8306270273082', 'NEQengqani', '', '', '', '06:53 26-4-2020', '26-4-2020', '06:53', 'Staff', '', '', 'NE / Qengqani', '', '', '', ''),
('in', '8306270273082', 'NEQengqani', '', '', '', '06:43 17-4-2020', '17-4-2020', '06:43', 'Staff', '', '', 'NE / Qengqani', '', '', '', ''),
('in', '8306270273082', 'NEQengqani', '', '', '', '06:44 16-4-2020', '16-4-2020', '06:44', 'Staff', '', '', 'NE / Qengqani', '', '', '', ''),
('in', '8306270273082', 'NEQengqani', '', '', '', '06:52 15-4-2020', '15-4-2020', '06:52', 'Staff', '', '', 'NE / Qengqani', '', '', '', ''),
('in', '8306270273082', 'NEQengqani', '', '', '', '06:48 12-4-2020', '2020/12/04', '06:48', 'Staff', '', '', 'NE / Qengqani', '', '', '', ''),
('in', '8306270273082', 'NEqeqani', '', '', '', '06:37 24-4-2020', '24-4-2020', '06:37', 'Staff', '', '', 'NE / qeqani', '', '', '', ''),
('in', '8306270273082', 'NomvuyisoQengqani', '', '', '', '06:39 20-4-2020', '20-4-2020', '06:39', 'Staff', '', '', 'Nomvuyiso / Qengqani', '', '', '', ''),
('in', '8306270273082', 'qengqaninomvuyiso', '', '', '', '06:44 25-4-2020', '25-4-2020', '06:44', 'Staff', '', '', 'qengqani / nomvuyiso', '', '', '', ''),
('out', '8306270273082', '', '', '', '', '14:04 08-5-2020', '2020/08/05', '14:04', 'Staff', '', '', 'NE / Qengqani', '', 'Kitchen', '', ''),
('out', '8306270273082', '', '', '', '', '17:07 05-5-2020', '2020/05/05', '17:07', 'Staff', '', '', 'NE / Qengqani', '', 'Kitchen', '', ''),
('out', '8306270273082', '', '', '', '', '17:01 04-5-2020', '2020/04/05', '17:01', 'Staff', '', '', 'NE  / Qengqani', '', 'Kitchen', '', ''),
('out', '8306270273082', '', '', '', '', '13:19 01-5-2020', '2020/01/05', '13:19', 'Staff', '', '', 'NE / qengqani', '', 'ketchen', '', ''),
('out', '8306270273082', '', '', '', '', '17:16 30-4-2020', '30-4-2020', '17:16', 'Staff', '', '', 'NE / Geqgani', '', '', '', ''),
('out', '8306270273082', '', '', '', '', '17:31 29-4-2020', '29-4-2020', '17:31', 'Staff', '', '', 'NE / Grgani', '', '', '', ''),
('out', '8306270273082', '', '', '', '', '16:57 26-4-2020', '26-4-2020', '16:57', 'Staff', '', '', 'NE / Qengqani', '', '', '', ''),
('out', '8306270273082', '', '', '', '', '17:09 25-4-2020', '25-4-2020', '17:09', 'Staff', '', '', 'qengqani / nomvuyiso', '', '', '', ''),
('out', '8306270273082', '', '', '', '', '17:26 24-4-2020', '24-4-2020', '17:26', 'Staff', '', '', 'NE / qeqani', '', '', '', ''),
('out', '8306270273082', '', '', '', '', '17:04 21-4-2020', '21-4-2020', '17:04', 'Staff', '', '', '', '', '', '', ''),
('out', '8306270273082', '', '', '', '', '17:06 20-4-2020', '20-4-2020', '17:06', 'Staff', '', '', 'Nomvuyiso / Qengqani', '', '', '', ''),
('out', '8306270273082', '', '', '', '', '14:02 17-4-2020', '17-4-2020', '14:02', 'Staff', '', '', 'NE / Qengqani', '', '', '', ''),
('out', '8306270273082', '', '', '', '', '16:58 16-4-2020', '16-4-2020', '16:58', 'Staff', '', '', 'NE / Qengqani', '', '', '', ''),
('out', '8306270273082', '', '', '', '', '17:13 15-4-2020', '15-4-2020', '17:13', 'Staff', '', '', 'NE / Qengqani', '', '', '', ''),
('out', '8306270273082', '', '', '', '', '17:27 12-4-2020', '2020/12/04', '17:27', 'Staff', '', '', 'NE / Qengqani', '', '', '', ''),
('out', '8306270273082', '', '', '', '', '17:03 11-4-2020', '2020/11/04', '17:03', 'Staff', '', '', 'NE  / Qengqani', '', '', '', ''),
('in', '8307260589081', 'XEMatinise', '', '', '', '06:43 11-5-2020', '2020/11/05', '06:43', 'Staff', '', '', 'XE / Matinise', '', 'Kitchen', '', ''),
('in', '8307260589081', 'Xmatinise', '', '', '', '07:03 01-5-2020', '2020/01/05', '07:03', 'Staff', '', '', 'X / matinise', '', 'Kitch', '', ''),
('in', '8307260589081', 'Xoliswa EthelMatinise', '', '', '', '06:35 03-5-2020', '2020/03/05', '06:35', 'Staff', '', '', 'Xoliswa Ethel / Matinise', '', 'Kitchen', '', ''),
('in', '8307260589081', 'Xoliswa EthelMatinise', '', '', '', '06:38 02-5-2020', '2020/02/05', '06:38', 'Staff', '', '', 'Xoliswa Ethel / Matinise', '', 'Kitchen', '', ''),
('in', '8307260589081', 'XoliswaMatinise', '', '', '', '06:23 06-5-2020', '2020/06/05', '06:23', 'Staff', '', '', 'Xoliswa / Matinise', '', 'kitchen', '', ''),
('out', '8307260589081', '', '', '', '', '16:10 07-5-2020', '2020/07/05', '16:10', 'Staff', '', '', '', '', '', '', ''),
('out', '8307260589081', '', '', '', '', '17:00 06-5-2020', '2020/06/05', '17:00', 'Staff', '', '', 'Xoliswa / Matinise', '', 'kitchen', '', ''),
('out', '8307260589081', '', '', '', '', '17:36 03-5-2020', '2020/03/05', '17:36', 'Staff', '', '', 'Xoliswa Ethel / Matinise', '', 'Kitchen', '', ''),
('out', '8307260589081', '', '', '', '', '17:14 02-5-2020', '2020/02/05', '17:14', 'Staff', '', '', 'Xoliswa Ethel / Matinise', '', 'Kitchen', '', ''),
('out', '8307260589081', '', '', '', '', '17:08 01-5-2020', '2020/01/05', '17:08', 'Staff', '', '', 'X / matinise', '', 'Kitch', '', ''),
('in', '8312161272084', 'G.SMoore', '', '', '', '17:52 22-4-2020', '22-4-2020', '17:52', 'Staff', '', '', 'G.S / Moore', '', '', '', ''),
('in', '8312161272084', 'GcobisaMoore', '', '', '', '16:58 02-5-2020', '2020/02/05', '16:58', 'Staff', '', '', 'Gcobisa / Moore', '', 'Unit 148', '', ''),
('out', '8312161272084', 'GCOTYISWA SHARLEENMOORE', '', '', '8312161272084', '07:07 04-5-2020', '2020/04/05', '07:07', 'Staff', '', '', 'GCOTYISWA SHARLEEN / MOORE', '', 'U-148', '', ''),
('in', '8312161272084', 'GCOTYISWA SHARLEENMOORE', '', '', '8312161272084', '16:52 03-5-2020', '2020/03/05', '16:52', 'Staff', '', '', 'GCOTYISWA SHARLEEN / MOORE', '', 'U-148', '', ''),
('in', '8312161272084', 'GCOTYISWA SHARLEENMOORE', '', '', '8312161272084', '16:48 01-5-2020', '2020/01/05', '16:48', 'Staff', '', '', 'GCOTYISWA SHARLEEN / MOORE', '', '148', '', ''),
('in', '8312161272084', 'GCOTYISWA SHARLEENMOORE', '', '', '8312161272084', '17:50 28-4-2020', '28-4-2020', '17:50', 'Staff', '', '', 'GCOTYISWA SHARLEEN / MOORE', '', '', '', ''),
('out', '8312161272084', 'GCOTYISWA SHARLEENMOORE', '', '', '8312161272084', '17:52 27-4-2020', '27-4-2020', '17:52', 'Staff', '', '', '', '', '', '', ''),
('in', '8312161272084', 'GCOTYISWA SHARLEENMOORE', '', '', '8312161272084', '17:48 23-4-2020', '23-4-2020', '17:48', 'Staff', '', '', 'GCOTYISWA SHARLEEN / MOORE', '', '', '', ''),
('out', '8312161272084', '', '', '', '', '06:57 03-5-2020', '2020/03/05', '06:57', 'Staff', '', '', 'Gcobisa / Moore', '', 'Unit 148', '', ''),
('out', '8312161272084', '', '', '', '', '06:52 02-5-2020', '2020/02/05', '06:52', 'Staff', '', '', 'GCOTYISWA SHARLEEN / MOORE', '', '148', '', ''),
('out', '8312161272084', '', '', '', '', '06:58 29-4-2020', '29-4-2020', '06:58', 'Staff', '', '', 'GCOTYISWA SHARLEEN / MOORE', '', '', '', ''),
('out', '8312161272084', '', '', '', '', '06:58 28-4-2020', '28-4-2020', '06:58', 'Staff', '', '', '', '', '', '', ''),
('out', '8312161272084', '', '', '', '', '06:57 24-4-2020', '24-4-2020', '06:57', 'Staff', '', '', 'GCOTYISWA SHARLEEN / MOORE', '', '', '', ''),
('out', '8312161272084', '', '', '', '', '06:58 23-4-2020', '23-4-2020', '06:58', 'Staff', '', '', 'G.S / Moore', '', '', '', ''),
('in', '8404120170085', 'E.RElnagar', '', '', '', '07:14 20-4-2020', '20-4-2020', '07:14', 'Staff', '', '', 'E.R / Elnagar', '', '', '', ''),
('in', '8404120170085', 'ELElnagar', '', '', '', '07:15 16-4-2020', '16-4-2020', '07:15', 'Staff', '', '', 'EL / Elnagar', '', '', '', ''),
('in', '8404120170085', 'ERElnagar', '', '', '', '07:16 11-5-2020', '2020/11/05', '07:16', 'Staff', '', '', 'ER / Elnagar', '', 'C/C', '', ''),
('in', '8404120170085', 'ERElnagar', '', '', '', '07:11 04-5-2020', '2020/04/05', '07:11', 'Staff', '', '', 'ER / Elnagar', '', 'Care Centre', '', ''),
('in', '8404120170085', 'ERElnagar', '', '', '', '07:16 29-4-2020', '29-4-2020', '07:16', 'Staff', '', '', 'ER / Elnagar', '', '', '', ''),
('in', '8404120170085', 'ERElnagar', '', '', '', '07:15 28-4-2020', '28-4-2020', '07:15', 'Staff', '', '', 'ER / Elnagar', '', '', '', ''),
('in', '8404120170085', 'ERElnagar', '', '', '', '07:18 24-4-2020', '24-4-2020', '07:18', 'Staff', '', '', 'ER / Elnagar', '', '', '', ''),
('in', '8404120170085', 'Erelnagar', '', '', '', '07:14 23-4-2020', '23-4-2020', '07:14', 'Staff', '', '', 'Er / elnagar', '', '', '', ''),
('in', '8404120170085', 'ERElnagar', '', '', '', '07:10 22-4-2020', '22-4-2020', '07:10', 'Staff', '', '', 'ER / Elnagar', '', '', '', ''),
('in', '8404120170085', 'ERElnargar', '', '', '', '07:11 05-5-2020', '2020/05/05', '07:11', 'Staff', '', '', 'ER / Elnargar', '', 'Care Centre', '', ''),
('in', '8404120170085', 'EREnargar', '', '', '', '07:15 30-4-2020', '30-4-2020', '07:15', 'Staff', '', '', 'ER / Enargar', '', '', '', ''),
('in', '8404120170085', 'ERernsger', '', '', '', '07:20 17-4-2020', '17-4-2020', '07:20', 'Staff', '', '', 'ER / ernsger', '', '', '', ''),
('in', '8404120170085', 'Erin Elnagar', '', '', '', '07:15 07-5-2020', '2020/07/05', '07:15', 'Staff', '', '', 'Erin  / Elnagar', '', 'Work', '', ''),
('in', '8404120170085', 'erinelgar', '', '', '', '07:12 06-5-2020', '2020/06/05', '07:12', 'Staff', '', '', 'erin / elgar', '', 'office', '', ''),
('in', '8404120170085', 'Eternagar', '', '', '', '07:15 21-4-2020', '21-4-2020', '07:15', 'Staff', '', '', 'Et / ernagar', '', '', '', ''),
('out', '8404120170085', '', '', '', '', '16:39 07-5-2020', '2020/07/05', '16:39', 'Staff', '', '', 'Erin  / Elnagar', '', 'Work', '', ''),
('out', '8404120170085', '', '', '', '', '16:36 06-5-2020', '2020/06/05', '16:36', 'Staff', '', '', 'erin / elgar', '', 'office', '', ''),
('out', '8404120170085', '', '', '', '', '16:42 05-5-2020', '2020/05/05', '16:42', 'Staff', '', '', 'ER / Elnargar', '', 'Care Centre', '', ''),
('out', '8404120170085', '', '', '', '', '16:43 04-5-2020', '2020/04/05', '16:43', 'Staff', '', '', 'ER / Elnagar', '', 'Care Centre', '', ''),
('out', '8404120170085', '', '', '', '', '16:09 30-4-2020', '30-4-2020', '16:09', 'Staff', '', '', 'ER / Enargar', '', '', '', ''),
('out', '8404120170085', '', '', '', '', '16:45 29-4-2020', '29-4-2020', '16:45', 'Staff', '', '', 'ER / Elnagar', '', '', '', ''),
('out', '8404120170085', '', '', '', '', '16:42 28-4-2020', '28-4-2020', '16:42', 'Staff', '', '', 'ER / Elnagar', '', '', '', ''),
('out', '8404120170085', '', '', '', '', '16:13 24-4-2020', '24-4-2020', '16:13', 'Staff', '', '', 'ER / Elnagar', '', '', '', ''),
('out', '8404120170085', '', '', '', '', '16:33 23-4-2020', '23-4-2020', '16:33', 'Staff', '', '', 'Er / elnagar', '', '', '', ''),
('out', '8404120170085', '', '', '', '', '16:42 22-4-2020', '22-4-2020', '16:42', 'Staff', '', '', 'ER / Elnagar', '', '', '', ''),
('out', '8404120170085', '', '', '', '', '16:38 21-4-2020', '21-4-2020', '16:38', 'Staff', '', '', 'Et / ernagar', '', '', '', ''),
('out', '8404120170085', '', '', '', '', '16:44 20-4-2020', '20-4-2020', '16:44', 'Staff', '', '', 'E.R / Elnagar', '', '', '', ''),
('out', '8404120170085', '', '', '', '', '16:07 17-4-2020', '17-4-2020', '16:07', 'Staff', '', '', 'ER / ernsger', '', '', '', ''),
('in', '8405025304083', 'RNALBERTS', 'butchetry', '', '8405025304083', '14:02 01-5-2020', '2020/01/05', '14:02', 'Contractors', 'Expired car licence', 'RN / ALBERTS', '', '', '', 'butchetry', ''),
('in', '8406291059088', 'Ngxopo NoluthandiN  Noluthando', '', '', '', '06:53 07-5-2020', '2020/07/05', '06:53', 'Staff', '', '', 'Ngxopo Noluthandi / N  Noluthando', '', 'kitchin', '', ''),
('in', '8406291059088', 'NNgxopo', '', '', '', '06:55 02-5-2020', '2020/02/05', '06:55', 'Staff', '', '', 'N / Ngxopo', '', 'Kitchen', '', ''),
('in', '8406291059088', 'NNgxopo', '', '', '', '06:52 01-5-2020', '2020/01/05', '06:52', 'Staff', '', '', 'N / Ngxopo', '', 'kitc', '', ''),
('in', '8406291059088', 'NoluthandoNgxopo', '', '', '', '06:32 03-5-2020', '2020/03/05', '06:32', 'Staff', '', '', 'Noluthando / Ngxopo', '', 'Kitchen', '', ''),
('out', '8406291059088', '', '', '', '', '17:34 07-5-2020', '2020/07/05', '17:34', 'Staff', '', '', 'Ngxopo Noluthandi / N  Noluthando', '', 'kitchin', '', ''),
('out', '8406291059088', '', '', '', '', '17:05 06-5-2020', '2020/06/05', '17:05', 'Staff', '', '', '', '', '', '', ''),
('out', '8406291059088', '', '', '', '', '16:44 03-5-2020', '2020/03/05', '16:44', 'Staff', '', '', 'Noluthando / Ngxopo', '', 'Kitchen', '', ''),
('out', '8406291059088', '', '', '', '', '17:36 02-5-2020', '2020/02/05', '17:36', 'Staff', '', '', 'N / Ngxopo', '', 'Kitchen', '', ''),
('out', '8406291059088', '', '', '', '', '17:10 01-5-2020', '2020/01/05', '17:10', 'Staff', '', '', 'N / Ngxopo', '', 'kitc', '', ''),
('in', '8412105070089', 'AERASMUS', 'Gardmed', '', '8412105070089', '13:06 23-4-2020', '23-4-2020', '13:06', 'Contractors', '', 'A / ERASMUS', '', '', '', 'Gardmed', ''),
('in', '8412280339085', 'NONCEDO LINKYMTSHERU', '', '', '8412280339085', '07:07 04-5-2020', '2020/04/05', '07:07', 'Staff', '', '', 'NONCEDO LINKY / MTSHERU', '', 'K', '', ''),
('in', '8501155034084', 'LHnm290', 'Lrach', '', '', '16:23 17-4-2020', '17-4-2020', '16:23', 'Contractors', 'Not scanned lic', 'L / Hnm290', '', '', '', 'Lrach', ''),
('in', '8501155034084', 'NicholasVan Lavieren', 'Leach pharmacy', '', '', '11:41 15-4-2020', '15-4-2020', '11:41', 'Contractors', 'Expired car licence, Not scanned lic', 'Nicholas / Van Lavieren', '', '', '', 'Leach pharmacy', ''),
('in', '8501155034084', 'NICOLAASVAN LAVIEREN', 'Leach pharmacy', '', '8501155034084', '12:10 23-4-2020', '23-4-2020', '12:10', 'Contractors', '', 'NICOLAAS / VAN LAVIEREN', '', '', '', 'Leach pharmacy', ''),
('in', '8501155034084', 'NICOLAASVAN LAVIEREN', 'Leach pharmacy', '', '8501155034084', '13:10 23-4-2020', '23-4-2020', '13:10', 'Contractors', '', 'NICOLAAS / VAN LAVIEREN', '', '', '', 'Leach pharmacy', ''),
('in', '8501155034084', 'NicolaasVan Lavieren', 'Leach pharmacy', '', '', '14:31 21-4-2020', '21-4-2020', '14:31', 'Contractors', 'Not scanned lic', 'Nicolaas / Van Lavieren', '', '', '', 'Leach pharmacy', ''),
('in', '8501155034084', 'NicolaasVan Lavieren', 'Leach pharmacy', '', '', '10:00 17-4-2020', '17-4-2020', '10:00', 'Contractors', 'Not scanned lic', 'Nicolaas / Van Lavieren', '', '', '', 'Leach pharmacy', ''),
('in', '8501155034084', 'NICOLAASVAN LAVIEREN', 'Leach pharmacy', '', '8501155034084', '12:31 11-4-2020', '2020/11/04', '12:31', 'Contractors', '', 'NICOLAAS / VAN LAVIEREN', '', '', '', 'Leach pharmacy', ''),
('in', '8501155034084', 'NicolaasVanLavieren', 'Leach pharmacy', '', '', '07:34 28-4-2020', '28-4-2020', '07:34', 'Contractors', 'Not scanned lic', 'Nicolaas / VanLavieren', '', '', '', 'Leach pharmacy', ''),
('in', '8501155034084', 'NVan Lavieren', 'Leach pharmacy', '', '', '10:38 11-4-2020', '2020/11/04', '10:38', 'Contractors', 'Expired car licence, Not scanned lic', 'N / Van Lavieren', '', '', '', 'Leach pharmacy', ''),
('in', '8501155034084', 'NVanLavieren', 'Leach pharmacy', '', '', '09:21 21-4-2020', '21-4-2020', '09:21', 'Contractors', 'Not scanned lic', 'N / VanLavieren', '', '', '', 'Leach pharmacy', ''),
('in', '8501170218084', 'Booysen ReginB Aletta', '', '', '', '08:12 06-5-2020', '2020/06/05', '08:12', 'Staff', '', '', 'Booysen Regin / B Aletta', '', 'Londri', '', ''),
('in', '8501170218084', 'BooysenRegins', '', '', '', '08:13 07-5-2020', '2020/07/05', '08:13', 'Staff', '', '', 'Booysen / Regins', '', 'work', '', ''),
('in', '8501170218084', 'Boycenr', '', '', '', '08:35 15-4-2020', '15-4-2020', '08:35', 'Staff', '', '', 'Boycen / r', '', '', '', ''),
('in', '8501170218084', 'R.ABooysen', '', '', '', '08:13 14-4-2020', '14-4-2020', '08:13', 'Staff', '', '', 'R.A / Booysen', '', '', '', ''),
('in', '8501170218084', 'RABooyse', '', '', '', '08:14 23-4-2020', '23-4-2020', '08:14', 'Staff', '', '', 'RA / Booyse', '', '', '', ''),
('in', '8501170218084', 'RABooysen', '', '', '', '08:00 05-5-2020', '2020/05/05', '08:00', 'Staff', '', '', 'RA / Booysen', '', 'Laundry', '', ''),
('in', '8501170218084', 'RABooysen', '', '', '', '08:03 02-5-2020', '2020/02/05', '08:03', 'Staff', '', '', 'RA / Booysen', '', 'Laundry', '', ''),
('in', '8501170218084', 'RABooysen', '', '', '', '08:22 28-4-2020', '28-4-2020', '08:22', 'Staff', '', '', 'RA / Booysen', '', '', '', ''),
('in', '8501170218084', 'RABooysen', '', '', '', '08:06 22-4-2020', '22-4-2020', '08:06', 'Staff', '', '', 'RA / Booysen', '', '', '', ''),
('in', '8501170218084', 'RABooysen', '', '', '', '08:02 16-4-2020', '16-4-2020', '08:02', 'Staff', '', '', 'RA / Booysen', '', '', '', ''),
('in', '8501170218084', 'RABooyson', '', '', '', '08:17 11-5-2020', '2020/11/05', '08:17', 'Staff', '', '', 'RA / Booyson', '', 'L', '', ''),
('in', '8501170218084', 'RABooyson', '', '', '', '08:09 09-5-2020', '2020/09/05', '08:09', 'Staff', '', '', 'RA / Booyson', '', 'L', '', ''),
('in', '8501170218084', 'RABooyson', '', '', '', '07:58 04-5-2020', '2020/04/05', '07:58', 'Staff', '', '', 'RA / Booyson', '', 'L', '', ''),
('in', '8501170218084', 'RABooyson', '', '', '', '08:43 27-4-2020', '27-4-2020', '08:43', 'Staff', '', '', 'RA / Booyson', '', '', '', ''),
('in', '8501170218084', 'RABooyson', '', '', '', '08:26 24-4-2020', '24-4-2020', '08:26', 'Staff', '', '', 'RA / Booyson', '', '', '', ''),
('in', '8501170218084', 'RAboycen', '', '', '', '08:27 17-4-2020', '17-4-2020', '08:27', 'Staff', '', '', 'RA / boycen', '', '', '', ''),
('in', '8501170218084', 'RBooysen', '', '', '', '08:02 08-5-2020', '2020/08/05', '08:02', 'Staff', '', '', 'R / Booysen', '', 'Laundry', '', ''),
('in', '8501170218084', 'Rbooysen', '', '', '', '08:01 01-5-2020', '2020/01/05', '08:01', 'Staff', '', '', 'R / booysen', '', 'laundry', '', ''),
('in', '8501170218084', 'RBooysen', '', '', '', '08:26 21-4-2020', '21-4-2020', '08:26', 'Staff', '', '', 'R / Booysen', '', '', '', ''),
('in', '8501170218084', 'RBooysen', '', '', '', '08:14 20-4-2020', '20-4-2020', '08:14', 'Resident', '', '', 'R / Booysen', '', '', '', ''),
('in', '8501170218084', 'RBooysen', '', '', '', '09:08 18-4-2020', '18-4-2020', '09:08', 'Staff', '', '', 'R / Booysen', '', '', '', ''),
('in', '8501170218084', 'RBooyson', '', '', '', '08:06 30-4-2020', '30-4-2020', '08:06', 'Staff', '', '', 'R / Booyson', '', '', '', ''),
('out', '8501170218084', 'REGINA ALETTABOOYSEN', '', '', '8501170218084', '15:54 13-4-2020', '13-4-2020', '15:54', 'Staff', '', '', 'Regina / Booysen', '', '', '', ''),
('in', '8501170218084', 'ReginaBooysen', '', '', '', '08:20 13-4-2020', '13-4-2020', '08:20', 'Staff', '', '', 'Regina / Booysen', '', '', '', ''),
('out', '8501170218084', '', '', '', '', '12:46 09-5-2020', '2020/09/05', '12:46', 'Staff', '', '', 'RA / Booyson', '', 'L', '', ''),
('out', '8501170218084', '', '', '', '', '15:56 08-5-2020', '2020/08/05', '15:56', 'Staff', '', '', 'R / Booysen', '', 'Laundry', '', ''),
('out', '8501170218084', '', '', '', '', '16:05 07-5-2020', '2020/07/05', '16:05', 'Staff', '', '', 'Booysen / Regins', '', 'work', '', ''),
('out', '8501170218084', '', '', '', '', '16:02 06-5-2020', '2020/06/05', '16:02', 'Staff', '', '', 'Booysen Regin / B Aletta', '', 'Londri', '', ''),
('out', '8501170218084', '', '', '', '', '15:57 05-5-2020', '2020/05/05', '15:57', 'Staff', '', '', 'RA / Booysen', '', 'Laundry', '', ''),
('out', '8501170218084', '', '', '', '', '15:58 04-5-2020', '2020/04/05', '15:58', 'Staff', '', '', 'RA / Booyson', '', 'L', '', ''),
('out', '8501170218084', '', '', '', '', '13:10 02-5-2020', '2020/02/05', '13:10', 'Staff', '', '', 'RA / Booysen', '', 'Laundry', '', ''),
('out', '8501170218084', '', '', '', '', '16:02 01-5-2020', '2020/01/05', '16:02', 'Staff', '', '', 'R / booysen', '', 'laundry', '', ''),
('out', '8501170218084', '', '', '', '', '15:57 30-4-2020', '30-4-2020', '15:57', 'Staff', '', '', 'R / Booyson', '', '', '', ''),
('out', '8501170218084', '', '', '', '', '16:08 28-4-2020', '28-4-2020', '16:08', 'Staff', '', '', 'RA / Booysen', '', '', '', ''),
('out', '8501170218084', '', '', '', '', '15:52 27-4-2020', '27-4-2020', '15:52', 'Staff', '', '', 'RA / Booyson', '', '', '', ''),
('out', '8501170218084', '', '', '', '', '15:50 24-4-2020', '24-4-2020', '15:50', 'Staff', '', '', 'RA / Booyson', '', '', '', ''),
('out', '8501170218084', '', '', '', '', '15:54 23-4-2020', '23-4-2020', '15:54', 'Staff', '', '', 'RA / Booyse', '', '', '', ''),
('out', '8501170218084', '', '', '', '', '15:59 22-4-2020', '22-4-2020', '15:59', 'Staff', '', '', 'RA / Booysen', '', '', '', ''),
('out', '8501170218084', '', '', '', '', '15:59 21-4-2020', '21-4-2020', '15:59', 'Staff', '', '', 'R / Booysen', '', '', '', ''),
('out', '8501170218084', '', '', '', '', '16:01 20-4-2020', '20-4-2020', '16:01', 'Staff', '', '', '', '', '', '', ''),
('out', '8501170218084', '', '', '', '', '13:27 18-4-2020', '18-4-2020', '13:27', 'Staff', '', '', 'R / Booysen', '', '', '', ''),
('out', '8501170218084', '', '', '', '', '15:56 17-4-2020', '17-4-2020', '15:56', 'Staff', '', '', 'RA / boycen', '', '', '', ''),
('out', '8501170218084', '', '', '', '', '16:04 16-4-2020', '16-4-2020', '16:04', 'Staff', '', '', 'RA / Booysen', '', '', '', ''),
('out', '8501170218084', '', '', '', '', '15:55 15-4-2020', '15-4-2020', '15:55', 'Staff', '', '', 'Boycen / r', '', '', '', ''),
('out', '8501170218084', '', '', '', '', '15:52 14-4-2020', '14-4-2020', '15:52', 'Staff', '', '', 'R.A / Booysen', '', '', '', ''),
('in', '8503210311085', 'GTrollip', '', '', '', '07:07 10-5-2020', '2020/10/05', '07:07', 'Staff', '', '', 'G / Trollip', '', 'Kitchen', '', ''),
('in', '8503210311085', 'GTrollip', '', '', '', '07:01 09-5-2020', '2020/09/05', '07:01', 'Staff', '', '', 'G / Trollip', '', 'Kitchen', '', ''),
('in', '8503210311085', 'GTrollip', '', '', '', '07:06 08-5-2020', '2020/08/05', '07:06', 'Staff', '', '', 'G / Trollip', '', 'Kitchen', '', ''),
('in', '8503210311085', 'GTrollip', '', '', '', '07:04 05-5-2020', '2020/05/05', '07:04', 'Staff', '', '', 'G / Trollip', '', 'Kitchen', '', ''),
('out', '8503210311085', '', '', '', '', '17:33 10-5-2020', '2020/10/05', '17:33', 'Staff', '', '', 'G / Trollip', '', 'Kitchen', '', ''),
('out', '8503210311085', '', '', '', '', '17:31 09-5-2020', '2020/09/05', '17:31', 'Staff', '', '', 'G / Trollip', '', 'Kitchen', '', ''),
('out', '8503210311085', '', '', '', '', '17:37 08-5-2020', '2020/08/05', '17:37', 'Staff', '', '', 'G / Trollip', '', 'Kitchen', '', ''),
('out', '8503210311085', '', '', '', '', '17:07 05-5-2020', '2020/05/05', '17:07', 'Staff', '', '', 'G / Trollip', '', 'Kitchen', '', ''),
('in', '8504055408085', 'A NVivier', '', '', '', '06:56 23-4-2020', '23-4-2020', '06:56', 'Staff', '', '', 'A N / Vivier', '', '', '', ''),
('in', '8504055408085', 'A Vivier', '', '', '', '06:45 17-4-2020', '17-4-2020', '06:45', 'Staff', '', '', 'A  / Vivier', '', '', '', ''),
('in', '8504055408085', 'A.NVivier', '', '', '', '06:57 20-4-2020', '20-4-2020', '06:57', 'Staff', '', '', 'A.N / Vivier', '', '', '', ''),
('out', '8504055408085', 'ANTHONY NEILVIVIER', '', '', '8504055408085', '11:43 04-5-2020', '2020/04/05', '11:43', 'Staff', '', '', 'A / Vivier', '', 'Kitchen', '', ''),
('out', '8504055408085', 'ANTHONY NEILVIVIER', '', '', '8504055408085', '13:22 01-5-2020', '2020/01/05', '13:22', 'Staff', '', '', '', '', '', '', ''),
('in', '8504055408085', 'ANTHONY NEILVIVIER', '', '', '8504055408085', '06:56 30-4-2020', '30-4-2020', '06:56', 'Staff', '', '', 'ANTHONY NEIL / VIVIER', '', '', '', ''),
('out', '8504055408085', 'ANTHONY NEILVIVIER', '', '', '8504055408085', '09:22 30-4-2020', '30-4-2020', '09:22', 'Staff', '', '', 'ANTHONY NEIL / VIVIER', '', '', '', ''),
('in', '8504055408085', 'ANTHONY NEILVIVIER', '', '', '8504055408085', '06:53 28-4-2020', '28-4-2020', '06:53', 'Staff', '', '', 'ANTHONY NEIL / VIVIER', '', '', '', ''),
('out', '8504055408085', 'ANTHONY NEILVIVIER', '', '', '8504055408085', '14:27 28-4-2020', '28-4-2020', '14:27', 'Staff', '', '', 'ANTHONY NEIL / VIVIER', '', '', '', ''),
('in', '8504055408085', 'ANTHONY NEILVIVIER', '', '', '8504055408085', '06:50 27-4-2020', '27-4-2020', '06:50', 'Staff', '', '', 'ANTHONY NEIL / VIVIER', '', '', '', ''),
('out', '8504055408085', 'ANTHONY NEILVIVIER', '', '', '8504055408085', '14:59 27-4-2020', '27-4-2020', '14:59', 'Staff', '', '', 'ANTHONY NEIL / VIVIER', '', '', '', ''),
('in', '8504055408085', 'ANTHONY NEILVIVIER', '', '', '8504055408085', '06:55 24-4-2020', '24-4-2020', '06:55', 'Staff', '', '', 'ANTHONY NEIL / VIVIER', '', '', '', ''),
('in', '8504055408085', 'ANTHONY NEILVIVIER', '', '', '8504055408085', '06:55 22-4-2020', '22-4-2020', '06:55', 'Staff', '', '', 'ANTHONY NEIL / VIVIER', '', '', '', ''),
('out', '8504055408085', 'ANTHONY NEILVIVIER', '', '', '8504055408085', '15:12 22-4-2020', '22-4-2020', '15:12', 'Staff', '', '', 'ANTHONY NEIL / VIVIER', '', '', '', ''),
('out', '8504055408085', 'ANTHONY NEILVIVIER', '', '', '8504055408085', '09:46 20-4-2020', '20-4-2020', '09:46', 'Staff', '', '', 'A.N / Vivier', '', '', '', ''),
('in', '8504055408085', 'ANTHONY NEILVIVIER', '', '', '8504055408085', '06:49 19-4-2020', '19-4-2020', '06:49', 'Staff', '', '', 'ANTHONY NEIL / VIVIER', '', '', '', '');
INSERT INTO `atthegate` (`direction`, `license`, `name`, `company`, `category`, `dr_license`, `creation`, `recdate`, `rectime`, `profile`, `incidents`, `dr_name`, `name_in`, `name_out`, `going`, `company2`, `visiting`) VALUES
('out', '8504055408085', 'ANTHONY NEILVIVIER', '', '', '8504055408085', '17:32 19-4-2020', '19-4-2020', '17:32', 'Staff', '', '', 'ANTHONY NEIL / VIVIER', '', '', '', ''),
('out', '8504055408085', 'ANTHONY NEILVIVIER', '', '', '8504055408085', '12:43 14-4-2020', '14-4-2020', '12:43', 'Staff', '', '', '', '', '', '', ''),
('in', '8504055408085', 'AVivier', '', '', '', '06:43 05-5-2020', '2020/05/05', '06:43', 'Staff', '', '', 'A / Vivier', '', 'Kitchen', '', ''),
('in', '8504055408085', 'AVivier', '', '', '', '07:03 04-5-2020', '2020/04/05', '07:03', 'Staff', '', '', 'A / Vivier', '', 'Kitchen', '', ''),
('in', '8504055408085', 'AVivier', '', '', '', '06:45 18-4-2020', '18-4-2020', '06:45', 'Staff', '', '', 'A / Vivier', '', '', '', ''),
('in', '8504055408085', 'AVivier', '', '', '', '06:54 15-4-2020', '15-4-2020', '06:54', 'Staff', '', '', 'A / Vivier', '', '', '', ''),
('out', '8504055408085', '', '', '', '', '11:31 05-5-2020', '2020/05/05', '11:31', 'Staff', '', '', 'A / Vivier', '', 'Kitchen', '', ''),
('out', '8504055408085', '', '', '', '', '13:43 23-4-2020', '23-4-2020', '13:43', 'Staff', '', '', 'A N / Vivier', '', '', '', ''),
('out', '8504055408085', '', '', '', '', '13:46 18-4-2020', '18-4-2020', '13:46', 'Staff', '', '', 'A / Vivier', '', '', '', ''),
('out', '8504055408085', '', '', '', '', '17:29 17-4-2020', '17-4-2020', '17:29', 'Staff', '', '', 'A  / Vivier', '', '', '', ''),
('out', '8504055408085', '', '', '', '', '13:24 15-4-2020', '15-4-2020', '13:24', 'Staff', '', '', 'A / Vivier', '', '', '', ''),
('out', '8504055408085', '', '', '', '', '06:55 14-4-2020', '14-4-2020', '06:55', 'Staff', '', '', '', '', '', '', ''),
('in', '8505215740085', 'MCOTSHENI', '', '', '8505215740085', '07:38 11-5-2020', '2020/11/05', '07:38', 'Staff', 'TU driver license warning', '', 'M / COTSHENI', '', 'M', '', ''),
('in', '8505215740085', 'MCOTSHENI', '', '', '8505215740085', '11:43 02-5-2020', '2020/02/05', '11:43', 'Staff', 'TU driver license warning', '', 'M / COTSHENI', '', '37,19', '', ''),
('out', '8505215740085', 'MCOTSHENI', '', '', '8505215740085', '12:02 02-5-2020', '2020/02/05', '12:02', 'Staff', 'TU driver license warning', '', 'M / COTSHENI', '', '37,19', '', ''),
('out', '8505215740085', 'MCOTSHENI', '', '', '8505215740085', '12:39 01-5-2020', '2020/01/05', '12:39', 'Staff', 'TU driver license warning', '', '', '', '', '', ''),
('out', '8505215740085', 'MCOTSHENI', '', '', '8505215740085', '16:32 29-4-2020', '29-4-2020', '16:32', 'Staff', 'TU driver license warning', '', '', '', '', '', ''),
('in', '8508190628085', 'N.James', '', '', '', '13:14 14-4-2020', '14-4-2020', '13:14', 'Staff', '', '', 'N. / James', '', '', '', ''),
('in', '8508190628085', 'NJames', '', '', '', '06:57 10-5-2020', '2020/10/05', '06:57', 'Staff', '', '', 'N / James', '', 'U-190', '', ''),
('in', '8508190628085', 'NJames', '', '', '', '07:32 09-5-2020', '2020/09/05', '07:32', 'Staff', '', '', 'N / James', '', '2', '', ''),
('in', '8508190628085', 'NJames', '', '', '', '06:59 18-4-2020', '18-4-2020', '06:59', 'Staff', '', '', 'N / James', '', '', '', ''),
('in', '8508190628085', 'NJames', '', '', '', '13:24 16-4-2020', '16-4-2020', '13:24', 'Staff', '', '', 'N / James', '', '', '', ''),
('in', '8508190628085', 'NJames', '', '', '', '13:26 15-4-2020', '15-4-2020', '13:26', 'Staff', '', '', 'N / James', '', '', '', ''),
('in', '8508190628085', 'NomelisizweJames', '', '', '', '12:33 25-4-2020', '25-4-2020', '12:33', 'Staff', '', '', 'Nomelisizwe / James', '', '', '', ''),
('in', '8508190628085', 'NomeliszweJames', '', '', '', '13:09 13-4-2020', '13-4-2020', '13:09', 'Staff', '', '', 'Nomeliszwe / James', '', '', '', ''),
('out', '8508190628085', '', '', '', '', '18:17 10-5-2020', '2020/10/05', '18:17', 'Staff', '', '', 'N / James', '', 'U-190', '', ''),
('out', '8508190628085', '', '', '', '', '18:19 09-5-2020', '2020/09/05', '18:19', 'Staff', '', '', 'N / James', '', '2', '', ''),
('out', '8508190628085', '', '', '', '', '18:30 07-5-2020', '2020/07/05', '18:30', 'Staff', '', '', '', '', '', '', ''),
('out', '8508190628085', '', '', '', '', '19:07 26-4-2020', '26-4-2020', '19:07', 'Staff', '', '', 'Nomelisizwe / James', '', '', '', ''),
('out', '8508190628085', '', '', '', '', '11:05 18-4-2020', '18-4-2020', '11:05', 'Staff', '', '', 'N / James', '', '', '', ''),
('out', '8508190628085', '', '', '', '', '13:17 17-4-2020', '17-4-2020', '13:17', 'Staff', '', '', '', '', '', '', ''),
('out', '8508190628085', '', '', '', '', '18:55 17-4-2020', '17-4-2020', '18:55', 'Staff', '', '', '', '', '', '', ''),
('out', '8508190628085', '', '', '', '', '18:52 16-4-2020', '16-4-2020', '18:52', 'Staff', '', '', 'N / James', '', '', '', ''),
('out', '8508190628085', '', '', '', '', '19:05 15-4-2020', '15-4-2020', '19:05', 'Staff', '', '', 'N / James', '', '', '', ''),
('out', '8508190628085', '', '', '', '', '18:51 14-4-2020', '14-4-2020', '18:51', 'Staff', '', '', 'N. / James', '', '', '', ''),
('out', '8508190628085', '', '', '', '', '18:51 13-4-2020', '13-4-2020', '18:51', 'Staff', '', '', 'Nomeliszwe / James', '', '', '', ''),
('out', '8508190628085', '', '', '', '', '18:34 12-4-2020', '2020/12/04', '18:34', 'Staff', '', '', '', '', '', '', ''),
('out', '8508190628085', '', '', '', '', '18:37 11-4-2020', '2020/11/04', '18:37', 'Staff', '', '', '', '', '', '', ''),
('in', '8511126272085', 'ADMlambo', '', '', '', '07:31 05-5-2020', '2020/05/05', '07:31', 'Staff', '', '', 'AD / Mlambo', '', 'KG', '', ''),
('in', '8511126272085', 'AMlambi', '', '', '', '07:30 30-4-2020', '30-4-2020', '07:30', 'Staff', '', '', 'A / Mlambi', '', '', '', ''),
('in', '8511126272085', 'ASMlambo', '', '', '', '07:34 29-4-2020', '29-4-2020', '07:34', 'Staff', '', '', 'AS / Mlambo', '', '', '', ''),
('in', '8511126272085', 'SAMlambo', '', '', '', '07:35 04-5-2020', '2020/04/05', '07:35', 'Staff', '', '', 'SA / Mlambo', '', 'K G', '', ''),
('out', '8511126272085', '', '', '', '', '15:50 05-5-2020', '2020/05/05', '15:50', 'Staff', '', '', 'AD / Mlambo', '', 'KG', '', ''),
('out', '8511126272085', '', '', '', '', '15:47 04-5-2020', '2020/04/05', '15:47', 'Staff', '', '', 'SA / Mlambo', '', 'K G', '', ''),
('out', '8511126272085', '', '', '', '', '16:02 30-4-2020', '30-4-2020', '16:02', 'Staff', '', '', 'A / Mlambi', '', '', '', ''),
('out', '8511126272085', '', '', '', '', '16:02 29-4-2020', '29-4-2020', '16:02', 'Staff', '', '', 'AS / Mlambo', '', '', '', ''),
('in', '8608305255087', 'Jackthobela', '', '', '', '07:40 07-5-2020', '2020/07/05', '07:40', 'Staff', '', '', 'Jack / thobela', '', 'work', '', ''),
('in', '8608305255087', 'TJack', '', '', '', '07:53 11-5-2020', '2020/11/05', '07:53', 'Staff', '', '', 'T / Jack', '', 'M', '', ''),
('in', '8608305255087', 'TJack', '', '', '', '07:28 08-5-2020', '2020/08/05', '07:28', 'Staff', '', '', 'T / Jack', '', 'M', '', ''),
('in', '8608305255087', 'tjack', '', '', '', '07:24 06-5-2020', '2020/06/05', '07:24', 'Staff', '', '', 't / jack', '', 'work', '', ''),
('in', '8608305255087', 'TJack', '', '', '', '08:29 05-5-2020', '2020/05/05', '08:29', 'Staff', '', '', 'T / Jack', '', 'M', '', ''),
('out', '8608305255087', '', '', '', '', '16:27 08-5-2020', '2020/08/05', '16:27', 'Staff', '', '', 'T / Jack', '', 'M', '', ''),
('out', '8608305255087', '', '', '', '', '16:29 07-5-2020', '2020/07/05', '16:29', 'Staff', '', '', 'Jack / thobela', '', 'work', '', ''),
('out', '8608305255087', '', '', '', '', '16:30 06-5-2020', '2020/06/05', '16:30', 'Staff', '', '', 't / jack', '', 'work', '', ''),
('out', '8608305255087', '', '', '', '', '16:27 05-5-2020', '2020/05/05', '16:27', 'Staff', '', '', 'T / Jack', '', 'M', '', ''),
('out', '8608305255087', '', '', '', '', '16:26 04-5-2020', '2020/04/05', '16:26', 'Staff', '', '', '', '', '', '', ''),
('in', '8608305355087', 'TJack', '', '', '', '07:45 04-5-2020', '2020/04/05', '07:45', 'Staff', '', '', 'T / Jack', '', 'Mantainance', '', ''),
('in', '8609070996087', 'F NtlokwwnFundiswa Ntlokwan', '', '', '', '09:57 19-4-2020', '19-4-2020', '09:57', 'Staff', '', '', 'F Ntlokwwn / Fundiswa Ntlokwan', '', '', '', ''),
('in', '8609070996087', 'FNtlokeana', '', '', '', '10:05 05-5-2020', '2020/05/05', '10:05', 'Staff', '', '', 'F / Ntlokeana', '', '124', '', ''),
('in', '8609070996087', 'fNtlokeana', '', '', '', '10:01 16-4-2020', '16-4-2020', '10:01', 'Staff', '', '', 'f / Ntlokeana', '', '', '', ''),
('in', '8609070996087', 'FNtlokena', '', '', '', '09:57 09-5-2020', '2020/09/05', '09:57', 'Staff', '', '', 'F / Ntlokena', '', '124', '', ''),
('in', '8609070996087', 'FNtlokwana', '', '', '', '10:07 11-5-2020', '2020/11/05', '10:07', 'Staff', '', '', 'F / Ntlokwana', '', '124', '', ''),
('in', '8609070996087', 'FNtlokwana', '', '', '', '10:03 10-5-2020', '2020/10/05', '10:03', 'Staff', '', '', 'F / Ntlokwana', '', 'U 124', '', ''),
('in', '8609070996087', 'FNtlokwana', '', '', '', '09:56 08-5-2020', '2020/08/05', '09:56', 'Staff', '', '', 'F / Ntlokwana', '', 'Unit 124', '', ''),
('in', '8609070996087', 'FNtlokwana', '', '', '', '09:59 04-5-2020', '2020/04/05', '09:59', 'Staff', '', '', 'F / Ntlokwana', '', '124', '', ''),
('in', '8609070996087', 'FNtlokwana', '', '', '', '09:59 30-4-2020', '30-4-2020', '09:59', 'Staff', '', '', 'F / Ntlokwana', '', '', '', ''),
('in', '8609070996087', 'FNtlokwana', '', '', '', '10:04 29-4-2020', '29-4-2020', '10:04', 'Staff', '', '', 'F / Ntlokwana', '', '', '', ''),
('in', '8609070996087', 'FNtlokwana', '', '', '', '09:48 28-4-2020', '28-4-2020', '09:48', 'Staff', '', '', 'F / Ntlokwana', '', '', '', ''),
('in', '8609070996087', 'FNtlokwana', '', '', '', '09:55 27-4-2020', '27-4-2020', '09:55', 'Staff', '', '', 'F / Ntlokwana', '', '', '', ''),
('in', '8609070996087', 'FNtlokwana', '', '', '', '09:54 26-4-2020', '26-4-2020', '09:54', 'Staff', '', '', 'F / Ntlokwana', '', '', '', ''),
('in', '8609070996087', 'FNtlokwana', '', '', '', '09:54 25-4-2020', '25-4-2020', '09:54', 'Staff', '', '', 'F / Ntlokwana', '', '', '', ''),
('in', '8609070996087', 'FNtlokwana', '', '', '', '09:55 24-4-2020', '24-4-2020', '09:55', 'Staff', '', '', 'F / Ntlokwana', '', '', '', ''),
('in', '8609070996087', 'FNtlokwana', '', '', '', '10:01 23-4-2020', '23-4-2020', '10:01', 'Visitors', '', 'F / Ntlokwana', '', '', '', '', '134'),
('in', '8609070996087', 'FNtlokwana', '', '', '', '09:55 22-4-2020', '22-4-2020', '09:55', 'Staff', '', '', 'F / Ntlokwana', '', '', '', ''),
('in', '8609070996087', 'FNtlokwana', '', '', '', '09:58 21-4-2020', '21-4-2020', '09:58', 'Staff', '', '', 'F / Ntlokwana', '', '', '', ''),
('in', '8609070996087', 'FNtlokwana', '', '', '', '10:02 17-4-2020', '17-4-2020', '10:02', 'Staff', '', '', 'F / Ntlokwana', '', '', '', ''),
('in', '8609070996087', 'Fundiswa Ntlokwana', '', '', '', '09:57 02-5-2020', '2020/02/05', '09:57', 'Staff', '', '', 'Fundiswa  / Ntlokwana', '', 'Unit 124', '', ''),
('in', '8609070996087', 'Fundiswa NtlokwanF Ntlokwana', '', '', '', '09:58 13-4-2020', '13-4-2020', '09:58', 'Staff', '', '', 'Fundiswa Ntlokwan / F Ntlokwana', '', '', '', ''),
('in', '8609070996087', 'FundiswaNtlokwana', '', '', '', '09:45 01-5-2020', '2020/01/05', '09:45', 'Staff', '', '', 'Fundiswa / Ntlokwana', '', '124', '', ''),
('in', '8609070996087', 'FundiswaNtlokwana', '', '', '', '09:32 20-4-2020', '20-4-2020', '09:32', 'Staff', '', '', 'Fundiswa / Ntlokwana', '', '', '', ''),
('in', '8609070996087', 'FundiswaNtlokwana', '', '', '', '10:01 14-4-2020', '14-4-2020', '10:01', 'Staff', '', '', 'Fundiswa / Ntlokwana', '', '', '', ''),
('in', '8609070996087', 'NNtlokwana', '', '', '', '09:57 03-5-2020', '2020/03/05', '09:57', 'Staff', '', '', 'N / Ntlokwana', '', '124', '', ''),
('in', '8609070996087', 'nnylikeans', '', '', '', '09:54 12-4-2020', '2020/12/04', '09:54', 'Staff', '', '', 'n / nylikeans', '', '', '', ''),
('in', '8609070996087', 'Ntlokeanaf', '', '', '', '10:00 15-4-2020', '15-4-2020', '10:00', 'Staff', '', '', 'Ntlokeana / f', '', '', '', ''),
('in', '8609070996087', 'Ntlokwan fundiswa', '', '', '', '09:58 07-5-2020', '2020/07/05', '09:58', 'Staff', '', '', 'Ntlokwan  / fundiswa', '', 'work', '', ''),
('in', '8609070996087', 'ntlokwanaf', '', '', '', '09:56 11-4-2020', '2020/11/04', '09:56', 'Staff', '', '', 'ntlokwana / f', '', '', '', ''),
('in', '8609070996087', 'Pntloma', '', '', '', '10:00 18-4-2020', '18-4-2020', '10:00', 'Staff', '', '', 'P / ntloma', '', '', '', ''),
('out', '8609070996087', '', '', '', '', '16:46 10-5-2020', '2020/10/05', '16:46', 'Staff', '', '', 'F / Ntlokwana', '', 'U 124', '', ''),
('out', '8609070996087', '', '', '', '', '16:42 09-5-2020', '2020/09/05', '16:42', 'Staff', '', '', 'F / Ntlokena', '', '124', '', ''),
('out', '8609070996087', '', '', '', '', '16:57 08-5-2020', '2020/08/05', '16:57', 'Staff', '', '', 'F / Ntlokwana', '', 'Unit 124', '', ''),
('out', '8609070996087', '', '', '', '', '16:57 07-5-2020', '2020/07/05', '16:57', 'Staff', '', '', 'Ntlokwan  / fundiswa', '', 'work', '', ''),
('out', '8609070996087', '', '', '', '', '16:54 05-5-2020', '2020/05/05', '16:54', 'Staff', '', '', 'F / Ntlokeana', '', '124', '', ''),
('out', '8609070996087', '', '', '', '', '16:47 04-5-2020', '2020/04/05', '16:47', 'Staff', '', '', 'F / Ntlokwana', '', '124', '', ''),
('out', '8609070996087', '', '', '', '', '16:49 03-5-2020', '2020/03/05', '16:49', 'Staff', '', '', 'N / Ntlokwana', '', '124', '', ''),
('out', '8609070996087', '', '', '', '', '16:45 02-5-2020', '2020/02/05', '16:45', 'Staff', '', '', 'Fundiswa  / Ntlokwana', '', 'Unit 124', '', ''),
('out', '8609070996087', '', '', '', '', '16:41 01-5-2020', '2020/01/05', '16:41', 'Staff', '', '', 'Fundiswa / Ntlokwana', '', '124', '', ''),
('out', '8609070996087', '', '', '', '', '16:41 30-4-2020', '30-4-2020', '16:41', 'Staff', '', '', 'F / Ntlokwana', '', '', '', ''),
('out', '8609070996087', '', '', '', '', '16:38 29-4-2020', '29-4-2020', '16:38', 'Staff', '', '', 'F / Ntlokwana', '', '', '', ''),
('out', '8609070996087', '', '', '', '', '16:46 28-4-2020', '28-4-2020', '16:46', 'Staff', '', '', 'F / Ntlokwana', '', '', '', ''),
('out', '8609070996087', '', '', '', '', '16:49 27-4-2020', '27-4-2020', '16:49', 'Staff', '', '', 'F / Ntlokwana', '', '', '', ''),
('out', '8609070996087', '', '', '', '', '16:50 26-4-2020', '26-4-2020', '16:50', 'Staff', '', '', 'F / Ntlokwana', '', '', '', ''),
('out', '8609070996087', '', '', '', '', '16:46 25-4-2020', '25-4-2020', '16:46', 'Staff', '', '', 'F / Ntlokwana', '', '', '', ''),
('out', '8609070996087', '', '', '', '', '16:41 24-4-2020', '24-4-2020', '16:41', 'Staff', '', '', 'F / Ntlokwana', '', '', '', ''),
('out', '8609070996087', '', '', '', '', '16:46 23-4-2020', '23-4-2020', '16:46', 'Staff', '', 'F / Ntlokwana', '', '', '', '', '134'),
('out', '8609070996087', '', '', '', '', '16:54 22-4-2020', '22-4-2020', '16:54', 'Staff', '', '', 'F / Ntlokwana', '', '', '', ''),
('out', '8609070996087', '', '', '', '', '16:41 21-4-2020', '21-4-2020', '16:41', 'Staff', '', '', 'F / Ntlokwana', '', '', '', ''),
('out', '8609070996087', '', '', '', '', '16:56 20-4-2020', '20-4-2020', '16:56', 'Staff', '', '', 'Fundiswa / Ntlokwana', '', '', '', ''),
('out', '8609070996087', '', '', '', '', '12:56 19-4-2020', '19-4-2020', '12:56', 'Staff', '', '', 'F Ntlokwwn / Fundiswa Ntlokwan', '', '', '', ''),
('out', '8609070996087', '', '', '', '', '15:40 18-4-2020', '18-4-2020', '15:40', 'Staff', '', '', 'P / ntloma', '', '', '', ''),
('out', '8609070996087', '', '', '', '', '16:33 17-4-2020', '17-4-2020', '16:33', 'Staff', '', '', 'F / Ntlokwana', '', '', '', ''),
('out', '8609070996087', '', '', '', '', '16:53 16-4-2020', '16-4-2020', '16:53', 'Staff', '', '', 'f / Ntlokeana', '', '', '', ''),
('out', '8609070996087', '', '', '', '', '16:48 15-4-2020', '15-4-2020', '16:48', 'Staff', '', '', 'Ntlokeana / f', '', '', '', ''),
('out', '8609070996087', '', '', '', '', '16:47 14-4-2020', '14-4-2020', '16:47', 'Staff', '', '', 'Fundiswa / Ntlokwana', '', '', '', ''),
('out', '8609070996087', '', '', '', '', '16:53 13-4-2020', '13-4-2020', '16:53', 'Staff', '', '', 'Fundiswa Ntlokwan / F Ntlokwana', '', '', '', ''),
('out', '8609070996087', '', '', '', '', '16:55 12-4-2020', '2020/12/04', '16:55', 'Staff', '', '', 'n / nylikeans', '', '', '', ''),
('out', '8609070996087', '', '', '', '', '16:49 11-4-2020', '2020/11/04', '16:49', 'Staff', '', '', 'ntlokwana / f', '', '', '', ''),
('in', '8610151225081', 'gumengephiliswa', '', '', '', '06:44 25-4-2020', '25-4-2020', '06:44', 'Staff', '', '', 'gumenge / philiswa', '', '', '', ''),
('in', '8610151225081', 'pgumege', '', '', '', '06:59 21-4-2020', '21-4-2020', '06:59', 'Staff', '', '', 'p / gumege', '', '', '', ''),
('in', '8610151225081', 'PGumenge', '', '', '', '06:49 08-5-2020', '2020/08/05', '06:49', 'Staff', '', '', 'P / Gumenge', '', 'Kitchen', '', ''),
('in', '8610151225081', 'PGumenge', '', '', '', '06:42 05-5-2020', '2020/05/05', '06:42', 'Staff', '', '', 'P / Gumenge', '', 'Kitchen', '', ''),
('in', '8610151225081', 'PGumenge', '', '', '', '07:06 04-5-2020', '2020/04/05', '07:06', 'Staff', '', '', 'P / Gumenge', '', 'K', '', ''),
('in', '8610151225081', 'PGumenge', '', '', '', '06:54 30-4-2020', '30-4-2020', '06:54', 'Staff', '', '', 'P / Gumenge', '', '', '', ''),
('in', '8610151225081', 'PGumenge', '', '', '', '06:55 29-4-2020', '29-4-2020', '06:55', 'Staff', '', '', 'P / Gumenge', '', '', '', ''),
('in', '8610151225081', 'PGumenge', '', '', '', '06:58 26-4-2020', '26-4-2020', '06:58', 'Staff', '', '', 'P / Gumenge', '', '', '', ''),
('in', '8610151225081', 'PGumenge', '', '', '', '07:02 24-4-2020', '24-4-2020', '07:02', 'Staff', '', '', 'P / Gumenge', '', '', '', ''),
('in', '8610151225081', 'PGumenge', '', '', '', '06:52 20-4-2020', '20-4-2020', '06:52', 'Staff', '', '', 'P / Gumenge', '', '', '', ''),
('in', '8610151225081', 'PGumenge', '', '', '', '06:50 17-4-2020', '17-4-2020', '06:50', 'Staff', '', '', 'P / Gumenge', '', '', '', ''),
('in', '8610151225081', 'PGumenge', '', '', '', '06:53 16-4-2020', '16-4-2020', '06:53', 'Staff', '', '', 'P / Gumenge', '', '', '', ''),
('in', '8610151225081', 'PGumenge', '', '', '', '06:53 15-4-2020', '15-4-2020', '06:53', 'Staff', '', '', 'P / Gumenge', '', '', '', ''),
('in', '8610151225081', 'PGumenge', '', '', '', '07:00 12-4-2020', '2020/12/04', '07:00', 'Staff', '', '', 'P / Gumenge', '', '', '', ''),
('in', '8610151225081', 'PGumenge', '', '', '', '06:59 11-4-2020', '2020/11/04', '06:59', 'Staff', '', '', 'P / Gumenge', '', '', '', ''),
('out', '8610151225081', '', '', '', '', '14:05 08-5-2020', '2020/08/05', '14:05', 'Staff', '', '', 'P / Gumenge', '', 'Kitchen', '', ''),
('out', '8610151225081', '', '', '', '', '17:09 05-5-2020', '2020/05/05', '17:09', 'Staff', '', '', 'P / Gumenge', '', 'Kitchen', '', ''),
('out', '8610151225081', '', '', '', '', '17:28 04-5-2020', '2020/04/05', '17:28', 'Staff', '', '', 'P / Gumenge', '', 'K', '', ''),
('out', '8610151225081', '', '', '', '', '17:15 30-4-2020', '30-4-2020', '17:15', 'Staff', '', '', 'P / Gumenge', '', '', '', ''),
('out', '8610151225081', '', '', '', '', '17:03 29-4-2020', '29-4-2020', '17:03', 'Staff', '', '', 'P / Gumenge', '', '', '', ''),
('out', '8610151225081', '', '', '', '', '17:27 26-4-2020', '26-4-2020', '17:27', 'Staff', '', '', 'P / Gumenge', '', '', '', ''),
('out', '8610151225081', '', '', '', '', '17:08 25-4-2020', '25-4-2020', '17:08', 'Staff', '', '', 'gumenge / philiswa', '', '', '', ''),
('out', '8610151225081', '', '', '', '', '17:07 24-4-2020', '24-4-2020', '17:07', 'Staff', '', '', 'P / Gumenge', '', '', '', ''),
('out', '8610151225081', '', '', '', '', '17:29 21-4-2020', '21-4-2020', '17:29', 'Staff', '', '', 'p / gumege', '', '', '', ''),
('out', '8610151225081', '', '', '', '', '17:02 20-4-2020', '20-4-2020', '17:02', 'Staff', '', '', 'P / Gumenge', '', '', '', ''),
('out', '8610151225081', '', '', '', '', '14:02 17-4-2020', '17-4-2020', '14:02', 'Staff', '', '', 'P / Gumenge', '', '', '', ''),
('out', '8610151225081', '', '', '', '', '17:32 16-4-2020', '16-4-2020', '17:32', 'Staff', '', '', 'P / Gumenge', '', '', '', ''),
('out', '8610151225081', '', '', '', '', '17:12 15-4-2020', '15-4-2020', '17:12', 'Staff', '', '', 'P / Gumenge', '', '', '', ''),
('out', '8610151225081', '', '', '', '', '07:00 12-4-2020', '2020/12/04', '07:00', 'Staff', '', '', '', '', '', '', ''),
('out', '8610151225081', '', '', '', '', '17:02 12-4-2020', '2020/12/04', '17:02', 'Staff', '', '', 'P / Gumenge', '', '', '', ''),
('out', '8610151225081', '', '', '', '', '17:35 11-4-2020', '2020/11/04', '17:35', 'Staff', '', '', 'P / Gumenge', '', '', '', ''),
('in', '8611245787086', 'LMATOMELA', '', '', '8611245787086', '06:59 04-5-2020', '2020/04/05', '06:59', 'Visitors', '', 'L / MATOMELA', '', '', '', '', 'Unit 190'),
('in', '8611245787086', 'LMATOMELA', '', '', '8611245787086', '18:38 03-5-2020', '2020/03/05', '18:38', 'Visitors', '', 'L / MATOMELA', '', '', '', '', '190'),
('out', '8611245787086', '', '', '', '', '18:58 03-5-2020', '2020/03/05', '18:58', 'Visitors', '', 'L / MATOMELA', '', '', '', '', '190'),
('in', '8703036897081', 'madodamzanywa', '', '', '', '06:56 06-5-2020', '2020/06/05', '06:56', 'Staff', '', '', 'madoda / mzanywa', '', 'work', '', ''),
('in', '8703036897081', 'MDMzanywa', '', '', '', '07:02 11-5-2020', '2020/11/05', '07:02', 'Staff', '', '', 'MD / Mzanywa', '', 'KG', '', ''),
('in', '8703036897081', 'MDMzanywa', '', '', '', '07:04 08-5-2020', '2020/08/05', '07:04', 'Staff', '', '', 'MD / Mzanywa', '', 'KG', '', ''),
('in', '8703036897081', 'MDMzanywa', '', '', '', '06:55 05-5-2020', '2020/05/05', '06:55', 'Staff', '', '', 'MD / Mzanywa', '', 'K G', '', ''),
('in', '8703036897081', 'MDMzanywa', '', '', '', '06:59 30-4-2020', '30-4-2020', '06:59', 'Staff', '', '', 'MD / Mzanywa', '', '', '', ''),
('in', '8703036897081', 'MDMzanywa', '', '', '', '07:02 29-4-2020', '29-4-2020', '07:02', 'Staff', '', '', 'MD / Mzanywa', '', '', '', ''),
('in', '8703036897081', 'Mzanywa MadidaM D', '', '', '', '07:07 07-5-2020', '2020/07/05', '07:07', 'Staff', '', '', 'Mzanywa Madida / M D', '', 'kenton Gardin', '', ''),
('out', '8703036897081', '', '', '', '', '16:08 08-5-2020', '2020/08/05', '16:08', 'Staff', '', '', 'MD / Mzanywa', '', 'KG', '', ''),
('out', '8703036897081', '', '', '', '', '16:25 07-5-2020', '2020/07/05', '16:25', 'Staff', '', '', 'Mzanywa Madida / M D', '', 'kenton Gardin', '', ''),
('out', '8703036897081', '', '', '', '', '16:17 06-5-2020', '2020/06/05', '16:17', 'Staff', '', '', 'madoda / mzanywa', '', 'work', '', ''),
('out', '8703036897081', '', '', '', '', '16:24 05-5-2020', '2020/05/05', '16:24', 'Staff', '', '', 'MD / Mzanywa', '', 'K G', '', ''),
('out', '8703036897081', '', '', '', '', '16:25 04-5-2020', '2020/04/05', '16:25', 'Staff', '', '', '', '', '', '', ''),
('out', '8703036897081', '', '', '', '', '16:03 30-4-2020', '30-4-2020', '16:03', 'Staff', '', '', 'MD / Mzanywa', '', '', '', ''),
('out', '8703036897081', '', '', '', '', '16:25 29-4-2020', '29-4-2020', '16:25', 'Staff', '', '', 'MD / Mzanywa', '', '', '', ''),
('in', '8703175638080', 'NyanaZolani', '', '', '', '07:17 07-5-2020', '2020/07/05', '07:17', 'Staff', '', '', 'Nyana / Zolani', '', 'work', '', ''),
('in', '8703175638080', 'Z MNyanya', '', '', '', '07:20 05-5-2020', '2020/05/05', '07:20', 'Staff', '', '', 'Z M / Nyanya', '', 'Mantainance', '', ''),
('in', '8703175638080', 'ZMNyanya', '', '', '', '07:20 11-5-2020', '2020/11/05', '07:20', 'Staff', '', '', 'ZM / Nyanya', '', 'M', '', ''),
('in', '8703175638080', 'ZMNyanya', '', '', '', '07:23 08-5-2020', '2020/08/05', '07:23', 'Staff', '', '', 'ZM / Nyanya', '', 'M', '', ''),
('in', '8703175638080', 'ZMNyanya', '', '', '', '07:29 04-5-2020', '2020/04/05', '07:29', 'Staff', '', '', 'ZM / Nyanya', '', 'Mantainance', '', ''),
('in', '8703175638080', 'ZMNyanya', '', '', '', '07:22 30-4-2020', '30-4-2020', '07:22', 'Staff', '', '', 'ZM / Nyanya', '', '', '', ''),
('in', '8703175638080', 'ZmNyanya', '', '', '', '07:22 29-4-2020', '29-4-2020', '07:22', 'Staff', '', '', 'Zm / Nyanya', '', '', '', ''),
('in', '8703175638080', 'znyanya', '', '', '', '07:18 06-5-2020', '2020/06/05', '07:18', 'Staff', '', '', 'z / nyanya', '', 'work', '', ''),
('out', '8703175638080', '', '', '', '', '16:27 08-5-2020', '2020/08/05', '16:27', 'Staff', '', '', 'ZM / Nyanya', '', 'M', '', ''),
('out', '8703175638080', '', '', '', '', '16:29 07-5-2020', '2020/07/05', '16:29', 'Staff', '', '', 'Nyana / Zolani', '', 'work', '', ''),
('out', '8703175638080', '', '', '', '', '16:29 06-5-2020', '2020/06/05', '16:29', 'Staff', '', '', 'z / nyanya', '', 'work', '', ''),
('out', '8703175638080', '', '', '', '', '16:27 05-5-2020', '2020/05/05', '16:27', 'Staff', '', '', 'Z M / Nyanya', '', 'Mantainance', '', ''),
('out', '8703175638080', '', '', '', '', '16:28 04-5-2020', '2020/04/05', '16:28', 'Staff', '', '', 'ZM / Nyanya', '', 'Mantainance', '', ''),
('out', '8703175638080', '', '', '', '', '16:27 30-4-2020', '30-4-2020', '16:27', 'Staff', '', '', 'ZM / Nyanya', '', '', '', ''),
('out', '8703175638080', '', '', '', '', '16:28 29-4-2020', '29-4-2020', '16:28', 'Staff', '', '', 'Zm / Nyanya', '', '', '', ''),
('in', '8705160078081', 'DRswart', '', '', '', '07:14 23-4-2020', '23-4-2020', '07:14', 'Staff', '', '', 'DR / swart', '', '', '', ''),
('in', '8705160078081', 'N.DSwaartz', '', '', '', '07:15 14-4-2020', '14-4-2020', '07:15', 'Staff', '', '', 'N.D / Swaartz', '', '', '', ''),
('in', '8705160078081', 'Ndswart', '', '', '', '07:42 18-4-2020', '18-4-2020', '07:42', 'Staff', '', '', 'Nd / swart', '', '', '', ''),
('in', '8705160078081', 'NDSwartz', '', '', '', '07:11 05-5-2020', '2020/05/05', '07:11', 'Staff', '', '', 'ND / Swartz', '', 'Care Centre', '', ''),
('in', '8705160078081', 'NDSwartz', '', '', '', '07:12 04-5-2020', '2020/04/05', '07:12', 'Staff', '', '', 'ND / Swartz', '', 'Care Centre', '', ''),
('in', '8705160078081', 'NDSwartz', '', '', '', '07:15 28-4-2020', '28-4-2020', '07:15', 'Staff', '', '', 'ND / Swartz', '', '', '', ''),
('in', '8705160078081', 'NDSwartz', '', '', '', '07:11 22-4-2020', '22-4-2020', '07:11', 'Staff', '', '', 'ND / Swartz', '', '', '', ''),
('in', '8705160078081', 'NDswartz', '', '', '', '07:17 21-4-2020', '21-4-2020', '07:17', 'Staff', '', '', 'ND / swartz', '', '', '', ''),
('in', '8705160078081', 'NDSwartz', '', '', '', '07:38 17-4-2020', '17-4-2020', '07:38', 'Staff', '', '', 'ND / Swartz', '', '', '', ''),
('in', '8705160078081', 'NDSwartz', '', '', '', '07:27 15-4-2020', '15-4-2020', '07:27', 'Staff', '', '', 'ND / Swartz', '', '', '', ''),
('in', '8705160078081', 'NHilpert', '', '', '', '07:13 20-4-2020', '20-4-2020', '07:13', 'Staff', '', '', 'N / Hilpert', '', '', '', ''),
('in', '8705160078081', 'NSwartz', '', '', '', '07:15 11-5-2020', '2020/11/05', '07:15', 'Staff', '', '', 'N / Swartz', '', 'C/C', '', ''),
('in', '8705160078081', 'NSwartz', '', '', '', '07:12 08-5-2020', '2020/08/05', '07:12', 'Staff', '', '', 'N / Swartz', '', 'Care Centre', '', ''),
('in', '8705160078081', 'NSwartz', '', '', '', '07:18 24-4-2020', '24-4-2020', '07:18', 'Staff', '', '', 'N / Swartz', '', '', '', ''),
('in', '8705160078081', 'NSwatz', '', '', '', '07:16 29-4-2020', '29-4-2020', '07:16', 'Staff', '', '', 'N / Swatz', '', '', '', ''),
('in', '8705160078081', 'SwartzNaydeen', '', '', '', '07:17 07-5-2020', '2020/07/05', '07:17', 'Staff', '', '', 'Swartz / Naydeen', '', 'Work', '', ''),
('out', '8705160078081', '', '', '', '', '10:56 11-5-2020', '2020/11/05', '10:56', 'Staff', '', '', 'N / Swartz', '', 'C/C', '', ''),
('out', '8705160078081', '', '', '', '', '16:11 08-5-2020', '2020/08/05', '16:11', 'Staff', '', '', 'N / Swartz', '', 'Care Centre', '', ''),
('out', '8705160078081', '', '', '', '', '16:39 07-5-2020', '2020/07/05', '16:39', 'Staff', '', '', 'Swartz / Naydeen', '', 'Work', '', ''),
('out', '8705160078081', '', '', '', '', '16:36 06-5-2020', '2020/06/05', '16:36', 'Staff', '', '', 'ND / Swartz', '', 'Care Centre', '', ''),
('out', '8705160078081', '', '', '', '', '16:44 04-5-2020', '2020/04/05', '16:44', 'Staff', '', '', 'ND / Swartz', '', 'Care Centre', '', ''),
('out', '8705160078081', '', '', '', '', '16:45 29-4-2020', '29-4-2020', '16:45', 'Staff', '', '', 'N / Swatz', '', '', '', ''),
('out', '8705160078081', '', '', '', '', '16:42 28-4-2020', '28-4-2020', '16:42', 'Staff', '', '', 'ND / Swartz', '', '', '', ''),
('out', '8705160078081', '', '', '', '', '13:14 24-4-2020', '24-4-2020', '13:14', 'Staff', '', '', 'N / Swartz', '', '', '', ''),
('out', '8705160078081', '', '', '', '', '16:33 23-4-2020', '23-4-2020', '16:33', 'Staff', '', '', 'DR / swart', '', '', '', ''),
('out', '8705160078081', '', '', '', '', '16:43 22-4-2020', '22-4-2020', '16:43', 'Staff', '', '', 'ND / Swartz', '', '', '', ''),
('out', '8705160078081', '', '', '', '', '16:38 21-4-2020', '21-4-2020', '16:38', 'Staff', '', '', 'ND / swartz', '', '', '', ''),
('out', '8705160078081', '', '', '', '', '16:44 20-4-2020', '20-4-2020', '16:44', 'Staff', '', '', 'N / Hilpert', '', '', '', ''),
('out', '8705160078081', '', '', '', '', '12:34 18-4-2020', '18-4-2020', '12:34', 'Staff', '', '', 'Nd / swart', '', '', '', ''),
('out', '8705160078081', '', '', '', '', '13:09 17-4-2020', '17-4-2020', '13:09', 'Staff', '', '', 'ND / Swartz', '', '', '', ''),
('out', '8705160078081', '', '', '', '', '16:16 15-4-2020', '15-4-2020', '16:16', 'Staff', '', '', 'ND / Swartz', '', '', '', ''),
('out', '8705160078081', '', '', '', '', '16:35 14-4-2020', '14-4-2020', '16:35', 'Staff', '', '', 'N.D / Swaartz', '', '', '', ''),
('in', '8708071225080', 'bfeni', '', '', '', '07:32 06-5-2020', '2020/06/05', '07:32', 'Staff', '', '', 'b / feni', '', 'work', '', ''),
('in', '8708071225080', 'BMafele', '', '', '', '08:14 11-5-2020', '2020/11/05', '08:14', 'Staff', '', '', 'B / Mafele', '', 'O', '', ''),
('in', '8708071225080', 'BMafele', '', '', '', '07:35 05-5-2020', '2020/05/05', '07:35', 'Staff', '', '', 'B / Mafele', '', 'Admin,', '', ''),
('in', '8708071225080', 'BMafele', '', '', '', '07:41 04-5-2020', '2020/04/05', '07:41', 'Staff', '', '', 'B / Mafele', '', 'Admin', '', ''),
('in', '8708071225080', 'BMafele', '', '', '', '07:37 16-4-2020', '16-4-2020', '07:37', 'Staff', '', '', 'B / Mafele', '', '', '', ''),
('in', '8708071225080', 'Mmafele', '', '', '', '07:36 08-5-2020', '2020/08/05', '07:36', 'Staff', '', '', 'M / mafele', '', 'admn', '', ''),
('out', '8708071225080', '', '', '', '', '16:37 08-5-2020', '2020/08/05', '16:37', 'Staff', '', '', 'M / mafele', '', 'admn', '', ''),
('out', '8708071225080', '', '', '', '', '16:37 06-5-2020', '2020/06/05', '16:37', 'Staff', '', '', 'b / feni', '', 'work', '', ''),
('out', '8708071225080', '', '', '', '', '16:40 05-5-2020', '2020/05/05', '16:40', 'Staff', '', '', 'B / Mafele', '', 'Admin,', '', ''),
('out', '8708071225080', '', '', '', '', '16:54 04-5-2020', '2020/04/05', '16:54', 'Staff', '', '', 'B / Mafele', '', 'Admin', '', ''),
('out', '8708071225080', '', '', '', '', '11:14 16-4-2020', '16-4-2020', '11:14', 'Staff', '', '', 'B / Mafele', '', '', '', ''),
('in', '8801125085087', 'Gronromab', '', '', '', '07:53 12-4-2020', '2020/12/04', '07:53', 'Visitors', 'Expired car licence', 'Gron / romab', '', '', '', '', 'del'),
('in', '8803310294086', 'ndyandyanincumisa', '', '', '', '06:43 25-4-2020', '25-4-2020', '06:43', 'Staff', '', '', 'ndyandyani / ncumisa', '', '', '', ''),
('in', '8803310294086', 'NNdandyan', '', '', '', '06:50 08-5-2020', '2020/08/05', '06:50', 'Staff', '', '', 'N / Ndandyan', '', 'Kitchen', '', ''),
('in', '8803310294086', 'Nndyandya', '', '', '', '06:59 21-4-2020', '21-4-2020', '06:59', 'Staff', '', '', 'N / ndyandya', '', '', '', ''),
('in', '8803310294086', 'NNdyandyan', '', '', '', '07:06 04-5-2020', '2020/04/05', '07:06', 'Staff', '', '', 'N / Ndyandyan', '', 'K', '', ''),
('in', '8803310294086', 'NNdyandyan', '', '', '', '06:55 29-4-2020', '29-4-2020', '06:55', 'Staff', '', '', 'N / Ndyandyan', '', '', '', ''),
('in', '8803310294086', 'NNdyandyan', '', '', '', '06:58 26-4-2020', '26-4-2020', '06:58', 'Staff', '', '', 'N / Ndyandyan', '', '', '', ''),
('in', '8803310294086', 'NNdyandyan', '', '', '', '06:49 17-4-2020', '17-4-2020', '06:49', 'Staff', '', '', 'N / Ndyandyan', '', '', '', ''),
('in', '8803310294086', 'NNdyandyan', '', '', '', '06:53 16-4-2020', '16-4-2020', '06:53', 'Staff', '', '', 'N / Ndyandyan', '', '', '', ''),
('in', '8803310294086', 'NNdyandyan', '', '', '', '06:59 11-4-2020', '2020/11/04', '06:59', 'Staff', '', '', 'N / Ndyandyan', '', '', '', ''),
('in', '8803310294086', 'NNdyandyani', '', '', '', '06:43 05-5-2020', '2020/05/05', '06:43', 'Staff', '', '', 'N / Ndyandyani', '', 'Kitchen', '', ''),
('in', '8803310294086', 'NNdyandyani', '', '', '', '06:51 20-4-2020', '20-4-2020', '06:51', 'Staff', '', '', 'N / Ndyandyani', '', '', '', ''),
('in', '8803310294086', 'NNjanjan', '', '', '', '07:02 24-4-2020', '24-4-2020', '07:02', 'Staff', '', '', 'N / Njanjan', '', '', '', ''),
('in', '8803310294086', 'NNjanjan', '', '', '', '07:01 12-4-2020', '2020/12/04', '07:01', 'Staff', '', '', 'N / Njanjan', '', '', '', ''),
('in', '8803310294086', 'SNdyandyan', '', '', '', '06:55 30-4-2020', '30-4-2020', '06:55', 'Staff', '', '', 'S / Ndyandyan', '', '', '', ''),
('out', '8803310294086', '', '', '', '', '14:05 08-5-2020', '2020/08/05', '14:05', 'Staff', '', '', 'N / Ndandyan', '', 'Kitchen', '', ''),
('out', '8803310294086', '', '', '', '', '17:09 05-5-2020', '2020/05/05', '17:09', 'Staff', '', '', 'N / Ndyandyani', '', 'Kitchen', '', ''),
('out', '8803310294086', '', '', '', '', '17:28 04-5-2020', '2020/04/05', '17:28', 'Staff', '', '', 'N / Ndyandyan', '', 'K', '', ''),
('out', '8803310294086', '', '', '', '', '17:15 30-4-2020', '30-4-2020', '17:15', 'Staff', '', '', 'S / Ndyandyan', '', '', '', ''),
('out', '8803310294086', '', '', '', '', '17:03 29-4-2020', '29-4-2020', '17:03', 'Staff', '', '', 'N / Ndyandyan', '', '', '', ''),
('out', '8803310294086', '', '', '', '', '17:27 26-4-2020', '26-4-2020', '17:27', 'Staff', '', '', 'N / Ndyandyan', '', '', '', ''),
('out', '8803310294086', '', '', '', '', '17:09 25-4-2020', '25-4-2020', '17:09', 'Staff', '', '', 'ndyandyani / ncumisa', '', '', '', ''),
('out', '8803310294086', '', '', '', '', '17:07 24-4-2020', '24-4-2020', '17:07', 'Staff', '', '', 'N / Njanjan', '', '', '', ''),
('out', '8803310294086', '', '', '', '', '17:29 21-4-2020', '21-4-2020', '17:29', 'Staff', '', '', 'N / ndyandya', '', '', '', ''),
('out', '8803310294086', '', '', '', '', '17:02 20-4-2020', '20-4-2020', '17:02', 'Staff', '', '', 'N / Ndyandyani', '', '', '', ''),
('out', '8803310294086', '', '', '', '', '14:02 17-4-2020', '17-4-2020', '14:02', 'Staff', '', '', 'N / Ndyandyan', '', '', '', ''),
('out', '8803310294086', '', '', '', '', '17:33 16-4-2020', '16-4-2020', '17:33', 'Staff', '', '', 'N / Ndyandyan', '', '', '', ''),
('out', '8803310294086', '', '', '', '', '17:02 12-4-2020', '2020/12/04', '17:02', 'Staff', '', '', 'N / Njanjan', '', '', '', ''),
('out', '8803310294086', '', '', '', '', '17:35 11-4-2020', '2020/11/04', '17:35', 'Staff', '', '', 'N / Ndyandyan', '', '', '', ''),
('in', '8805131065082', 'G13(8', '', '', '', '07:58 15-4-2020', '15-4-2020', '07:58', 'Staff', '', '', 'G / 13(8', '', '', '', ''),
('out', '8805131065082', 'null null', '', '', 'C16SE02DR6935', '07:12 07-5-2020', '2020/07/05', '07:12', 'Staff', '', '', '', '', '', '', ''),
('out', '8805131065082', 'null null', '', '', 'C16SE02DR6935', '07:33 20-4-2020', '20-4-2020', '07:33', 'Staff', '', 'vuyiseka / Jekana', '', '', '', 'jekana', ''),
('in', '8805131065082', 'V Jekanav Jekana', '', '', 'C16SE02DR6935', '18:06 20-4-2020', '20-4-2020', '18:06', 'Staff', '', '', 'V Jekana / v Jekana', '', '', '', ''),
('in', '8805131065082', 'V jekanVuyiseka Jekana', '', '', '', '18:56 04-5-2020', '2020/04/05', '18:56', 'Staff', '', '', 'V jekan / Vuyiseka Jekana', '', '128d', '', ''),
('out', '8805131065082', 'VJEKANA', '', '', '8805131065082', '16:35 09-5-2020', '2020/09/05', '16:35', 'Staff', '', '', '', '', '', '', ''),
('out', '8805131065082', 'VJEKANA', '', '', '8805131065082', '07:12 05-5-2020', '2020/05/05', '07:12', 'Staff', '', '', 'V jekan / Vuyiseka Jekana', '', '128d', '', ''),
('in', '8805131065082', 'VJekana', '', '', '', '07:46 02-5-2020', '2020/02/05', '07:46', 'Staff', '', '', 'V / Jekana', '', 'Unit 128 D', '', ''),
('in', '8805131065082', 'VJekana', '', '', '', '06:57 01-5-2020', '2020/01/05', '06:57', 'Staff', '', '', 'V / Jekana', '', '128', '', ''),
('in', '8805131065082', 'VJekana', '', '', '', '07:01 30-4-2020', '30-4-2020', '07:01', 'Staff', '', '', 'V / Jekana', '', '', '', ''),
('in', '8805131065082', 'VJekana', '', '', '', '06:58 29-4-2020', '29-4-2020', '06:58', 'Staff', '', '', 'V / Jekana', '', '', '', ''),
('in', '8805131065082', 'VJekana', '', '', '', '06:49 28-4-2020', '28-4-2020', '06:49', 'Staff', '', '', 'V / Jekana', '', '', '', ''),
('in', '8805131065082', 'VJekana', '', '', '', '07:40 27-4-2020', '27-4-2020', '07:40', 'Visitors', '', 'V / Jekana', '', '', '', '', '128'),
('in', '8805131065082', 'VJekana', '', '', '', '07:54 26-4-2020', '26-4-2020', '07:54', 'Staff', '', '', 'V / Jekana', '', '', '', ''),
('in', '8805131065082', 'VJekana', '', '', '', '07:53 25-4-2020', '25-4-2020', '07:53', 'Staff', '', '', 'V / Jekana', '', '', '', ''),
('in', '8805131065082', 'VJekana', '', '', '', '07:53 23-4-2020', '23-4-2020', '07:53', 'Staff', '', '', 'V / Jekana', '', '', '', ''),
('in', '8805131065082', 'Vjekana', '', '', '', '16:28 18-4-2020', '18-4-2020', '16:28', 'Staff', '', '', 'V / jekana', '', '', '', ''),
('in', '8805131065082', 'VJekana', '', '', '', '07:53 17-4-2020', '17-4-2020', '07:53', 'Staff', '', '', 'V / Jekana', '', '', '', ''),
('in', '8805131065082', 'VJekana', '', '', '', '07:51 16-4-2020', '16-4-2020', '07:51', 'Staff', '', '', 'V / Jekana', '', '', '', ''),
('in', '8805131065082', 'VJekana', '', '', '', '16:17 11-4-2020', '2020/11/04', '16:17', 'Staff', '', '', 'V / Jekana', '', '', '', ''),
('in', '8805131065082', 'Vuyiseka JekanaV jakana', '', '', '', '18:35 04-5-2020', '2020/04/05', '18:35', 'Visitors', '', 'Vuyiseka Jekana / V jakana', '', '', '', '', '128d'),
('in', '8805131065082', 'Vuyiseka jekanav Jekana', '', '', '', '18:10 21-4-2020', '21-4-2020', '18:10', 'Staff', '', '', 'Vuyiseka jekana / v Jekana', '', '', '', ''),
('in', '8805131065082', 'vuyisekaJekana', 'jekana', '', 'C16SE02DR6935', '18:05 19-4-2020', '19-4-2020', '18:05', 'Contractors', '', 'vuyiseka / Jekana', '', '', '', 'jekana', ''),
('in', '8805131065082', 'VuyisekaJekana', '', '', '', '07:58 14-4-2020', '14-4-2020', '07:58', 'Staff', '', '', 'Vuyiseka / Jekana', '', '', '', ''),
('in', '8805131065082', 'VuyisekaJekana', '', '', '', '07:54 13-4-2020', '13-4-2020', '07:54', 'Staff', '', '', 'Vuyiseka / Jekana', '', '', '', ''),
('out', '8805131065082', '', '', '', '', '07:15 04-5-2020', '2020/04/05', '07:15', 'Staff', '', '', 'V / Jekana', '', 'Unit 128 D', '', ''),
('out', '8805131065082', '', '', '', '', '18:45 01-5-2020', '2020/01/05', '18:45', 'Staff', '', '', 'V / Jekana', '', '128', '', ''),
('out', '8805131065082', '', '', '', '', '18:40 30-4-2020', '30-4-2020', '18:40', 'Staff', '', '', 'V / Jekana', '', '', '', ''),
('out', '8805131065082', '', '', '', '', '18:41 29-4-2020', '29-4-2020', '18:41', 'Staff', '', '', 'V / Jekana', '', '', '', ''),
('out', '8805131065082', '', '', '', '', '18:50 28-4-2020', '28-4-2020', '18:50', 'Staff', '', '', 'V / Jekana', '', '', '', ''),
('out', '8805131065082', '', '', '', '', '18:37 27-4-2020', '27-4-2020', '18:37', 'Visitors', '', 'V / Jekana', '', '', '', '', '128'),
('out', '8805131065082', '', '', '', '', '16:38 26-4-2020', '26-4-2020', '16:38', 'Staff', '', '', 'V / Jekana', '', '', '', ''),
('out', '8805131065082', '', '', '', '', '16:34 25-4-2020', '25-4-2020', '16:34', 'Staff', '', '', 'V / Jekana', '', '', '', ''),
('out', '8805131065082', '', '', '', '', '16:47 24-4-2020', '24-4-2020', '16:47', 'Staff', '', '', '', '', '', '', ''),
('out', '8805131065082', '', '', '', '', '16:37 23-4-2020', '23-4-2020', '16:37', 'Staff', '', '', 'V / Jekana', '', '', '', ''),
('out', '8805131065082', '', '', '', '', '07:08 22-4-2020', '22-4-2020', '07:08', 'Staff', '', '', 'Vuyiseka jekana / v Jekana', '', '', '', ''),
('out', '8805131065082', '', '', '', '', '07:52 21-4-2020', '21-4-2020', '07:52', 'Staff', '', '', 'V Jekana / v Jekana', '', '', '', ''),
('out', '8805131065082', '', '', '', '', '08:10 19-4-2020', '19-4-2020', '08:10', 'Staff', '', '', 'V / jekana', '', '', '', ''),
('out', '8805131065082', '', '', '', '', '08:07 18-4-2020', '18-4-2020', '08:07', 'Staff', '', '', 'V / Jekana', '', '', '', ''),
('out', '8805131065082', '', '', '', '', '16:41 16-4-2020', '16-4-2020', '16:41', 'Staff', '', '', 'V / Jekana', '', '', '', ''),
('out', '8805131065082', '', '', '', '', '16:42 15-4-2020', '15-4-2020', '16:42', 'Staff', '', '', 'G / 13(8', '', '', '', ''),
('out', '8805131065082', '', '', '', '', '16:46 14-4-2020', '14-4-2020', '16:46', 'Staff', '', '', 'Vuyiseka / Jekana', '', '', '', ''),
('out', '8805131065082', '', '', '', '', '16:54 13-4-2020', '13-4-2020', '16:54', 'Staff', '', '', 'Vuyiseka / Jekana', '', '', '', ''),
('out', '8805131065082', '', '', '', '', '08:11 12-4-2020', '2020/12/04', '08:11', 'Staff', '', '', 'V / Jekana', '', '', '', ''),
('out', '8805131065082', '', '', '', '', '08:15 11-4-2020', '2020/11/04', '08:15', 'Staff', '', '', 'jekana / v', '', '', '', ''),
('out', '8805131065083', '', '', '', '', '18:52 04-5-2020', '2020/04/05', '18:52', 'Staff', '', '', '', '', '', '', ''),
('out', '8805141065082', 'VJEKANA', '', '', '8805131065082', '07:14 21-4-2020', '21-4-2020', '07:14', 'Staff', '', '', '', '', '', '', ''),
('in', '8907085468088', 'AIsaac', '', '', '', '07:31 11-5-2020', '2020/11/05', '07:31', 'Staff', '', '', 'A / Isaac', '', 'S', '', ''),
('in', '8907085468088', 'AIsaac', '', '', '', '07:18 08-5-2020', '2020/08/05', '07:18', 'Staff', '', '', 'A / Isaac', '', 'KG', '', ''),
('in', '8907085468088', 'AIsaac', '', '', '', '07:37 05-5-2020', '2020/05/05', '07:37', 'Staff', '', '', 'A / Isaac', '', 'KG', '', ''),
('in', '8907085468088', 'AIsaac', '', '', '', '07:36 04-5-2020', '2020/04/05', '07:36', 'Staff', '', '', 'A / Isaac', '', 'KG', '', ''),
('in', '8907085468088', 'AIsaac', '', '', '', '07:36 30-4-2020', '30-4-2020', '07:36', 'Staff', '', '', 'A / Isaac', '', '', '', ''),
('in', '8907085468088', 'AIsaac', '', '', '', '07:37 29-4-2020', '29-4-2020', '07:37', 'Staff', '', '', 'A / Isaac', '', '', '', ''),
('in', '8907085468088', 'AIsaac', '', '', '', '09:13 28-4-2020', '28-4-2020', '09:13', 'Staff', '', '', 'A / Isaac', '', '', '', ''),
('in', '8907085468088', 'aisaak', '', '', '', '07:26 06-5-2020', '2020/06/05', '07:26', 'Staff', '', '', 'a / isaak', '', 'work', '', ''),
('in', '8907085468088', 'Isaac Anel', '', '', '', '07:31 07-5-2020', '2020/07/05', '07:31', 'Staff', '', '', 'Isaac  / Anel', '', 'work', '', ''),
('out', '8907085468088', '', '', '', '', '16:01 08-5-2020', '2020/08/05', '16:01', 'Staff', '', '', 'A / Isaac', '', 'KG', '', ''),
('out', '8907085468088', '', '', '', '', '16:25 07-5-2020', '2020/07/05', '16:25', 'Staff', '', '', 'Isaac  / Anel', '', 'work', '', ''),
('out', '8907085468088', '', '', '', '', '16:27 06-5-2020', '2020/06/05', '16:27', 'Staff', '', '', 'a / isaak', '', 'work', '', ''),
('out', '8907085468088', '', '', '', '', '16:25 05-5-2020', '2020/05/05', '16:25', 'Staff', '', '', 'A / Isaac', '', 'KG', '', ''),
('out', '8907085468088', '', '', '', '', '16:25 04-5-2020', '2020/04/05', '16:25', 'Staff', '', '', 'A / Isaac', '', 'KG', '', ''),
('out', '8907085468088', '', '', '', '', '16:04 30-4-2020', '30-4-2020', '16:04', 'Staff', '', '', 'A / Isaac', '', '', '', ''),
('out', '8907085468088', '', '', '', '', '16:25 29-4-2020', '29-4-2020', '16:25', 'Staff', '', '', 'A / Isaac', '', '', '', ''),
('out', '8907085468088', '', '', '', '', '16:26 28-4-2020', '28-4-2020', '16:26', 'Staff', '', '', 'A / Isaac', '', '', '', ''),
('in', '8908070631086', 'A Campbell', '', '', '', '06:53 05-5-2020', '2020/05/05', '06:53', 'Staff', '', '', 'A  / Campbell', '', 'Kitchen', '', ''),
